date,year,quarter,month,day,weekday,is_weekend,week_of_year,month_name,dow_name
1/1/2010,2010,1,1,1,5,0,1,Jan,Fri
1/2/2010,2010,1,1,2,6,1,1,Jan,Sat
1/3/2010,2010,1,1,3,7,1,2,Jan,Sun
1/4/2010,2010,1,1,4,1,0,2,Jan,Mon
1/5/2010,2010,1,1,5,2,0,2,Jan,Tue
1/6/2010,2010,1,1,6,3,0,2,Jan,Wed
1/7/2010,2010,1,1,7,4,0,2,Jan,Thu
1/8/2010,2010,1,1,8,5,0,2,Jan,Fri
1/9/2010,2010,1,1,9,6,1,2,Jan,Sat
1/10/2010,2010,1,1,10,7,1,3,Jan,Sun
1/11/2010,2010,1,1,11,1,0,3,Jan,Mon
1/12/2010,2010,1,1,12,2,0,3,Jan,Tue
1/13/2010,2010,1,1,13,3,0,3,Jan,Wed
1/14/2010,2010,1,1,14,4,0,3,Jan,Thu
1/15/2010,2010,1,1,15,5,0,3,Jan,Fri
1/16/2010,2010,1,1,16,6,1,3,Jan,Sat
1/17/2010,2010,1,1,17,7,1,4,Jan,Sun
1/18/2010,2010,1,1,18,1,0,4,Jan,Mon
1/19/2010,2010,1,1,19,2,0,4,Jan,Tue
1/20/2010,2010,1,1,20,3,0,4,Jan,Wed
1/21/2010,2010,1,1,21,4,0,4,Jan,Thu
1/22/2010,2010,1,1,22,5,0,4,Jan,Fri
1/23/2010,2010,1,1,23,6,1,4,Jan,Sat
1/24/2010,2010,1,1,24,7,1,5,Jan,Sun
1/25/2010,2010,1,1,25,1,0,5,Jan,Mon
1/26/2010,2010,1,1,26,2,0,5,Jan,Tue
1/27/2010,2010,1,1,27,3,0,5,Jan,Wed
1/28/2010,2010,1,1,28,4,0,5,Jan,Thu
1/29/2010,2010,1,1,29,5,0,5,Jan,Fri
1/30/2010,2010,1,1,30,6,1,5,Jan,Sat
1/31/2010,2010,1,1,31,7,1,6,Jan,Sun
2/1/2010,2010,1,2,1,1,0,6,Feb,Mon
2/2/2010,2010,1,2,2,2,0,6,Feb,Tue
2/3/2010,2010,1,2,3,3,0,6,Feb,Wed
2/4/2010,2010,1,2,4,4,0,6,Feb,Thu
2/5/2010,2010,1,2,5,5,0,6,Feb,Fri
2/6/2010,2010,1,2,6,6,1,6,Feb,Sat
2/7/2010,2010,1,2,7,7,1,7,Feb,Sun
2/8/2010,2010,1,2,8,1,0,7,Feb,Mon
2/9/2010,2010,1,2,9,2,0,7,Feb,Tue
2/10/2010,2010,1,2,10,3,0,7,Feb,Wed
2/11/2010,2010,1,2,11,4,0,7,Feb,Thu
2/12/2010,2010,1,2,12,5,0,7,Feb,Fri
2/13/2010,2010,1,2,13,6,1,7,Feb,Sat
2/14/2010,2010,1,2,14,7,1,8,Feb,Sun
2/15/2010,2010,1,2,15,1,0,8,Feb,Mon
2/16/2010,2010,1,2,16,2,0,8,Feb,Tue
2/17/2010,2010,1,2,17,3,0,8,Feb,Wed
2/18/2010,2010,1,2,18,4,0,8,Feb,Thu
2/19/2010,2010,1,2,19,5,0,8,Feb,Fri
2/20/2010,2010,1,2,20,6,1,8,Feb,Sat
2/21/2010,2010,1,2,21,7,1,9,Feb,Sun
2/22/2010,2010,1,2,22,1,0,9,Feb,Mon
2/23/2010,2010,1,2,23,2,0,9,Feb,Tue
2/24/2010,2010,1,2,24,3,0,9,Feb,Wed
2/25/2010,2010,1,2,25,4,0,9,Feb,Thu
2/26/2010,2010,1,2,26,5,0,9,Feb,Fri
2/27/2010,2010,1,2,27,6,1,9,Feb,Sat
2/28/2010,2010,1,2,28,7,1,10,Feb,Sun
3/1/2010,2010,1,3,1,1,0,10,Mar,Mon
3/2/2010,2010,1,3,2,2,0,10,Mar,Tue
3/3/2010,2010,1,3,3,3,0,10,Mar,Wed
3/4/2010,2010,1,3,4,4,0,10,Mar,Thu
3/5/2010,2010,1,3,5,5,0,10,Mar,Fri
3/6/2010,2010,1,3,6,6,1,10,Mar,Sat
3/7/2010,2010,1,3,7,7,1,11,Mar,Sun
3/8/2010,2010,1,3,8,1,0,11,Mar,Mon
3/9/2010,2010,1,3,9,2,0,11,Mar,Tue
3/10/2010,2010,1,3,10,3,0,11,Mar,Wed
3/11/2010,2010,1,3,11,4,0,11,Mar,Thu
3/12/2010,2010,1,3,12,5,0,11,Mar,Fri
3/13/2010,2010,1,3,13,6,1,11,Mar,Sat
3/14/2010,2010,1,3,14,7,1,12,Mar,Sun
3/15/2010,2010,1,3,15,1,0,12,Mar,Mon
3/16/2010,2010,1,3,16,2,0,12,Mar,Tue
3/17/2010,2010,1,3,17,3,0,12,Mar,Wed
3/18/2010,2010,1,3,18,4,0,12,Mar,Thu
3/19/2010,2010,1,3,19,5,0,12,Mar,Fri
3/20/2010,2010,1,3,20,6,1,12,Mar,Sat
3/21/2010,2010,1,3,21,7,1,13,Mar,Sun
3/22/2010,2010,1,3,22,1,0,13,Mar,Mon
3/23/2010,2010,1,3,23,2,0,13,Mar,Tue
3/24/2010,2010,1,3,24,3,0,13,Mar,Wed
3/25/2010,2010,1,3,25,4,0,13,Mar,Thu
3/26/2010,2010,1,3,26,5,0,13,Mar,Fri
3/27/2010,2010,1,3,27,6,1,13,Mar,Sat
3/28/2010,2010,1,3,28,7,1,14,Mar,Sun
3/29/2010,2010,1,3,29,1,0,14,Mar,Mon
3/30/2010,2010,1,3,30,2,0,14,Mar,Tue
3/31/2010,2010,1,3,31,3,0,14,Mar,Wed
4/1/2010,2010,2,4,1,4,0,14,Apr,Thu
4/2/2010,2010,2,4,2,5,0,14,Apr,Fri
4/3/2010,2010,2,4,3,6,1,14,Apr,Sat
4/4/2010,2010,2,4,4,7,1,15,Apr,Sun
4/5/2010,2010,2,4,5,1,0,15,Apr,Mon
4/6/2010,2010,2,4,6,2,0,15,Apr,Tue
4/7/2010,2010,2,4,7,3,0,15,Apr,Wed
4/8/2010,2010,2,4,8,4,0,15,Apr,Thu
4/9/2010,2010,2,4,9,5,0,15,Apr,Fri
4/10/2010,2010,2,4,10,6,1,15,Apr,Sat
4/11/2010,2010,2,4,11,7,1,16,Apr,Sun
4/12/2010,2010,2,4,12,1,0,16,Apr,Mon
4/13/2010,2010,2,4,13,2,0,16,Apr,Tue
4/14/2010,2010,2,4,14,3,0,16,Apr,Wed
4/15/2010,2010,2,4,15,4,0,16,Apr,Thu
4/16/2010,2010,2,4,16,5,0,16,Apr,Fri
4/17/2010,2010,2,4,17,6,1,16,Apr,Sat
4/18/2010,2010,2,4,18,7,1,17,Apr,Sun
4/19/2010,2010,2,4,19,1,0,17,Apr,Mon
4/20/2010,2010,2,4,20,2,0,17,Apr,Tue
4/21/2010,2010,2,4,21,3,0,17,Apr,Wed
4/22/2010,2010,2,4,22,4,0,17,Apr,Thu
4/23/2010,2010,2,4,23,5,0,17,Apr,Fri
4/24/2010,2010,2,4,24,6,1,17,Apr,Sat
4/25/2010,2010,2,4,25,7,1,18,Apr,Sun
4/26/2010,2010,2,4,26,1,0,18,Apr,Mon
4/27/2010,2010,2,4,27,2,0,18,Apr,Tue
4/28/2010,2010,2,4,28,3,0,18,Apr,Wed
4/29/2010,2010,2,4,29,4,0,18,Apr,Thu
4/30/2010,2010,2,4,30,5,0,18,Apr,Fri
5/1/2010,2010,2,5,1,6,1,18,May,Sat
5/2/2010,2010,2,5,2,7,1,19,May,Sun
5/3/2010,2010,2,5,3,1,0,19,May,Mon
5/4/2010,2010,2,5,4,2,0,19,May,Tue
5/5/2010,2010,2,5,5,3,0,19,May,Wed
5/6/2010,2010,2,5,6,4,0,19,May,Thu
5/7/2010,2010,2,5,7,5,0,19,May,Fri
5/8/2010,2010,2,5,8,6,1,19,May,Sat
5/9/2010,2010,2,5,9,7,1,20,May,Sun
5/10/2010,2010,2,5,10,1,0,20,May,Mon
5/11/2010,2010,2,5,11,2,0,20,May,Tue
5/12/2010,2010,2,5,12,3,0,20,May,Wed
5/13/2010,2010,2,5,13,4,0,20,May,Thu
5/14/2010,2010,2,5,14,5,0,20,May,Fri
5/15/2010,2010,2,5,15,6,1,20,May,Sat
5/16/2010,2010,2,5,16,7,1,21,May,Sun
5/17/2010,2010,2,5,17,1,0,21,May,Mon
5/18/2010,2010,2,5,18,2,0,21,May,Tue
5/19/2010,2010,2,5,19,3,0,21,May,Wed
5/20/2010,2010,2,5,20,4,0,21,May,Thu
5/21/2010,2010,2,5,21,5,0,21,May,Fri
5/22/2010,2010,2,5,22,6,1,21,May,Sat
5/23/2010,2010,2,5,23,7,1,22,May,Sun
5/24/2010,2010,2,5,24,1,0,22,May,Mon
5/25/2010,2010,2,5,25,2,0,22,May,Tue
5/26/2010,2010,2,5,26,3,0,22,May,Wed
5/27/2010,2010,2,5,27,4,0,22,May,Thu
5/28/2010,2010,2,5,28,5,0,22,May,Fri
5/29/2010,2010,2,5,29,6,1,22,May,Sat
5/30/2010,2010,2,5,30,7,1,23,May,Sun
5/31/2010,2010,2,5,31,1,0,23,May,Mon
6/1/2010,2010,2,6,1,2,0,23,Jun,Tue
6/2/2010,2010,2,6,2,3,0,23,Jun,Wed
6/3/2010,2010,2,6,3,4,0,23,Jun,Thu
6/4/2010,2010,2,6,4,5,0,23,Jun,Fri
6/5/2010,2010,2,6,5,6,1,23,Jun,Sat
6/6/2010,2010,2,6,6,7,1,24,Jun,Sun
6/7/2010,2010,2,6,7,1,0,24,Jun,Mon
6/8/2010,2010,2,6,8,2,0,24,Jun,Tue
6/9/2010,2010,2,6,9,3,0,24,Jun,Wed
6/10/2010,2010,2,6,10,4,0,24,Jun,Thu
6/11/2010,2010,2,6,11,5,0,24,Jun,Fri
6/12/2010,2010,2,6,12,6,1,24,Jun,Sat
6/13/2010,2010,2,6,13,7,1,25,Jun,Sun
6/14/2010,2010,2,6,14,1,0,25,Jun,Mon
6/15/2010,2010,2,6,15,2,0,25,Jun,Tue
6/16/2010,2010,2,6,16,3,0,25,Jun,Wed
6/17/2010,2010,2,6,17,4,0,25,Jun,Thu
6/18/2010,2010,2,6,18,5,0,25,Jun,Fri
6/19/2010,2010,2,6,19,6,1,25,Jun,Sat
6/20/2010,2010,2,6,20,7,1,26,Jun,Sun
6/21/2010,2010,2,6,21,1,0,26,Jun,Mon
6/22/2010,2010,2,6,22,2,0,26,Jun,Tue
6/23/2010,2010,2,6,23,3,0,26,Jun,Wed
6/24/2010,2010,2,6,24,4,0,26,Jun,Thu
6/25/2010,2010,2,6,25,5,0,26,Jun,Fri
6/26/2010,2010,2,6,26,6,1,26,Jun,Sat
6/27/2010,2010,2,6,27,7,1,27,Jun,Sun
6/28/2010,2010,2,6,28,1,0,27,Jun,Mon
6/29/2010,2010,2,6,29,2,0,27,Jun,Tue
6/30/2010,2010,2,6,30,3,0,27,Jun,Wed
7/1/2010,2010,3,7,1,4,0,27,Jul,Thu
7/2/2010,2010,3,7,2,5,0,27,Jul,Fri
7/3/2010,2010,3,7,3,6,1,27,Jul,Sat
7/4/2010,2010,3,7,4,7,1,28,Jul,Sun
7/5/2010,2010,3,7,5,1,0,28,Jul,Mon
7/6/2010,2010,3,7,6,2,0,28,Jul,Tue
7/7/2010,2010,3,7,7,3,0,28,Jul,Wed
7/8/2010,2010,3,7,8,4,0,28,Jul,Thu
7/9/2010,2010,3,7,9,5,0,28,Jul,Fri
7/10/2010,2010,3,7,10,6,1,28,Jul,Sat
7/11/2010,2010,3,7,11,7,1,29,Jul,Sun
7/12/2010,2010,3,7,12,1,0,29,Jul,Mon
7/13/2010,2010,3,7,13,2,0,29,Jul,Tue
7/14/2010,2010,3,7,14,3,0,29,Jul,Wed
7/15/2010,2010,3,7,15,4,0,29,Jul,Thu
7/16/2010,2010,3,7,16,5,0,29,Jul,Fri
7/17/2010,2010,3,7,17,6,1,29,Jul,Sat
7/18/2010,2010,3,7,18,7,1,30,Jul,Sun
7/19/2010,2010,3,7,19,1,0,30,Jul,Mon
7/20/2010,2010,3,7,20,2,0,30,Jul,Tue
7/21/2010,2010,3,7,21,3,0,30,Jul,Wed
7/22/2010,2010,3,7,22,4,0,30,Jul,Thu
7/23/2010,2010,3,7,23,5,0,30,Jul,Fri
7/24/2010,2010,3,7,24,6,1,30,Jul,Sat
7/25/2010,2010,3,7,25,7,1,31,Jul,Sun
7/26/2010,2010,3,7,26,1,0,31,Jul,Mon
7/27/2010,2010,3,7,27,2,0,31,Jul,Tue
7/28/2010,2010,3,7,28,3,0,31,Jul,Wed
7/29/2010,2010,3,7,29,4,0,31,Jul,Thu
7/30/2010,2010,3,7,30,5,0,31,Jul,Fri
7/31/2010,2010,3,7,31,6,1,31,Jul,Sat
8/1/2010,2010,3,8,1,7,1,32,Aug,Sun
8/2/2010,2010,3,8,2,1,0,32,Aug,Mon
8/3/2010,2010,3,8,3,2,0,32,Aug,Tue
8/4/2010,2010,3,8,4,3,0,32,Aug,Wed
8/5/2010,2010,3,8,5,4,0,32,Aug,Thu
8/6/2010,2010,3,8,6,5,0,32,Aug,Fri
8/7/2010,2010,3,8,7,6,1,32,Aug,Sat
8/8/2010,2010,3,8,8,7,1,33,Aug,Sun
8/9/2010,2010,3,8,9,1,0,33,Aug,Mon
8/10/2010,2010,3,8,10,2,0,33,Aug,Tue
8/11/2010,2010,3,8,11,3,0,33,Aug,Wed
8/12/2010,2010,3,8,12,4,0,33,Aug,Thu
8/13/2010,2010,3,8,13,5,0,33,Aug,Fri
8/14/2010,2010,3,8,14,6,1,33,Aug,Sat
8/15/2010,2010,3,8,15,7,1,34,Aug,Sun
8/16/2010,2010,3,8,16,1,0,34,Aug,Mon
8/17/2010,2010,3,8,17,2,0,34,Aug,Tue
8/18/2010,2010,3,8,18,3,0,34,Aug,Wed
8/19/2010,2010,3,8,19,4,0,34,Aug,Thu
8/20/2010,2010,3,8,20,5,0,34,Aug,Fri
8/21/2010,2010,3,8,21,6,1,34,Aug,Sat
8/22/2010,2010,3,8,22,7,1,35,Aug,Sun
8/23/2010,2010,3,8,23,1,0,35,Aug,Mon
8/24/2010,2010,3,8,24,2,0,35,Aug,Tue
8/25/2010,2010,3,8,25,3,0,35,Aug,Wed
8/26/2010,2010,3,8,26,4,0,35,Aug,Thu
8/27/2010,2010,3,8,27,5,0,35,Aug,Fri
8/28/2010,2010,3,8,28,6,1,35,Aug,Sat
8/29/2010,2010,3,8,29,7,1,36,Aug,Sun
8/30/2010,2010,3,8,30,1,0,36,Aug,Mon
8/31/2010,2010,3,8,31,2,0,36,Aug,Tue
9/1/2010,2010,3,9,1,3,0,36,Sep,Wed
9/2/2010,2010,3,9,2,4,0,36,Sep,Thu
9/3/2010,2010,3,9,3,5,0,36,Sep,Fri
9/4/2010,2010,3,9,4,6,1,36,Sep,Sat
9/5/2010,2010,3,9,5,7,1,37,Sep,Sun
9/6/2010,2010,3,9,6,1,0,37,Sep,Mon
9/7/2010,2010,3,9,7,2,0,37,Sep,Tue
9/8/2010,2010,3,9,8,3,0,37,Sep,Wed
9/9/2010,2010,3,9,9,4,0,37,Sep,Thu
9/10/2010,2010,3,9,10,5,0,37,Sep,Fri
9/11/2010,2010,3,9,11,6,1,37,Sep,Sat
9/12/2010,2010,3,9,12,7,1,38,Sep,Sun
9/13/2010,2010,3,9,13,1,0,38,Sep,Mon
9/14/2010,2010,3,9,14,2,0,38,Sep,Tue
9/15/2010,2010,3,9,15,3,0,38,Sep,Wed
9/16/2010,2010,3,9,16,4,0,38,Sep,Thu
9/17/2010,2010,3,9,17,5,0,38,Sep,Fri
9/18/2010,2010,3,9,18,6,1,38,Sep,Sat
9/19/2010,2010,3,9,19,7,1,39,Sep,Sun
9/20/2010,2010,3,9,20,1,0,39,Sep,Mon
9/21/2010,2010,3,9,21,2,0,39,Sep,Tue
9/22/2010,2010,3,9,22,3,0,39,Sep,Wed
9/23/2010,2010,3,9,23,4,0,39,Sep,Thu
9/24/2010,2010,3,9,24,5,0,39,Sep,Fri
9/25/2010,2010,3,9,25,6,1,39,Sep,Sat
9/26/2010,2010,3,9,26,7,1,40,Sep,Sun
9/27/2010,2010,3,9,27,1,0,40,Sep,Mon
9/28/2010,2010,3,9,28,2,0,40,Sep,Tue
9/29/2010,2010,3,9,29,3,0,40,Sep,Wed
9/30/2010,2010,3,9,30,4,0,40,Sep,Thu
10/1/2010,2010,4,10,1,5,0,40,Oct,Fri
10/2/2010,2010,4,10,2,6,1,40,Oct,Sat
10/3/2010,2010,4,10,3,7,1,41,Oct,Sun
10/4/2010,2010,4,10,4,1,0,41,Oct,Mon
10/5/2010,2010,4,10,5,2,0,41,Oct,Tue
10/6/2010,2010,4,10,6,3,0,41,Oct,Wed
10/7/2010,2010,4,10,7,4,0,41,Oct,Thu
10/8/2010,2010,4,10,8,5,0,41,Oct,Fri
10/9/2010,2010,4,10,9,6,1,41,Oct,Sat
10/10/2010,2010,4,10,10,7,1,42,Oct,Sun
10/11/2010,2010,4,10,11,1,0,42,Oct,Mon
10/12/2010,2010,4,10,12,2,0,42,Oct,Tue
10/13/2010,2010,4,10,13,3,0,42,Oct,Wed
10/14/2010,2010,4,10,14,4,0,42,Oct,Thu
10/15/2010,2010,4,10,15,5,0,42,Oct,Fri
10/16/2010,2010,4,10,16,6,1,42,Oct,Sat
10/17/2010,2010,4,10,17,7,1,43,Oct,Sun
10/18/2010,2010,4,10,18,1,0,43,Oct,Mon
10/19/2010,2010,4,10,19,2,0,43,Oct,Tue
10/20/2010,2010,4,10,20,3,0,43,Oct,Wed
10/21/2010,2010,4,10,21,4,0,43,Oct,Thu
10/22/2010,2010,4,10,22,5,0,43,Oct,Fri
10/23/2010,2010,4,10,23,6,1,43,Oct,Sat
10/24/2010,2010,4,10,24,7,1,44,Oct,Sun
10/25/2010,2010,4,10,25,1,0,44,Oct,Mon
10/26/2010,2010,4,10,26,2,0,44,Oct,Tue
10/27/2010,2010,4,10,27,3,0,44,Oct,Wed
10/28/2010,2010,4,10,28,4,0,44,Oct,Thu
10/29/2010,2010,4,10,29,5,0,44,Oct,Fri
10/30/2010,2010,4,10,30,6,1,44,Oct,Sat
10/31/2010,2010,4,10,31,7,1,45,Oct,Sun
11/1/2010,2010,4,11,1,1,0,45,Nov,Mon
11/2/2010,2010,4,11,2,2,0,45,Nov,Tue
11/3/2010,2010,4,11,3,3,0,45,Nov,Wed
11/4/2010,2010,4,11,4,4,0,45,Nov,Thu
11/5/2010,2010,4,11,5,5,0,45,Nov,Fri
11/6/2010,2010,4,11,6,6,1,45,Nov,Sat
11/7/2010,2010,4,11,7,7,1,46,Nov,Sun
11/8/2010,2010,4,11,8,1,0,46,Nov,Mon
11/9/2010,2010,4,11,9,2,0,46,Nov,Tue
11/10/2010,2010,4,11,10,3,0,46,Nov,Wed
11/11/2010,2010,4,11,11,4,0,46,Nov,Thu
11/12/2010,2010,4,11,12,5,0,46,Nov,Fri
11/13/2010,2010,4,11,13,6,1,46,Nov,Sat
11/14/2010,2010,4,11,14,7,1,47,Nov,Sun
11/15/2010,2010,4,11,15,1,0,47,Nov,Mon
11/16/2010,2010,4,11,16,2,0,47,Nov,Tue
11/17/2010,2010,4,11,17,3,0,47,Nov,Wed
11/18/2010,2010,4,11,18,4,0,47,Nov,Thu
11/19/2010,2010,4,11,19,5,0,47,Nov,Fri
11/20/2010,2010,4,11,20,6,1,47,Nov,Sat
11/21/2010,2010,4,11,21,7,1,48,Nov,Sun
11/22/2010,2010,4,11,22,1,0,48,Nov,Mon
11/23/2010,2010,4,11,23,2,0,48,Nov,Tue
11/24/2010,2010,4,11,24,3,0,48,Nov,Wed
11/25/2010,2010,4,11,25,4,0,48,Nov,Thu
11/26/2010,2010,4,11,26,5,0,48,Nov,Fri
11/27/2010,2010,4,11,27,6,1,48,Nov,Sat
11/28/2010,2010,4,11,28,7,1,49,Nov,Sun
11/29/2010,2010,4,11,29,1,0,49,Nov,Mon
11/30/2010,2010,4,11,30,2,0,49,Nov,Tue
12/1/2010,2010,4,12,1,3,0,49,Dec,Wed
12/2/2010,2010,4,12,2,4,0,49,Dec,Thu
12/3/2010,2010,4,12,3,5,0,49,Dec,Fri
12/4/2010,2010,4,12,4,6,1,49,Dec,Sat
12/5/2010,2010,4,12,5,7,1,50,Dec,Sun
12/6/2010,2010,4,12,6,1,0,50,Dec,Mon
12/7/2010,2010,4,12,7,2,0,50,Dec,Tue
12/8/2010,2010,4,12,8,3,0,50,Dec,Wed
12/9/2010,2010,4,12,9,4,0,50,Dec,Thu
12/10/2010,2010,4,12,10,5,0,50,Dec,Fri
12/11/2010,2010,4,12,11,6,1,50,Dec,Sat
12/12/2010,2010,4,12,12,7,1,51,Dec,Sun
12/13/2010,2010,4,12,13,1,0,51,Dec,Mon
12/14/2010,2010,4,12,14,2,0,51,Dec,Tue
12/15/2010,2010,4,12,15,3,0,51,Dec,Wed
12/16/2010,2010,4,12,16,4,0,51,Dec,Thu
12/17/2010,2010,4,12,17,5,0,51,Dec,Fri
12/18/2010,2010,4,12,18,6,1,51,Dec,Sat
12/19/2010,2010,4,12,19,7,1,52,Dec,Sun
12/20/2010,2010,4,12,20,1,0,52,Dec,Mon
12/21/2010,2010,4,12,21,2,0,52,Dec,Tue
12/22/2010,2010,4,12,22,3,0,52,Dec,Wed
12/23/2010,2010,4,12,23,4,0,52,Dec,Thu
12/24/2010,2010,4,12,24,5,0,52,Dec,Fri
12/25/2010,2010,4,12,25,6,1,52,Dec,Sat
12/26/2010,2010,4,12,26,7,1,53,Dec,Sun
12/27/2010,2010,4,12,27,1,0,53,Dec,Mon
12/28/2010,2010,4,12,28,2,0,53,Dec,Tue
12/29/2010,2010,4,12,29,3,0,53,Dec,Wed
12/30/2010,2010,4,12,30,4,0,53,Dec,Thu
12/31/2010,2010,4,12,31,5,0,53,Dec,Fri
1/1/2011,2011,1,1,1,6,1,1,Jan,Sat
1/2/2011,2011,1,1,2,7,1,2,Jan,Sun
1/3/2011,2011,1,1,3,1,0,2,Jan,Mon
1/4/2011,2011,1,1,4,2,0,2,Jan,Tue
1/5/2011,2011,1,1,5,3,0,2,Jan,Wed
1/6/2011,2011,1,1,6,4,0,2,Jan,Thu
1/7/2011,2011,1,1,7,5,0,2,Jan,Fri
1/8/2011,2011,1,1,8,6,1,2,Jan,Sat
1/9/2011,2011,1,1,9,7,1,3,Jan,Sun
1/10/2011,2011,1,1,10,1,0,3,Jan,Mon
1/11/2011,2011,1,1,11,2,0,3,Jan,Tue
1/12/2011,2011,1,1,12,3,0,3,Jan,Wed
1/13/2011,2011,1,1,13,4,0,3,Jan,Thu
1/14/2011,2011,1,1,14,5,0,3,Jan,Fri
1/15/2011,2011,1,1,15,6,1,3,Jan,Sat
1/16/2011,2011,1,1,16,7,1,4,Jan,Sun
1/17/2011,2011,1,1,17,1,0,4,Jan,Mon
1/18/2011,2011,1,1,18,2,0,4,Jan,Tue
1/19/2011,2011,1,1,19,3,0,4,Jan,Wed
1/20/2011,2011,1,1,20,4,0,4,Jan,Thu
1/21/2011,2011,1,1,21,5,0,4,Jan,Fri
1/22/2011,2011,1,1,22,6,1,4,Jan,Sat
1/23/2011,2011,1,1,23,7,1,5,Jan,Sun
1/24/2011,2011,1,1,24,1,0,5,Jan,Mon
1/25/2011,2011,1,1,25,2,0,5,Jan,Tue
1/26/2011,2011,1,1,26,3,0,5,Jan,Wed
1/27/2011,2011,1,1,27,4,0,5,Jan,Thu
1/28/2011,2011,1,1,28,5,0,5,Jan,Fri
1/29/2011,2011,1,1,29,6,1,5,Jan,Sat
1/30/2011,2011,1,1,30,7,1,6,Jan,Sun
1/31/2011,2011,1,1,31,1,0,6,Jan,Mon
2/1/2011,2011,1,2,1,2,0,6,Feb,Tue
2/2/2011,2011,1,2,2,3,0,6,Feb,Wed
2/3/2011,2011,1,2,3,4,0,6,Feb,Thu
2/4/2011,2011,1,2,4,5,0,6,Feb,Fri
2/5/2011,2011,1,2,5,6,1,6,Feb,Sat
2/6/2011,2011,1,2,6,7,1,7,Feb,Sun
2/7/2011,2011,1,2,7,1,0,7,Feb,Mon
2/8/2011,2011,1,2,8,2,0,7,Feb,Tue
2/9/2011,2011,1,2,9,3,0,7,Feb,Wed
2/10/2011,2011,1,2,10,4,0,7,Feb,Thu
2/11/2011,2011,1,2,11,5,0,7,Feb,Fri
2/12/2011,2011,1,2,12,6,1,7,Feb,Sat
2/13/2011,2011,1,2,13,7,1,8,Feb,Sun
2/14/2011,2011,1,2,14,1,0,8,Feb,Mon
2/15/2011,2011,1,2,15,2,0,8,Feb,Tue
2/16/2011,2011,1,2,16,3,0,8,Feb,Wed
2/17/2011,2011,1,2,17,4,0,8,Feb,Thu
2/18/2011,2011,1,2,18,5,0,8,Feb,Fri
2/19/2011,2011,1,2,19,6,1,8,Feb,Sat
2/20/2011,2011,1,2,20,7,1,9,Feb,Sun
2/21/2011,2011,1,2,21,1,0,9,Feb,Mon
2/22/2011,2011,1,2,22,2,0,9,Feb,Tue
2/23/2011,2011,1,2,23,3,0,9,Feb,Wed
2/24/2011,2011,1,2,24,4,0,9,Feb,Thu
2/25/2011,2011,1,2,25,5,0,9,Feb,Fri
2/26/2011,2011,1,2,26,6,1,9,Feb,Sat
2/27/2011,2011,1,2,27,7,1,10,Feb,Sun
2/28/2011,2011,1,2,28,1,0,10,Feb,Mon
3/1/2011,2011,1,3,1,2,0,10,Mar,Tue
3/2/2011,2011,1,3,2,3,0,10,Mar,Wed
3/3/2011,2011,1,3,3,4,0,10,Mar,Thu
3/4/2011,2011,1,3,4,5,0,10,Mar,Fri
3/5/2011,2011,1,3,5,6,1,10,Mar,Sat
3/6/2011,2011,1,3,6,7,1,11,Mar,Sun
3/7/2011,2011,1,3,7,1,0,11,Mar,Mon
3/8/2011,2011,1,3,8,2,0,11,Mar,Tue
3/9/2011,2011,1,3,9,3,0,11,Mar,Wed
3/10/2011,2011,1,3,10,4,0,11,Mar,Thu
3/11/2011,2011,1,3,11,5,0,11,Mar,Fri
3/12/2011,2011,1,3,12,6,1,11,Mar,Sat
3/13/2011,2011,1,3,13,7,1,12,Mar,Sun
3/14/2011,2011,1,3,14,1,0,12,Mar,Mon
3/15/2011,2011,1,3,15,2,0,12,Mar,Tue
3/16/2011,2011,1,3,16,3,0,12,Mar,Wed
3/17/2011,2011,1,3,17,4,0,12,Mar,Thu
3/18/2011,2011,1,3,18,5,0,12,Mar,Fri
3/19/2011,2011,1,3,19,6,1,12,Mar,Sat
3/20/2011,2011,1,3,20,7,1,13,Mar,Sun
3/21/2011,2011,1,3,21,1,0,13,Mar,Mon
3/22/2011,2011,1,3,22,2,0,13,Mar,Tue
3/23/2011,2011,1,3,23,3,0,13,Mar,Wed
3/24/2011,2011,1,3,24,4,0,13,Mar,Thu
3/25/2011,2011,1,3,25,5,0,13,Mar,Fri
3/26/2011,2011,1,3,26,6,1,13,Mar,Sat
3/27/2011,2011,1,3,27,7,1,14,Mar,Sun
3/28/2011,2011,1,3,28,1,0,14,Mar,Mon
3/29/2011,2011,1,3,29,2,0,14,Mar,Tue
3/30/2011,2011,1,3,30,3,0,14,Mar,Wed
3/31/2011,2011,1,3,31,4,0,14,Mar,Thu
4/1/2011,2011,2,4,1,5,0,14,Apr,Fri
4/2/2011,2011,2,4,2,6,1,14,Apr,Sat
4/3/2011,2011,2,4,3,7,1,15,Apr,Sun
4/4/2011,2011,2,4,4,1,0,15,Apr,Mon
4/5/2011,2011,2,4,5,2,0,15,Apr,Tue
4/6/2011,2011,2,4,6,3,0,15,Apr,Wed
4/7/2011,2011,2,4,7,4,0,15,Apr,Thu
4/8/2011,2011,2,4,8,5,0,15,Apr,Fri
4/9/2011,2011,2,4,9,6,1,15,Apr,Sat
4/10/2011,2011,2,4,10,7,1,16,Apr,Sun
4/11/2011,2011,2,4,11,1,0,16,Apr,Mon
4/12/2011,2011,2,4,12,2,0,16,Apr,Tue
4/13/2011,2011,2,4,13,3,0,16,Apr,Wed
4/14/2011,2011,2,4,14,4,0,16,Apr,Thu
4/15/2011,2011,2,4,15,5,0,16,Apr,Fri
4/16/2011,2011,2,4,16,6,1,16,Apr,Sat
4/17/2011,2011,2,4,17,7,1,17,Apr,Sun
4/18/2011,2011,2,4,18,1,0,17,Apr,Mon
4/19/2011,2011,2,4,19,2,0,17,Apr,Tue
4/20/2011,2011,2,4,20,3,0,17,Apr,Wed
4/21/2011,2011,2,4,21,4,0,17,Apr,Thu
4/22/2011,2011,2,4,22,5,0,17,Apr,Fri
4/23/2011,2011,2,4,23,6,1,17,Apr,Sat
4/24/2011,2011,2,4,24,7,1,18,Apr,Sun
4/25/2011,2011,2,4,25,1,0,18,Apr,Mon
4/26/2011,2011,2,4,26,2,0,18,Apr,Tue
4/27/2011,2011,2,4,27,3,0,18,Apr,Wed
4/28/2011,2011,2,4,28,4,0,18,Apr,Thu
4/29/2011,2011,2,4,29,5,0,18,Apr,Fri
4/30/2011,2011,2,4,30,6,1,18,Apr,Sat
5/1/2011,2011,2,5,1,7,1,19,May,Sun
5/2/2011,2011,2,5,2,1,0,19,May,Mon
5/3/2011,2011,2,5,3,2,0,19,May,Tue
5/4/2011,2011,2,5,4,3,0,19,May,Wed
5/5/2011,2011,2,5,5,4,0,19,May,Thu
5/6/2011,2011,2,5,6,5,0,19,May,Fri
5/7/2011,2011,2,5,7,6,1,19,May,Sat
5/8/2011,2011,2,5,8,7,1,20,May,Sun
5/9/2011,2011,2,5,9,1,0,20,May,Mon
5/10/2011,2011,2,5,10,2,0,20,May,Tue
5/11/2011,2011,2,5,11,3,0,20,May,Wed
5/12/2011,2011,2,5,12,4,0,20,May,Thu
5/13/2011,2011,2,5,13,5,0,20,May,Fri
5/14/2011,2011,2,5,14,6,1,20,May,Sat
5/15/2011,2011,2,5,15,7,1,21,May,Sun
5/16/2011,2011,2,5,16,1,0,21,May,Mon
5/17/2011,2011,2,5,17,2,0,21,May,Tue
5/18/2011,2011,2,5,18,3,0,21,May,Wed
5/19/2011,2011,2,5,19,4,0,21,May,Thu
5/20/2011,2011,2,5,20,5,0,21,May,Fri
5/21/2011,2011,2,5,21,6,1,21,May,Sat
5/22/2011,2011,2,5,22,7,1,22,May,Sun
5/23/2011,2011,2,5,23,1,0,22,May,Mon
5/24/2011,2011,2,5,24,2,0,22,May,Tue
5/25/2011,2011,2,5,25,3,0,22,May,Wed
5/26/2011,2011,2,5,26,4,0,22,May,Thu
5/27/2011,2011,2,5,27,5,0,22,May,Fri
5/28/2011,2011,2,5,28,6,1,22,May,Sat
5/29/2011,2011,2,5,29,7,1,23,May,Sun
5/30/2011,2011,2,5,30,1,0,23,May,Mon
5/31/2011,2011,2,5,31,2,0,23,May,Tue
6/1/2011,2011,2,6,1,3,0,23,Jun,Wed
6/2/2011,2011,2,6,2,4,0,23,Jun,Thu
6/3/2011,2011,2,6,3,5,0,23,Jun,Fri
6/4/2011,2011,2,6,4,6,1,23,Jun,Sat
6/5/2011,2011,2,6,5,7,1,24,Jun,Sun
6/6/2011,2011,2,6,6,1,0,24,Jun,Mon
6/7/2011,2011,2,6,7,2,0,24,Jun,Tue
6/8/2011,2011,2,6,8,3,0,24,Jun,Wed
6/9/2011,2011,2,6,9,4,0,24,Jun,Thu
6/10/2011,2011,2,6,10,5,0,24,Jun,Fri
6/11/2011,2011,2,6,11,6,1,24,Jun,Sat
6/12/2011,2011,2,6,12,7,1,25,Jun,Sun
6/13/2011,2011,2,6,13,1,0,25,Jun,Mon
6/14/2011,2011,2,6,14,2,0,25,Jun,Tue
6/15/2011,2011,2,6,15,3,0,25,Jun,Wed
6/16/2011,2011,2,6,16,4,0,25,Jun,Thu
6/17/2011,2011,2,6,17,5,0,25,Jun,Fri
6/18/2011,2011,2,6,18,6,1,25,Jun,Sat
6/19/2011,2011,2,6,19,7,1,26,Jun,Sun
6/20/2011,2011,2,6,20,1,0,26,Jun,Mon
6/21/2011,2011,2,6,21,2,0,26,Jun,Tue
6/22/2011,2011,2,6,22,3,0,26,Jun,Wed
6/23/2011,2011,2,6,23,4,0,26,Jun,Thu
6/24/2011,2011,2,6,24,5,0,26,Jun,Fri
6/25/2011,2011,2,6,25,6,1,26,Jun,Sat
6/26/2011,2011,2,6,26,7,1,27,Jun,Sun
6/27/2011,2011,2,6,27,1,0,27,Jun,Mon
6/28/2011,2011,2,6,28,2,0,27,Jun,Tue
6/29/2011,2011,2,6,29,3,0,27,Jun,Wed
6/30/2011,2011,2,6,30,4,0,27,Jun,Thu
7/1/2011,2011,3,7,1,5,0,27,Jul,Fri
7/2/2011,2011,3,7,2,6,1,27,Jul,Sat
7/3/2011,2011,3,7,3,7,1,28,Jul,Sun
7/4/2011,2011,3,7,4,1,0,28,Jul,Mon
7/5/2011,2011,3,7,5,2,0,28,Jul,Tue
7/6/2011,2011,3,7,6,3,0,28,Jul,Wed
7/7/2011,2011,3,7,7,4,0,28,Jul,Thu
7/8/2011,2011,3,7,8,5,0,28,Jul,Fri
7/9/2011,2011,3,7,9,6,1,28,Jul,Sat
7/10/2011,2011,3,7,10,7,1,29,Jul,Sun
7/11/2011,2011,3,7,11,1,0,29,Jul,Mon
7/12/2011,2011,3,7,12,2,0,29,Jul,Tue
7/13/2011,2011,3,7,13,3,0,29,Jul,Wed
7/14/2011,2011,3,7,14,4,0,29,Jul,Thu
7/15/2011,2011,3,7,15,5,0,29,Jul,Fri
7/16/2011,2011,3,7,16,6,1,29,Jul,Sat
7/17/2011,2011,3,7,17,7,1,30,Jul,Sun
7/18/2011,2011,3,7,18,1,0,30,Jul,Mon
7/19/2011,2011,3,7,19,2,0,30,Jul,Tue
7/20/2011,2011,3,7,20,3,0,30,Jul,Wed
7/21/2011,2011,3,7,21,4,0,30,Jul,Thu
7/22/2011,2011,3,7,22,5,0,30,Jul,Fri
7/23/2011,2011,3,7,23,6,1,30,Jul,Sat
7/24/2011,2011,3,7,24,7,1,31,Jul,Sun
7/25/2011,2011,3,7,25,1,0,31,Jul,Mon
7/26/2011,2011,3,7,26,2,0,31,Jul,Tue
7/27/2011,2011,3,7,27,3,0,31,Jul,Wed
7/28/2011,2011,3,7,28,4,0,31,Jul,Thu
7/29/2011,2011,3,7,29,5,0,31,Jul,Fri
7/30/2011,2011,3,7,30,6,1,31,Jul,Sat
7/31/2011,2011,3,7,31,7,1,32,Jul,Sun
8/1/2011,2011,3,8,1,1,0,32,Aug,Mon
8/2/2011,2011,3,8,2,2,0,32,Aug,Tue
8/3/2011,2011,3,8,3,3,0,32,Aug,Wed
8/4/2011,2011,3,8,4,4,0,32,Aug,Thu
8/5/2011,2011,3,8,5,5,0,32,Aug,Fri
8/6/2011,2011,3,8,6,6,1,32,Aug,Sat
8/7/2011,2011,3,8,7,7,1,33,Aug,Sun
8/8/2011,2011,3,8,8,1,0,33,Aug,Mon
8/9/2011,2011,3,8,9,2,0,33,Aug,Tue
8/10/2011,2011,3,8,10,3,0,33,Aug,Wed
8/11/2011,2011,3,8,11,4,0,33,Aug,Thu
8/12/2011,2011,3,8,12,5,0,33,Aug,Fri
8/13/2011,2011,3,8,13,6,1,33,Aug,Sat
8/14/2011,2011,3,8,14,7,1,34,Aug,Sun
8/15/2011,2011,3,8,15,1,0,34,Aug,Mon
8/16/2011,2011,3,8,16,2,0,34,Aug,Tue
8/17/2011,2011,3,8,17,3,0,34,Aug,Wed
8/18/2011,2011,3,8,18,4,0,34,Aug,Thu
8/19/2011,2011,3,8,19,5,0,34,Aug,Fri
8/20/2011,2011,3,8,20,6,1,34,Aug,Sat
8/21/2011,2011,3,8,21,7,1,35,Aug,Sun
8/22/2011,2011,3,8,22,1,0,35,Aug,Mon
8/23/2011,2011,3,8,23,2,0,35,Aug,Tue
8/24/2011,2011,3,8,24,3,0,35,Aug,Wed
8/25/2011,2011,3,8,25,4,0,35,Aug,Thu
8/26/2011,2011,3,8,26,5,0,35,Aug,Fri
8/27/2011,2011,3,8,27,6,1,35,Aug,Sat
8/28/2011,2011,3,8,28,7,1,36,Aug,Sun
8/29/2011,2011,3,8,29,1,0,36,Aug,Mon
8/30/2011,2011,3,8,30,2,0,36,Aug,Tue
8/31/2011,2011,3,8,31,3,0,36,Aug,Wed
9/1/2011,2011,3,9,1,4,0,36,Sep,Thu
9/2/2011,2011,3,9,2,5,0,36,Sep,Fri
9/3/2011,2011,3,9,3,6,1,36,Sep,Sat
9/4/2011,2011,3,9,4,7,1,37,Sep,Sun
9/5/2011,2011,3,9,5,1,0,37,Sep,Mon
9/6/2011,2011,3,9,6,2,0,37,Sep,Tue
9/7/2011,2011,3,9,7,3,0,37,Sep,Wed
9/8/2011,2011,3,9,8,4,0,37,Sep,Thu
9/9/2011,2011,3,9,9,5,0,37,Sep,Fri
9/10/2011,2011,3,9,10,6,1,37,Sep,Sat
9/11/2011,2011,3,9,11,7,1,38,Sep,Sun
9/12/2011,2011,3,9,12,1,0,38,Sep,Mon
9/13/2011,2011,3,9,13,2,0,38,Sep,Tue
9/14/2011,2011,3,9,14,3,0,38,Sep,Wed
9/15/2011,2011,3,9,15,4,0,38,Sep,Thu
9/16/2011,2011,3,9,16,5,0,38,Sep,Fri
9/17/2011,2011,3,9,17,6,1,38,Sep,Sat
9/18/2011,2011,3,9,18,7,1,39,Sep,Sun
9/19/2011,2011,3,9,19,1,0,39,Sep,Mon
9/20/2011,2011,3,9,20,2,0,39,Sep,Tue
9/21/2011,2011,3,9,21,3,0,39,Sep,Wed
9/22/2011,2011,3,9,22,4,0,39,Sep,Thu
9/23/2011,2011,3,9,23,5,0,39,Sep,Fri
9/24/2011,2011,3,9,24,6,1,39,Sep,Sat
9/25/2011,2011,3,9,25,7,1,40,Sep,Sun
9/26/2011,2011,3,9,26,1,0,40,Sep,Mon
9/27/2011,2011,3,9,27,2,0,40,Sep,Tue
9/28/2011,2011,3,9,28,3,0,40,Sep,Wed
9/29/2011,2011,3,9,29,4,0,40,Sep,Thu
9/30/2011,2011,3,9,30,5,0,40,Sep,Fri
10/1/2011,2011,4,10,1,6,1,40,Oct,Sat
10/2/2011,2011,4,10,2,7,1,41,Oct,Sun
10/3/2011,2011,4,10,3,1,0,41,Oct,Mon
10/4/2011,2011,4,10,4,2,0,41,Oct,Tue
10/5/2011,2011,4,10,5,3,0,41,Oct,Wed
10/6/2011,2011,4,10,6,4,0,41,Oct,Thu
10/7/2011,2011,4,10,7,5,0,41,Oct,Fri
10/8/2011,2011,4,10,8,6,1,41,Oct,Sat
10/9/2011,2011,4,10,9,7,1,42,Oct,Sun
10/10/2011,2011,4,10,10,1,0,42,Oct,Mon
10/11/2011,2011,4,10,11,2,0,42,Oct,Tue
10/12/2011,2011,4,10,12,3,0,42,Oct,Wed
10/13/2011,2011,4,10,13,4,0,42,Oct,Thu
10/14/2011,2011,4,10,14,5,0,42,Oct,Fri
10/15/2011,2011,4,10,15,6,1,42,Oct,Sat
10/16/2011,2011,4,10,16,7,1,43,Oct,Sun
10/17/2011,2011,4,10,17,1,0,43,Oct,Mon
10/18/2011,2011,4,10,18,2,0,43,Oct,Tue
10/19/2011,2011,4,10,19,3,0,43,Oct,Wed
10/20/2011,2011,4,10,20,4,0,43,Oct,Thu
10/21/2011,2011,4,10,21,5,0,43,Oct,Fri
10/22/2011,2011,4,10,22,6,1,43,Oct,Sat
10/23/2011,2011,4,10,23,7,1,44,Oct,Sun
10/24/2011,2011,4,10,24,1,0,44,Oct,Mon
10/25/2011,2011,4,10,25,2,0,44,Oct,Tue
10/26/2011,2011,4,10,26,3,0,44,Oct,Wed
10/27/2011,2011,4,10,27,4,0,44,Oct,Thu
10/28/2011,2011,4,10,28,5,0,44,Oct,Fri
10/29/2011,2011,4,10,29,6,1,44,Oct,Sat
10/30/2011,2011,4,10,30,7,1,45,Oct,Sun
10/31/2011,2011,4,10,31,1,0,45,Oct,Mon
11/1/2011,2011,4,11,1,2,0,45,Nov,Tue
11/2/2011,2011,4,11,2,3,0,45,Nov,Wed
11/3/2011,2011,4,11,3,4,0,45,Nov,Thu
11/4/2011,2011,4,11,4,5,0,45,Nov,Fri
11/5/2011,2011,4,11,5,6,1,45,Nov,Sat
11/6/2011,2011,4,11,6,7,1,46,Nov,Sun
11/7/2011,2011,4,11,7,1,0,46,Nov,Mon
11/8/2011,2011,4,11,8,2,0,46,Nov,Tue
11/9/2011,2011,4,11,9,3,0,46,Nov,Wed
11/10/2011,2011,4,11,10,4,0,46,Nov,Thu
11/11/2011,2011,4,11,11,5,0,46,Nov,Fri
11/12/2011,2011,4,11,12,6,1,46,Nov,Sat
11/13/2011,2011,4,11,13,7,1,47,Nov,Sun
11/14/2011,2011,4,11,14,1,0,47,Nov,Mon
11/15/2011,2011,4,11,15,2,0,47,Nov,Tue
11/16/2011,2011,4,11,16,3,0,47,Nov,Wed
11/17/2011,2011,4,11,17,4,0,47,Nov,Thu
11/18/2011,2011,4,11,18,5,0,47,Nov,Fri
11/19/2011,2011,4,11,19,6,1,47,Nov,Sat
11/20/2011,2011,4,11,20,7,1,48,Nov,Sun
11/21/2011,2011,4,11,21,1,0,48,Nov,Mon
11/22/2011,2011,4,11,22,2,0,48,Nov,Tue
11/23/2011,2011,4,11,23,3,0,48,Nov,Wed
11/24/2011,2011,4,11,24,4,0,48,Nov,Thu
11/25/2011,2011,4,11,25,5,0,48,Nov,Fri
11/26/2011,2011,4,11,26,6,1,48,Nov,Sat
11/27/2011,2011,4,11,27,7,1,49,Nov,Sun
11/28/2011,2011,4,11,28,1,0,49,Nov,Mon
11/29/2011,2011,4,11,29,2,0,49,Nov,Tue
11/30/2011,2011,4,11,30,3,0,49,Nov,Wed
12/1/2011,2011,4,12,1,4,0,49,Dec,Thu
12/2/2011,2011,4,12,2,5,0,49,Dec,Fri
12/3/2011,2011,4,12,3,6,1,49,Dec,Sat
12/4/2011,2011,4,12,4,7,1,50,Dec,Sun
12/5/2011,2011,4,12,5,1,0,50,Dec,Mon
12/6/2011,2011,4,12,6,2,0,50,Dec,Tue
12/7/2011,2011,4,12,7,3,0,50,Dec,Wed
12/8/2011,2011,4,12,8,4,0,50,Dec,Thu
12/9/2011,2011,4,12,9,5,0,50,Dec,Fri
12/10/2011,2011,4,12,10,6,1,50,Dec,Sat
12/11/2011,2011,4,12,11,7,1,51,Dec,Sun
12/12/2011,2011,4,12,12,1,0,51,Dec,Mon
12/13/2011,2011,4,12,13,2,0,51,Dec,Tue
12/14/2011,2011,4,12,14,3,0,51,Dec,Wed
12/15/2011,2011,4,12,15,4,0,51,Dec,Thu
12/16/2011,2011,4,12,16,5,0,51,Dec,Fri
12/17/2011,2011,4,12,17,6,1,51,Dec,Sat
12/18/2011,2011,4,12,18,7,1,52,Dec,Sun
12/19/2011,2011,4,12,19,1,0,52,Dec,Mon
12/20/2011,2011,4,12,20,2,0,52,Dec,Tue
12/21/2011,2011,4,12,21,3,0,52,Dec,Wed
12/22/2011,2011,4,12,22,4,0,52,Dec,Thu
12/23/2011,2011,4,12,23,5,0,52,Dec,Fri
12/24/2011,2011,4,12,24,6,1,52,Dec,Sat
12/25/2011,2011,4,12,25,7,1,53,Dec,Sun
12/26/2011,2011,4,12,26,1,0,53,Dec,Mon
12/27/2011,2011,4,12,27,2,0,53,Dec,Tue
12/28/2011,2011,4,12,28,3,0,53,Dec,Wed
12/29/2011,2011,4,12,29,4,0,53,Dec,Thu
12/30/2011,2011,4,12,30,5,0,53,Dec,Fri
12/31/2011,2011,4,12,31,6,1,53,Dec,Sat
1/1/2012,2012,1,1,1,7,1,2,Jan,Sun
1/2/2012,2012,1,1,2,1,0,2,Jan,Mon
1/3/2012,2012,1,1,3,2,0,2,Jan,Tue
1/4/2012,2012,1,1,4,3,0,2,Jan,Wed
1/5/2012,2012,1,1,5,4,0,2,Jan,Thu
1/6/2012,2012,1,1,6,5,0,2,Jan,Fri
1/7/2012,2012,1,1,7,6,1,2,Jan,Sat
1/8/2012,2012,1,1,8,7,1,3,Jan,Sun
1/9/2012,2012,1,1,9,1,0,3,Jan,Mon
1/10/2012,2012,1,1,10,2,0,3,Jan,Tue
1/11/2012,2012,1,1,11,3,0,3,Jan,Wed
1/12/2012,2012,1,1,12,4,0,3,Jan,Thu
1/13/2012,2012,1,1,13,5,0,3,Jan,Fri
1/14/2012,2012,1,1,14,6,1,3,Jan,Sat
1/15/2012,2012,1,1,15,7,1,4,Jan,Sun
1/16/2012,2012,1,1,16,1,0,4,Jan,Mon
1/17/2012,2012,1,1,17,2,0,4,Jan,Tue
1/18/2012,2012,1,1,18,3,0,4,Jan,Wed
1/19/2012,2012,1,1,19,4,0,4,Jan,Thu
1/20/2012,2012,1,1,20,5,0,4,Jan,Fri
1/21/2012,2012,1,1,21,6,1,4,Jan,Sat
1/22/2012,2012,1,1,22,7,1,5,Jan,Sun
1/23/2012,2012,1,1,23,1,0,5,Jan,Mon
1/24/2012,2012,1,1,24,2,0,5,Jan,Tue
1/25/2012,2012,1,1,25,3,0,5,Jan,Wed
1/26/2012,2012,1,1,26,4,0,5,Jan,Thu
1/27/2012,2012,1,1,27,5,0,5,Jan,Fri
1/28/2012,2012,1,1,28,6,1,5,Jan,Sat
1/29/2012,2012,1,1,29,7,1,6,Jan,Sun
1/30/2012,2012,1,1,30,1,0,6,Jan,Mon
1/31/2012,2012,1,1,31,2,0,6,Jan,Tue
2/1/2012,2012,1,2,1,3,0,6,Feb,Wed
2/2/2012,2012,1,2,2,4,0,6,Feb,Thu
2/3/2012,2012,1,2,3,5,0,6,Feb,Fri
2/4/2012,2012,1,2,4,6,1,6,Feb,Sat
2/5/2012,2012,1,2,5,7,1,7,Feb,Sun
2/6/2012,2012,1,2,6,1,0,7,Feb,Mon
2/7/2012,2012,1,2,7,2,0,7,Feb,Tue
2/8/2012,2012,1,2,8,3,0,7,Feb,Wed
2/9/2012,2012,1,2,9,4,0,7,Feb,Thu
2/10/2012,2012,1,2,10,5,0,7,Feb,Fri
2/11/2012,2012,1,2,11,6,1,7,Feb,Sat
2/12/2012,2012,1,2,12,7,1,8,Feb,Sun
2/13/2012,2012,1,2,13,1,0,8,Feb,Mon
2/14/2012,2012,1,2,14,2,0,8,Feb,Tue
2/15/2012,2012,1,2,15,3,0,8,Feb,Wed
2/16/2012,2012,1,2,16,4,0,8,Feb,Thu
2/17/2012,2012,1,2,17,5,0,8,Feb,Fri
2/18/2012,2012,1,2,18,6,1,8,Feb,Sat
2/19/2012,2012,1,2,19,7,1,9,Feb,Sun
2/20/2012,2012,1,2,20,1,0,9,Feb,Mon
2/21/2012,2012,1,2,21,2,0,9,Feb,Tue
2/22/2012,2012,1,2,22,3,0,9,Feb,Wed
2/23/2012,2012,1,2,23,4,0,9,Feb,Thu
2/24/2012,2012,1,2,24,5,0,9,Feb,Fri
2/25/2012,2012,1,2,25,6,1,9,Feb,Sat
2/26/2012,2012,1,2,26,7,1,10,Feb,Sun
2/27/2012,2012,1,2,27,1,0,10,Feb,Mon
2/28/2012,2012,1,2,28,2,0,10,Feb,Tue
2/29/2012,2012,1,2,29,3,0,10,Feb,Wed
3/1/2012,2012,1,3,1,4,0,10,Mar,Thu
3/2/2012,2012,1,3,2,5,0,10,Mar,Fri
3/3/2012,2012,1,3,3,6,1,10,Mar,Sat
3/4/2012,2012,1,3,4,7,1,11,Mar,Sun
3/5/2012,2012,1,3,5,1,0,11,Mar,Mon
3/6/2012,2012,1,3,6,2,0,11,Mar,Tue
3/7/2012,2012,1,3,7,3,0,11,Mar,Wed
3/8/2012,2012,1,3,8,4,0,11,Mar,Thu
3/9/2012,2012,1,3,9,5,0,11,Mar,Fri
3/10/2012,2012,1,3,10,6,1,11,Mar,Sat
3/11/2012,2012,1,3,11,7,1,12,Mar,Sun
3/12/2012,2012,1,3,12,1,0,12,Mar,Mon
3/13/2012,2012,1,3,13,2,0,12,Mar,Tue
3/14/2012,2012,1,3,14,3,0,12,Mar,Wed
3/15/2012,2012,1,3,15,4,0,12,Mar,Thu
3/16/2012,2012,1,3,16,5,0,12,Mar,Fri
3/17/2012,2012,1,3,17,6,1,12,Mar,Sat
3/18/2012,2012,1,3,18,7,1,13,Mar,Sun
3/19/2012,2012,1,3,19,1,0,13,Mar,Mon
3/20/2012,2012,1,3,20,2,0,13,Mar,Tue
3/21/2012,2012,1,3,21,3,0,13,Mar,Wed
3/22/2012,2012,1,3,22,4,0,13,Mar,Thu
3/23/2012,2012,1,3,23,5,0,13,Mar,Fri
3/24/2012,2012,1,3,24,6,1,13,Mar,Sat
3/25/2012,2012,1,3,25,7,1,14,Mar,Sun
3/26/2012,2012,1,3,26,1,0,14,Mar,Mon
3/27/2012,2012,1,3,27,2,0,14,Mar,Tue
3/28/2012,2012,1,3,28,3,0,14,Mar,Wed
3/29/2012,2012,1,3,29,4,0,14,Mar,Thu
3/30/2012,2012,1,3,30,5,0,14,Mar,Fri
3/31/2012,2012,1,3,31,6,1,14,Mar,Sat
4/1/2012,2012,2,4,1,7,1,15,Apr,Sun
4/2/2012,2012,2,4,2,1,0,15,Apr,Mon
4/3/2012,2012,2,4,3,2,0,15,Apr,Tue
4/4/2012,2012,2,4,4,3,0,15,Apr,Wed
4/5/2012,2012,2,4,5,4,0,15,Apr,Thu
4/6/2012,2012,2,4,6,5,0,15,Apr,Fri
4/7/2012,2012,2,4,7,6,1,15,Apr,Sat
4/8/2012,2012,2,4,8,7,1,16,Apr,Sun
4/9/2012,2012,2,4,9,1,0,16,Apr,Mon
4/10/2012,2012,2,4,10,2,0,16,Apr,Tue
4/11/2012,2012,2,4,11,3,0,16,Apr,Wed
4/12/2012,2012,2,4,12,4,0,16,Apr,Thu
4/13/2012,2012,2,4,13,5,0,16,Apr,Fri
4/14/2012,2012,2,4,14,6,1,16,Apr,Sat
4/15/2012,2012,2,4,15,7,1,17,Apr,Sun
4/16/2012,2012,2,4,16,1,0,17,Apr,Mon
4/17/2012,2012,2,4,17,2,0,17,Apr,Tue
4/18/2012,2012,2,4,18,3,0,17,Apr,Wed
4/19/2012,2012,2,4,19,4,0,17,Apr,Thu
4/20/2012,2012,2,4,20,5,0,17,Apr,Fri
4/21/2012,2012,2,4,21,6,1,17,Apr,Sat
4/22/2012,2012,2,4,22,7,1,18,Apr,Sun
4/23/2012,2012,2,4,23,1,0,18,Apr,Mon
4/24/2012,2012,2,4,24,2,0,18,Apr,Tue
4/25/2012,2012,2,4,25,3,0,18,Apr,Wed
4/26/2012,2012,2,4,26,4,0,18,Apr,Thu
4/27/2012,2012,2,4,27,5,0,18,Apr,Fri
4/28/2012,2012,2,4,28,6,1,18,Apr,Sat
4/29/2012,2012,2,4,29,7,1,19,Apr,Sun
4/30/2012,2012,2,4,30,1,0,19,Apr,Mon
5/1/2012,2012,2,5,1,2,0,19,May,Tue
5/2/2012,2012,2,5,2,3,0,19,May,Wed
5/3/2012,2012,2,5,3,4,0,19,May,Thu
5/4/2012,2012,2,5,4,5,0,19,May,Fri
5/5/2012,2012,2,5,5,6,1,19,May,Sat
5/6/2012,2012,2,5,6,7,1,20,May,Sun
5/7/2012,2012,2,5,7,1,0,20,May,Mon
5/8/2012,2012,2,5,8,2,0,20,May,Tue
5/9/2012,2012,2,5,9,3,0,20,May,Wed
5/10/2012,2012,2,5,10,4,0,20,May,Thu
5/11/2012,2012,2,5,11,5,0,20,May,Fri
5/12/2012,2012,2,5,12,6,1,20,May,Sat
5/13/2012,2012,2,5,13,7,1,21,May,Sun
5/14/2012,2012,2,5,14,1,0,21,May,Mon
5/15/2012,2012,2,5,15,2,0,21,May,Tue
5/16/2012,2012,2,5,16,3,0,21,May,Wed
5/17/2012,2012,2,5,17,4,0,21,May,Thu
5/18/2012,2012,2,5,18,5,0,21,May,Fri
5/19/2012,2012,2,5,19,6,1,21,May,Sat
5/20/2012,2012,2,5,20,7,1,22,May,Sun
5/21/2012,2012,2,5,21,1,0,22,May,Mon
5/22/2012,2012,2,5,22,2,0,22,May,Tue
5/23/2012,2012,2,5,23,3,0,22,May,Wed
5/24/2012,2012,2,5,24,4,0,22,May,Thu
5/25/2012,2012,2,5,25,5,0,22,May,Fri
5/26/2012,2012,2,5,26,6,1,22,May,Sat
5/27/2012,2012,2,5,27,7,1,23,May,Sun
5/28/2012,2012,2,5,28,1,0,23,May,Mon
5/29/2012,2012,2,5,29,2,0,23,May,Tue
5/30/2012,2012,2,5,30,3,0,23,May,Wed
5/31/2012,2012,2,5,31,4,0,23,May,Thu
6/1/2012,2012,2,6,1,5,0,23,Jun,Fri
6/2/2012,2012,2,6,2,6,1,23,Jun,Sat
6/3/2012,2012,2,6,3,7,1,24,Jun,Sun
6/4/2012,2012,2,6,4,1,0,24,Jun,Mon
6/5/2012,2012,2,6,5,2,0,24,Jun,Tue
6/6/2012,2012,2,6,6,3,0,24,Jun,Wed
6/7/2012,2012,2,6,7,4,0,24,Jun,Thu
6/8/2012,2012,2,6,8,5,0,24,Jun,Fri
6/9/2012,2012,2,6,9,6,1,24,Jun,Sat
6/10/2012,2012,2,6,10,7,1,25,Jun,Sun
6/11/2012,2012,2,6,11,1,0,25,Jun,Mon
6/12/2012,2012,2,6,12,2,0,25,Jun,Tue
6/13/2012,2012,2,6,13,3,0,25,Jun,Wed
6/14/2012,2012,2,6,14,4,0,25,Jun,Thu
6/15/2012,2012,2,6,15,5,0,25,Jun,Fri
6/16/2012,2012,2,6,16,6,1,25,Jun,Sat
6/17/2012,2012,2,6,17,7,1,26,Jun,Sun
6/18/2012,2012,2,6,18,1,0,26,Jun,Mon
6/19/2012,2012,2,6,19,2,0,26,Jun,Tue
6/20/2012,2012,2,6,20,3,0,26,Jun,Wed
6/21/2012,2012,2,6,21,4,0,26,Jun,Thu
6/22/2012,2012,2,6,22,5,0,26,Jun,Fri
6/23/2012,2012,2,6,23,6,1,26,Jun,Sat
6/24/2012,2012,2,6,24,7,1,27,Jun,Sun
6/25/2012,2012,2,6,25,1,0,27,Jun,Mon
6/26/2012,2012,2,6,26,2,0,27,Jun,Tue
6/27/2012,2012,2,6,27,3,0,27,Jun,Wed
6/28/2012,2012,2,6,28,4,0,27,Jun,Thu
6/29/2012,2012,2,6,29,5,0,27,Jun,Fri
6/30/2012,2012,2,6,30,6,1,27,Jun,Sat
7/1/2012,2012,3,7,1,7,1,28,Jul,Sun
7/2/2012,2012,3,7,2,1,0,28,Jul,Mon
7/3/2012,2012,3,7,3,2,0,28,Jul,Tue
7/4/2012,2012,3,7,4,3,0,28,Jul,Wed
7/5/2012,2012,3,7,5,4,0,28,Jul,Thu
7/6/2012,2012,3,7,6,5,0,28,Jul,Fri
7/7/2012,2012,3,7,7,6,1,28,Jul,Sat
7/8/2012,2012,3,7,8,7,1,29,Jul,Sun
7/9/2012,2012,3,7,9,1,0,29,Jul,Mon
7/10/2012,2012,3,7,10,2,0,29,Jul,Tue
7/11/2012,2012,3,7,11,3,0,29,Jul,Wed
7/12/2012,2012,3,7,12,4,0,29,Jul,Thu
7/13/2012,2012,3,7,13,5,0,29,Jul,Fri
7/14/2012,2012,3,7,14,6,1,29,Jul,Sat
7/15/2012,2012,3,7,15,7,1,30,Jul,Sun
7/16/2012,2012,3,7,16,1,0,30,Jul,Mon
7/17/2012,2012,3,7,17,2,0,30,Jul,Tue
7/18/2012,2012,3,7,18,3,0,30,Jul,Wed
7/19/2012,2012,3,7,19,4,0,30,Jul,Thu
7/20/2012,2012,3,7,20,5,0,30,Jul,Fri
7/21/2012,2012,3,7,21,6,1,30,Jul,Sat
7/22/2012,2012,3,7,22,7,1,31,Jul,Sun
7/23/2012,2012,3,7,23,1,0,31,Jul,Mon
7/24/2012,2012,3,7,24,2,0,31,Jul,Tue
7/25/2012,2012,3,7,25,3,0,31,Jul,Wed
7/26/2012,2012,3,7,26,4,0,31,Jul,Thu
7/27/2012,2012,3,7,27,5,0,31,Jul,Fri
7/28/2012,2012,3,7,28,6,1,31,Jul,Sat
7/29/2012,2012,3,7,29,7,1,32,Jul,Sun
7/30/2012,2012,3,7,30,1,0,32,Jul,Mon
7/31/2012,2012,3,7,31,2,0,32,Jul,Tue
8/1/2012,2012,3,8,1,3,0,32,Aug,Wed
8/2/2012,2012,3,8,2,4,0,32,Aug,Thu
8/3/2012,2012,3,8,3,5,0,32,Aug,Fri
8/4/2012,2012,3,8,4,6,1,32,Aug,Sat
8/5/2012,2012,3,8,5,7,1,33,Aug,Sun
8/6/2012,2012,3,8,6,1,0,33,Aug,Mon
8/7/2012,2012,3,8,7,2,0,33,Aug,Tue
8/8/2012,2012,3,8,8,3,0,33,Aug,Wed
8/9/2012,2012,3,8,9,4,0,33,Aug,Thu
8/10/2012,2012,3,8,10,5,0,33,Aug,Fri
8/11/2012,2012,3,8,11,6,1,33,Aug,Sat
8/12/2012,2012,3,8,12,7,1,34,Aug,Sun
8/13/2012,2012,3,8,13,1,0,34,Aug,Mon
8/14/2012,2012,3,8,14,2,0,34,Aug,Tue
8/15/2012,2012,3,8,15,3,0,34,Aug,Wed
8/16/2012,2012,3,8,16,4,0,34,Aug,Thu
8/17/2012,2012,3,8,17,5,0,34,Aug,Fri
8/18/2012,2012,3,8,18,6,1,34,Aug,Sat
8/19/2012,2012,3,8,19,7,1,35,Aug,Sun
8/20/2012,2012,3,8,20,1,0,35,Aug,Mon
8/21/2012,2012,3,8,21,2,0,35,Aug,Tue
8/22/2012,2012,3,8,22,3,0,35,Aug,Wed
8/23/2012,2012,3,8,23,4,0,35,Aug,Thu
8/24/2012,2012,3,8,24,5,0,35,Aug,Fri
8/25/2012,2012,3,8,25,6,1,35,Aug,Sat
8/26/2012,2012,3,8,26,7,1,36,Aug,Sun
8/27/2012,2012,3,8,27,1,0,36,Aug,Mon
8/28/2012,2012,3,8,28,2,0,36,Aug,Tue
8/29/2012,2012,3,8,29,3,0,36,Aug,Wed
8/30/2012,2012,3,8,30,4,0,36,Aug,Thu
8/31/2012,2012,3,8,31,5,0,36,Aug,Fri
9/1/2012,2012,3,9,1,6,1,36,Sep,Sat
9/2/2012,2012,3,9,2,7,1,37,Sep,Sun
9/3/2012,2012,3,9,3,1,0,37,Sep,Mon
9/4/2012,2012,3,9,4,2,0,37,Sep,Tue
9/5/2012,2012,3,9,5,3,0,37,Sep,Wed
9/6/2012,2012,3,9,6,4,0,37,Sep,Thu
9/7/2012,2012,3,9,7,5,0,37,Sep,Fri
9/8/2012,2012,3,9,8,6,1,37,Sep,Sat
9/9/2012,2012,3,9,9,7,1,38,Sep,Sun
9/10/2012,2012,3,9,10,1,0,38,Sep,Mon
9/11/2012,2012,3,9,11,2,0,38,Sep,Tue
9/12/2012,2012,3,9,12,3,0,38,Sep,Wed
9/13/2012,2012,3,9,13,4,0,38,Sep,Thu
9/14/2012,2012,3,9,14,5,0,38,Sep,Fri
9/15/2012,2012,3,9,15,6,1,38,Sep,Sat
9/16/2012,2012,3,9,16,7,1,39,Sep,Sun
9/17/2012,2012,3,9,17,1,0,39,Sep,Mon
9/18/2012,2012,3,9,18,2,0,39,Sep,Tue
9/19/2012,2012,3,9,19,3,0,39,Sep,Wed
9/20/2012,2012,3,9,20,4,0,39,Sep,Thu
9/21/2012,2012,3,9,21,5,0,39,Sep,Fri
9/22/2012,2012,3,9,22,6,1,39,Sep,Sat
9/23/2012,2012,3,9,23,7,1,40,Sep,Sun
9/24/2012,2012,3,9,24,1,0,40,Sep,Mon
9/25/2012,2012,3,9,25,2,0,40,Sep,Tue
9/26/2012,2012,3,9,26,3,0,40,Sep,Wed
9/27/2012,2012,3,9,27,4,0,40,Sep,Thu
9/28/2012,2012,3,9,28,5,0,40,Sep,Fri
9/29/2012,2012,3,9,29,6,1,40,Sep,Sat
9/30/2012,2012,3,9,30,7,1,41,Sep,Sun
10/1/2012,2012,4,10,1,1,0,41,Oct,Mon
10/2/2012,2012,4,10,2,2,0,41,Oct,Tue
10/3/2012,2012,4,10,3,3,0,41,Oct,Wed
10/4/2012,2012,4,10,4,4,0,41,Oct,Thu
10/5/2012,2012,4,10,5,5,0,41,Oct,Fri
10/6/2012,2012,4,10,6,6,1,41,Oct,Sat
10/7/2012,2012,4,10,7,7,1,42,Oct,Sun
10/8/2012,2012,4,10,8,1,0,42,Oct,Mon
10/9/2012,2012,4,10,9,2,0,42,Oct,Tue
10/10/2012,2012,4,10,10,3,0,42,Oct,Wed
10/11/2012,2012,4,10,11,4,0,42,Oct,Thu
10/12/2012,2012,4,10,12,5,0,42,Oct,Fri
10/13/2012,2012,4,10,13,6,1,42,Oct,Sat
10/14/2012,2012,4,10,14,7,1,43,Oct,Sun
10/15/2012,2012,4,10,15,1,0,43,Oct,Mon
10/16/2012,2012,4,10,16,2,0,43,Oct,Tue
10/17/2012,2012,4,10,17,3,0,43,Oct,Wed
10/18/2012,2012,4,10,18,4,0,43,Oct,Thu
10/19/2012,2012,4,10,19,5,0,43,Oct,Fri
10/20/2012,2012,4,10,20,6,1,43,Oct,Sat
10/21/2012,2012,4,10,21,7,1,44,Oct,Sun
10/22/2012,2012,4,10,22,1,0,44,Oct,Mon
10/23/2012,2012,4,10,23,2,0,44,Oct,Tue
10/24/2012,2012,4,10,24,3,0,44,Oct,Wed
10/25/2012,2012,4,10,25,4,0,44,Oct,Thu
10/26/2012,2012,4,10,26,5,0,44,Oct,Fri
10/27/2012,2012,4,10,27,6,1,44,Oct,Sat
10/28/2012,2012,4,10,28,7,1,45,Oct,Sun
10/29/2012,2012,4,10,29,1,0,45,Oct,Mon
10/30/2012,2012,4,10,30,2,0,45,Oct,Tue
10/31/2012,2012,4,10,31,3,0,45,Oct,Wed
11/1/2012,2012,4,11,1,4,0,45,Nov,Thu
11/2/2012,2012,4,11,2,5,0,45,Nov,Fri
11/3/2012,2012,4,11,3,6,1,45,Nov,Sat
11/4/2012,2012,4,11,4,7,1,46,Nov,Sun
11/5/2012,2012,4,11,5,1,0,46,Nov,Mon
11/6/2012,2012,4,11,6,2,0,46,Nov,Tue
11/7/2012,2012,4,11,7,3,0,46,Nov,Wed
11/8/2012,2012,4,11,8,4,0,46,Nov,Thu
11/9/2012,2012,4,11,9,5,0,46,Nov,Fri
11/10/2012,2012,4,11,10,6,1,46,Nov,Sat
11/11/2012,2012,4,11,11,7,1,47,Nov,Sun
11/12/2012,2012,4,11,12,1,0,47,Nov,Mon
11/13/2012,2012,4,11,13,2,0,47,Nov,Tue
11/14/2012,2012,4,11,14,3,0,47,Nov,Wed
11/15/2012,2012,4,11,15,4,0,47,Nov,Thu
11/16/2012,2012,4,11,16,5,0,47,Nov,Fri
11/17/2012,2012,4,11,17,6,1,47,Nov,Sat
11/18/2012,2012,4,11,18,7,1,48,Nov,Sun
11/19/2012,2012,4,11,19,1,0,48,Nov,Mon
11/20/2012,2012,4,11,20,2,0,48,Nov,Tue
11/21/2012,2012,4,11,21,3,0,48,Nov,Wed
11/22/2012,2012,4,11,22,4,0,48,Nov,Thu
11/23/2012,2012,4,11,23,5,0,48,Nov,Fri
11/24/2012,2012,4,11,24,6,1,48,Nov,Sat
11/25/2012,2012,4,11,25,7,1,49,Nov,Sun
11/26/2012,2012,4,11,26,1,0,49,Nov,Mon
11/27/2012,2012,4,11,27,2,0,49,Nov,Tue
11/28/2012,2012,4,11,28,3,0,49,Nov,Wed
11/29/2012,2012,4,11,29,4,0,49,Nov,Thu
11/30/2012,2012,4,11,30,5,0,49,Nov,Fri
12/1/2012,2012,4,12,1,6,1,49,Dec,Sat
12/2/2012,2012,4,12,2,7,1,50,Dec,Sun
12/3/2012,2012,4,12,3,1,0,50,Dec,Mon
12/4/2012,2012,4,12,4,2,0,50,Dec,Tue
12/5/2012,2012,4,12,5,3,0,50,Dec,Wed
12/6/2012,2012,4,12,6,4,0,50,Dec,Thu
12/7/2012,2012,4,12,7,5,0,50,Dec,Fri
12/8/2012,2012,4,12,8,6,1,50,Dec,Sat
12/9/2012,2012,4,12,9,7,1,51,Dec,Sun
12/10/2012,2012,4,12,10,1,0,51,Dec,Mon
12/11/2012,2012,4,12,11,2,0,51,Dec,Tue
12/12/2012,2012,4,12,12,3,0,51,Dec,Wed
12/13/2012,2012,4,12,13,4,0,51,Dec,Thu
12/14/2012,2012,4,12,14,5,0,51,Dec,Fri
12/15/2012,2012,4,12,15,6,1,51,Dec,Sat
12/16/2012,2012,4,12,16,7,1,52,Dec,Sun
12/17/2012,2012,4,12,17,1,0,52,Dec,Mon
12/18/2012,2012,4,12,18,2,0,52,Dec,Tue
12/19/2012,2012,4,12,19,3,0,52,Dec,Wed
12/20/2012,2012,4,12,20,4,0,52,Dec,Thu
12/21/2012,2012,4,12,21,5,0,52,Dec,Fri
12/22/2012,2012,4,12,22,6,1,52,Dec,Sat
12/23/2012,2012,4,12,23,7,1,53,Dec,Sun
12/24/2012,2012,4,12,24,1,0,53,Dec,Mon
12/25/2012,2012,4,12,25,2,0,53,Dec,Tue
12/26/2012,2012,4,12,26,3,0,53,Dec,Wed
12/27/2012,2012,4,12,27,4,0,53,Dec,Thu
12/28/2012,2012,4,12,28,5,0,53,Dec,Fri
12/29/2012,2012,4,12,29,6,1,53,Dec,Sat
12/30/2012,2012,4,12,30,7,1,54,Dec,Sun
12/31/2012,2012,4,12,31,1,0,54,Dec,Mon
1/1/2013,2013,1,1,1,2,0,1,Jan,Tue
1/2/2013,2013,1,1,2,3,0,1,Jan,Wed
1/3/2013,2013,1,1,3,4,0,1,Jan,Thu
1/4/2013,2013,1,1,4,5,0,1,Jan,Fri
1/5/2013,2013,1,1,5,6,1,1,Jan,Sat
1/6/2013,2013,1,1,6,7,1,2,Jan,Sun
1/7/2013,2013,1,1,7,1,0,2,Jan,Mon
1/8/2013,2013,1,1,8,2,0,2,Jan,Tue
1/9/2013,2013,1,1,9,3,0,2,Jan,Wed
1/10/2013,2013,1,1,10,4,0,2,Jan,Thu
1/11/2013,2013,1,1,11,5,0,2,Jan,Fri
1/12/2013,2013,1,1,12,6,1,2,Jan,Sat
1/13/2013,2013,1,1,13,7,1,3,Jan,Sun
1/14/2013,2013,1,1,14,1,0,3,Jan,Mon
1/15/2013,2013,1,1,15,2,0,3,Jan,Tue
1/16/2013,2013,1,1,16,3,0,3,Jan,Wed
1/17/2013,2013,1,1,17,4,0,3,Jan,Thu
1/18/2013,2013,1,1,18,5,0,3,Jan,Fri
1/19/2013,2013,1,1,19,6,1,3,Jan,Sat
1/20/2013,2013,1,1,20,7,1,4,Jan,Sun
1/21/2013,2013,1,1,21,1,0,4,Jan,Mon
1/22/2013,2013,1,1,22,2,0,4,Jan,Tue
1/23/2013,2013,1,1,23,3,0,4,Jan,Wed
1/24/2013,2013,1,1,24,4,0,4,Jan,Thu
1/25/2013,2013,1,1,25,5,0,4,Jan,Fri
1/26/2013,2013,1,1,26,6,1,4,Jan,Sat
1/27/2013,2013,1,1,27,7,1,5,Jan,Sun
1/28/2013,2013,1,1,28,1,0,5,Jan,Mon
1/29/2013,2013,1,1,29,2,0,5,Jan,Tue
1/30/2013,2013,1,1,30,3,0,5,Jan,Wed
1/31/2013,2013,1,1,31,4,0,5,Jan,Thu
2/1/2013,2013,1,2,1,5,0,5,Feb,Fri
2/2/2013,2013,1,2,2,6,1,5,Feb,Sat
2/3/2013,2013,1,2,3,7,1,6,Feb,Sun
2/4/2013,2013,1,2,4,1,0,6,Feb,Mon
2/5/2013,2013,1,2,5,2,0,6,Feb,Tue
2/6/2013,2013,1,2,6,3,0,6,Feb,Wed
2/7/2013,2013,1,2,7,4,0,6,Feb,Thu
2/8/2013,2013,1,2,8,5,0,6,Feb,Fri
2/9/2013,2013,1,2,9,6,1,6,Feb,Sat
2/10/2013,2013,1,2,10,7,1,7,Feb,Sun
2/11/2013,2013,1,2,11,1,0,7,Feb,Mon
2/12/2013,2013,1,2,12,2,0,7,Feb,Tue
2/13/2013,2013,1,2,13,3,0,7,Feb,Wed
2/14/2013,2013,1,2,14,4,0,7,Feb,Thu
2/15/2013,2013,1,2,15,5,0,7,Feb,Fri
2/16/2013,2013,1,2,16,6,1,7,Feb,Sat
2/17/2013,2013,1,2,17,7,1,8,Feb,Sun
2/18/2013,2013,1,2,18,1,0,8,Feb,Mon
2/19/2013,2013,1,2,19,2,0,8,Feb,Tue
2/20/2013,2013,1,2,20,3,0,8,Feb,Wed
2/21/2013,2013,1,2,21,4,0,8,Feb,Thu
2/22/2013,2013,1,2,22,5,0,8,Feb,Fri
2/23/2013,2013,1,2,23,6,1,8,Feb,Sat
2/24/2013,2013,1,2,24,7,1,9,Feb,Sun
2/25/2013,2013,1,2,25,1,0,9,Feb,Mon
2/26/2013,2013,1,2,26,2,0,9,Feb,Tue
2/27/2013,2013,1,2,27,3,0,9,Feb,Wed
2/28/2013,2013,1,2,28,4,0,9,Feb,Thu
3/1/2013,2013,1,3,1,5,0,9,Mar,Fri
3/2/2013,2013,1,3,2,6,1,9,Mar,Sat
3/3/2013,2013,1,3,3,7,1,10,Mar,Sun
3/4/2013,2013,1,3,4,1,0,10,Mar,Mon
3/5/2013,2013,1,3,5,2,0,10,Mar,Tue
3/6/2013,2013,1,3,6,3,0,10,Mar,Wed
3/7/2013,2013,1,3,7,4,0,10,Mar,Thu
3/8/2013,2013,1,3,8,5,0,10,Mar,Fri
3/9/2013,2013,1,3,9,6,1,10,Mar,Sat
3/10/2013,2013,1,3,10,7,1,11,Mar,Sun
3/11/2013,2013,1,3,11,1,0,11,Mar,Mon
3/12/2013,2013,1,3,12,2,0,11,Mar,Tue
3/13/2013,2013,1,3,13,3,0,11,Mar,Wed
3/14/2013,2013,1,3,14,4,0,11,Mar,Thu
3/15/2013,2013,1,3,15,5,0,11,Mar,Fri
3/16/2013,2013,1,3,16,6,1,11,Mar,Sat
3/17/2013,2013,1,3,17,7,1,12,Mar,Sun
3/18/2013,2013,1,3,18,1,0,12,Mar,Mon
3/19/2013,2013,1,3,19,2,0,12,Mar,Tue
3/20/2013,2013,1,3,20,3,0,12,Mar,Wed
3/21/2013,2013,1,3,21,4,0,12,Mar,Thu
3/22/2013,2013,1,3,22,5,0,12,Mar,Fri
3/23/2013,2013,1,3,23,6,1,12,Mar,Sat
3/24/2013,2013,1,3,24,7,1,13,Mar,Sun
3/25/2013,2013,1,3,25,1,0,13,Mar,Mon
3/26/2013,2013,1,3,26,2,0,13,Mar,Tue
3/27/2013,2013,1,3,27,3,0,13,Mar,Wed
3/28/2013,2013,1,3,28,4,0,13,Mar,Thu
3/29/2013,2013,1,3,29,5,0,13,Mar,Fri
3/30/2013,2013,1,3,30,6,1,13,Mar,Sat
3/31/2013,2013,1,3,31,7,1,14,Mar,Sun
4/1/2013,2013,2,4,1,1,0,14,Apr,Mon
4/2/2013,2013,2,4,2,2,0,14,Apr,Tue
4/3/2013,2013,2,4,3,3,0,14,Apr,Wed
4/4/2013,2013,2,4,4,4,0,14,Apr,Thu
4/5/2013,2013,2,4,5,5,0,14,Apr,Fri
4/6/2013,2013,2,4,6,6,1,14,Apr,Sat
4/7/2013,2013,2,4,7,7,1,15,Apr,Sun
4/8/2013,2013,2,4,8,1,0,15,Apr,Mon
4/9/2013,2013,2,4,9,2,0,15,Apr,Tue
4/10/2013,2013,2,4,10,3,0,15,Apr,Wed
4/11/2013,2013,2,4,11,4,0,15,Apr,Thu
4/12/2013,2013,2,4,12,5,0,15,Apr,Fri
4/13/2013,2013,2,4,13,6,1,15,Apr,Sat
4/14/2013,2013,2,4,14,7,1,16,Apr,Sun
4/15/2013,2013,2,4,15,1,0,16,Apr,Mon
4/16/2013,2013,2,4,16,2,0,16,Apr,Tue
4/17/2013,2013,2,4,17,3,0,16,Apr,Wed
4/18/2013,2013,2,4,18,4,0,16,Apr,Thu
4/19/2013,2013,2,4,19,5,0,16,Apr,Fri
4/20/2013,2013,2,4,20,6,1,16,Apr,Sat
4/21/2013,2013,2,4,21,7,1,17,Apr,Sun
4/22/2013,2013,2,4,22,1,0,17,Apr,Mon
4/23/2013,2013,2,4,23,2,0,17,Apr,Tue
4/24/2013,2013,2,4,24,3,0,17,Apr,Wed
4/25/2013,2013,2,4,25,4,0,17,Apr,Thu
4/26/2013,2013,2,4,26,5,0,17,Apr,Fri
4/27/2013,2013,2,4,27,6,1,17,Apr,Sat
4/28/2013,2013,2,4,28,7,1,18,Apr,Sun
4/29/2013,2013,2,4,29,1,0,18,Apr,Mon
4/30/2013,2013,2,4,30,2,0,18,Apr,Tue
5/1/2013,2013,2,5,1,3,0,18,May,Wed
5/2/2013,2013,2,5,2,4,0,18,May,Thu
5/3/2013,2013,2,5,3,5,0,18,May,Fri
5/4/2013,2013,2,5,4,6,1,18,May,Sat
5/5/2013,2013,2,5,5,7,1,19,May,Sun
5/6/2013,2013,2,5,6,1,0,19,May,Mon
5/7/2013,2013,2,5,7,2,0,19,May,Tue
5/8/2013,2013,2,5,8,3,0,19,May,Wed
5/9/2013,2013,2,5,9,4,0,19,May,Thu
5/10/2013,2013,2,5,10,5,0,19,May,Fri
5/11/2013,2013,2,5,11,6,1,19,May,Sat
5/12/2013,2013,2,5,12,7,1,20,May,Sun
5/13/2013,2013,2,5,13,1,0,20,May,Mon
5/14/2013,2013,2,5,14,2,0,20,May,Tue
5/15/2013,2013,2,5,15,3,0,20,May,Wed
5/16/2013,2013,2,5,16,4,0,20,May,Thu
5/17/2013,2013,2,5,17,5,0,20,May,Fri
5/18/2013,2013,2,5,18,6,1,20,May,Sat
5/19/2013,2013,2,5,19,7,1,21,May,Sun
5/20/2013,2013,2,5,20,1,0,21,May,Mon
5/21/2013,2013,2,5,21,2,0,21,May,Tue
5/22/2013,2013,2,5,22,3,0,21,May,Wed
5/23/2013,2013,2,5,23,4,0,21,May,Thu
5/24/2013,2013,2,5,24,5,0,21,May,Fri
5/25/2013,2013,2,5,25,6,1,21,May,Sat
5/26/2013,2013,2,5,26,7,1,22,May,Sun
5/27/2013,2013,2,5,27,1,0,22,May,Mon
5/28/2013,2013,2,5,28,2,0,22,May,Tue
5/29/2013,2013,2,5,29,3,0,22,May,Wed
5/30/2013,2013,2,5,30,4,0,22,May,Thu
5/31/2013,2013,2,5,31,5,0,22,May,Fri
6/1/2013,2013,2,6,1,6,1,22,Jun,Sat
6/2/2013,2013,2,6,2,7,1,23,Jun,Sun
6/3/2013,2013,2,6,3,1,0,23,Jun,Mon
6/4/2013,2013,2,6,4,2,0,23,Jun,Tue
6/5/2013,2013,2,6,5,3,0,23,Jun,Wed
6/6/2013,2013,2,6,6,4,0,23,Jun,Thu
6/7/2013,2013,2,6,7,5,0,23,Jun,Fri
6/8/2013,2013,2,6,8,6,1,23,Jun,Sat
6/9/2013,2013,2,6,9,7,1,24,Jun,Sun
6/10/2013,2013,2,6,10,1,0,24,Jun,Mon
6/11/2013,2013,2,6,11,2,0,24,Jun,Tue
6/12/2013,2013,2,6,12,3,0,24,Jun,Wed
6/13/2013,2013,2,6,13,4,0,24,Jun,Thu
6/14/2013,2013,2,6,14,5,0,24,Jun,Fri
6/15/2013,2013,2,6,15,6,1,24,Jun,Sat
6/16/2013,2013,2,6,16,7,1,25,Jun,Sun
6/17/2013,2013,2,6,17,1,0,25,Jun,Mon
6/18/2013,2013,2,6,18,2,0,25,Jun,Tue
6/19/2013,2013,2,6,19,3,0,25,Jun,Wed
6/20/2013,2013,2,6,20,4,0,25,Jun,Thu
6/21/2013,2013,2,6,21,5,0,25,Jun,Fri
6/22/2013,2013,2,6,22,6,1,25,Jun,Sat
6/23/2013,2013,2,6,23,7,1,26,Jun,Sun
6/24/2013,2013,2,6,24,1,0,26,Jun,Mon
6/25/2013,2013,2,6,25,2,0,26,Jun,Tue
6/26/2013,2013,2,6,26,3,0,26,Jun,Wed
6/27/2013,2013,2,6,27,4,0,26,Jun,Thu
6/28/2013,2013,2,6,28,5,0,26,Jun,Fri
6/29/2013,2013,2,6,29,6,1,26,Jun,Sat
6/30/2013,2013,2,6,30,7,1,27,Jun,Sun
7/1/2013,2013,3,7,1,1,0,27,Jul,Mon
7/2/2013,2013,3,7,2,2,0,27,Jul,Tue
7/3/2013,2013,3,7,3,3,0,27,Jul,Wed
7/4/2013,2013,3,7,4,4,0,27,Jul,Thu
7/5/2013,2013,3,7,5,5,0,27,Jul,Fri
7/6/2013,2013,3,7,6,6,1,27,Jul,Sat
7/7/2013,2013,3,7,7,7,1,28,Jul,Sun
7/8/2013,2013,3,7,8,1,0,28,Jul,Mon
7/9/2013,2013,3,7,9,2,0,28,Jul,Tue
7/10/2013,2013,3,7,10,3,0,28,Jul,Wed
7/11/2013,2013,3,7,11,4,0,28,Jul,Thu
7/12/2013,2013,3,7,12,5,0,28,Jul,Fri
7/13/2013,2013,3,7,13,6,1,28,Jul,Sat
7/14/2013,2013,3,7,14,7,1,29,Jul,Sun
7/15/2013,2013,3,7,15,1,0,29,Jul,Mon
7/16/2013,2013,3,7,16,2,0,29,Jul,Tue
7/17/2013,2013,3,7,17,3,0,29,Jul,Wed
7/18/2013,2013,3,7,18,4,0,29,Jul,Thu
7/19/2013,2013,3,7,19,5,0,29,Jul,Fri
7/20/2013,2013,3,7,20,6,1,29,Jul,Sat
7/21/2013,2013,3,7,21,7,1,30,Jul,Sun
7/22/2013,2013,3,7,22,1,0,30,Jul,Mon
7/23/2013,2013,3,7,23,2,0,30,Jul,Tue
7/24/2013,2013,3,7,24,3,0,30,Jul,Wed
7/25/2013,2013,3,7,25,4,0,30,Jul,Thu
7/26/2013,2013,3,7,26,5,0,30,Jul,Fri
7/27/2013,2013,3,7,27,6,1,30,Jul,Sat
7/28/2013,2013,3,7,28,7,1,31,Jul,Sun
7/29/2013,2013,3,7,29,1,0,31,Jul,Mon
7/30/2013,2013,3,7,30,2,0,31,Jul,Tue
7/31/2013,2013,3,7,31,3,0,31,Jul,Wed
8/1/2013,2013,3,8,1,4,0,31,Aug,Thu
8/2/2013,2013,3,8,2,5,0,31,Aug,Fri
8/3/2013,2013,3,8,3,6,1,31,Aug,Sat
8/4/2013,2013,3,8,4,7,1,32,Aug,Sun
8/5/2013,2013,3,8,5,1,0,32,Aug,Mon
8/6/2013,2013,3,8,6,2,0,32,Aug,Tue
8/7/2013,2013,3,8,7,3,0,32,Aug,Wed
8/8/2013,2013,3,8,8,4,0,32,Aug,Thu
8/9/2013,2013,3,8,9,5,0,32,Aug,Fri
8/10/2013,2013,3,8,10,6,1,32,Aug,Sat
8/11/2013,2013,3,8,11,7,1,33,Aug,Sun
8/12/2013,2013,3,8,12,1,0,33,Aug,Mon
8/13/2013,2013,3,8,13,2,0,33,Aug,Tue
8/14/2013,2013,3,8,14,3,0,33,Aug,Wed
8/15/2013,2013,3,8,15,4,0,33,Aug,Thu
8/16/2013,2013,3,8,16,5,0,33,Aug,Fri
8/17/2013,2013,3,8,17,6,1,33,Aug,Sat
8/18/2013,2013,3,8,18,7,1,34,Aug,Sun
8/19/2013,2013,3,8,19,1,0,34,Aug,Mon
8/20/2013,2013,3,8,20,2,0,34,Aug,Tue
8/21/2013,2013,3,8,21,3,0,34,Aug,Wed
8/22/2013,2013,3,8,22,4,0,34,Aug,Thu
8/23/2013,2013,3,8,23,5,0,34,Aug,Fri
8/24/2013,2013,3,8,24,6,1,34,Aug,Sat
8/25/2013,2013,3,8,25,7,1,35,Aug,Sun
8/26/2013,2013,3,8,26,1,0,35,Aug,Mon
8/27/2013,2013,3,8,27,2,0,35,Aug,Tue
8/28/2013,2013,3,8,28,3,0,35,Aug,Wed
8/29/2013,2013,3,8,29,4,0,35,Aug,Thu
8/30/2013,2013,3,8,30,5,0,35,Aug,Fri
8/31/2013,2013,3,8,31,6,1,35,Aug,Sat
9/1/2013,2013,3,9,1,7,1,36,Sep,Sun
9/2/2013,2013,3,9,2,1,0,36,Sep,Mon
9/3/2013,2013,3,9,3,2,0,36,Sep,Tue
9/4/2013,2013,3,9,4,3,0,36,Sep,Wed
9/5/2013,2013,3,9,5,4,0,36,Sep,Thu
9/6/2013,2013,3,9,6,5,0,36,Sep,Fri
9/7/2013,2013,3,9,7,6,1,36,Sep,Sat
9/8/2013,2013,3,9,8,7,1,37,Sep,Sun
9/9/2013,2013,3,9,9,1,0,37,Sep,Mon
9/10/2013,2013,3,9,10,2,0,37,Sep,Tue
9/11/2013,2013,3,9,11,3,0,37,Sep,Wed
9/12/2013,2013,3,9,12,4,0,37,Sep,Thu
9/13/2013,2013,3,9,13,5,0,37,Sep,Fri
9/14/2013,2013,3,9,14,6,1,37,Sep,Sat
9/15/2013,2013,3,9,15,7,1,38,Sep,Sun
9/16/2013,2013,3,9,16,1,0,38,Sep,Mon
9/17/2013,2013,3,9,17,2,0,38,Sep,Tue
9/18/2013,2013,3,9,18,3,0,38,Sep,Wed
9/19/2013,2013,3,9,19,4,0,38,Sep,Thu
9/20/2013,2013,3,9,20,5,0,38,Sep,Fri
9/21/2013,2013,3,9,21,6,1,38,Sep,Sat
9/22/2013,2013,3,9,22,7,1,39,Sep,Sun
9/23/2013,2013,3,9,23,1,0,39,Sep,Mon
9/24/2013,2013,3,9,24,2,0,39,Sep,Tue
9/25/2013,2013,3,9,25,3,0,39,Sep,Wed
9/26/2013,2013,3,9,26,4,0,39,Sep,Thu
9/27/2013,2013,3,9,27,5,0,39,Sep,Fri
9/28/2013,2013,3,9,28,6,1,39,Sep,Sat
9/29/2013,2013,3,9,29,7,1,40,Sep,Sun
9/30/2013,2013,3,9,30,1,0,40,Sep,Mon
10/1/2013,2013,4,10,1,2,0,40,Oct,Tue
10/2/2013,2013,4,10,2,3,0,40,Oct,Wed
10/3/2013,2013,4,10,3,4,0,40,Oct,Thu
10/4/2013,2013,4,10,4,5,0,40,Oct,Fri
10/5/2013,2013,4,10,5,6,1,40,Oct,Sat
10/6/2013,2013,4,10,6,7,1,41,Oct,Sun
10/7/2013,2013,4,10,7,1,0,41,Oct,Mon
10/8/2013,2013,4,10,8,2,0,41,Oct,Tue
10/9/2013,2013,4,10,9,3,0,41,Oct,Wed
10/10/2013,2013,4,10,10,4,0,41,Oct,Thu
10/11/2013,2013,4,10,11,5,0,41,Oct,Fri
10/12/2013,2013,4,10,12,6,1,41,Oct,Sat
10/13/2013,2013,4,10,13,7,1,42,Oct,Sun
10/14/2013,2013,4,10,14,1,0,42,Oct,Mon
10/15/2013,2013,4,10,15,2,0,42,Oct,Tue
10/16/2013,2013,4,10,16,3,0,42,Oct,Wed
10/17/2013,2013,4,10,17,4,0,42,Oct,Thu
10/18/2013,2013,4,10,18,5,0,42,Oct,Fri
10/19/2013,2013,4,10,19,6,1,42,Oct,Sat
10/20/2013,2013,4,10,20,7,1,43,Oct,Sun
10/21/2013,2013,4,10,21,1,0,43,Oct,Mon
10/22/2013,2013,4,10,22,2,0,43,Oct,Tue
10/23/2013,2013,4,10,23,3,0,43,Oct,Wed
10/24/2013,2013,4,10,24,4,0,43,Oct,Thu
10/25/2013,2013,4,10,25,5,0,43,Oct,Fri
10/26/2013,2013,4,10,26,6,1,43,Oct,Sat
10/27/2013,2013,4,10,27,7,1,44,Oct,Sun
10/28/2013,2013,4,10,28,1,0,44,Oct,Mon
10/29/2013,2013,4,10,29,2,0,44,Oct,Tue
10/30/2013,2013,4,10,30,3,0,44,Oct,Wed
10/31/2013,2013,4,10,31,4,0,44,Oct,Thu
11/1/2013,2013,4,11,1,5,0,44,Nov,Fri
11/2/2013,2013,4,11,2,6,1,44,Nov,Sat
11/3/2013,2013,4,11,3,7,1,45,Nov,Sun
11/4/2013,2013,4,11,4,1,0,45,Nov,Mon
11/5/2013,2013,4,11,5,2,0,45,Nov,Tue
11/6/2013,2013,4,11,6,3,0,45,Nov,Wed
11/7/2013,2013,4,11,7,4,0,45,Nov,Thu
11/8/2013,2013,4,11,8,5,0,45,Nov,Fri
11/9/2013,2013,4,11,9,6,1,45,Nov,Sat
11/10/2013,2013,4,11,10,7,1,46,Nov,Sun
11/11/2013,2013,4,11,11,1,0,46,Nov,Mon
11/12/2013,2013,4,11,12,2,0,46,Nov,Tue
11/13/2013,2013,4,11,13,3,0,46,Nov,Wed
11/14/2013,2013,4,11,14,4,0,46,Nov,Thu
11/15/2013,2013,4,11,15,5,0,46,Nov,Fri
11/16/2013,2013,4,11,16,6,1,46,Nov,Sat
11/17/2013,2013,4,11,17,7,1,47,Nov,Sun
11/18/2013,2013,4,11,18,1,0,47,Nov,Mon
11/19/2013,2013,4,11,19,2,0,47,Nov,Tue
11/20/2013,2013,4,11,20,3,0,47,Nov,Wed
11/21/2013,2013,4,11,21,4,0,47,Nov,Thu
11/22/2013,2013,4,11,22,5,0,47,Nov,Fri
11/23/2013,2013,4,11,23,6,1,47,Nov,Sat
11/24/2013,2013,4,11,24,7,1,48,Nov,Sun
11/25/2013,2013,4,11,25,1,0,48,Nov,Mon
11/26/2013,2013,4,11,26,2,0,48,Nov,Tue
11/27/2013,2013,4,11,27,3,0,48,Nov,Wed
11/28/2013,2013,4,11,28,4,0,48,Nov,Thu
11/29/2013,2013,4,11,29,5,0,48,Nov,Fri
11/30/2013,2013,4,11,30,6,1,48,Nov,Sat
12/1/2013,2013,4,12,1,7,1,49,Dec,Sun
12/2/2013,2013,4,12,2,1,0,49,Dec,Mon
12/3/2013,2013,4,12,3,2,0,49,Dec,Tue
12/4/2013,2013,4,12,4,3,0,49,Dec,Wed
12/5/2013,2013,4,12,5,4,0,49,Dec,Thu
12/6/2013,2013,4,12,6,5,0,49,Dec,Fri
12/7/2013,2013,4,12,7,6,1,49,Dec,Sat
12/8/2013,2013,4,12,8,7,1,50,Dec,Sun
12/9/2013,2013,4,12,9,1,0,50,Dec,Mon
12/10/2013,2013,4,12,10,2,0,50,Dec,Tue
12/11/2013,2013,4,12,11,3,0,50,Dec,Wed
12/12/2013,2013,4,12,12,4,0,50,Dec,Thu
12/13/2013,2013,4,12,13,5,0,50,Dec,Fri
12/14/2013,2013,4,12,14,6,1,50,Dec,Sat
12/15/2013,2013,4,12,15,7,1,51,Dec,Sun
12/16/2013,2013,4,12,16,1,0,51,Dec,Mon
12/17/2013,2013,4,12,17,2,0,51,Dec,Tue
12/18/2013,2013,4,12,18,3,0,51,Dec,Wed
12/19/2013,2013,4,12,19,4,0,51,Dec,Thu
12/20/2013,2013,4,12,20,5,0,51,Dec,Fri
12/21/2013,2013,4,12,21,6,1,51,Dec,Sat
12/22/2013,2013,4,12,22,7,1,52,Dec,Sun
12/23/2013,2013,4,12,23,1,0,52,Dec,Mon
12/24/2013,2013,4,12,24,2,0,52,Dec,Tue
12/25/2013,2013,4,12,25,3,0,52,Dec,Wed
12/26/2013,2013,4,12,26,4,0,52,Dec,Thu
12/27/2013,2013,4,12,27,5,0,52,Dec,Fri
12/28/2013,2013,4,12,28,6,1,52,Dec,Sat
12/29/2013,2013,4,12,29,7,1,53,Dec,Sun
12/30/2013,2013,4,12,30,1,0,53,Dec,Mon
12/31/2013,2013,4,12,31,2,0,53,Dec,Tue
1/1/2014,2014,1,1,1,3,0,1,Jan,Wed
1/2/2014,2014,1,1,2,4,0,1,Jan,Thu
1/3/2014,2014,1,1,3,5,0,1,Jan,Fri
1/4/2014,2014,1,1,4,6,1,1,Jan,Sat
1/5/2014,2014,1,1,5,7,1,2,Jan,Sun
1/6/2014,2014,1,1,6,1,0,2,Jan,Mon
1/7/2014,2014,1,1,7,2,0,2,Jan,Tue
1/8/2014,2014,1,1,8,3,0,2,Jan,Wed
1/9/2014,2014,1,1,9,4,0,2,Jan,Thu
1/10/2014,2014,1,1,10,5,0,2,Jan,Fri
1/11/2014,2014,1,1,11,6,1,2,Jan,Sat
1/12/2014,2014,1,1,12,7,1,3,Jan,Sun
1/13/2014,2014,1,1,13,1,0,3,Jan,Mon
1/14/2014,2014,1,1,14,2,0,3,Jan,Tue
1/15/2014,2014,1,1,15,3,0,3,Jan,Wed
1/16/2014,2014,1,1,16,4,0,3,Jan,Thu
1/17/2014,2014,1,1,17,5,0,3,Jan,Fri
1/18/2014,2014,1,1,18,6,1,3,Jan,Sat
1/19/2014,2014,1,1,19,7,1,4,Jan,Sun
1/20/2014,2014,1,1,20,1,0,4,Jan,Mon
1/21/2014,2014,1,1,21,2,0,4,Jan,Tue
1/22/2014,2014,1,1,22,3,0,4,Jan,Wed
1/23/2014,2014,1,1,23,4,0,4,Jan,Thu
1/24/2014,2014,1,1,24,5,0,4,Jan,Fri
1/25/2014,2014,1,1,25,6,1,4,Jan,Sat
1/26/2014,2014,1,1,26,7,1,5,Jan,Sun
1/27/2014,2014,1,1,27,1,0,5,Jan,Mon
1/28/2014,2014,1,1,28,2,0,5,Jan,Tue
1/29/2014,2014,1,1,29,3,0,5,Jan,Wed
1/30/2014,2014,1,1,30,4,0,5,Jan,Thu
1/31/2014,2014,1,1,31,5,0,5,Jan,Fri
2/1/2014,2014,1,2,1,6,1,5,Feb,Sat
2/2/2014,2014,1,2,2,7,1,6,Feb,Sun
2/3/2014,2014,1,2,3,1,0,6,Feb,Mon
2/4/2014,2014,1,2,4,2,0,6,Feb,Tue
2/5/2014,2014,1,2,5,3,0,6,Feb,Wed
2/6/2014,2014,1,2,6,4,0,6,Feb,Thu
2/7/2014,2014,1,2,7,5,0,6,Feb,Fri
2/8/2014,2014,1,2,8,6,1,6,Feb,Sat
2/9/2014,2014,1,2,9,7,1,7,Feb,Sun
2/10/2014,2014,1,2,10,1,0,7,Feb,Mon
2/11/2014,2014,1,2,11,2,0,7,Feb,Tue
2/12/2014,2014,1,2,12,3,0,7,Feb,Wed
2/13/2014,2014,1,2,13,4,0,7,Feb,Thu
2/14/2014,2014,1,2,14,5,0,7,Feb,Fri
2/15/2014,2014,1,2,15,6,1,7,Feb,Sat
2/16/2014,2014,1,2,16,7,1,8,Feb,Sun
2/17/2014,2014,1,2,17,1,0,8,Feb,Mon
2/18/2014,2014,1,2,18,2,0,8,Feb,Tue
2/19/2014,2014,1,2,19,3,0,8,Feb,Wed
2/20/2014,2014,1,2,20,4,0,8,Feb,Thu
2/21/2014,2014,1,2,21,5,0,8,Feb,Fri
2/22/2014,2014,1,2,22,6,1,8,Feb,Sat
2/23/2014,2014,1,2,23,7,1,9,Feb,Sun
2/24/2014,2014,1,2,24,1,0,9,Feb,Mon
2/25/2014,2014,1,2,25,2,0,9,Feb,Tue
2/26/2014,2014,1,2,26,3,0,9,Feb,Wed
2/27/2014,2014,1,2,27,4,0,9,Feb,Thu
2/28/2014,2014,1,2,28,5,0,9,Feb,Fri
3/1/2014,2014,1,3,1,6,1,9,Mar,Sat
3/2/2014,2014,1,3,2,7,1,10,Mar,Sun
3/3/2014,2014,1,3,3,1,0,10,Mar,Mon
3/4/2014,2014,1,3,4,2,0,10,Mar,Tue
3/5/2014,2014,1,3,5,3,0,10,Mar,Wed
3/6/2014,2014,1,3,6,4,0,10,Mar,Thu
3/7/2014,2014,1,3,7,5,0,10,Mar,Fri
3/8/2014,2014,1,3,8,6,1,10,Mar,Sat
3/9/2014,2014,1,3,9,7,1,11,Mar,Sun
3/10/2014,2014,1,3,10,1,0,11,Mar,Mon
3/11/2014,2014,1,3,11,2,0,11,Mar,Tue
3/12/2014,2014,1,3,12,3,0,11,Mar,Wed
3/13/2014,2014,1,3,13,4,0,11,Mar,Thu
3/14/2014,2014,1,3,14,5,0,11,Mar,Fri
3/15/2014,2014,1,3,15,6,1,11,Mar,Sat
3/16/2014,2014,1,3,16,7,1,12,Mar,Sun
3/17/2014,2014,1,3,17,1,0,12,Mar,Mon
3/18/2014,2014,1,3,18,2,0,12,Mar,Tue
3/19/2014,2014,1,3,19,3,0,12,Mar,Wed
3/20/2014,2014,1,3,20,4,0,12,Mar,Thu
3/21/2014,2014,1,3,21,5,0,12,Mar,Fri
3/22/2014,2014,1,3,22,6,1,12,Mar,Sat
3/23/2014,2014,1,3,23,7,1,13,Mar,Sun
3/24/2014,2014,1,3,24,1,0,13,Mar,Mon
3/25/2014,2014,1,3,25,2,0,13,Mar,Tue
3/26/2014,2014,1,3,26,3,0,13,Mar,Wed
3/27/2014,2014,1,3,27,4,0,13,Mar,Thu
3/28/2014,2014,1,3,28,5,0,13,Mar,Fri
3/29/2014,2014,1,3,29,6,1,13,Mar,Sat
3/30/2014,2014,1,3,30,7,1,14,Mar,Sun
3/31/2014,2014,1,3,31,1,0,14,Mar,Mon
4/1/2014,2014,2,4,1,2,0,14,Apr,Tue
4/2/2014,2014,2,4,2,3,0,14,Apr,Wed
4/3/2014,2014,2,4,3,4,0,14,Apr,Thu
4/4/2014,2014,2,4,4,5,0,14,Apr,Fri
4/5/2014,2014,2,4,5,6,1,14,Apr,Sat
4/6/2014,2014,2,4,6,7,1,15,Apr,Sun
4/7/2014,2014,2,4,7,1,0,15,Apr,Mon
4/8/2014,2014,2,4,8,2,0,15,Apr,Tue
4/9/2014,2014,2,4,9,3,0,15,Apr,Wed
4/10/2014,2014,2,4,10,4,0,15,Apr,Thu
4/11/2014,2014,2,4,11,5,0,15,Apr,Fri
4/12/2014,2014,2,4,12,6,1,15,Apr,Sat
4/13/2014,2014,2,4,13,7,1,16,Apr,Sun
4/14/2014,2014,2,4,14,1,0,16,Apr,Mon
4/15/2014,2014,2,4,15,2,0,16,Apr,Tue
4/16/2014,2014,2,4,16,3,0,16,Apr,Wed
4/17/2014,2014,2,4,17,4,0,16,Apr,Thu
4/18/2014,2014,2,4,18,5,0,16,Apr,Fri
4/19/2014,2014,2,4,19,6,1,16,Apr,Sat
4/20/2014,2014,2,4,20,7,1,17,Apr,Sun
4/21/2014,2014,2,4,21,1,0,17,Apr,Mon
4/22/2014,2014,2,4,22,2,0,17,Apr,Tue
4/23/2014,2014,2,4,23,3,0,17,Apr,Wed
4/24/2014,2014,2,4,24,4,0,17,Apr,Thu
4/25/2014,2014,2,4,25,5,0,17,Apr,Fri
4/26/2014,2014,2,4,26,6,1,17,Apr,Sat
4/27/2014,2014,2,4,27,7,1,18,Apr,Sun
4/28/2014,2014,2,4,28,1,0,18,Apr,Mon
4/29/2014,2014,2,4,29,2,0,18,Apr,Tue
4/30/2014,2014,2,4,30,3,0,18,Apr,Wed
5/1/2014,2014,2,5,1,4,0,18,May,Thu
5/2/2014,2014,2,5,2,5,0,18,May,Fri
5/3/2014,2014,2,5,3,6,1,18,May,Sat
5/4/2014,2014,2,5,4,7,1,19,May,Sun
5/5/2014,2014,2,5,5,1,0,19,May,Mon
5/6/2014,2014,2,5,6,2,0,19,May,Tue
5/7/2014,2014,2,5,7,3,0,19,May,Wed
5/8/2014,2014,2,5,8,4,0,19,May,Thu
5/9/2014,2014,2,5,9,5,0,19,May,Fri
5/10/2014,2014,2,5,10,6,1,19,May,Sat
5/11/2014,2014,2,5,11,7,1,20,May,Sun
5/12/2014,2014,2,5,12,1,0,20,May,Mon
5/13/2014,2014,2,5,13,2,0,20,May,Tue
5/14/2014,2014,2,5,14,3,0,20,May,Wed
5/15/2014,2014,2,5,15,4,0,20,May,Thu
5/16/2014,2014,2,5,16,5,0,20,May,Fri
5/17/2014,2014,2,5,17,6,1,20,May,Sat
5/18/2014,2014,2,5,18,7,1,21,May,Sun
5/19/2014,2014,2,5,19,1,0,21,May,Mon
5/20/2014,2014,2,5,20,2,0,21,May,Tue
5/21/2014,2014,2,5,21,3,0,21,May,Wed
5/22/2014,2014,2,5,22,4,0,21,May,Thu
5/23/2014,2014,2,5,23,5,0,21,May,Fri
5/24/2014,2014,2,5,24,6,1,21,May,Sat
5/25/2014,2014,2,5,25,7,1,22,May,Sun
5/26/2014,2014,2,5,26,1,0,22,May,Mon
5/27/2014,2014,2,5,27,2,0,22,May,Tue
5/28/2014,2014,2,5,28,3,0,22,May,Wed
5/29/2014,2014,2,5,29,4,0,22,May,Thu
5/30/2014,2014,2,5,30,5,0,22,May,Fri
5/31/2014,2014,2,5,31,6,1,22,May,Sat
6/1/2014,2014,2,6,1,7,1,23,Jun,Sun
6/2/2014,2014,2,6,2,1,0,23,Jun,Mon
6/3/2014,2014,2,6,3,2,0,23,Jun,Tue
6/4/2014,2014,2,6,4,3,0,23,Jun,Wed
6/5/2014,2014,2,6,5,4,0,23,Jun,Thu
6/6/2014,2014,2,6,6,5,0,23,Jun,Fri
6/7/2014,2014,2,6,7,6,1,23,Jun,Sat
6/8/2014,2014,2,6,8,7,1,24,Jun,Sun
6/9/2014,2014,2,6,9,1,0,24,Jun,Mon
6/10/2014,2014,2,6,10,2,0,24,Jun,Tue
6/11/2014,2014,2,6,11,3,0,24,Jun,Wed
6/12/2014,2014,2,6,12,4,0,24,Jun,Thu
6/13/2014,2014,2,6,13,5,0,24,Jun,Fri
6/14/2014,2014,2,6,14,6,1,24,Jun,Sat
6/15/2014,2014,2,6,15,7,1,25,Jun,Sun
6/16/2014,2014,2,6,16,1,0,25,Jun,Mon
6/17/2014,2014,2,6,17,2,0,25,Jun,Tue
6/18/2014,2014,2,6,18,3,0,25,Jun,Wed
6/19/2014,2014,2,6,19,4,0,25,Jun,Thu
6/20/2014,2014,2,6,20,5,0,25,Jun,Fri
6/21/2014,2014,2,6,21,6,1,25,Jun,Sat
6/22/2014,2014,2,6,22,7,1,26,Jun,Sun
6/23/2014,2014,2,6,23,1,0,26,Jun,Mon
6/24/2014,2014,2,6,24,2,0,26,Jun,Tue
6/25/2014,2014,2,6,25,3,0,26,Jun,Wed
6/26/2014,2014,2,6,26,4,0,26,Jun,Thu
6/27/2014,2014,2,6,27,5,0,26,Jun,Fri
6/28/2014,2014,2,6,28,6,1,26,Jun,Sat
6/29/2014,2014,2,6,29,7,1,27,Jun,Sun
6/30/2014,2014,2,6,30,1,0,27,Jun,Mon
7/1/2014,2014,3,7,1,2,0,27,Jul,Tue
7/2/2014,2014,3,7,2,3,0,27,Jul,Wed
7/3/2014,2014,3,7,3,4,0,27,Jul,Thu
7/4/2014,2014,3,7,4,5,0,27,Jul,Fri
7/5/2014,2014,3,7,5,6,1,27,Jul,Sat
7/6/2014,2014,3,7,6,7,1,28,Jul,Sun
7/7/2014,2014,3,7,7,1,0,28,Jul,Mon
7/8/2014,2014,3,7,8,2,0,28,Jul,Tue
7/9/2014,2014,3,7,9,3,0,28,Jul,Wed
7/10/2014,2014,3,7,10,4,0,28,Jul,Thu
7/11/2014,2014,3,7,11,5,0,28,Jul,Fri
7/12/2014,2014,3,7,12,6,1,28,Jul,Sat
7/13/2014,2014,3,7,13,7,1,29,Jul,Sun
7/14/2014,2014,3,7,14,1,0,29,Jul,Mon
7/15/2014,2014,3,7,15,2,0,29,Jul,Tue
7/16/2014,2014,3,7,16,3,0,29,Jul,Wed
7/17/2014,2014,3,7,17,4,0,29,Jul,Thu
7/18/2014,2014,3,7,18,5,0,29,Jul,Fri
7/19/2014,2014,3,7,19,6,1,29,Jul,Sat
7/20/2014,2014,3,7,20,7,1,30,Jul,Sun
7/21/2014,2014,3,7,21,1,0,30,Jul,Mon
7/22/2014,2014,3,7,22,2,0,30,Jul,Tue
7/23/2014,2014,3,7,23,3,0,30,Jul,Wed
7/24/2014,2014,3,7,24,4,0,30,Jul,Thu
7/25/2014,2014,3,7,25,5,0,30,Jul,Fri
7/26/2014,2014,3,7,26,6,1,30,Jul,Sat
7/27/2014,2014,3,7,27,7,1,31,Jul,Sun
7/28/2014,2014,3,7,28,1,0,31,Jul,Mon
7/29/2014,2014,3,7,29,2,0,31,Jul,Tue
7/30/2014,2014,3,7,30,3,0,31,Jul,Wed
7/31/2014,2014,3,7,31,4,0,31,Jul,Thu
8/1/2014,2014,3,8,1,5,0,31,Aug,Fri
8/2/2014,2014,3,8,2,6,1,31,Aug,Sat
8/3/2014,2014,3,8,3,7,1,32,Aug,Sun
8/4/2014,2014,3,8,4,1,0,32,Aug,Mon
8/5/2014,2014,3,8,5,2,0,32,Aug,Tue
8/6/2014,2014,3,8,6,3,0,32,Aug,Wed
8/7/2014,2014,3,8,7,4,0,32,Aug,Thu
8/8/2014,2014,3,8,8,5,0,32,Aug,Fri
8/9/2014,2014,3,8,9,6,1,32,Aug,Sat
8/10/2014,2014,3,8,10,7,1,33,Aug,Sun
8/11/2014,2014,3,8,11,1,0,33,Aug,Mon
8/12/2014,2014,3,8,12,2,0,33,Aug,Tue
8/13/2014,2014,3,8,13,3,0,33,Aug,Wed
8/14/2014,2014,3,8,14,4,0,33,Aug,Thu
8/15/2014,2014,3,8,15,5,0,33,Aug,Fri
8/16/2014,2014,3,8,16,6,1,33,Aug,Sat
8/17/2014,2014,3,8,17,7,1,34,Aug,Sun
8/18/2014,2014,3,8,18,1,0,34,Aug,Mon
8/19/2014,2014,3,8,19,2,0,34,Aug,Tue
8/20/2014,2014,3,8,20,3,0,34,Aug,Wed
8/21/2014,2014,3,8,21,4,0,34,Aug,Thu
8/22/2014,2014,3,8,22,5,0,34,Aug,Fri
8/23/2014,2014,3,8,23,6,1,34,Aug,Sat
8/24/2014,2014,3,8,24,7,1,35,Aug,Sun
8/25/2014,2014,3,8,25,1,0,35,Aug,Mon
8/26/2014,2014,3,8,26,2,0,35,Aug,Tue
8/27/2014,2014,3,8,27,3,0,35,Aug,Wed
8/28/2014,2014,3,8,28,4,0,35,Aug,Thu
8/29/2014,2014,3,8,29,5,0,35,Aug,Fri
8/30/2014,2014,3,8,30,6,1,35,Aug,Sat
8/31/2014,2014,3,8,31,7,1,36,Aug,Sun
9/1/2014,2014,3,9,1,1,0,36,Sep,Mon
9/2/2014,2014,3,9,2,2,0,36,Sep,Tue
9/3/2014,2014,3,9,3,3,0,36,Sep,Wed
9/4/2014,2014,3,9,4,4,0,36,Sep,Thu
9/5/2014,2014,3,9,5,5,0,36,Sep,Fri
9/6/2014,2014,3,9,6,6,1,36,Sep,Sat
9/7/2014,2014,3,9,7,7,1,37,Sep,Sun
9/8/2014,2014,3,9,8,1,0,37,Sep,Mon
9/9/2014,2014,3,9,9,2,0,37,Sep,Tue
9/10/2014,2014,3,9,10,3,0,37,Sep,Wed
9/11/2014,2014,3,9,11,4,0,37,Sep,Thu
9/12/2014,2014,3,9,12,5,0,37,Sep,Fri
9/13/2014,2014,3,9,13,6,1,37,Sep,Sat
9/14/2014,2014,3,9,14,7,1,38,Sep,Sun
9/15/2014,2014,3,9,15,1,0,38,Sep,Mon
9/16/2014,2014,3,9,16,2,0,38,Sep,Tue
9/17/2014,2014,3,9,17,3,0,38,Sep,Wed
9/18/2014,2014,3,9,18,4,0,38,Sep,Thu
9/19/2014,2014,3,9,19,5,0,38,Sep,Fri
9/20/2014,2014,3,9,20,6,1,38,Sep,Sat
9/21/2014,2014,3,9,21,7,1,39,Sep,Sun
9/22/2014,2014,3,9,22,1,0,39,Sep,Mon
9/23/2014,2014,3,9,23,2,0,39,Sep,Tue
9/24/2014,2014,3,9,24,3,0,39,Sep,Wed
9/25/2014,2014,3,9,25,4,0,39,Sep,Thu
9/26/2014,2014,3,9,26,5,0,39,Sep,Fri
9/27/2014,2014,3,9,27,6,1,39,Sep,Sat
9/28/2014,2014,3,9,28,7,1,40,Sep,Sun
9/29/2014,2014,3,9,29,1,0,40,Sep,Mon
9/30/2014,2014,3,9,30,2,0,40,Sep,Tue
10/1/2014,2014,4,10,1,3,0,40,Oct,Wed
10/2/2014,2014,4,10,2,4,0,40,Oct,Thu
10/3/2014,2014,4,10,3,5,0,40,Oct,Fri
10/4/2014,2014,4,10,4,6,1,40,Oct,Sat
10/5/2014,2014,4,10,5,7,1,41,Oct,Sun
10/6/2014,2014,4,10,6,1,0,41,Oct,Mon
10/7/2014,2014,4,10,7,2,0,41,Oct,Tue
10/8/2014,2014,4,10,8,3,0,41,Oct,Wed
10/9/2014,2014,4,10,9,4,0,41,Oct,Thu
10/10/2014,2014,4,10,10,5,0,41,Oct,Fri
10/11/2014,2014,4,10,11,6,1,41,Oct,Sat
10/12/2014,2014,4,10,12,7,1,42,Oct,Sun
10/13/2014,2014,4,10,13,1,0,42,Oct,Mon
10/14/2014,2014,4,10,14,2,0,42,Oct,Tue
10/15/2014,2014,4,10,15,3,0,42,Oct,Wed
10/16/2014,2014,4,10,16,4,0,42,Oct,Thu
10/17/2014,2014,4,10,17,5,0,42,Oct,Fri
10/18/2014,2014,4,10,18,6,1,42,Oct,Sat
10/19/2014,2014,4,10,19,7,1,43,Oct,Sun
10/20/2014,2014,4,10,20,1,0,43,Oct,Mon
10/21/2014,2014,4,10,21,2,0,43,Oct,Tue
10/22/2014,2014,4,10,22,3,0,43,Oct,Wed
10/23/2014,2014,4,10,23,4,0,43,Oct,Thu
10/24/2014,2014,4,10,24,5,0,43,Oct,Fri
10/25/2014,2014,4,10,25,6,1,43,Oct,Sat
10/26/2014,2014,4,10,26,7,1,44,Oct,Sun
10/27/2014,2014,4,10,27,1,0,44,Oct,Mon
10/28/2014,2014,4,10,28,2,0,44,Oct,Tue
10/29/2014,2014,4,10,29,3,0,44,Oct,Wed
10/30/2014,2014,4,10,30,4,0,44,Oct,Thu
10/31/2014,2014,4,10,31,5,0,44,Oct,Fri
11/1/2014,2014,4,11,1,6,1,44,Nov,Sat
11/2/2014,2014,4,11,2,7,1,45,Nov,Sun
11/3/2014,2014,4,11,3,1,0,45,Nov,Mon
11/4/2014,2014,4,11,4,2,0,45,Nov,Tue
11/5/2014,2014,4,11,5,3,0,45,Nov,Wed
11/6/2014,2014,4,11,6,4,0,45,Nov,Thu
11/7/2014,2014,4,11,7,5,0,45,Nov,Fri
11/8/2014,2014,4,11,8,6,1,45,Nov,Sat
11/9/2014,2014,4,11,9,7,1,46,Nov,Sun
11/10/2014,2014,4,11,10,1,0,46,Nov,Mon
11/11/2014,2014,4,11,11,2,0,46,Nov,Tue
11/12/2014,2014,4,11,12,3,0,46,Nov,Wed
11/13/2014,2014,4,11,13,4,0,46,Nov,Thu
11/14/2014,2014,4,11,14,5,0,46,Nov,Fri
11/15/2014,2014,4,11,15,6,1,46,Nov,Sat
11/16/2014,2014,4,11,16,7,1,47,Nov,Sun
11/17/2014,2014,4,11,17,1,0,47,Nov,Mon
11/18/2014,2014,4,11,18,2,0,47,Nov,Tue
11/19/2014,2014,4,11,19,3,0,47,Nov,Wed
11/20/2014,2014,4,11,20,4,0,47,Nov,Thu
11/21/2014,2014,4,11,21,5,0,47,Nov,Fri
11/22/2014,2014,4,11,22,6,1,47,Nov,Sat
11/23/2014,2014,4,11,23,7,1,48,Nov,Sun
11/24/2014,2014,4,11,24,1,0,48,Nov,Mon
11/25/2014,2014,4,11,25,2,0,48,Nov,Tue
11/26/2014,2014,4,11,26,3,0,48,Nov,Wed
11/27/2014,2014,4,11,27,4,0,48,Nov,Thu
11/28/2014,2014,4,11,28,5,0,48,Nov,Fri
11/29/2014,2014,4,11,29,6,1,48,Nov,Sat
11/30/2014,2014,4,11,30,7,1,49,Nov,Sun
12/1/2014,2014,4,12,1,1,0,49,Dec,Mon
12/2/2014,2014,4,12,2,2,0,49,Dec,Tue
12/3/2014,2014,4,12,3,3,0,49,Dec,Wed
12/4/2014,2014,4,12,4,4,0,49,Dec,Thu
12/5/2014,2014,4,12,5,5,0,49,Dec,Fri
12/6/2014,2014,4,12,6,6,1,49,Dec,Sat
12/7/2014,2014,4,12,7,7,1,50,Dec,Sun
12/8/2014,2014,4,12,8,1,0,50,Dec,Mon
12/9/2014,2014,4,12,9,2,0,50,Dec,Tue
12/10/2014,2014,4,12,10,3,0,50,Dec,Wed
12/11/2014,2014,4,12,11,4,0,50,Dec,Thu
12/12/2014,2014,4,12,12,5,0,50,Dec,Fri
12/13/2014,2014,4,12,13,6,1,50,Dec,Sat
12/14/2014,2014,4,12,14,7,1,51,Dec,Sun
12/15/2014,2014,4,12,15,1,0,51,Dec,Mon
12/16/2014,2014,4,12,16,2,0,51,Dec,Tue
12/17/2014,2014,4,12,17,3,0,51,Dec,Wed
12/18/2014,2014,4,12,18,4,0,51,Dec,Thu
12/19/2014,2014,4,12,19,5,0,51,Dec,Fri
12/20/2014,2014,4,12,20,6,1,51,Dec,Sat
12/21/2014,2014,4,12,21,7,1,52,Dec,Sun
12/22/2014,2014,4,12,22,1,0,52,Dec,Mon
12/23/2014,2014,4,12,23,2,0,52,Dec,Tue
12/24/2014,2014,4,12,24,3,0,52,Dec,Wed
12/25/2014,2014,4,12,25,4,0,52,Dec,Thu
12/26/2014,2014,4,12,26,5,0,52,Dec,Fri
12/27/2014,2014,4,12,27,6,1,52,Dec,Sat
12/28/2014,2014,4,12,28,7,1,53,Dec,Sun
12/29/2014,2014,4,12,29,1,0,53,Dec,Mon
12/30/2014,2014,4,12,30,2,0,53,Dec,Tue
12/31/2014,2014,4,12,31,3,0,53,Dec,Wed
1/1/2015,2015,1,1,1,4,0,1,Jan,Thu
1/2/2015,2015,1,1,2,5,0,1,Jan,Fri
1/3/2015,2015,1,1,3,6,1,1,Jan,Sat
1/4/2015,2015,1,1,4,7,1,2,Jan,Sun
1/5/2015,2015,1,1,5,1,0,2,Jan,Mon
1/6/2015,2015,1,1,6,2,0,2,Jan,Tue
1/7/2015,2015,1,1,7,3,0,2,Jan,Wed
1/8/2015,2015,1,1,8,4,0,2,Jan,Thu
1/9/2015,2015,1,1,9,5,0,2,Jan,Fri
1/10/2015,2015,1,1,10,6,1,2,Jan,Sat
1/11/2015,2015,1,1,11,7,1,3,Jan,Sun
1/12/2015,2015,1,1,12,1,0,3,Jan,Mon
1/13/2015,2015,1,1,13,2,0,3,Jan,Tue
1/14/2015,2015,1,1,14,3,0,3,Jan,Wed
1/15/2015,2015,1,1,15,4,0,3,Jan,Thu
1/16/2015,2015,1,1,16,5,0,3,Jan,Fri
1/17/2015,2015,1,1,17,6,1,3,Jan,Sat
1/18/2015,2015,1,1,18,7,1,4,Jan,Sun
1/19/2015,2015,1,1,19,1,0,4,Jan,Mon
1/20/2015,2015,1,1,20,2,0,4,Jan,Tue
1/21/2015,2015,1,1,21,3,0,4,Jan,Wed
1/22/2015,2015,1,1,22,4,0,4,Jan,Thu
1/23/2015,2015,1,1,23,5,0,4,Jan,Fri
1/24/2015,2015,1,1,24,6,1,4,Jan,Sat
1/25/2015,2015,1,1,25,7,1,5,Jan,Sun
1/26/2015,2015,1,1,26,1,0,5,Jan,Mon
1/27/2015,2015,1,1,27,2,0,5,Jan,Tue
1/28/2015,2015,1,1,28,3,0,5,Jan,Wed
1/29/2015,2015,1,1,29,4,0,5,Jan,Thu
1/30/2015,2015,1,1,30,5,0,5,Jan,Fri
1/31/2015,2015,1,1,31,6,1,5,Jan,Sat
2/1/2015,2015,1,2,1,7,1,6,Feb,Sun
2/2/2015,2015,1,2,2,1,0,6,Feb,Mon
2/3/2015,2015,1,2,3,2,0,6,Feb,Tue
2/4/2015,2015,1,2,4,3,0,6,Feb,Wed
2/5/2015,2015,1,2,5,4,0,6,Feb,Thu
2/6/2015,2015,1,2,6,5,0,6,Feb,Fri
2/7/2015,2015,1,2,7,6,1,6,Feb,Sat
2/8/2015,2015,1,2,8,7,1,7,Feb,Sun
2/9/2015,2015,1,2,9,1,0,7,Feb,Mon
2/10/2015,2015,1,2,10,2,0,7,Feb,Tue
2/11/2015,2015,1,2,11,3,0,7,Feb,Wed
2/12/2015,2015,1,2,12,4,0,7,Feb,Thu
2/13/2015,2015,1,2,13,5,0,7,Feb,Fri
2/14/2015,2015,1,2,14,6,1,7,Feb,Sat
2/15/2015,2015,1,2,15,7,1,8,Feb,Sun
2/16/2015,2015,1,2,16,1,0,8,Feb,Mon
2/17/2015,2015,1,2,17,2,0,8,Feb,Tue
2/18/2015,2015,1,2,18,3,0,8,Feb,Wed
2/19/2015,2015,1,2,19,4,0,8,Feb,Thu
2/20/2015,2015,1,2,20,5,0,8,Feb,Fri
2/21/2015,2015,1,2,21,6,1,8,Feb,Sat
2/22/2015,2015,1,2,22,7,1,9,Feb,Sun
2/23/2015,2015,1,2,23,1,0,9,Feb,Mon
2/24/2015,2015,1,2,24,2,0,9,Feb,Tue
2/25/2015,2015,1,2,25,3,0,9,Feb,Wed
2/26/2015,2015,1,2,26,4,0,9,Feb,Thu
2/27/2015,2015,1,2,27,5,0,9,Feb,Fri
2/28/2015,2015,1,2,28,6,1,9,Feb,Sat
3/1/2015,2015,1,3,1,7,1,10,Mar,Sun
3/2/2015,2015,1,3,2,1,0,10,Mar,Mon
3/3/2015,2015,1,3,3,2,0,10,Mar,Tue
3/4/2015,2015,1,3,4,3,0,10,Mar,Wed
3/5/2015,2015,1,3,5,4,0,10,Mar,Thu
3/6/2015,2015,1,3,6,5,0,10,Mar,Fri
3/7/2015,2015,1,3,7,6,1,10,Mar,Sat
3/8/2015,2015,1,3,8,7,1,11,Mar,Sun
3/9/2015,2015,1,3,9,1,0,11,Mar,Mon
3/10/2015,2015,1,3,10,2,0,11,Mar,Tue
3/11/2015,2015,1,3,11,3,0,11,Mar,Wed
3/12/2015,2015,1,3,12,4,0,11,Mar,Thu
3/13/2015,2015,1,3,13,5,0,11,Mar,Fri
3/14/2015,2015,1,3,14,6,1,11,Mar,Sat
3/15/2015,2015,1,3,15,7,1,12,Mar,Sun
3/16/2015,2015,1,3,16,1,0,12,Mar,Mon
3/17/2015,2015,1,3,17,2,0,12,Mar,Tue
3/18/2015,2015,1,3,18,3,0,12,Mar,Wed
3/19/2015,2015,1,3,19,4,0,12,Mar,Thu
3/20/2015,2015,1,3,20,5,0,12,Mar,Fri
3/21/2015,2015,1,3,21,6,1,12,Mar,Sat
3/22/2015,2015,1,3,22,7,1,13,Mar,Sun
3/23/2015,2015,1,3,23,1,0,13,Mar,Mon
3/24/2015,2015,1,3,24,2,0,13,Mar,Tue
3/25/2015,2015,1,3,25,3,0,13,Mar,Wed
3/26/2015,2015,1,3,26,4,0,13,Mar,Thu
3/27/2015,2015,1,3,27,5,0,13,Mar,Fri
3/28/2015,2015,1,3,28,6,1,13,Mar,Sat
3/29/2015,2015,1,3,29,7,1,14,Mar,Sun
3/30/2015,2015,1,3,30,1,0,14,Mar,Mon
3/31/2015,2015,1,3,31,2,0,14,Mar,Tue
4/1/2015,2015,2,4,1,3,0,14,Apr,Wed
4/2/2015,2015,2,4,2,4,0,14,Apr,Thu
4/3/2015,2015,2,4,3,5,0,14,Apr,Fri
4/4/2015,2015,2,4,4,6,1,14,Apr,Sat
4/5/2015,2015,2,4,5,7,1,15,Apr,Sun
4/6/2015,2015,2,4,6,1,0,15,Apr,Mon
4/7/2015,2015,2,4,7,2,0,15,Apr,Tue
4/8/2015,2015,2,4,8,3,0,15,Apr,Wed
4/9/2015,2015,2,4,9,4,0,15,Apr,Thu
4/10/2015,2015,2,4,10,5,0,15,Apr,Fri
4/11/2015,2015,2,4,11,6,1,15,Apr,Sat
4/12/2015,2015,2,4,12,7,1,16,Apr,Sun
4/13/2015,2015,2,4,13,1,0,16,Apr,Mon
4/14/2015,2015,2,4,14,2,0,16,Apr,Tue
4/15/2015,2015,2,4,15,3,0,16,Apr,Wed
4/16/2015,2015,2,4,16,4,0,16,Apr,Thu
4/17/2015,2015,2,4,17,5,0,16,Apr,Fri
4/18/2015,2015,2,4,18,6,1,16,Apr,Sat
4/19/2015,2015,2,4,19,7,1,17,Apr,Sun
4/20/2015,2015,2,4,20,1,0,17,Apr,Mon
4/21/2015,2015,2,4,21,2,0,17,Apr,Tue
4/22/2015,2015,2,4,22,3,0,17,Apr,Wed
4/23/2015,2015,2,4,23,4,0,17,Apr,Thu
4/24/2015,2015,2,4,24,5,0,17,Apr,Fri
4/25/2015,2015,2,4,25,6,1,17,Apr,Sat
4/26/2015,2015,2,4,26,7,1,18,Apr,Sun
4/27/2015,2015,2,4,27,1,0,18,Apr,Mon
4/28/2015,2015,2,4,28,2,0,18,Apr,Tue
4/29/2015,2015,2,4,29,3,0,18,Apr,Wed
4/30/2015,2015,2,4,30,4,0,18,Apr,Thu
5/1/2015,2015,2,5,1,5,0,18,May,Fri
5/2/2015,2015,2,5,2,6,1,18,May,Sat
5/3/2015,2015,2,5,3,7,1,19,May,Sun
5/4/2015,2015,2,5,4,1,0,19,May,Mon
5/5/2015,2015,2,5,5,2,0,19,May,Tue
5/6/2015,2015,2,5,6,3,0,19,May,Wed
5/7/2015,2015,2,5,7,4,0,19,May,Thu
5/8/2015,2015,2,5,8,5,0,19,May,Fri
5/9/2015,2015,2,5,9,6,1,19,May,Sat
5/10/2015,2015,2,5,10,7,1,20,May,Sun
5/11/2015,2015,2,5,11,1,0,20,May,Mon
5/12/2015,2015,2,5,12,2,0,20,May,Tue
5/13/2015,2015,2,5,13,3,0,20,May,Wed
5/14/2015,2015,2,5,14,4,0,20,May,Thu
5/15/2015,2015,2,5,15,5,0,20,May,Fri
5/16/2015,2015,2,5,16,6,1,20,May,Sat
5/17/2015,2015,2,5,17,7,1,21,May,Sun
5/18/2015,2015,2,5,18,1,0,21,May,Mon
5/19/2015,2015,2,5,19,2,0,21,May,Tue
5/20/2015,2015,2,5,20,3,0,21,May,Wed
5/21/2015,2015,2,5,21,4,0,21,May,Thu
5/22/2015,2015,2,5,22,5,0,21,May,Fri
5/23/2015,2015,2,5,23,6,1,21,May,Sat
5/24/2015,2015,2,5,24,7,1,22,May,Sun
5/25/2015,2015,2,5,25,1,0,22,May,Mon
5/26/2015,2015,2,5,26,2,0,22,May,Tue
5/27/2015,2015,2,5,27,3,0,22,May,Wed
5/28/2015,2015,2,5,28,4,0,22,May,Thu
5/29/2015,2015,2,5,29,5,0,22,May,Fri
5/30/2015,2015,2,5,30,6,1,22,May,Sat
5/31/2015,2015,2,5,31,7,1,23,May,Sun
6/1/2015,2015,2,6,1,1,0,23,Jun,Mon
6/2/2015,2015,2,6,2,2,0,23,Jun,Tue
6/3/2015,2015,2,6,3,3,0,23,Jun,Wed
6/4/2015,2015,2,6,4,4,0,23,Jun,Thu
6/5/2015,2015,2,6,5,5,0,23,Jun,Fri
6/6/2015,2015,2,6,6,6,1,23,Jun,Sat
6/7/2015,2015,2,6,7,7,1,24,Jun,Sun
6/8/2015,2015,2,6,8,1,0,24,Jun,Mon
6/9/2015,2015,2,6,9,2,0,24,Jun,Tue
6/10/2015,2015,2,6,10,3,0,24,Jun,Wed
6/11/2015,2015,2,6,11,4,0,24,Jun,Thu
6/12/2015,2015,2,6,12,5,0,24,Jun,Fri
6/13/2015,2015,2,6,13,6,1,24,Jun,Sat
6/14/2015,2015,2,6,14,7,1,25,Jun,Sun
6/15/2015,2015,2,6,15,1,0,25,Jun,Mon
6/16/2015,2015,2,6,16,2,0,25,Jun,Tue
6/17/2015,2015,2,6,17,3,0,25,Jun,Wed
6/18/2015,2015,2,6,18,4,0,25,Jun,Thu
6/19/2015,2015,2,6,19,5,0,25,Jun,Fri
6/20/2015,2015,2,6,20,6,1,25,Jun,Sat
6/21/2015,2015,2,6,21,7,1,26,Jun,Sun
6/22/2015,2015,2,6,22,1,0,26,Jun,Mon
6/23/2015,2015,2,6,23,2,0,26,Jun,Tue
6/24/2015,2015,2,6,24,3,0,26,Jun,Wed
6/25/2015,2015,2,6,25,4,0,26,Jun,Thu
6/26/2015,2015,2,6,26,5,0,26,Jun,Fri
6/27/2015,2015,2,6,27,6,1,26,Jun,Sat
6/28/2015,2015,2,6,28,7,1,27,Jun,Sun
6/29/2015,2015,2,6,29,1,0,27,Jun,Mon
6/30/2015,2015,2,6,30,2,0,27,Jun,Tue
7/1/2015,2015,3,7,1,3,0,27,Jul,Wed
7/2/2015,2015,3,7,2,4,0,27,Jul,Thu
7/3/2015,2015,3,7,3,5,0,27,Jul,Fri
7/4/2015,2015,3,7,4,6,1,27,Jul,Sat
7/5/2015,2015,3,7,5,7,1,28,Jul,Sun
7/6/2015,2015,3,7,6,1,0,28,Jul,Mon
7/7/2015,2015,3,7,7,2,0,28,Jul,Tue
7/8/2015,2015,3,7,8,3,0,28,Jul,Wed
7/9/2015,2015,3,7,9,4,0,28,Jul,Thu
7/10/2015,2015,3,7,10,5,0,28,Jul,Fri
7/11/2015,2015,3,7,11,6,1,28,Jul,Sat
7/12/2015,2015,3,7,12,7,1,29,Jul,Sun
7/13/2015,2015,3,7,13,1,0,29,Jul,Mon
7/14/2015,2015,3,7,14,2,0,29,Jul,Tue
7/15/2015,2015,3,7,15,3,0,29,Jul,Wed
7/16/2015,2015,3,7,16,4,0,29,Jul,Thu
7/17/2015,2015,3,7,17,5,0,29,Jul,Fri
7/18/2015,2015,3,7,18,6,1,29,Jul,Sat
7/19/2015,2015,3,7,19,7,1,30,Jul,Sun
7/20/2015,2015,3,7,20,1,0,30,Jul,Mon
7/21/2015,2015,3,7,21,2,0,30,Jul,Tue
7/22/2015,2015,3,7,22,3,0,30,Jul,Wed
7/23/2015,2015,3,7,23,4,0,30,Jul,Thu
7/24/2015,2015,3,7,24,5,0,30,Jul,Fri
7/25/2015,2015,3,7,25,6,1,30,Jul,Sat
7/26/2015,2015,3,7,26,7,1,31,Jul,Sun
7/27/2015,2015,3,7,27,1,0,31,Jul,Mon
7/28/2015,2015,3,7,28,2,0,31,Jul,Tue
7/29/2015,2015,3,7,29,3,0,31,Jul,Wed
7/30/2015,2015,3,7,30,4,0,31,Jul,Thu
7/31/2015,2015,3,7,31,5,0,31,Jul,Fri
8/1/2015,2015,3,8,1,6,1,31,Aug,Sat
8/2/2015,2015,3,8,2,7,1,32,Aug,Sun
8/3/2015,2015,3,8,3,1,0,32,Aug,Mon
8/4/2015,2015,3,8,4,2,0,32,Aug,Tue
8/5/2015,2015,3,8,5,3,0,32,Aug,Wed
8/6/2015,2015,3,8,6,4,0,32,Aug,Thu
8/7/2015,2015,3,8,7,5,0,32,Aug,Fri
8/8/2015,2015,3,8,8,6,1,32,Aug,Sat
8/9/2015,2015,3,8,9,7,1,33,Aug,Sun
8/10/2015,2015,3,8,10,1,0,33,Aug,Mon
8/11/2015,2015,3,8,11,2,0,33,Aug,Tue
8/12/2015,2015,3,8,12,3,0,33,Aug,Wed
8/13/2015,2015,3,8,13,4,0,33,Aug,Thu
8/14/2015,2015,3,8,14,5,0,33,Aug,Fri
8/15/2015,2015,3,8,15,6,1,33,Aug,Sat
8/16/2015,2015,3,8,16,7,1,34,Aug,Sun
8/17/2015,2015,3,8,17,1,0,34,Aug,Mon
8/18/2015,2015,3,8,18,2,0,34,Aug,Tue
8/19/2015,2015,3,8,19,3,0,34,Aug,Wed
8/20/2015,2015,3,8,20,4,0,34,Aug,Thu
8/21/2015,2015,3,8,21,5,0,34,Aug,Fri
8/22/2015,2015,3,8,22,6,1,34,Aug,Sat
8/23/2015,2015,3,8,23,7,1,35,Aug,Sun
8/24/2015,2015,3,8,24,1,0,35,Aug,Mon
8/25/2015,2015,3,8,25,2,0,35,Aug,Tue
8/26/2015,2015,3,8,26,3,0,35,Aug,Wed
8/27/2015,2015,3,8,27,4,0,35,Aug,Thu
8/28/2015,2015,3,8,28,5,0,35,Aug,Fri
8/29/2015,2015,3,8,29,6,1,35,Aug,Sat
8/30/2015,2015,3,8,30,7,1,36,Aug,Sun
8/31/2015,2015,3,8,31,1,0,36,Aug,Mon
9/1/2015,2015,3,9,1,2,0,36,Sep,Tue
9/2/2015,2015,3,9,2,3,0,36,Sep,Wed
9/3/2015,2015,3,9,3,4,0,36,Sep,Thu
9/4/2015,2015,3,9,4,5,0,36,Sep,Fri
9/5/2015,2015,3,9,5,6,1,36,Sep,Sat
9/6/2015,2015,3,9,6,7,1,37,Sep,Sun
9/7/2015,2015,3,9,7,1,0,37,Sep,Mon
9/8/2015,2015,3,9,8,2,0,37,Sep,Tue
9/9/2015,2015,3,9,9,3,0,37,Sep,Wed
9/10/2015,2015,3,9,10,4,0,37,Sep,Thu
9/11/2015,2015,3,9,11,5,0,37,Sep,Fri
9/12/2015,2015,3,9,12,6,1,37,Sep,Sat
9/13/2015,2015,3,9,13,7,1,38,Sep,Sun
9/14/2015,2015,3,9,14,1,0,38,Sep,Mon
9/15/2015,2015,3,9,15,2,0,38,Sep,Tue
9/16/2015,2015,3,9,16,3,0,38,Sep,Wed
9/17/2015,2015,3,9,17,4,0,38,Sep,Thu
9/18/2015,2015,3,9,18,5,0,38,Sep,Fri
9/19/2015,2015,3,9,19,6,1,38,Sep,Sat
9/20/2015,2015,3,9,20,7,1,39,Sep,Sun
9/21/2015,2015,3,9,21,1,0,39,Sep,Mon
9/22/2015,2015,3,9,22,2,0,39,Sep,Tue
9/23/2015,2015,3,9,23,3,0,39,Sep,Wed
9/24/2015,2015,3,9,24,4,0,39,Sep,Thu
9/25/2015,2015,3,9,25,5,0,39,Sep,Fri
9/26/2015,2015,3,9,26,6,1,39,Sep,Sat
9/27/2015,2015,3,9,27,7,1,40,Sep,Sun
9/28/2015,2015,3,9,28,1,0,40,Sep,Mon
9/29/2015,2015,3,9,29,2,0,40,Sep,Tue
9/30/2015,2015,3,9,30,3,0,40,Sep,Wed
10/1/2015,2015,4,10,1,4,0,40,Oct,Thu
10/2/2015,2015,4,10,2,5,0,40,Oct,Fri
10/3/2015,2015,4,10,3,6,1,40,Oct,Sat
10/4/2015,2015,4,10,4,7,1,41,Oct,Sun
10/5/2015,2015,4,10,5,1,0,41,Oct,Mon
10/6/2015,2015,4,10,6,2,0,41,Oct,Tue
10/7/2015,2015,4,10,7,3,0,41,Oct,Wed
10/8/2015,2015,4,10,8,4,0,41,Oct,Thu
10/9/2015,2015,4,10,9,5,0,41,Oct,Fri
10/10/2015,2015,4,10,10,6,1,41,Oct,Sat
10/11/2015,2015,4,10,11,7,1,42,Oct,Sun
10/12/2015,2015,4,10,12,1,0,42,Oct,Mon
10/13/2015,2015,4,10,13,2,0,42,Oct,Tue
10/14/2015,2015,4,10,14,3,0,42,Oct,Wed
10/15/2015,2015,4,10,15,4,0,42,Oct,Thu
10/16/2015,2015,4,10,16,5,0,42,Oct,Fri
10/17/2015,2015,4,10,17,6,1,42,Oct,Sat
10/18/2015,2015,4,10,18,7,1,43,Oct,Sun
10/19/2015,2015,4,10,19,1,0,43,Oct,Mon
10/20/2015,2015,4,10,20,2,0,43,Oct,Tue
10/21/2015,2015,4,10,21,3,0,43,Oct,Wed
10/22/2015,2015,4,10,22,4,0,43,Oct,Thu
10/23/2015,2015,4,10,23,5,0,43,Oct,Fri
10/24/2015,2015,4,10,24,6,1,43,Oct,Sat
10/25/2015,2015,4,10,25,7,1,44,Oct,Sun
10/26/2015,2015,4,10,26,1,0,44,Oct,Mon
10/27/2015,2015,4,10,27,2,0,44,Oct,Tue
10/28/2015,2015,4,10,28,3,0,44,Oct,Wed
10/29/2015,2015,4,10,29,4,0,44,Oct,Thu
10/30/2015,2015,4,10,30,5,0,44,Oct,Fri
10/31/2015,2015,4,10,31,6,1,44,Oct,Sat
11/1/2015,2015,4,11,1,7,1,45,Nov,Sun
11/2/2015,2015,4,11,2,1,0,45,Nov,Mon
11/3/2015,2015,4,11,3,2,0,45,Nov,Tue
11/4/2015,2015,4,11,4,3,0,45,Nov,Wed
11/5/2015,2015,4,11,5,4,0,45,Nov,Thu
11/6/2015,2015,4,11,6,5,0,45,Nov,Fri
11/7/2015,2015,4,11,7,6,1,45,Nov,Sat
11/8/2015,2015,4,11,8,7,1,46,Nov,Sun
11/9/2015,2015,4,11,9,1,0,46,Nov,Mon
11/10/2015,2015,4,11,10,2,0,46,Nov,Tue
11/11/2015,2015,4,11,11,3,0,46,Nov,Wed
11/12/2015,2015,4,11,12,4,0,46,Nov,Thu
11/13/2015,2015,4,11,13,5,0,46,Nov,Fri
11/14/2015,2015,4,11,14,6,1,46,Nov,Sat
11/15/2015,2015,4,11,15,7,1,47,Nov,Sun
11/16/2015,2015,4,11,16,1,0,47,Nov,Mon
11/17/2015,2015,4,11,17,2,0,47,Nov,Tue
11/18/2015,2015,4,11,18,3,0,47,Nov,Wed
11/19/2015,2015,4,11,19,4,0,47,Nov,Thu
11/20/2015,2015,4,11,20,5,0,47,Nov,Fri
11/21/2015,2015,4,11,21,6,1,47,Nov,Sat
11/22/2015,2015,4,11,22,7,1,48,Nov,Sun
11/23/2015,2015,4,11,23,1,0,48,Nov,Mon
11/24/2015,2015,4,11,24,2,0,48,Nov,Tue
11/25/2015,2015,4,11,25,3,0,48,Nov,Wed
11/26/2015,2015,4,11,26,4,0,48,Nov,Thu
11/27/2015,2015,4,11,27,5,0,48,Nov,Fri
11/28/2015,2015,4,11,28,6,1,48,Nov,Sat
11/29/2015,2015,4,11,29,7,1,49,Nov,Sun
11/30/2015,2015,4,11,30,1,0,49,Nov,Mon
12/1/2015,2015,4,12,1,2,0,49,Dec,Tue
12/2/2015,2015,4,12,2,3,0,49,Dec,Wed
12/3/2015,2015,4,12,3,4,0,49,Dec,Thu
12/4/2015,2015,4,12,4,5,0,49,Dec,Fri
12/5/2015,2015,4,12,5,6,1,49,Dec,Sat
12/6/2015,2015,4,12,6,7,1,50,Dec,Sun
12/7/2015,2015,4,12,7,1,0,50,Dec,Mon
12/8/2015,2015,4,12,8,2,0,50,Dec,Tue
12/9/2015,2015,4,12,9,3,0,50,Dec,Wed
12/10/2015,2015,4,12,10,4,0,50,Dec,Thu
12/11/2015,2015,4,12,11,5,0,50,Dec,Fri
12/12/2015,2015,4,12,12,6,1,50,Dec,Sat
12/13/2015,2015,4,12,13,7,1,51,Dec,Sun
12/14/2015,2015,4,12,14,1,0,51,Dec,Mon
12/15/2015,2015,4,12,15,2,0,51,Dec,Tue
12/16/2015,2015,4,12,16,3,0,51,Dec,Wed
12/17/2015,2015,4,12,17,4,0,51,Dec,Thu
12/18/2015,2015,4,12,18,5,0,51,Dec,Fri
12/19/2015,2015,4,12,19,6,1,51,Dec,Sat
12/20/2015,2015,4,12,20,7,1,52,Dec,Sun
12/21/2015,2015,4,12,21,1,0,52,Dec,Mon
12/22/2015,2015,4,12,22,2,0,52,Dec,Tue
12/23/2015,2015,4,12,23,3,0,52,Dec,Wed
12/24/2015,2015,4,12,24,4,0,52,Dec,Thu
12/25/2015,2015,4,12,25,5,0,52,Dec,Fri
12/26/2015,2015,4,12,26,6,1,52,Dec,Sat
12/27/2015,2015,4,12,27,7,1,53,Dec,Sun
12/28/2015,2015,4,12,28,1,0,53,Dec,Mon
12/29/2015,2015,4,12,29,2,0,53,Dec,Tue
12/30/2015,2015,4,12,30,3,0,53,Dec,Wed
12/31/2015,2015,4,12,31,4,0,53,Dec,Thu
1/1/2016,2016,1,1,1,5,0,1,Jan,Fri
1/2/2016,2016,1,1,2,6,1,1,Jan,Sat
1/3/2016,2016,1,1,3,7,1,2,Jan,Sun
1/4/2016,2016,1,1,4,1,0,2,Jan,Mon
1/5/2016,2016,1,1,5,2,0,2,Jan,Tue
1/6/2016,2016,1,1,6,3,0,2,Jan,Wed
1/7/2016,2016,1,1,7,4,0,2,Jan,Thu
1/8/2016,2016,1,1,8,5,0,2,Jan,Fri
1/9/2016,2016,1,1,9,6,1,2,Jan,Sat
1/10/2016,2016,1,1,10,7,1,3,Jan,Sun
1/11/2016,2016,1,1,11,1,0,3,Jan,Mon
1/12/2016,2016,1,1,12,2,0,3,Jan,Tue
1/13/2016,2016,1,1,13,3,0,3,Jan,Wed
1/14/2016,2016,1,1,14,4,0,3,Jan,Thu
1/15/2016,2016,1,1,15,5,0,3,Jan,Fri
1/16/2016,2016,1,1,16,6,1,3,Jan,Sat
1/17/2016,2016,1,1,17,7,1,4,Jan,Sun
1/18/2016,2016,1,1,18,1,0,4,Jan,Mon
1/19/2016,2016,1,1,19,2,0,4,Jan,Tue
1/20/2016,2016,1,1,20,3,0,4,Jan,Wed
1/21/2016,2016,1,1,21,4,0,4,Jan,Thu
1/22/2016,2016,1,1,22,5,0,4,Jan,Fri
1/23/2016,2016,1,1,23,6,1,4,Jan,Sat
1/24/2016,2016,1,1,24,7,1,5,Jan,Sun
1/25/2016,2016,1,1,25,1,0,5,Jan,Mon
1/26/2016,2016,1,1,26,2,0,5,Jan,Tue
1/27/2016,2016,1,1,27,3,0,5,Jan,Wed
1/28/2016,2016,1,1,28,4,0,5,Jan,Thu
1/29/2016,2016,1,1,29,5,0,5,Jan,Fri
1/30/2016,2016,1,1,30,6,1,5,Jan,Sat
1/31/2016,2016,1,1,31,7,1,6,Jan,Sun
2/1/2016,2016,1,2,1,1,0,6,Feb,Mon
2/2/2016,2016,1,2,2,2,0,6,Feb,Tue
2/3/2016,2016,1,2,3,3,0,6,Feb,Wed
2/4/2016,2016,1,2,4,4,0,6,Feb,Thu
2/5/2016,2016,1,2,5,5,0,6,Feb,Fri
2/6/2016,2016,1,2,6,6,1,6,Feb,Sat
2/7/2016,2016,1,2,7,7,1,7,Feb,Sun
2/8/2016,2016,1,2,8,1,0,7,Feb,Mon
2/9/2016,2016,1,2,9,2,0,7,Feb,Tue
2/10/2016,2016,1,2,10,3,0,7,Feb,Wed
2/11/2016,2016,1,2,11,4,0,7,Feb,Thu
2/12/2016,2016,1,2,12,5,0,7,Feb,Fri
2/13/2016,2016,1,2,13,6,1,7,Feb,Sat
2/14/2016,2016,1,2,14,7,1,8,Feb,Sun
2/15/2016,2016,1,2,15,1,0,8,Feb,Mon
2/16/2016,2016,1,2,16,2,0,8,Feb,Tue
2/17/2016,2016,1,2,17,3,0,8,Feb,Wed
2/18/2016,2016,1,2,18,4,0,8,Feb,Thu
2/19/2016,2016,1,2,19,5,0,8,Feb,Fri
2/20/2016,2016,1,2,20,6,1,8,Feb,Sat
2/21/2016,2016,1,2,21,7,1,9,Feb,Sun
2/22/2016,2016,1,2,22,1,0,9,Feb,Mon
2/23/2016,2016,1,2,23,2,0,9,Feb,Tue
2/24/2016,2016,1,2,24,3,0,9,Feb,Wed
2/25/2016,2016,1,2,25,4,0,9,Feb,Thu
2/26/2016,2016,1,2,26,5,0,9,Feb,Fri
2/27/2016,2016,1,2,27,6,1,9,Feb,Sat
2/28/2016,2016,1,2,28,7,1,10,Feb,Sun
2/29/2016,2016,1,2,29,1,0,10,Feb,Mon
3/1/2016,2016,1,3,1,2,0,10,Mar,Tue
3/2/2016,2016,1,3,2,3,0,10,Mar,Wed
3/3/2016,2016,1,3,3,4,0,10,Mar,Thu
3/4/2016,2016,1,3,4,5,0,10,Mar,Fri
3/5/2016,2016,1,3,5,6,1,10,Mar,Sat
3/6/2016,2016,1,3,6,7,1,11,Mar,Sun
3/7/2016,2016,1,3,7,1,0,11,Mar,Mon
3/8/2016,2016,1,3,8,2,0,11,Mar,Tue
3/9/2016,2016,1,3,9,3,0,11,Mar,Wed
3/10/2016,2016,1,3,10,4,0,11,Mar,Thu
3/11/2016,2016,1,3,11,5,0,11,Mar,Fri
3/12/2016,2016,1,3,12,6,1,11,Mar,Sat
3/13/2016,2016,1,3,13,7,1,12,Mar,Sun
3/14/2016,2016,1,3,14,1,0,12,Mar,Mon
3/15/2016,2016,1,3,15,2,0,12,Mar,Tue
3/16/2016,2016,1,3,16,3,0,12,Mar,Wed
3/17/2016,2016,1,3,17,4,0,12,Mar,Thu
3/18/2016,2016,1,3,18,5,0,12,Mar,Fri
3/19/2016,2016,1,3,19,6,1,12,Mar,Sat
3/20/2016,2016,1,3,20,7,1,13,Mar,Sun
3/21/2016,2016,1,3,21,1,0,13,Mar,Mon
3/22/2016,2016,1,3,22,2,0,13,Mar,Tue
3/23/2016,2016,1,3,23,3,0,13,Mar,Wed
3/24/2016,2016,1,3,24,4,0,13,Mar,Thu
3/25/2016,2016,1,3,25,5,0,13,Mar,Fri
3/26/2016,2016,1,3,26,6,1,13,Mar,Sat
3/27/2016,2016,1,3,27,7,1,14,Mar,Sun
3/28/2016,2016,1,3,28,1,0,14,Mar,Mon
3/29/2016,2016,1,3,29,2,0,14,Mar,Tue
3/30/2016,2016,1,3,30,3,0,14,Mar,Wed
3/31/2016,2016,1,3,31,4,0,14,Mar,Thu
4/1/2016,2016,2,4,1,5,0,14,Apr,Fri
4/2/2016,2016,2,4,2,6,1,14,Apr,Sat
4/3/2016,2016,2,4,3,7,1,15,Apr,Sun
4/4/2016,2016,2,4,4,1,0,15,Apr,Mon
4/5/2016,2016,2,4,5,2,0,15,Apr,Tue
4/6/2016,2016,2,4,6,3,0,15,Apr,Wed
4/7/2016,2016,2,4,7,4,0,15,Apr,Thu
4/8/2016,2016,2,4,8,5,0,15,Apr,Fri
4/9/2016,2016,2,4,9,6,1,15,Apr,Sat
4/10/2016,2016,2,4,10,7,1,16,Apr,Sun
4/11/2016,2016,2,4,11,1,0,16,Apr,Mon
4/12/2016,2016,2,4,12,2,0,16,Apr,Tue
4/13/2016,2016,2,4,13,3,0,16,Apr,Wed
4/14/2016,2016,2,4,14,4,0,16,Apr,Thu
4/15/2016,2016,2,4,15,5,0,16,Apr,Fri
4/16/2016,2016,2,4,16,6,1,16,Apr,Sat
4/17/2016,2016,2,4,17,7,1,17,Apr,Sun
4/18/2016,2016,2,4,18,1,0,17,Apr,Mon
4/19/2016,2016,2,4,19,2,0,17,Apr,Tue
4/20/2016,2016,2,4,20,3,0,17,Apr,Wed
4/21/2016,2016,2,4,21,4,0,17,Apr,Thu
4/22/2016,2016,2,4,22,5,0,17,Apr,Fri
4/23/2016,2016,2,4,23,6,1,17,Apr,Sat
4/24/2016,2016,2,4,24,7,1,18,Apr,Sun
4/25/2016,2016,2,4,25,1,0,18,Apr,Mon
4/26/2016,2016,2,4,26,2,0,18,Apr,Tue
4/27/2016,2016,2,4,27,3,0,18,Apr,Wed
4/28/2016,2016,2,4,28,4,0,18,Apr,Thu
4/29/2016,2016,2,4,29,5,0,18,Apr,Fri
4/30/2016,2016,2,4,30,6,1,18,Apr,Sat
5/1/2016,2016,2,5,1,7,1,19,May,Sun
5/2/2016,2016,2,5,2,1,0,19,May,Mon
5/3/2016,2016,2,5,3,2,0,19,May,Tue
5/4/2016,2016,2,5,4,3,0,19,May,Wed
5/5/2016,2016,2,5,5,4,0,19,May,Thu
5/6/2016,2016,2,5,6,5,0,19,May,Fri
5/7/2016,2016,2,5,7,6,1,19,May,Sat
5/8/2016,2016,2,5,8,7,1,20,May,Sun
5/9/2016,2016,2,5,9,1,0,20,May,Mon
5/10/2016,2016,2,5,10,2,0,20,May,Tue
5/11/2016,2016,2,5,11,3,0,20,May,Wed
5/12/2016,2016,2,5,12,4,0,20,May,Thu
5/13/2016,2016,2,5,13,5,0,20,May,Fri
5/14/2016,2016,2,5,14,6,1,20,May,Sat
5/15/2016,2016,2,5,15,7,1,21,May,Sun
5/16/2016,2016,2,5,16,1,0,21,May,Mon
5/17/2016,2016,2,5,17,2,0,21,May,Tue
5/18/2016,2016,2,5,18,3,0,21,May,Wed
5/19/2016,2016,2,5,19,4,0,21,May,Thu
5/20/2016,2016,2,5,20,5,0,21,May,Fri
5/21/2016,2016,2,5,21,6,1,21,May,Sat
5/22/2016,2016,2,5,22,7,1,22,May,Sun
5/23/2016,2016,2,5,23,1,0,22,May,Mon
5/24/2016,2016,2,5,24,2,0,22,May,Tue
5/25/2016,2016,2,5,25,3,0,22,May,Wed
5/26/2016,2016,2,5,26,4,0,22,May,Thu
5/27/2016,2016,2,5,27,5,0,22,May,Fri
5/28/2016,2016,2,5,28,6,1,22,May,Sat
5/29/2016,2016,2,5,29,7,1,23,May,Sun
5/30/2016,2016,2,5,30,1,0,23,May,Mon
5/31/2016,2016,2,5,31,2,0,23,May,Tue
6/1/2016,2016,2,6,1,3,0,23,Jun,Wed
6/2/2016,2016,2,6,2,4,0,23,Jun,Thu
6/3/2016,2016,2,6,3,5,0,23,Jun,Fri
6/4/2016,2016,2,6,4,6,1,23,Jun,Sat
6/5/2016,2016,2,6,5,7,1,24,Jun,Sun
6/6/2016,2016,2,6,6,1,0,24,Jun,Mon
6/7/2016,2016,2,6,7,2,0,24,Jun,Tue
6/8/2016,2016,2,6,8,3,0,24,Jun,Wed
6/9/2016,2016,2,6,9,4,0,24,Jun,Thu
6/10/2016,2016,2,6,10,5,0,24,Jun,Fri
6/11/2016,2016,2,6,11,6,1,24,Jun,Sat
6/12/2016,2016,2,6,12,7,1,25,Jun,Sun
6/13/2016,2016,2,6,13,1,0,25,Jun,Mon
6/14/2016,2016,2,6,14,2,0,25,Jun,Tue
6/15/2016,2016,2,6,15,3,0,25,Jun,Wed
6/16/2016,2016,2,6,16,4,0,25,Jun,Thu
6/17/2016,2016,2,6,17,5,0,25,Jun,Fri
6/18/2016,2016,2,6,18,6,1,25,Jun,Sat
6/19/2016,2016,2,6,19,7,1,26,Jun,Sun
6/20/2016,2016,2,6,20,1,0,26,Jun,Mon
6/21/2016,2016,2,6,21,2,0,26,Jun,Tue
6/22/2016,2016,2,6,22,3,0,26,Jun,Wed
6/23/2016,2016,2,6,23,4,0,26,Jun,Thu
6/24/2016,2016,2,6,24,5,0,26,Jun,Fri
6/25/2016,2016,2,6,25,6,1,26,Jun,Sat
6/26/2016,2016,2,6,26,7,1,27,Jun,Sun
6/27/2016,2016,2,6,27,1,0,27,Jun,Mon
6/28/2016,2016,2,6,28,2,0,27,Jun,Tue
6/29/2016,2016,2,6,29,3,0,27,Jun,Wed
6/30/2016,2016,2,6,30,4,0,27,Jun,Thu
7/1/2016,2016,3,7,1,5,0,27,Jul,Fri
7/2/2016,2016,3,7,2,6,1,27,Jul,Sat
7/3/2016,2016,3,7,3,7,1,28,Jul,Sun
7/4/2016,2016,3,7,4,1,0,28,Jul,Mon
7/5/2016,2016,3,7,5,2,0,28,Jul,Tue
7/6/2016,2016,3,7,6,3,0,28,Jul,Wed
7/7/2016,2016,3,7,7,4,0,28,Jul,Thu
7/8/2016,2016,3,7,8,5,0,28,Jul,Fri
7/9/2016,2016,3,7,9,6,1,28,Jul,Sat
7/10/2016,2016,3,7,10,7,1,29,Jul,Sun
7/11/2016,2016,3,7,11,1,0,29,Jul,Mon
7/12/2016,2016,3,7,12,2,0,29,Jul,Tue
7/13/2016,2016,3,7,13,3,0,29,Jul,Wed
7/14/2016,2016,3,7,14,4,0,29,Jul,Thu
7/15/2016,2016,3,7,15,5,0,29,Jul,Fri
7/16/2016,2016,3,7,16,6,1,29,Jul,Sat
7/17/2016,2016,3,7,17,7,1,30,Jul,Sun
7/18/2016,2016,3,7,18,1,0,30,Jul,Mon
7/19/2016,2016,3,7,19,2,0,30,Jul,Tue
7/20/2016,2016,3,7,20,3,0,30,Jul,Wed
7/21/2016,2016,3,7,21,4,0,30,Jul,Thu
7/22/2016,2016,3,7,22,5,0,30,Jul,Fri
7/23/2016,2016,3,7,23,6,1,30,Jul,Sat
7/24/2016,2016,3,7,24,7,1,31,Jul,Sun
7/25/2016,2016,3,7,25,1,0,31,Jul,Mon
7/26/2016,2016,3,7,26,2,0,31,Jul,Tue
7/27/2016,2016,3,7,27,3,0,31,Jul,Wed
7/28/2016,2016,3,7,28,4,0,31,Jul,Thu
7/29/2016,2016,3,7,29,5,0,31,Jul,Fri
7/30/2016,2016,3,7,30,6,1,31,Jul,Sat
7/31/2016,2016,3,7,31,7,1,32,Jul,Sun
8/1/2016,2016,3,8,1,1,0,32,Aug,Mon
8/2/2016,2016,3,8,2,2,0,32,Aug,Tue
8/3/2016,2016,3,8,3,3,0,32,Aug,Wed
8/4/2016,2016,3,8,4,4,0,32,Aug,Thu
8/5/2016,2016,3,8,5,5,0,32,Aug,Fri
8/6/2016,2016,3,8,6,6,1,32,Aug,Sat
8/7/2016,2016,3,8,7,7,1,33,Aug,Sun
8/8/2016,2016,3,8,8,1,0,33,Aug,Mon
8/9/2016,2016,3,8,9,2,0,33,Aug,Tue
8/10/2016,2016,3,8,10,3,0,33,Aug,Wed
8/11/2016,2016,3,8,11,4,0,33,Aug,Thu
8/12/2016,2016,3,8,12,5,0,33,Aug,Fri
8/13/2016,2016,3,8,13,6,1,33,Aug,Sat
8/14/2016,2016,3,8,14,7,1,34,Aug,Sun
8/15/2016,2016,3,8,15,1,0,34,Aug,Mon
8/16/2016,2016,3,8,16,2,0,34,Aug,Tue
8/17/2016,2016,3,8,17,3,0,34,Aug,Wed
8/18/2016,2016,3,8,18,4,0,34,Aug,Thu
8/19/2016,2016,3,8,19,5,0,34,Aug,Fri
8/20/2016,2016,3,8,20,6,1,34,Aug,Sat
8/21/2016,2016,3,8,21,7,1,35,Aug,Sun
8/22/2016,2016,3,8,22,1,0,35,Aug,Mon
8/23/2016,2016,3,8,23,2,0,35,Aug,Tue
8/24/2016,2016,3,8,24,3,0,35,Aug,Wed
8/25/2016,2016,3,8,25,4,0,35,Aug,Thu
8/26/2016,2016,3,8,26,5,0,35,Aug,Fri
8/27/2016,2016,3,8,27,6,1,35,Aug,Sat
8/28/2016,2016,3,8,28,7,1,36,Aug,Sun
8/29/2016,2016,3,8,29,1,0,36,Aug,Mon
8/30/2016,2016,3,8,30,2,0,36,Aug,Tue
8/31/2016,2016,3,8,31,3,0,36,Aug,Wed
9/1/2016,2016,3,9,1,4,0,36,Sep,Thu
9/2/2016,2016,3,9,2,5,0,36,Sep,Fri
9/3/2016,2016,3,9,3,6,1,36,Sep,Sat
9/4/2016,2016,3,9,4,7,1,37,Sep,Sun
9/5/2016,2016,3,9,5,1,0,37,Sep,Mon
9/6/2016,2016,3,9,6,2,0,37,Sep,Tue
9/7/2016,2016,3,9,7,3,0,37,Sep,Wed
9/8/2016,2016,3,9,8,4,0,37,Sep,Thu
9/9/2016,2016,3,9,9,5,0,37,Sep,Fri
9/10/2016,2016,3,9,10,6,1,37,Sep,Sat
9/11/2016,2016,3,9,11,7,1,38,Sep,Sun
9/12/2016,2016,3,9,12,1,0,38,Sep,Mon
9/13/2016,2016,3,9,13,2,0,38,Sep,Tue
9/14/2016,2016,3,9,14,3,0,38,Sep,Wed
9/15/2016,2016,3,9,15,4,0,38,Sep,Thu
9/16/2016,2016,3,9,16,5,0,38,Sep,Fri
9/17/2016,2016,3,9,17,6,1,38,Sep,Sat
9/18/2016,2016,3,9,18,7,1,39,Sep,Sun
9/19/2016,2016,3,9,19,1,0,39,Sep,Mon
9/20/2016,2016,3,9,20,2,0,39,Sep,Tue
9/21/2016,2016,3,9,21,3,0,39,Sep,Wed
9/22/2016,2016,3,9,22,4,0,39,Sep,Thu
9/23/2016,2016,3,9,23,5,0,39,Sep,Fri
9/24/2016,2016,3,9,24,6,1,39,Sep,Sat
9/25/2016,2016,3,9,25,7,1,40,Sep,Sun
9/26/2016,2016,3,9,26,1,0,40,Sep,Mon
9/27/2016,2016,3,9,27,2,0,40,Sep,Tue
9/28/2016,2016,3,9,28,3,0,40,Sep,Wed
9/29/2016,2016,3,9,29,4,0,40,Sep,Thu
9/30/2016,2016,3,9,30,5,0,40,Sep,Fri
10/1/2016,2016,4,10,1,6,1,40,Oct,Sat
10/2/2016,2016,4,10,2,7,1,41,Oct,Sun
10/3/2016,2016,4,10,3,1,0,41,Oct,Mon
10/4/2016,2016,4,10,4,2,0,41,Oct,Tue
10/5/2016,2016,4,10,5,3,0,41,Oct,Wed
10/6/2016,2016,4,10,6,4,0,41,Oct,Thu
10/7/2016,2016,4,10,7,5,0,41,Oct,Fri
10/8/2016,2016,4,10,8,6,1,41,Oct,Sat
10/9/2016,2016,4,10,9,7,1,42,Oct,Sun
10/10/2016,2016,4,10,10,1,0,42,Oct,Mon
10/11/2016,2016,4,10,11,2,0,42,Oct,Tue
10/12/2016,2016,4,10,12,3,0,42,Oct,Wed
10/13/2016,2016,4,10,13,4,0,42,Oct,Thu
10/14/2016,2016,4,10,14,5,0,42,Oct,Fri
10/15/2016,2016,4,10,15,6,1,42,Oct,Sat
10/16/2016,2016,4,10,16,7,1,43,Oct,Sun
10/17/2016,2016,4,10,17,1,0,43,Oct,Mon
10/18/2016,2016,4,10,18,2,0,43,Oct,Tue
10/19/2016,2016,4,10,19,3,0,43,Oct,Wed
10/20/2016,2016,4,10,20,4,0,43,Oct,Thu
10/21/2016,2016,4,10,21,5,0,43,Oct,Fri
10/22/2016,2016,4,10,22,6,1,43,Oct,Sat
10/23/2016,2016,4,10,23,7,1,44,Oct,Sun
10/24/2016,2016,4,10,24,1,0,44,Oct,Mon
10/25/2016,2016,4,10,25,2,0,44,Oct,Tue
10/26/2016,2016,4,10,26,3,0,44,Oct,Wed
10/27/2016,2016,4,10,27,4,0,44,Oct,Thu
10/28/2016,2016,4,10,28,5,0,44,Oct,Fri
10/29/2016,2016,4,10,29,6,1,44,Oct,Sat
10/30/2016,2016,4,10,30,7,1,45,Oct,Sun
10/31/2016,2016,4,10,31,1,0,45,Oct,Mon
11/1/2016,2016,4,11,1,2,0,45,Nov,Tue
11/2/2016,2016,4,11,2,3,0,45,Nov,Wed
11/3/2016,2016,4,11,3,4,0,45,Nov,Thu
11/4/2016,2016,4,11,4,5,0,45,Nov,Fri
11/5/2016,2016,4,11,5,6,1,45,Nov,Sat
11/6/2016,2016,4,11,6,7,1,46,Nov,Sun
11/7/2016,2016,4,11,7,1,0,46,Nov,Mon
11/8/2016,2016,4,11,8,2,0,46,Nov,Tue
11/9/2016,2016,4,11,9,3,0,46,Nov,Wed
11/10/2016,2016,4,11,10,4,0,46,Nov,Thu
11/11/2016,2016,4,11,11,5,0,46,Nov,Fri
11/12/2016,2016,4,11,12,6,1,46,Nov,Sat
11/13/2016,2016,4,11,13,7,1,47,Nov,Sun
11/14/2016,2016,4,11,14,1,0,47,Nov,Mon
11/15/2016,2016,4,11,15,2,0,47,Nov,Tue
11/16/2016,2016,4,11,16,3,0,47,Nov,Wed
11/17/2016,2016,4,11,17,4,0,47,Nov,Thu
11/18/2016,2016,4,11,18,5,0,47,Nov,Fri
11/19/2016,2016,4,11,19,6,1,47,Nov,Sat
11/20/2016,2016,4,11,20,7,1,48,Nov,Sun
11/21/2016,2016,4,11,21,1,0,48,Nov,Mon
11/22/2016,2016,4,11,22,2,0,48,Nov,Tue
11/23/2016,2016,4,11,23,3,0,48,Nov,Wed
11/24/2016,2016,4,11,24,4,0,48,Nov,Thu
11/25/2016,2016,4,11,25,5,0,48,Nov,Fri
11/26/2016,2016,4,11,26,6,1,48,Nov,Sat
11/27/2016,2016,4,11,27,7,1,49,Nov,Sun
11/28/2016,2016,4,11,28,1,0,49,Nov,Mon
11/29/2016,2016,4,11,29,2,0,49,Nov,Tue
11/30/2016,2016,4,11,30,3,0,49,Nov,Wed
12/1/2016,2016,4,12,1,4,0,49,Dec,Thu
12/2/2016,2016,4,12,2,5,0,49,Dec,Fri
12/3/2016,2016,4,12,3,6,1,49,Dec,Sat
12/4/2016,2016,4,12,4,7,1,50,Dec,Sun
12/5/2016,2016,4,12,5,1,0,50,Dec,Mon
12/6/2016,2016,4,12,6,2,0,50,Dec,Tue
12/7/2016,2016,4,12,7,3,0,50,Dec,Wed
12/8/2016,2016,4,12,8,4,0,50,Dec,Thu
12/9/2016,2016,4,12,9,5,0,50,Dec,Fri
12/10/2016,2016,4,12,10,6,1,50,Dec,Sat
12/11/2016,2016,4,12,11,7,1,51,Dec,Sun
12/12/2016,2016,4,12,12,1,0,51,Dec,Mon
12/13/2016,2016,4,12,13,2,0,51,Dec,Tue
12/14/2016,2016,4,12,14,3,0,51,Dec,Wed
12/15/2016,2016,4,12,15,4,0,51,Dec,Thu
12/16/2016,2016,4,12,16,5,0,51,Dec,Fri
12/17/2016,2016,4,12,17,6,1,51,Dec,Sat
12/18/2016,2016,4,12,18,7,1,52,Dec,Sun
12/19/2016,2016,4,12,19,1,0,52,Dec,Mon
12/20/2016,2016,4,12,20,2,0,52,Dec,Tue
12/21/2016,2016,4,12,21,3,0,52,Dec,Wed
12/22/2016,2016,4,12,22,4,0,52,Dec,Thu
12/23/2016,2016,4,12,23,5,0,52,Dec,Fri
12/24/2016,2016,4,12,24,6,1,52,Dec,Sat
12/25/2016,2016,4,12,25,7,1,53,Dec,Sun
12/26/2016,2016,4,12,26,1,0,53,Dec,Mon
12/27/2016,2016,4,12,27,2,0,53,Dec,Tue
12/28/2016,2016,4,12,28,3,0,53,Dec,Wed
12/29/2016,2016,4,12,29,4,0,53,Dec,Thu
12/30/2016,2016,4,12,30,5,0,53,Dec,Fri
12/31/2016,2016,4,12,31,6,1,53,Dec,Sat
1/1/2017,2017,1,1,1,7,1,2,Jan,Sun
1/2/2017,2017,1,1,2,1,0,2,Jan,Mon
1/3/2017,2017,1,1,3,2,0,2,Jan,Tue
1/4/2017,2017,1,1,4,3,0,2,Jan,Wed
1/5/2017,2017,1,1,5,4,0,2,Jan,Thu
1/6/2017,2017,1,1,6,5,0,2,Jan,Fri
1/7/2017,2017,1,1,7,6,1,2,Jan,Sat
1/8/2017,2017,1,1,8,7,1,3,Jan,Sun
1/9/2017,2017,1,1,9,1,0,3,Jan,Mon
1/10/2017,2017,1,1,10,2,0,3,Jan,Tue
1/11/2017,2017,1,1,11,3,0,3,Jan,Wed
1/12/2017,2017,1,1,12,4,0,3,Jan,Thu
1/13/2017,2017,1,1,13,5,0,3,Jan,Fri
1/14/2017,2017,1,1,14,6,1,3,Jan,Sat
1/15/2017,2017,1,1,15,7,1,4,Jan,Sun
1/16/2017,2017,1,1,16,1,0,4,Jan,Mon
1/17/2017,2017,1,1,17,2,0,4,Jan,Tue
1/18/2017,2017,1,1,18,3,0,4,Jan,Wed
1/19/2017,2017,1,1,19,4,0,4,Jan,Thu
1/20/2017,2017,1,1,20,5,0,4,Jan,Fri
1/21/2017,2017,1,1,21,6,1,4,Jan,Sat
1/22/2017,2017,1,1,22,7,1,5,Jan,Sun
1/23/2017,2017,1,1,23,1,0,5,Jan,Mon
1/24/2017,2017,1,1,24,2,0,5,Jan,Tue
1/25/2017,2017,1,1,25,3,0,5,Jan,Wed
1/26/2017,2017,1,1,26,4,0,5,Jan,Thu
1/27/2017,2017,1,1,27,5,0,5,Jan,Fri
1/28/2017,2017,1,1,28,6,1,5,Jan,Sat
1/29/2017,2017,1,1,29,7,1,6,Jan,Sun
1/30/2017,2017,1,1,30,1,0,6,Jan,Mon
1/31/2017,2017,1,1,31,2,0,6,Jan,Tue
2/1/2017,2017,1,2,1,3,0,6,Feb,Wed
2/2/2017,2017,1,2,2,4,0,6,Feb,Thu
2/3/2017,2017,1,2,3,5,0,6,Feb,Fri
2/4/2017,2017,1,2,4,6,1,6,Feb,Sat
2/5/2017,2017,1,2,5,7,1,7,Feb,Sun
2/6/2017,2017,1,2,6,1,0,7,Feb,Mon
2/7/2017,2017,1,2,7,2,0,7,Feb,Tue
2/8/2017,2017,1,2,8,3,0,7,Feb,Wed
2/9/2017,2017,1,2,9,4,0,7,Feb,Thu
2/10/2017,2017,1,2,10,5,0,7,Feb,Fri
2/11/2017,2017,1,2,11,6,1,7,Feb,Sat
2/12/2017,2017,1,2,12,7,1,8,Feb,Sun
2/13/2017,2017,1,2,13,1,0,8,Feb,Mon
2/14/2017,2017,1,2,14,2,0,8,Feb,Tue
2/15/2017,2017,1,2,15,3,0,8,Feb,Wed
2/16/2017,2017,1,2,16,4,0,8,Feb,Thu
2/17/2017,2017,1,2,17,5,0,8,Feb,Fri
2/18/2017,2017,1,2,18,6,1,8,Feb,Sat
2/19/2017,2017,1,2,19,7,1,9,Feb,Sun
2/20/2017,2017,1,2,20,1,0,9,Feb,Mon
2/21/2017,2017,1,2,21,2,0,9,Feb,Tue
2/22/2017,2017,1,2,22,3,0,9,Feb,Wed
2/23/2017,2017,1,2,23,4,0,9,Feb,Thu
2/24/2017,2017,1,2,24,5,0,9,Feb,Fri
2/25/2017,2017,1,2,25,6,1,9,Feb,Sat
2/26/2017,2017,1,2,26,7,1,10,Feb,Sun
2/27/2017,2017,1,2,27,1,0,10,Feb,Mon
2/28/2017,2017,1,2,28,2,0,10,Feb,Tue
3/1/2017,2017,1,3,1,3,0,10,Mar,Wed
3/2/2017,2017,1,3,2,4,0,10,Mar,Thu
3/3/2017,2017,1,3,3,5,0,10,Mar,Fri
3/4/2017,2017,1,3,4,6,1,10,Mar,Sat
3/5/2017,2017,1,3,5,7,1,11,Mar,Sun
3/6/2017,2017,1,3,6,1,0,11,Mar,Mon
3/7/2017,2017,1,3,7,2,0,11,Mar,Tue
3/8/2017,2017,1,3,8,3,0,11,Mar,Wed
3/9/2017,2017,1,3,9,4,0,11,Mar,Thu
3/10/2017,2017,1,3,10,5,0,11,Mar,Fri
3/11/2017,2017,1,3,11,6,1,11,Mar,Sat
3/12/2017,2017,1,3,12,7,1,12,Mar,Sun
3/13/2017,2017,1,3,13,1,0,12,Mar,Mon
3/14/2017,2017,1,3,14,2,0,12,Mar,Tue
3/15/2017,2017,1,3,15,3,0,12,Mar,Wed
3/16/2017,2017,1,3,16,4,0,12,Mar,Thu
3/17/2017,2017,1,3,17,5,0,12,Mar,Fri
3/18/2017,2017,1,3,18,6,1,12,Mar,Sat
3/19/2017,2017,1,3,19,7,1,13,Mar,Sun
3/20/2017,2017,1,3,20,1,0,13,Mar,Mon
3/21/2017,2017,1,3,21,2,0,13,Mar,Tue
3/22/2017,2017,1,3,22,3,0,13,Mar,Wed
3/23/2017,2017,1,3,23,4,0,13,Mar,Thu
3/24/2017,2017,1,3,24,5,0,13,Mar,Fri
3/25/2017,2017,1,3,25,6,1,13,Mar,Sat
3/26/2017,2017,1,3,26,7,1,14,Mar,Sun
3/27/2017,2017,1,3,27,1,0,14,Mar,Mon
3/28/2017,2017,1,3,28,2,0,14,Mar,Tue
3/29/2017,2017,1,3,29,3,0,14,Mar,Wed
3/30/2017,2017,1,3,30,4,0,14,Mar,Thu
3/31/2017,2017,1,3,31,5,0,14,Mar,Fri
4/1/2017,2017,2,4,1,6,1,14,Apr,Sat
4/2/2017,2017,2,4,2,7,1,15,Apr,Sun
4/3/2017,2017,2,4,3,1,0,15,Apr,Mon
4/4/2017,2017,2,4,4,2,0,15,Apr,Tue
4/5/2017,2017,2,4,5,3,0,15,Apr,Wed
4/6/2017,2017,2,4,6,4,0,15,Apr,Thu
4/7/2017,2017,2,4,7,5,0,15,Apr,Fri
4/8/2017,2017,2,4,8,6,1,15,Apr,Sat
4/9/2017,2017,2,4,9,7,1,16,Apr,Sun
4/10/2017,2017,2,4,10,1,0,16,Apr,Mon
4/11/2017,2017,2,4,11,2,0,16,Apr,Tue
4/12/2017,2017,2,4,12,3,0,16,Apr,Wed
4/13/2017,2017,2,4,13,4,0,16,Apr,Thu
4/14/2017,2017,2,4,14,5,0,16,Apr,Fri
4/15/2017,2017,2,4,15,6,1,16,Apr,Sat
4/16/2017,2017,2,4,16,7,1,17,Apr,Sun
4/17/2017,2017,2,4,17,1,0,17,Apr,Mon
4/18/2017,2017,2,4,18,2,0,17,Apr,Tue
4/19/2017,2017,2,4,19,3,0,17,Apr,Wed
4/20/2017,2017,2,4,20,4,0,17,Apr,Thu
4/21/2017,2017,2,4,21,5,0,17,Apr,Fri
4/22/2017,2017,2,4,22,6,1,17,Apr,Sat
4/23/2017,2017,2,4,23,7,1,18,Apr,Sun
4/24/2017,2017,2,4,24,1,0,18,Apr,Mon
4/25/2017,2017,2,4,25,2,0,18,Apr,Tue
4/26/2017,2017,2,4,26,3,0,18,Apr,Wed
4/27/2017,2017,2,4,27,4,0,18,Apr,Thu
4/28/2017,2017,2,4,28,5,0,18,Apr,Fri
4/29/2017,2017,2,4,29,6,1,18,Apr,Sat
4/30/2017,2017,2,4,30,7,1,19,Apr,Sun
5/1/2017,2017,2,5,1,1,0,19,May,Mon
5/2/2017,2017,2,5,2,2,0,19,May,Tue
5/3/2017,2017,2,5,3,3,0,19,May,Wed
5/4/2017,2017,2,5,4,4,0,19,May,Thu
5/5/2017,2017,2,5,5,5,0,19,May,Fri
5/6/2017,2017,2,5,6,6,1,19,May,Sat
5/7/2017,2017,2,5,7,7,1,20,May,Sun
5/8/2017,2017,2,5,8,1,0,20,May,Mon
5/9/2017,2017,2,5,9,2,0,20,May,Tue
5/10/2017,2017,2,5,10,3,0,20,May,Wed
5/11/2017,2017,2,5,11,4,0,20,May,Thu
5/12/2017,2017,2,5,12,5,0,20,May,Fri
5/13/2017,2017,2,5,13,6,1,20,May,Sat
5/14/2017,2017,2,5,14,7,1,21,May,Sun
5/15/2017,2017,2,5,15,1,0,21,May,Mon
5/16/2017,2017,2,5,16,2,0,21,May,Tue
5/17/2017,2017,2,5,17,3,0,21,May,Wed
5/18/2017,2017,2,5,18,4,0,21,May,Thu
5/19/2017,2017,2,5,19,5,0,21,May,Fri
5/20/2017,2017,2,5,20,6,1,21,May,Sat
5/21/2017,2017,2,5,21,7,1,22,May,Sun
5/22/2017,2017,2,5,22,1,0,22,May,Mon
5/23/2017,2017,2,5,23,2,0,22,May,Tue
5/24/2017,2017,2,5,24,3,0,22,May,Wed
5/25/2017,2017,2,5,25,4,0,22,May,Thu
5/26/2017,2017,2,5,26,5,0,22,May,Fri
5/27/2017,2017,2,5,27,6,1,22,May,Sat
5/28/2017,2017,2,5,28,7,1,23,May,Sun
5/29/2017,2017,2,5,29,1,0,23,May,Mon
5/30/2017,2017,2,5,30,2,0,23,May,Tue
5/31/2017,2017,2,5,31,3,0,23,May,Wed
6/1/2017,2017,2,6,1,4,0,23,Jun,Thu
6/2/2017,2017,2,6,2,5,0,23,Jun,Fri
6/3/2017,2017,2,6,3,6,1,23,Jun,Sat
6/4/2017,2017,2,6,4,7,1,24,Jun,Sun
6/5/2017,2017,2,6,5,1,0,24,Jun,Mon
6/6/2017,2017,2,6,6,2,0,24,Jun,Tue
6/7/2017,2017,2,6,7,3,0,24,Jun,Wed
6/8/2017,2017,2,6,8,4,0,24,Jun,Thu
6/9/2017,2017,2,6,9,5,0,24,Jun,Fri
6/10/2017,2017,2,6,10,6,1,24,Jun,Sat
6/11/2017,2017,2,6,11,7,1,25,Jun,Sun
6/12/2017,2017,2,6,12,1,0,25,Jun,Mon
6/13/2017,2017,2,6,13,2,0,25,Jun,Tue
6/14/2017,2017,2,6,14,3,0,25,Jun,Wed
6/15/2017,2017,2,6,15,4,0,25,Jun,Thu
6/16/2017,2017,2,6,16,5,0,25,Jun,Fri
6/17/2017,2017,2,6,17,6,1,25,Jun,Sat
6/18/2017,2017,2,6,18,7,1,26,Jun,Sun
6/19/2017,2017,2,6,19,1,0,26,Jun,Mon
6/20/2017,2017,2,6,20,2,0,26,Jun,Tue
6/21/2017,2017,2,6,21,3,0,26,Jun,Wed
6/22/2017,2017,2,6,22,4,0,26,Jun,Thu
6/23/2017,2017,2,6,23,5,0,26,Jun,Fri
6/24/2017,2017,2,6,24,6,1,26,Jun,Sat
6/25/2017,2017,2,6,25,7,1,27,Jun,Sun
6/26/2017,2017,2,6,26,1,0,27,Jun,Mon
6/27/2017,2017,2,6,27,2,0,27,Jun,Tue
6/28/2017,2017,2,6,28,3,0,27,Jun,Wed
6/29/2017,2017,2,6,29,4,0,27,Jun,Thu
6/30/2017,2017,2,6,30,5,0,27,Jun,Fri
7/1/2017,2017,3,7,1,6,1,27,Jul,Sat
7/2/2017,2017,3,7,2,7,1,28,Jul,Sun
7/3/2017,2017,3,7,3,1,0,28,Jul,Mon
7/4/2017,2017,3,7,4,2,0,28,Jul,Tue
7/5/2017,2017,3,7,5,3,0,28,Jul,Wed
7/6/2017,2017,3,7,6,4,0,28,Jul,Thu
7/7/2017,2017,3,7,7,5,0,28,Jul,Fri
7/8/2017,2017,3,7,8,6,1,28,Jul,Sat
7/9/2017,2017,3,7,9,7,1,29,Jul,Sun
7/10/2017,2017,3,7,10,1,0,29,Jul,Mon
7/11/2017,2017,3,7,11,2,0,29,Jul,Tue
7/12/2017,2017,3,7,12,3,0,29,Jul,Wed
7/13/2017,2017,3,7,13,4,0,29,Jul,Thu
7/14/2017,2017,3,7,14,5,0,29,Jul,Fri
7/15/2017,2017,3,7,15,6,1,29,Jul,Sat
7/16/2017,2017,3,7,16,7,1,30,Jul,Sun
7/17/2017,2017,3,7,17,1,0,30,Jul,Mon
7/18/2017,2017,3,7,18,2,0,30,Jul,Tue
7/19/2017,2017,3,7,19,3,0,30,Jul,Wed
7/20/2017,2017,3,7,20,4,0,30,Jul,Thu
7/21/2017,2017,3,7,21,5,0,30,Jul,Fri
7/22/2017,2017,3,7,22,6,1,30,Jul,Sat
7/23/2017,2017,3,7,23,7,1,31,Jul,Sun
7/24/2017,2017,3,7,24,1,0,31,Jul,Mon
7/25/2017,2017,3,7,25,2,0,31,Jul,Tue
7/26/2017,2017,3,7,26,3,0,31,Jul,Wed
7/27/2017,2017,3,7,27,4,0,31,Jul,Thu
7/28/2017,2017,3,7,28,5,0,31,Jul,Fri
7/29/2017,2017,3,7,29,6,1,31,Jul,Sat
7/30/2017,2017,3,7,30,7,1,32,Jul,Sun
7/31/2017,2017,3,7,31,1,0,32,Jul,Mon
8/1/2017,2017,3,8,1,2,0,32,Aug,Tue
8/2/2017,2017,3,8,2,3,0,32,Aug,Wed
8/3/2017,2017,3,8,3,4,0,32,Aug,Thu
8/4/2017,2017,3,8,4,5,0,32,Aug,Fri
8/5/2017,2017,3,8,5,6,1,32,Aug,Sat
8/6/2017,2017,3,8,6,7,1,33,Aug,Sun
8/7/2017,2017,3,8,7,1,0,33,Aug,Mon
8/8/2017,2017,3,8,8,2,0,33,Aug,Tue
8/9/2017,2017,3,8,9,3,0,33,Aug,Wed
8/10/2017,2017,3,8,10,4,0,33,Aug,Thu
8/11/2017,2017,3,8,11,5,0,33,Aug,Fri
8/12/2017,2017,3,8,12,6,1,33,Aug,Sat
8/13/2017,2017,3,8,13,7,1,34,Aug,Sun
8/14/2017,2017,3,8,14,1,0,34,Aug,Mon
8/15/2017,2017,3,8,15,2,0,34,Aug,Tue
8/16/2017,2017,3,8,16,3,0,34,Aug,Wed
8/17/2017,2017,3,8,17,4,0,34,Aug,Thu
8/18/2017,2017,3,8,18,5,0,34,Aug,Fri
8/19/2017,2017,3,8,19,6,1,34,Aug,Sat
8/20/2017,2017,3,8,20,7,1,35,Aug,Sun
8/21/2017,2017,3,8,21,1,0,35,Aug,Mon
8/22/2017,2017,3,8,22,2,0,35,Aug,Tue
8/23/2017,2017,3,8,23,3,0,35,Aug,Wed
8/24/2017,2017,3,8,24,4,0,35,Aug,Thu
8/25/2017,2017,3,8,25,5,0,35,Aug,Fri
8/26/2017,2017,3,8,26,6,1,35,Aug,Sat
8/27/2017,2017,3,8,27,7,1,36,Aug,Sun
8/28/2017,2017,3,8,28,1,0,36,Aug,Mon
8/29/2017,2017,3,8,29,2,0,36,Aug,Tue
8/30/2017,2017,3,8,30,3,0,36,Aug,Wed
8/31/2017,2017,3,8,31,4,0,36,Aug,Thu
9/1/2017,2017,3,9,1,5,0,36,Sep,Fri
9/2/2017,2017,3,9,2,6,1,36,Sep,Sat
9/3/2017,2017,3,9,3,7,1,37,Sep,Sun
9/4/2017,2017,3,9,4,1,0,37,Sep,Mon
9/5/2017,2017,3,9,5,2,0,37,Sep,Tue
9/6/2017,2017,3,9,6,3,0,37,Sep,Wed
9/7/2017,2017,3,9,7,4,0,37,Sep,Thu
9/8/2017,2017,3,9,8,5,0,37,Sep,Fri
9/9/2017,2017,3,9,9,6,1,37,Sep,Sat
9/10/2017,2017,3,9,10,7,1,38,Sep,Sun
9/11/2017,2017,3,9,11,1,0,38,Sep,Mon
9/12/2017,2017,3,9,12,2,0,38,Sep,Tue
9/13/2017,2017,3,9,13,3,0,38,Sep,Wed
9/14/2017,2017,3,9,14,4,0,38,Sep,Thu
9/15/2017,2017,3,9,15,5,0,38,Sep,Fri
9/16/2017,2017,3,9,16,6,1,38,Sep,Sat
9/17/2017,2017,3,9,17,7,1,39,Sep,Sun
9/18/2017,2017,3,9,18,1,0,39,Sep,Mon
9/19/2017,2017,3,9,19,2,0,39,Sep,Tue
9/20/2017,2017,3,9,20,3,0,39,Sep,Wed
9/21/2017,2017,3,9,21,4,0,39,Sep,Thu
9/22/2017,2017,3,9,22,5,0,39,Sep,Fri
9/23/2017,2017,3,9,23,6,1,39,Sep,Sat
9/24/2017,2017,3,9,24,7,1,40,Sep,Sun
9/25/2017,2017,3,9,25,1,0,40,Sep,Mon
9/26/2017,2017,3,9,26,2,0,40,Sep,Tue
9/27/2017,2017,3,9,27,3,0,40,Sep,Wed
9/28/2017,2017,3,9,28,4,0,40,Sep,Thu
9/29/2017,2017,3,9,29,5,0,40,Sep,Fri
9/30/2017,2017,3,9,30,6,1,40,Sep,Sat
10/1/2017,2017,4,10,1,7,1,41,Oct,Sun
10/2/2017,2017,4,10,2,1,0,41,Oct,Mon
10/3/2017,2017,4,10,3,2,0,41,Oct,Tue
10/4/2017,2017,4,10,4,3,0,41,Oct,Wed
10/5/2017,2017,4,10,5,4,0,41,Oct,Thu
10/6/2017,2017,4,10,6,5,0,41,Oct,Fri
10/7/2017,2017,4,10,7,6,1,41,Oct,Sat
10/8/2017,2017,4,10,8,7,1,42,Oct,Sun
10/9/2017,2017,4,10,9,1,0,42,Oct,Mon
10/10/2017,2017,4,10,10,2,0,42,Oct,Tue
10/11/2017,2017,4,10,11,3,0,42,Oct,Wed
10/12/2017,2017,4,10,12,4,0,42,Oct,Thu
10/13/2017,2017,4,10,13,5,0,42,Oct,Fri
10/14/2017,2017,4,10,14,6,1,42,Oct,Sat
10/15/2017,2017,4,10,15,7,1,43,Oct,Sun
10/16/2017,2017,4,10,16,1,0,43,Oct,Mon
10/17/2017,2017,4,10,17,2,0,43,Oct,Tue
10/18/2017,2017,4,10,18,3,0,43,Oct,Wed
10/19/2017,2017,4,10,19,4,0,43,Oct,Thu
10/20/2017,2017,4,10,20,5,0,43,Oct,Fri
10/21/2017,2017,4,10,21,6,1,43,Oct,Sat
10/22/2017,2017,4,10,22,7,1,44,Oct,Sun
10/23/2017,2017,4,10,23,1,0,44,Oct,Mon
10/24/2017,2017,4,10,24,2,0,44,Oct,Tue
10/25/2017,2017,4,10,25,3,0,44,Oct,Wed
10/26/2017,2017,4,10,26,4,0,44,Oct,Thu
10/27/2017,2017,4,10,27,5,0,44,Oct,Fri
10/28/2017,2017,4,10,28,6,1,44,Oct,Sat
10/29/2017,2017,4,10,29,7,1,45,Oct,Sun
10/30/2017,2017,4,10,30,1,0,45,Oct,Mon
10/31/2017,2017,4,10,31,2,0,45,Oct,Tue
11/1/2017,2017,4,11,1,3,0,45,Nov,Wed
11/2/2017,2017,4,11,2,4,0,45,Nov,Thu
11/3/2017,2017,4,11,3,5,0,45,Nov,Fri
11/4/2017,2017,4,11,4,6,1,45,Nov,Sat
11/5/2017,2017,4,11,5,7,1,46,Nov,Sun
11/6/2017,2017,4,11,6,1,0,46,Nov,Mon
11/7/2017,2017,4,11,7,2,0,46,Nov,Tue
11/8/2017,2017,4,11,8,3,0,46,Nov,Wed
11/9/2017,2017,4,11,9,4,0,46,Nov,Thu
11/10/2017,2017,4,11,10,5,0,46,Nov,Fri
11/11/2017,2017,4,11,11,6,1,46,Nov,Sat
11/12/2017,2017,4,11,12,7,1,47,Nov,Sun
11/13/2017,2017,4,11,13,1,0,47,Nov,Mon
11/14/2017,2017,4,11,14,2,0,47,Nov,Tue
11/15/2017,2017,4,11,15,3,0,47,Nov,Wed
11/16/2017,2017,4,11,16,4,0,47,Nov,Thu
11/17/2017,2017,4,11,17,5,0,47,Nov,Fri
11/18/2017,2017,4,11,18,6,1,47,Nov,Sat
11/19/2017,2017,4,11,19,7,1,48,Nov,Sun
11/20/2017,2017,4,11,20,1,0,48,Nov,Mon
11/21/2017,2017,4,11,21,2,0,48,Nov,Tue
11/22/2017,2017,4,11,22,3,0,48,Nov,Wed
11/23/2017,2017,4,11,23,4,0,48,Nov,Thu
11/24/2017,2017,4,11,24,5,0,48,Nov,Fri
11/25/2017,2017,4,11,25,6,1,48,Nov,Sat
11/26/2017,2017,4,11,26,7,1,49,Nov,Sun
11/27/2017,2017,4,11,27,1,0,49,Nov,Mon
11/28/2017,2017,4,11,28,2,0,49,Nov,Tue
11/29/2017,2017,4,11,29,3,0,49,Nov,Wed
11/30/2017,2017,4,11,30,4,0,49,Nov,Thu
12/1/2017,2017,4,12,1,5,0,49,Dec,Fri
12/2/2017,2017,4,12,2,6,1,49,Dec,Sat
12/3/2017,2017,4,12,3,7,1,50,Dec,Sun
12/4/2017,2017,4,12,4,1,0,50,Dec,Mon
12/5/2017,2017,4,12,5,2,0,50,Dec,Tue
12/6/2017,2017,4,12,6,3,0,50,Dec,Wed
12/7/2017,2017,4,12,7,4,0,50,Dec,Thu
12/8/2017,2017,4,12,8,5,0,50,Dec,Fri
12/9/2017,2017,4,12,9,6,1,50,Dec,Sat
12/10/2017,2017,4,12,10,7,1,51,Dec,Sun
12/11/2017,2017,4,12,11,1,0,51,Dec,Mon
12/12/2017,2017,4,12,12,2,0,51,Dec,Tue
12/13/2017,2017,4,12,13,3,0,51,Dec,Wed
12/14/2017,2017,4,12,14,4,0,51,Dec,Thu
12/15/2017,2017,4,12,15,5,0,51,Dec,Fri
12/16/2017,2017,4,12,16,6,1,51,Dec,Sat
12/17/2017,2017,4,12,17,7,1,52,Dec,Sun
12/18/2017,2017,4,12,18,1,0,52,Dec,Mon
12/19/2017,2017,4,12,19,2,0,52,Dec,Tue
12/20/2017,2017,4,12,20,3,0,52,Dec,Wed
12/21/2017,2017,4,12,21,4,0,52,Dec,Thu
12/22/2017,2017,4,12,22,5,0,52,Dec,Fri
12/23/2017,2017,4,12,23,6,1,52,Dec,Sat
12/24/2017,2017,4,12,24,7,1,53,Dec,Sun
12/25/2017,2017,4,12,25,1,0,53,Dec,Mon
12/26/2017,2017,4,12,26,2,0,53,Dec,Tue
12/27/2017,2017,4,12,27,3,0,53,Dec,Wed
12/28/2017,2017,4,12,28,4,0,53,Dec,Thu
12/29/2017,2017,4,12,29,5,0,53,Dec,Fri
12/30/2017,2017,4,12,30,6,1,53,Dec,Sat
12/31/2017,2017,4,12,31,7,1,54,Dec,Sun
1/1/2018,2018,1,1,1,1,0,1,Jan,Mon
1/2/2018,2018,1,1,2,2,0,1,Jan,Tue
1/3/2018,2018,1,1,3,3,0,1,Jan,Wed
1/4/2018,2018,1,1,4,4,0,1,Jan,Thu
1/5/2018,2018,1,1,5,5,0,1,Jan,Fri
1/6/2018,2018,1,1,6,6,1,1,Jan,Sat
1/7/2018,2018,1,1,7,7,1,2,Jan,Sun
1/8/2018,2018,1,1,8,1,0,2,Jan,Mon
1/9/2018,2018,1,1,9,2,0,2,Jan,Tue
1/10/2018,2018,1,1,10,3,0,2,Jan,Wed
1/11/2018,2018,1,1,11,4,0,2,Jan,Thu
1/12/2018,2018,1,1,12,5,0,2,Jan,Fri
1/13/2018,2018,1,1,13,6,1,2,Jan,Sat
1/14/2018,2018,1,1,14,7,1,3,Jan,Sun
1/15/2018,2018,1,1,15,1,0,3,Jan,Mon
1/16/2018,2018,1,1,16,2,0,3,Jan,Tue
1/17/2018,2018,1,1,17,3,0,3,Jan,Wed
1/18/2018,2018,1,1,18,4,0,3,Jan,Thu
1/19/2018,2018,1,1,19,5,0,3,Jan,Fri
1/20/2018,2018,1,1,20,6,1,3,Jan,Sat
1/21/2018,2018,1,1,21,7,1,4,Jan,Sun
1/22/2018,2018,1,1,22,1,0,4,Jan,Mon
1/23/2018,2018,1,1,23,2,0,4,Jan,Tue
1/24/2018,2018,1,1,24,3,0,4,Jan,Wed
1/25/2018,2018,1,1,25,4,0,4,Jan,Thu
1/26/2018,2018,1,1,26,5,0,4,Jan,Fri
1/27/2018,2018,1,1,27,6,1,4,Jan,Sat
1/28/2018,2018,1,1,28,7,1,5,Jan,Sun
1/29/2018,2018,1,1,29,1,0,5,Jan,Mon
1/30/2018,2018,1,1,30,2,0,5,Jan,Tue
1/31/2018,2018,1,1,31,3,0,5,Jan,Wed
2/1/2018,2018,1,2,1,4,0,5,Feb,Thu
2/2/2018,2018,1,2,2,5,0,5,Feb,Fri
2/3/2018,2018,1,2,3,6,1,5,Feb,Sat
2/4/2018,2018,1,2,4,7,1,6,Feb,Sun
2/5/2018,2018,1,2,5,1,0,6,Feb,Mon
2/6/2018,2018,1,2,6,2,0,6,Feb,Tue
2/7/2018,2018,1,2,7,3,0,6,Feb,Wed
2/8/2018,2018,1,2,8,4,0,6,Feb,Thu
2/9/2018,2018,1,2,9,5,0,6,Feb,Fri
2/10/2018,2018,1,2,10,6,1,6,Feb,Sat
2/11/2018,2018,1,2,11,7,1,7,Feb,Sun
2/12/2018,2018,1,2,12,1,0,7,Feb,Mon
2/13/2018,2018,1,2,13,2,0,7,Feb,Tue
2/14/2018,2018,1,2,14,3,0,7,Feb,Wed
2/15/2018,2018,1,2,15,4,0,7,Feb,Thu
2/16/2018,2018,1,2,16,5,0,7,Feb,Fri
2/17/2018,2018,1,2,17,6,1,7,Feb,Sat
2/18/2018,2018,1,2,18,7,1,8,Feb,Sun
2/19/2018,2018,1,2,19,1,0,8,Feb,Mon
2/20/2018,2018,1,2,20,2,0,8,Feb,Tue
2/21/2018,2018,1,2,21,3,0,8,Feb,Wed
2/22/2018,2018,1,2,22,4,0,8,Feb,Thu
2/23/2018,2018,1,2,23,5,0,8,Feb,Fri
2/24/2018,2018,1,2,24,6,1,8,Feb,Sat
2/25/2018,2018,1,2,25,7,1,9,Feb,Sun
2/26/2018,2018,1,2,26,1,0,9,Feb,Mon
2/27/2018,2018,1,2,27,2,0,9,Feb,Tue
2/28/2018,2018,1,2,28,3,0,9,Feb,Wed
3/1/2018,2018,1,3,1,4,0,9,Mar,Thu
3/2/2018,2018,1,3,2,5,0,9,Mar,Fri
3/3/2018,2018,1,3,3,6,1,9,Mar,Sat
3/4/2018,2018,1,3,4,7,1,10,Mar,Sun
3/5/2018,2018,1,3,5,1,0,10,Mar,Mon
3/6/2018,2018,1,3,6,2,0,10,Mar,Tue
3/7/2018,2018,1,3,7,3,0,10,Mar,Wed
3/8/2018,2018,1,3,8,4,0,10,Mar,Thu
3/9/2018,2018,1,3,9,5,0,10,Mar,Fri
3/10/2018,2018,1,3,10,6,1,10,Mar,Sat
3/11/2018,2018,1,3,11,7,1,11,Mar,Sun
3/12/2018,2018,1,3,12,1,0,11,Mar,Mon
3/13/2018,2018,1,3,13,2,0,11,Mar,Tue
3/14/2018,2018,1,3,14,3,0,11,Mar,Wed
3/15/2018,2018,1,3,15,4,0,11,Mar,Thu
3/16/2018,2018,1,3,16,5,0,11,Mar,Fri
3/17/2018,2018,1,3,17,6,1,11,Mar,Sat
3/18/2018,2018,1,3,18,7,1,12,Mar,Sun
3/19/2018,2018,1,3,19,1,0,12,Mar,Mon
3/20/2018,2018,1,3,20,2,0,12,Mar,Tue
3/21/2018,2018,1,3,21,3,0,12,Mar,Wed
3/22/2018,2018,1,3,22,4,0,12,Mar,Thu
3/23/2018,2018,1,3,23,5,0,12,Mar,Fri
3/24/2018,2018,1,3,24,6,1,12,Mar,Sat
3/25/2018,2018,1,3,25,7,1,13,Mar,Sun
3/26/2018,2018,1,3,26,1,0,13,Mar,Mon
3/27/2018,2018,1,3,27,2,0,13,Mar,Tue
3/28/2018,2018,1,3,28,3,0,13,Mar,Wed
3/29/2018,2018,1,3,29,4,0,13,Mar,Thu
3/30/2018,2018,1,3,30,5,0,13,Mar,Fri
3/31/2018,2018,1,3,31,6,1,13,Mar,Sat
4/1/2018,2018,2,4,1,7,1,14,Apr,Sun
4/2/2018,2018,2,4,2,1,0,14,Apr,Mon
4/3/2018,2018,2,4,3,2,0,14,Apr,Tue
4/4/2018,2018,2,4,4,3,0,14,Apr,Wed
4/5/2018,2018,2,4,5,4,0,14,Apr,Thu
4/6/2018,2018,2,4,6,5,0,14,Apr,Fri
4/7/2018,2018,2,4,7,6,1,14,Apr,Sat
4/8/2018,2018,2,4,8,7,1,15,Apr,Sun
4/9/2018,2018,2,4,9,1,0,15,Apr,Mon
4/10/2018,2018,2,4,10,2,0,15,Apr,Tue
4/11/2018,2018,2,4,11,3,0,15,Apr,Wed
4/12/2018,2018,2,4,12,4,0,15,Apr,Thu
4/13/2018,2018,2,4,13,5,0,15,Apr,Fri
4/14/2018,2018,2,4,14,6,1,15,Apr,Sat
4/15/2018,2018,2,4,15,7,1,16,Apr,Sun
4/16/2018,2018,2,4,16,1,0,16,Apr,Mon
4/17/2018,2018,2,4,17,2,0,16,Apr,Tue
4/18/2018,2018,2,4,18,3,0,16,Apr,Wed
4/19/2018,2018,2,4,19,4,0,16,Apr,Thu
4/20/2018,2018,2,4,20,5,0,16,Apr,Fri
4/21/2018,2018,2,4,21,6,1,16,Apr,Sat
4/22/2018,2018,2,4,22,7,1,17,Apr,Sun
4/23/2018,2018,2,4,23,1,0,17,Apr,Mon
4/24/2018,2018,2,4,24,2,0,17,Apr,Tue
4/25/2018,2018,2,4,25,3,0,17,Apr,Wed
4/26/2018,2018,2,4,26,4,0,17,Apr,Thu
4/27/2018,2018,2,4,27,5,0,17,Apr,Fri
4/28/2018,2018,2,4,28,6,1,17,Apr,Sat
4/29/2018,2018,2,4,29,7,1,18,Apr,Sun
4/30/2018,2018,2,4,30,1,0,18,Apr,Mon
5/1/2018,2018,2,5,1,2,0,18,May,Tue
5/2/2018,2018,2,5,2,3,0,18,May,Wed
5/3/2018,2018,2,5,3,4,0,18,May,Thu
5/4/2018,2018,2,5,4,5,0,18,May,Fri
5/5/2018,2018,2,5,5,6,1,18,May,Sat
5/6/2018,2018,2,5,6,7,1,19,May,Sun
5/7/2018,2018,2,5,7,1,0,19,May,Mon
5/8/2018,2018,2,5,8,2,0,19,May,Tue
5/9/2018,2018,2,5,9,3,0,19,May,Wed
5/10/2018,2018,2,5,10,4,0,19,May,Thu
5/11/2018,2018,2,5,11,5,0,19,May,Fri
5/12/2018,2018,2,5,12,6,1,19,May,Sat
5/13/2018,2018,2,5,13,7,1,20,May,Sun
5/14/2018,2018,2,5,14,1,0,20,May,Mon
5/15/2018,2018,2,5,15,2,0,20,May,Tue
5/16/2018,2018,2,5,16,3,0,20,May,Wed
5/17/2018,2018,2,5,17,4,0,20,May,Thu
5/18/2018,2018,2,5,18,5,0,20,May,Fri
5/19/2018,2018,2,5,19,6,1,20,May,Sat
5/20/2018,2018,2,5,20,7,1,21,May,Sun
5/21/2018,2018,2,5,21,1,0,21,May,Mon
5/22/2018,2018,2,5,22,2,0,21,May,Tue
5/23/2018,2018,2,5,23,3,0,21,May,Wed
5/24/2018,2018,2,5,24,4,0,21,May,Thu
5/25/2018,2018,2,5,25,5,0,21,May,Fri
5/26/2018,2018,2,5,26,6,1,21,May,Sat
5/27/2018,2018,2,5,27,7,1,22,May,Sun
5/28/2018,2018,2,5,28,1,0,22,May,Mon
5/29/2018,2018,2,5,29,2,0,22,May,Tue
5/30/2018,2018,2,5,30,3,0,22,May,Wed
5/31/2018,2018,2,5,31,4,0,22,May,Thu
6/1/2018,2018,2,6,1,5,0,22,Jun,Fri
6/2/2018,2018,2,6,2,6,1,22,Jun,Sat
6/3/2018,2018,2,6,3,7,1,23,Jun,Sun
6/4/2018,2018,2,6,4,1,0,23,Jun,Mon
6/5/2018,2018,2,6,5,2,0,23,Jun,Tue
6/6/2018,2018,2,6,6,3,0,23,Jun,Wed
6/7/2018,2018,2,6,7,4,0,23,Jun,Thu
6/8/2018,2018,2,6,8,5,0,23,Jun,Fri
6/9/2018,2018,2,6,9,6,1,23,Jun,Sat
6/10/2018,2018,2,6,10,7,1,24,Jun,Sun
6/11/2018,2018,2,6,11,1,0,24,Jun,Mon
6/12/2018,2018,2,6,12,2,0,24,Jun,Tue
6/13/2018,2018,2,6,13,3,0,24,Jun,Wed
6/14/2018,2018,2,6,14,4,0,24,Jun,Thu
6/15/2018,2018,2,6,15,5,0,24,Jun,Fri
6/16/2018,2018,2,6,16,6,1,24,Jun,Sat
6/17/2018,2018,2,6,17,7,1,25,Jun,Sun
6/18/2018,2018,2,6,18,1,0,25,Jun,Mon
6/19/2018,2018,2,6,19,2,0,25,Jun,Tue
6/20/2018,2018,2,6,20,3,0,25,Jun,Wed
6/21/2018,2018,2,6,21,4,0,25,Jun,Thu
6/22/2018,2018,2,6,22,5,0,25,Jun,Fri
6/23/2018,2018,2,6,23,6,1,25,Jun,Sat
6/24/2018,2018,2,6,24,7,1,26,Jun,Sun
6/25/2018,2018,2,6,25,1,0,26,Jun,Mon
6/26/2018,2018,2,6,26,2,0,26,Jun,Tue
6/27/2018,2018,2,6,27,3,0,26,Jun,Wed
6/28/2018,2018,2,6,28,4,0,26,Jun,Thu
6/29/2018,2018,2,6,29,5,0,26,Jun,Fri
6/30/2018,2018,2,6,30,6,1,26,Jun,Sat
7/1/2018,2018,3,7,1,7,1,27,Jul,Sun
7/2/2018,2018,3,7,2,1,0,27,Jul,Mon
7/3/2018,2018,3,7,3,2,0,27,Jul,Tue
7/4/2018,2018,3,7,4,3,0,27,Jul,Wed
7/5/2018,2018,3,7,5,4,0,27,Jul,Thu
7/6/2018,2018,3,7,6,5,0,27,Jul,Fri
7/7/2018,2018,3,7,7,6,1,27,Jul,Sat
7/8/2018,2018,3,7,8,7,1,28,Jul,Sun
7/9/2018,2018,3,7,9,1,0,28,Jul,Mon
7/10/2018,2018,3,7,10,2,0,28,Jul,Tue
7/11/2018,2018,3,7,11,3,0,28,Jul,Wed
7/12/2018,2018,3,7,12,4,0,28,Jul,Thu
7/13/2018,2018,3,7,13,5,0,28,Jul,Fri
7/14/2018,2018,3,7,14,6,1,28,Jul,Sat
7/15/2018,2018,3,7,15,7,1,29,Jul,Sun
7/16/2018,2018,3,7,16,1,0,29,Jul,Mon
7/17/2018,2018,3,7,17,2,0,29,Jul,Tue
7/18/2018,2018,3,7,18,3,0,29,Jul,Wed
7/19/2018,2018,3,7,19,4,0,29,Jul,Thu
7/20/2018,2018,3,7,20,5,0,29,Jul,Fri
7/21/2018,2018,3,7,21,6,1,29,Jul,Sat
7/22/2018,2018,3,7,22,7,1,30,Jul,Sun
7/23/2018,2018,3,7,23,1,0,30,Jul,Mon
7/24/2018,2018,3,7,24,2,0,30,Jul,Tue
7/25/2018,2018,3,7,25,3,0,30,Jul,Wed
7/26/2018,2018,3,7,26,4,0,30,Jul,Thu
7/27/2018,2018,3,7,27,5,0,30,Jul,Fri
7/28/2018,2018,3,7,28,6,1,30,Jul,Sat
7/29/2018,2018,3,7,29,7,1,31,Jul,Sun
7/30/2018,2018,3,7,30,1,0,31,Jul,Mon
7/31/2018,2018,3,7,31,2,0,31,Jul,Tue
8/1/2018,2018,3,8,1,3,0,31,Aug,Wed
8/2/2018,2018,3,8,2,4,0,31,Aug,Thu
8/3/2018,2018,3,8,3,5,0,31,Aug,Fri
8/4/2018,2018,3,8,4,6,1,31,Aug,Sat
8/5/2018,2018,3,8,5,7,1,32,Aug,Sun
8/6/2018,2018,3,8,6,1,0,32,Aug,Mon
8/7/2018,2018,3,8,7,2,0,32,Aug,Tue
8/8/2018,2018,3,8,8,3,0,32,Aug,Wed
8/9/2018,2018,3,8,9,4,0,32,Aug,Thu
8/10/2018,2018,3,8,10,5,0,32,Aug,Fri
8/11/2018,2018,3,8,11,6,1,32,Aug,Sat
8/12/2018,2018,3,8,12,7,1,33,Aug,Sun
8/13/2018,2018,3,8,13,1,0,33,Aug,Mon
8/14/2018,2018,3,8,14,2,0,33,Aug,Tue
8/15/2018,2018,3,8,15,3,0,33,Aug,Wed
8/16/2018,2018,3,8,16,4,0,33,Aug,Thu
8/17/2018,2018,3,8,17,5,0,33,Aug,Fri
8/18/2018,2018,3,8,18,6,1,33,Aug,Sat
8/19/2018,2018,3,8,19,7,1,34,Aug,Sun
8/20/2018,2018,3,8,20,1,0,34,Aug,Mon
8/21/2018,2018,3,8,21,2,0,34,Aug,Tue
8/22/2018,2018,3,8,22,3,0,34,Aug,Wed
8/23/2018,2018,3,8,23,4,0,34,Aug,Thu
8/24/2018,2018,3,8,24,5,0,34,Aug,Fri
8/25/2018,2018,3,8,25,6,1,34,Aug,Sat
8/26/2018,2018,3,8,26,7,1,35,Aug,Sun
8/27/2018,2018,3,8,27,1,0,35,Aug,Mon
8/28/2018,2018,3,8,28,2,0,35,Aug,Tue
8/29/2018,2018,3,8,29,3,0,35,Aug,Wed
8/30/2018,2018,3,8,30,4,0,35,Aug,Thu
8/31/2018,2018,3,8,31,5,0,35,Aug,Fri
9/1/2018,2018,3,9,1,6,1,35,Sep,Sat
9/2/2018,2018,3,9,2,7,1,36,Sep,Sun
9/3/2018,2018,3,9,3,1,0,36,Sep,Mon
9/4/2018,2018,3,9,4,2,0,36,Sep,Tue
9/5/2018,2018,3,9,5,3,0,36,Sep,Wed
9/6/2018,2018,3,9,6,4,0,36,Sep,Thu
9/7/2018,2018,3,9,7,5,0,36,Sep,Fri
9/8/2018,2018,3,9,8,6,1,36,Sep,Sat
9/9/2018,2018,3,9,9,7,1,37,Sep,Sun
9/10/2018,2018,3,9,10,1,0,37,Sep,Mon
9/11/2018,2018,3,9,11,2,0,37,Sep,Tue
9/12/2018,2018,3,9,12,3,0,37,Sep,Wed
9/13/2018,2018,3,9,13,4,0,37,Sep,Thu
9/14/2018,2018,3,9,14,5,0,37,Sep,Fri
9/15/2018,2018,3,9,15,6,1,37,Sep,Sat
9/16/2018,2018,3,9,16,7,1,38,Sep,Sun
9/17/2018,2018,3,9,17,1,0,38,Sep,Mon
9/18/2018,2018,3,9,18,2,0,38,Sep,Tue
9/19/2018,2018,3,9,19,3,0,38,Sep,Wed
9/20/2018,2018,3,9,20,4,0,38,Sep,Thu
9/21/2018,2018,3,9,21,5,0,38,Sep,Fri
9/22/2018,2018,3,9,22,6,1,38,Sep,Sat
9/23/2018,2018,3,9,23,7,1,39,Sep,Sun
9/24/2018,2018,3,9,24,1,0,39,Sep,Mon
9/25/2018,2018,3,9,25,2,0,39,Sep,Tue
9/26/2018,2018,3,9,26,3,0,39,Sep,Wed
9/27/2018,2018,3,9,27,4,0,39,Sep,Thu
9/28/2018,2018,3,9,28,5,0,39,Sep,Fri
9/29/2018,2018,3,9,29,6,1,39,Sep,Sat
9/30/2018,2018,3,9,30,7,1,40,Sep,Sun
10/1/2018,2018,4,10,1,1,0,40,Oct,Mon
10/2/2018,2018,4,10,2,2,0,40,Oct,Tue
10/3/2018,2018,4,10,3,3,0,40,Oct,Wed
10/4/2018,2018,4,10,4,4,0,40,Oct,Thu
10/5/2018,2018,4,10,5,5,0,40,Oct,Fri
10/6/2018,2018,4,10,6,6,1,40,Oct,Sat
10/7/2018,2018,4,10,7,7,1,41,Oct,Sun
10/8/2018,2018,4,10,8,1,0,41,Oct,Mon
10/9/2018,2018,4,10,9,2,0,41,Oct,Tue
10/10/2018,2018,4,10,10,3,0,41,Oct,Wed
10/11/2018,2018,4,10,11,4,0,41,Oct,Thu
10/12/2018,2018,4,10,12,5,0,41,Oct,Fri
10/13/2018,2018,4,10,13,6,1,41,Oct,Sat
10/14/2018,2018,4,10,14,7,1,42,Oct,Sun
10/15/2018,2018,4,10,15,1,0,42,Oct,Mon
10/16/2018,2018,4,10,16,2,0,42,Oct,Tue
10/17/2018,2018,4,10,17,3,0,42,Oct,Wed
10/18/2018,2018,4,10,18,4,0,42,Oct,Thu
10/19/2018,2018,4,10,19,5,0,42,Oct,Fri
10/20/2018,2018,4,10,20,6,1,42,Oct,Sat
10/21/2018,2018,4,10,21,7,1,43,Oct,Sun
10/22/2018,2018,4,10,22,1,0,43,Oct,Mon
10/23/2018,2018,4,10,23,2,0,43,Oct,Tue
10/24/2018,2018,4,10,24,3,0,43,Oct,Wed
10/25/2018,2018,4,10,25,4,0,43,Oct,Thu
10/26/2018,2018,4,10,26,5,0,43,Oct,Fri
10/27/2018,2018,4,10,27,6,1,43,Oct,Sat
10/28/2018,2018,4,10,28,7,1,44,Oct,Sun
10/29/2018,2018,4,10,29,1,0,44,Oct,Mon
10/30/2018,2018,4,10,30,2,0,44,Oct,Tue
10/31/2018,2018,4,10,31,3,0,44,Oct,Wed
11/1/2018,2018,4,11,1,4,0,44,Nov,Thu
11/2/2018,2018,4,11,2,5,0,44,Nov,Fri
11/3/2018,2018,4,11,3,6,1,44,Nov,Sat
11/4/2018,2018,4,11,4,7,1,45,Nov,Sun
11/5/2018,2018,4,11,5,1,0,45,Nov,Mon
11/6/2018,2018,4,11,6,2,0,45,Nov,Tue
11/7/2018,2018,4,11,7,3,0,45,Nov,Wed
11/8/2018,2018,4,11,8,4,0,45,Nov,Thu
11/9/2018,2018,4,11,9,5,0,45,Nov,Fri
11/10/2018,2018,4,11,10,6,1,45,Nov,Sat
11/11/2018,2018,4,11,11,7,1,46,Nov,Sun
11/12/2018,2018,4,11,12,1,0,46,Nov,Mon
11/13/2018,2018,4,11,13,2,0,46,Nov,Tue
11/14/2018,2018,4,11,14,3,0,46,Nov,Wed
11/15/2018,2018,4,11,15,4,0,46,Nov,Thu
11/16/2018,2018,4,11,16,5,0,46,Nov,Fri
11/17/2018,2018,4,11,17,6,1,46,Nov,Sat
11/18/2018,2018,4,11,18,7,1,47,Nov,Sun
11/19/2018,2018,4,11,19,1,0,47,Nov,Mon
11/20/2018,2018,4,11,20,2,0,47,Nov,Tue
11/21/2018,2018,4,11,21,3,0,47,Nov,Wed
11/22/2018,2018,4,11,22,4,0,47,Nov,Thu
11/23/2018,2018,4,11,23,5,0,47,Nov,Fri
11/24/2018,2018,4,11,24,6,1,47,Nov,Sat
11/25/2018,2018,4,11,25,7,1,48,Nov,Sun
11/26/2018,2018,4,11,26,1,0,48,Nov,Mon
11/27/2018,2018,4,11,27,2,0,48,Nov,Tue
11/28/2018,2018,4,11,28,3,0,48,Nov,Wed
11/29/2018,2018,4,11,29,4,0,48,Nov,Thu
11/30/2018,2018,4,11,30,5,0,48,Nov,Fri
12/1/2018,2018,4,12,1,6,1,48,Dec,Sat
12/2/2018,2018,4,12,2,7,1,49,Dec,Sun
12/3/2018,2018,4,12,3,1,0,49,Dec,Mon
12/4/2018,2018,4,12,4,2,0,49,Dec,Tue
12/5/2018,2018,4,12,5,3,0,49,Dec,Wed
12/6/2018,2018,4,12,6,4,0,49,Dec,Thu
12/7/2018,2018,4,12,7,5,0,49,Dec,Fri
12/8/2018,2018,4,12,8,6,1,49,Dec,Sat
12/9/2018,2018,4,12,9,7,1,50,Dec,Sun
12/10/2018,2018,4,12,10,1,0,50,Dec,Mon
12/11/2018,2018,4,12,11,2,0,50,Dec,Tue
12/12/2018,2018,4,12,12,3,0,50,Dec,Wed
12/13/2018,2018,4,12,13,4,0,50,Dec,Thu
12/14/2018,2018,4,12,14,5,0,50,Dec,Fri
12/15/2018,2018,4,12,15,6,1,50,Dec,Sat
12/16/2018,2018,4,12,16,7,1,51,Dec,Sun
12/17/2018,2018,4,12,17,1,0,51,Dec,Mon
12/18/2018,2018,4,12,18,2,0,51,Dec,Tue
12/19/2018,2018,4,12,19,3,0,51,Dec,Wed
12/20/2018,2018,4,12,20,4,0,51,Dec,Thu
12/21/2018,2018,4,12,21,5,0,51,Dec,Fri
12/22/2018,2018,4,12,22,6,1,51,Dec,Sat
12/23/2018,2018,4,12,23,7,1,52,Dec,Sun
12/24/2018,2018,4,12,24,1,0,52,Dec,Mon
12/25/2018,2018,4,12,25,2,0,52,Dec,Tue
12/26/2018,2018,4,12,26,3,0,52,Dec,Wed
12/27/2018,2018,4,12,27,4,0,52,Dec,Thu
12/28/2018,2018,4,12,28,5,0,52,Dec,Fri
12/29/2018,2018,4,12,29,6,1,52,Dec,Sat
12/30/2018,2018,4,12,30,7,1,53,Dec,Sun
12/31/2018,2018,4,12,31,1,0,53,Dec,Mon
1/1/2019,2019,1,1,1,2,0,1,Jan,Tue
1/2/2019,2019,1,1,2,3,0,1,Jan,Wed
1/3/2019,2019,1,1,3,4,0,1,Jan,Thu
1/4/2019,2019,1,1,4,5,0,1,Jan,Fri
1/5/2019,2019,1,1,5,6,1,1,Jan,Sat
1/6/2019,2019,1,1,6,7,1,2,Jan,Sun
1/7/2019,2019,1,1,7,1,0,2,Jan,Mon
1/8/2019,2019,1,1,8,2,0,2,Jan,Tue
1/9/2019,2019,1,1,9,3,0,2,Jan,Wed
1/10/2019,2019,1,1,10,4,0,2,Jan,Thu
1/11/2019,2019,1,1,11,5,0,2,Jan,Fri
1/12/2019,2019,1,1,12,6,1,2,Jan,Sat
1/13/2019,2019,1,1,13,7,1,3,Jan,Sun
1/14/2019,2019,1,1,14,1,0,3,Jan,Mon
1/15/2019,2019,1,1,15,2,0,3,Jan,Tue
1/16/2019,2019,1,1,16,3,0,3,Jan,Wed
1/17/2019,2019,1,1,17,4,0,3,Jan,Thu
1/18/2019,2019,1,1,18,5,0,3,Jan,Fri
1/19/2019,2019,1,1,19,6,1,3,Jan,Sat
1/20/2019,2019,1,1,20,7,1,4,Jan,Sun
1/21/2019,2019,1,1,21,1,0,4,Jan,Mon
1/22/2019,2019,1,1,22,2,0,4,Jan,Tue
1/23/2019,2019,1,1,23,3,0,4,Jan,Wed
1/24/2019,2019,1,1,24,4,0,4,Jan,Thu
1/25/2019,2019,1,1,25,5,0,4,Jan,Fri
1/26/2019,2019,1,1,26,6,1,4,Jan,Sat
1/27/2019,2019,1,1,27,7,1,5,Jan,Sun
1/28/2019,2019,1,1,28,1,0,5,Jan,Mon
1/29/2019,2019,1,1,29,2,0,5,Jan,Tue
1/30/2019,2019,1,1,30,3,0,5,Jan,Wed
1/31/2019,2019,1,1,31,4,0,5,Jan,Thu
2/1/2019,2019,1,2,1,5,0,5,Feb,Fri
2/2/2019,2019,1,2,2,6,1,5,Feb,Sat
2/3/2019,2019,1,2,3,7,1,6,Feb,Sun
2/4/2019,2019,1,2,4,1,0,6,Feb,Mon
2/5/2019,2019,1,2,5,2,0,6,Feb,Tue
2/6/2019,2019,1,2,6,3,0,6,Feb,Wed
2/7/2019,2019,1,2,7,4,0,6,Feb,Thu
2/8/2019,2019,1,2,8,5,0,6,Feb,Fri
2/9/2019,2019,1,2,9,6,1,6,Feb,Sat
2/10/2019,2019,1,2,10,7,1,7,Feb,Sun
2/11/2019,2019,1,2,11,1,0,7,Feb,Mon
2/12/2019,2019,1,2,12,2,0,7,Feb,Tue
2/13/2019,2019,1,2,13,3,0,7,Feb,Wed
2/14/2019,2019,1,2,14,4,0,7,Feb,Thu
2/15/2019,2019,1,2,15,5,0,7,Feb,Fri
2/16/2019,2019,1,2,16,6,1,7,Feb,Sat
2/17/2019,2019,1,2,17,7,1,8,Feb,Sun
2/18/2019,2019,1,2,18,1,0,8,Feb,Mon
2/19/2019,2019,1,2,19,2,0,8,Feb,Tue
2/20/2019,2019,1,2,20,3,0,8,Feb,Wed
2/21/2019,2019,1,2,21,4,0,8,Feb,Thu
2/22/2019,2019,1,2,22,5,0,8,Feb,Fri
2/23/2019,2019,1,2,23,6,1,8,Feb,Sat
2/24/2019,2019,1,2,24,7,1,9,Feb,Sun
2/25/2019,2019,1,2,25,1,0,9,Feb,Mon
2/26/2019,2019,1,2,26,2,0,9,Feb,Tue
2/27/2019,2019,1,2,27,3,0,9,Feb,Wed
2/28/2019,2019,1,2,28,4,0,9,Feb,Thu
3/1/2019,2019,1,3,1,5,0,9,Mar,Fri
3/2/2019,2019,1,3,2,6,1,9,Mar,Sat
3/3/2019,2019,1,3,3,7,1,10,Mar,Sun
3/4/2019,2019,1,3,4,1,0,10,Mar,Mon
3/5/2019,2019,1,3,5,2,0,10,Mar,Tue
3/6/2019,2019,1,3,6,3,0,10,Mar,Wed
3/7/2019,2019,1,3,7,4,0,10,Mar,Thu
3/8/2019,2019,1,3,8,5,0,10,Mar,Fri
3/9/2019,2019,1,3,9,6,1,10,Mar,Sat
3/10/2019,2019,1,3,10,7,1,11,Mar,Sun
3/11/2019,2019,1,3,11,1,0,11,Mar,Mon
3/12/2019,2019,1,3,12,2,0,11,Mar,Tue
3/13/2019,2019,1,3,13,3,0,11,Mar,Wed
3/14/2019,2019,1,3,14,4,0,11,Mar,Thu
3/15/2019,2019,1,3,15,5,0,11,Mar,Fri
3/16/2019,2019,1,3,16,6,1,11,Mar,Sat
3/17/2019,2019,1,3,17,7,1,12,Mar,Sun
3/18/2019,2019,1,3,18,1,0,12,Mar,Mon
3/19/2019,2019,1,3,19,2,0,12,Mar,Tue
3/20/2019,2019,1,3,20,3,0,12,Mar,Wed
3/21/2019,2019,1,3,21,4,0,12,Mar,Thu
3/22/2019,2019,1,3,22,5,0,12,Mar,Fri
3/23/2019,2019,1,3,23,6,1,12,Mar,Sat
3/24/2019,2019,1,3,24,7,1,13,Mar,Sun
3/25/2019,2019,1,3,25,1,0,13,Mar,Mon
3/26/2019,2019,1,3,26,2,0,13,Mar,Tue
3/27/2019,2019,1,3,27,3,0,13,Mar,Wed
3/28/2019,2019,1,3,28,4,0,13,Mar,Thu
3/29/2019,2019,1,3,29,5,0,13,Mar,Fri
3/30/2019,2019,1,3,30,6,1,13,Mar,Sat
3/31/2019,2019,1,3,31,7,1,14,Mar,Sun
4/1/2019,2019,2,4,1,1,0,14,Apr,Mon
4/2/2019,2019,2,4,2,2,0,14,Apr,Tue
4/3/2019,2019,2,4,3,3,0,14,Apr,Wed
4/4/2019,2019,2,4,4,4,0,14,Apr,Thu
4/5/2019,2019,2,4,5,5,0,14,Apr,Fri
4/6/2019,2019,2,4,6,6,1,14,Apr,Sat
4/7/2019,2019,2,4,7,7,1,15,Apr,Sun
4/8/2019,2019,2,4,8,1,0,15,Apr,Mon
4/9/2019,2019,2,4,9,2,0,15,Apr,Tue
4/10/2019,2019,2,4,10,3,0,15,Apr,Wed
4/11/2019,2019,2,4,11,4,0,15,Apr,Thu
4/12/2019,2019,2,4,12,5,0,15,Apr,Fri
4/13/2019,2019,2,4,13,6,1,15,Apr,Sat
4/14/2019,2019,2,4,14,7,1,16,Apr,Sun
4/15/2019,2019,2,4,15,1,0,16,Apr,Mon
4/16/2019,2019,2,4,16,2,0,16,Apr,Tue
4/17/2019,2019,2,4,17,3,0,16,Apr,Wed
4/18/2019,2019,2,4,18,4,0,16,Apr,Thu
4/19/2019,2019,2,4,19,5,0,16,Apr,Fri
4/20/2019,2019,2,4,20,6,1,16,Apr,Sat
4/21/2019,2019,2,4,21,7,1,17,Apr,Sun
4/22/2019,2019,2,4,22,1,0,17,Apr,Mon
4/23/2019,2019,2,4,23,2,0,17,Apr,Tue
4/24/2019,2019,2,4,24,3,0,17,Apr,Wed
4/25/2019,2019,2,4,25,4,0,17,Apr,Thu
4/26/2019,2019,2,4,26,5,0,17,Apr,Fri
4/27/2019,2019,2,4,27,6,1,17,Apr,Sat
4/28/2019,2019,2,4,28,7,1,18,Apr,Sun
4/29/2019,2019,2,4,29,1,0,18,Apr,Mon
4/30/2019,2019,2,4,30,2,0,18,Apr,Tue
5/1/2019,2019,2,5,1,3,0,18,May,Wed
5/2/2019,2019,2,5,2,4,0,18,May,Thu
5/3/2019,2019,2,5,3,5,0,18,May,Fri
5/4/2019,2019,2,5,4,6,1,18,May,Sat
5/5/2019,2019,2,5,5,7,1,19,May,Sun
5/6/2019,2019,2,5,6,1,0,19,May,Mon
5/7/2019,2019,2,5,7,2,0,19,May,Tue
5/8/2019,2019,2,5,8,3,0,19,May,Wed
5/9/2019,2019,2,5,9,4,0,19,May,Thu
5/10/2019,2019,2,5,10,5,0,19,May,Fri
5/11/2019,2019,2,5,11,6,1,19,May,Sat
5/12/2019,2019,2,5,12,7,1,20,May,Sun
5/13/2019,2019,2,5,13,1,0,20,May,Mon
5/14/2019,2019,2,5,14,2,0,20,May,Tue
5/15/2019,2019,2,5,15,3,0,20,May,Wed
5/16/2019,2019,2,5,16,4,0,20,May,Thu
5/17/2019,2019,2,5,17,5,0,20,May,Fri
5/18/2019,2019,2,5,18,6,1,20,May,Sat
5/19/2019,2019,2,5,19,7,1,21,May,Sun
5/20/2019,2019,2,5,20,1,0,21,May,Mon
5/21/2019,2019,2,5,21,2,0,21,May,Tue
5/22/2019,2019,2,5,22,3,0,21,May,Wed
5/23/2019,2019,2,5,23,4,0,21,May,Thu
5/24/2019,2019,2,5,24,5,0,21,May,Fri
5/25/2019,2019,2,5,25,6,1,21,May,Sat
5/26/2019,2019,2,5,26,7,1,22,May,Sun
5/27/2019,2019,2,5,27,1,0,22,May,Mon
5/28/2019,2019,2,5,28,2,0,22,May,Tue
5/29/2019,2019,2,5,29,3,0,22,May,Wed
5/30/2019,2019,2,5,30,4,0,22,May,Thu
5/31/2019,2019,2,5,31,5,0,22,May,Fri
6/1/2019,2019,2,6,1,6,1,22,Jun,Sat
6/2/2019,2019,2,6,2,7,1,23,Jun,Sun
6/3/2019,2019,2,6,3,1,0,23,Jun,Mon
6/4/2019,2019,2,6,4,2,0,23,Jun,Tue
6/5/2019,2019,2,6,5,3,0,23,Jun,Wed
6/6/2019,2019,2,6,6,4,0,23,Jun,Thu
6/7/2019,2019,2,6,7,5,0,23,Jun,Fri
6/8/2019,2019,2,6,8,6,1,23,Jun,Sat
6/9/2019,2019,2,6,9,7,1,24,Jun,Sun
6/10/2019,2019,2,6,10,1,0,24,Jun,Mon
6/11/2019,2019,2,6,11,2,0,24,Jun,Tue
6/12/2019,2019,2,6,12,3,0,24,Jun,Wed
6/13/2019,2019,2,6,13,4,0,24,Jun,Thu
6/14/2019,2019,2,6,14,5,0,24,Jun,Fri
6/15/2019,2019,2,6,15,6,1,24,Jun,Sat
6/16/2019,2019,2,6,16,7,1,25,Jun,Sun
6/17/2019,2019,2,6,17,1,0,25,Jun,Mon
6/18/2019,2019,2,6,18,2,0,25,Jun,Tue
6/19/2019,2019,2,6,19,3,0,25,Jun,Wed
6/20/2019,2019,2,6,20,4,0,25,Jun,Thu
6/21/2019,2019,2,6,21,5,0,25,Jun,Fri
6/22/2019,2019,2,6,22,6,1,25,Jun,Sat
6/23/2019,2019,2,6,23,7,1,26,Jun,Sun
6/24/2019,2019,2,6,24,1,0,26,Jun,Mon
6/25/2019,2019,2,6,25,2,0,26,Jun,Tue
6/26/2019,2019,2,6,26,3,0,26,Jun,Wed
6/27/2019,2019,2,6,27,4,0,26,Jun,Thu
6/28/2019,2019,2,6,28,5,0,26,Jun,Fri
6/29/2019,2019,2,6,29,6,1,26,Jun,Sat
6/30/2019,2019,2,6,30,7,1,27,Jun,Sun
7/1/2019,2019,3,7,1,1,0,27,Jul,Mon
7/2/2019,2019,3,7,2,2,0,27,Jul,Tue
7/3/2019,2019,3,7,3,3,0,27,Jul,Wed
7/4/2019,2019,3,7,4,4,0,27,Jul,Thu
7/5/2019,2019,3,7,5,5,0,27,Jul,Fri
7/6/2019,2019,3,7,6,6,1,27,Jul,Sat
7/7/2019,2019,3,7,7,7,1,28,Jul,Sun
7/8/2019,2019,3,7,8,1,0,28,Jul,Mon
7/9/2019,2019,3,7,9,2,0,28,Jul,Tue
7/10/2019,2019,3,7,10,3,0,28,Jul,Wed
7/11/2019,2019,3,7,11,4,0,28,Jul,Thu
7/12/2019,2019,3,7,12,5,0,28,Jul,Fri
7/13/2019,2019,3,7,13,6,1,28,Jul,Sat
7/14/2019,2019,3,7,14,7,1,29,Jul,Sun
7/15/2019,2019,3,7,15,1,0,29,Jul,Mon
7/16/2019,2019,3,7,16,2,0,29,Jul,Tue
7/17/2019,2019,3,7,17,3,0,29,Jul,Wed
7/18/2019,2019,3,7,18,4,0,29,Jul,Thu
7/19/2019,2019,3,7,19,5,0,29,Jul,Fri
7/20/2019,2019,3,7,20,6,1,29,Jul,Sat
7/21/2019,2019,3,7,21,7,1,30,Jul,Sun
7/22/2019,2019,3,7,22,1,0,30,Jul,Mon
7/23/2019,2019,3,7,23,2,0,30,Jul,Tue
7/24/2019,2019,3,7,24,3,0,30,Jul,Wed
7/25/2019,2019,3,7,25,4,0,30,Jul,Thu
7/26/2019,2019,3,7,26,5,0,30,Jul,Fri
7/27/2019,2019,3,7,27,6,1,30,Jul,Sat
7/28/2019,2019,3,7,28,7,1,31,Jul,Sun
7/29/2019,2019,3,7,29,1,0,31,Jul,Mon
7/30/2019,2019,3,7,30,2,0,31,Jul,Tue
7/31/2019,2019,3,7,31,3,0,31,Jul,Wed
8/1/2019,2019,3,8,1,4,0,31,Aug,Thu
8/2/2019,2019,3,8,2,5,0,31,Aug,Fri
8/3/2019,2019,3,8,3,6,1,31,Aug,Sat
8/4/2019,2019,3,8,4,7,1,32,Aug,Sun
8/5/2019,2019,3,8,5,1,0,32,Aug,Mon
8/6/2019,2019,3,8,6,2,0,32,Aug,Tue
8/7/2019,2019,3,8,7,3,0,32,Aug,Wed
8/8/2019,2019,3,8,8,4,0,32,Aug,Thu
8/9/2019,2019,3,8,9,5,0,32,Aug,Fri
8/10/2019,2019,3,8,10,6,1,32,Aug,Sat
8/11/2019,2019,3,8,11,7,1,33,Aug,Sun
8/12/2019,2019,3,8,12,1,0,33,Aug,Mon
8/13/2019,2019,3,8,13,2,0,33,Aug,Tue
8/14/2019,2019,3,8,14,3,0,33,Aug,Wed
8/15/2019,2019,3,8,15,4,0,33,Aug,Thu
8/16/2019,2019,3,8,16,5,0,33,Aug,Fri
8/17/2019,2019,3,8,17,6,1,33,Aug,Sat
8/18/2019,2019,3,8,18,7,1,34,Aug,Sun
8/19/2019,2019,3,8,19,1,0,34,Aug,Mon
8/20/2019,2019,3,8,20,2,0,34,Aug,Tue
8/21/2019,2019,3,8,21,3,0,34,Aug,Wed
8/22/2019,2019,3,8,22,4,0,34,Aug,Thu
8/23/2019,2019,3,8,23,5,0,34,Aug,Fri
8/24/2019,2019,3,8,24,6,1,34,Aug,Sat
8/25/2019,2019,3,8,25,7,1,35,Aug,Sun
8/26/2019,2019,3,8,26,1,0,35,Aug,Mon
8/27/2019,2019,3,8,27,2,0,35,Aug,Tue
8/28/2019,2019,3,8,28,3,0,35,Aug,Wed
8/29/2019,2019,3,8,29,4,0,35,Aug,Thu
8/30/2019,2019,3,8,30,5,0,35,Aug,Fri
8/31/2019,2019,3,8,31,6,1,35,Aug,Sat
9/1/2019,2019,3,9,1,7,1,36,Sep,Sun
9/2/2019,2019,3,9,2,1,0,36,Sep,Mon
9/3/2019,2019,3,9,3,2,0,36,Sep,Tue
9/4/2019,2019,3,9,4,3,0,36,Sep,Wed
9/5/2019,2019,3,9,5,4,0,36,Sep,Thu
9/6/2019,2019,3,9,6,5,0,36,Sep,Fri
9/7/2019,2019,3,9,7,6,1,36,Sep,Sat
9/8/2019,2019,3,9,8,7,1,37,Sep,Sun
9/9/2019,2019,3,9,9,1,0,37,Sep,Mon
9/10/2019,2019,3,9,10,2,0,37,Sep,Tue
9/11/2019,2019,3,9,11,3,0,37,Sep,Wed
9/12/2019,2019,3,9,12,4,0,37,Sep,Thu
9/13/2019,2019,3,9,13,5,0,37,Sep,Fri
9/14/2019,2019,3,9,14,6,1,37,Sep,Sat
9/15/2019,2019,3,9,15,7,1,38,Sep,Sun
9/16/2019,2019,3,9,16,1,0,38,Sep,Mon
9/17/2019,2019,3,9,17,2,0,38,Sep,Tue
9/18/2019,2019,3,9,18,3,0,38,Sep,Wed
9/19/2019,2019,3,9,19,4,0,38,Sep,Thu
9/20/2019,2019,3,9,20,5,0,38,Sep,Fri
9/21/2019,2019,3,9,21,6,1,38,Sep,Sat
9/22/2019,2019,3,9,22,7,1,39,Sep,Sun
9/23/2019,2019,3,9,23,1,0,39,Sep,Mon
9/24/2019,2019,3,9,24,2,0,39,Sep,Tue
9/25/2019,2019,3,9,25,3,0,39,Sep,Wed
9/26/2019,2019,3,9,26,4,0,39,Sep,Thu
9/27/2019,2019,3,9,27,5,0,39,Sep,Fri
9/28/2019,2019,3,9,28,6,1,39,Sep,Sat
9/29/2019,2019,3,9,29,7,1,40,Sep,Sun
9/30/2019,2019,3,9,30,1,0,40,Sep,Mon
10/1/2019,2019,4,10,1,2,0,40,Oct,Tue
10/2/2019,2019,4,10,2,3,0,40,Oct,Wed
10/3/2019,2019,4,10,3,4,0,40,Oct,Thu
10/4/2019,2019,4,10,4,5,0,40,Oct,Fri
10/5/2019,2019,4,10,5,6,1,40,Oct,Sat
10/6/2019,2019,4,10,6,7,1,41,Oct,Sun
10/7/2019,2019,4,10,7,1,0,41,Oct,Mon
10/8/2019,2019,4,10,8,2,0,41,Oct,Tue
10/9/2019,2019,4,10,9,3,0,41,Oct,Wed
10/10/2019,2019,4,10,10,4,0,41,Oct,Thu
10/11/2019,2019,4,10,11,5,0,41,Oct,Fri
10/12/2019,2019,4,10,12,6,1,41,Oct,Sat
10/13/2019,2019,4,10,13,7,1,42,Oct,Sun
10/14/2019,2019,4,10,14,1,0,42,Oct,Mon
10/15/2019,2019,4,10,15,2,0,42,Oct,Tue
10/16/2019,2019,4,10,16,3,0,42,Oct,Wed
10/17/2019,2019,4,10,17,4,0,42,Oct,Thu
10/18/2019,2019,4,10,18,5,0,42,Oct,Fri
10/19/2019,2019,4,10,19,6,1,42,Oct,Sat
10/20/2019,2019,4,10,20,7,1,43,Oct,Sun
10/21/2019,2019,4,10,21,1,0,43,Oct,Mon
10/22/2019,2019,4,10,22,2,0,43,Oct,Tue
10/23/2019,2019,4,10,23,3,0,43,Oct,Wed
10/24/2019,2019,4,10,24,4,0,43,Oct,Thu
10/25/2019,2019,4,10,25,5,0,43,Oct,Fri
10/26/2019,2019,4,10,26,6,1,43,Oct,Sat
10/27/2019,2019,4,10,27,7,1,44,Oct,Sun
10/28/2019,2019,4,10,28,1,0,44,Oct,Mon
10/29/2019,2019,4,10,29,2,0,44,Oct,Tue
10/30/2019,2019,4,10,30,3,0,44,Oct,Wed
10/31/2019,2019,4,10,31,4,0,44,Oct,Thu
11/1/2019,2019,4,11,1,5,0,44,Nov,Fri
11/2/2019,2019,4,11,2,6,1,44,Nov,Sat
11/3/2019,2019,4,11,3,7,1,45,Nov,Sun
11/4/2019,2019,4,11,4,1,0,45,Nov,Mon
11/5/2019,2019,4,11,5,2,0,45,Nov,Tue
11/6/2019,2019,4,11,6,3,0,45,Nov,Wed
11/7/2019,2019,4,11,7,4,0,45,Nov,Thu
11/8/2019,2019,4,11,8,5,0,45,Nov,Fri
11/9/2019,2019,4,11,9,6,1,45,Nov,Sat
11/10/2019,2019,4,11,10,7,1,46,Nov,Sun
11/11/2019,2019,4,11,11,1,0,46,Nov,Mon
11/12/2019,2019,4,11,12,2,0,46,Nov,Tue
11/13/2019,2019,4,11,13,3,0,46,Nov,Wed
11/14/2019,2019,4,11,14,4,0,46,Nov,Thu
11/15/2019,2019,4,11,15,5,0,46,Nov,Fri
11/16/2019,2019,4,11,16,6,1,46,Nov,Sat
11/17/2019,2019,4,11,17,7,1,47,Nov,Sun
11/18/2019,2019,4,11,18,1,0,47,Nov,Mon
11/19/2019,2019,4,11,19,2,0,47,Nov,Tue
11/20/2019,2019,4,11,20,3,0,47,Nov,Wed
11/21/2019,2019,4,11,21,4,0,47,Nov,Thu
11/22/2019,2019,4,11,22,5,0,47,Nov,Fri
11/23/2019,2019,4,11,23,6,1,47,Nov,Sat
11/24/2019,2019,4,11,24,7,1,48,Nov,Sun
11/25/2019,2019,4,11,25,1,0,48,Nov,Mon
11/26/2019,2019,4,11,26,2,0,48,Nov,Tue
11/27/2019,2019,4,11,27,3,0,48,Nov,Wed
11/28/2019,2019,4,11,28,4,0,48,Nov,Thu
11/29/2019,2019,4,11,29,5,0,48,Nov,Fri
11/30/2019,2019,4,11,30,6,1,48,Nov,Sat
12/1/2019,2019,4,12,1,7,1,49,Dec,Sun
12/2/2019,2019,4,12,2,1,0,49,Dec,Mon
12/3/2019,2019,4,12,3,2,0,49,Dec,Tue
12/4/2019,2019,4,12,4,3,0,49,Dec,Wed
12/5/2019,2019,4,12,5,4,0,49,Dec,Thu
12/6/2019,2019,4,12,6,5,0,49,Dec,Fri
12/7/2019,2019,4,12,7,6,1,49,Dec,Sat
12/8/2019,2019,4,12,8,7,1,50,Dec,Sun
12/9/2019,2019,4,12,9,1,0,50,Dec,Mon
12/10/2019,2019,4,12,10,2,0,50,Dec,Tue
12/11/2019,2019,4,12,11,3,0,50,Dec,Wed
12/12/2019,2019,4,12,12,4,0,50,Dec,Thu
12/13/2019,2019,4,12,13,5,0,50,Dec,Fri
12/14/2019,2019,4,12,14,6,1,50,Dec,Sat
12/15/2019,2019,4,12,15,7,1,51,Dec,Sun
12/16/2019,2019,4,12,16,1,0,51,Dec,Mon
12/17/2019,2019,4,12,17,2,0,51,Dec,Tue
12/18/2019,2019,4,12,18,3,0,51,Dec,Wed
12/19/2019,2019,4,12,19,4,0,51,Dec,Thu
12/20/2019,2019,4,12,20,5,0,51,Dec,Fri
12/21/2019,2019,4,12,21,6,1,51,Dec,Sat
12/22/2019,2019,4,12,22,7,1,52,Dec,Sun
12/23/2019,2019,4,12,23,1,0,52,Dec,Mon
12/24/2019,2019,4,12,24,2,0,52,Dec,Tue
12/25/2019,2019,4,12,25,3,0,52,Dec,Wed
12/26/2019,2019,4,12,26,4,0,52,Dec,Thu
12/27/2019,2019,4,12,27,5,0,52,Dec,Fri
12/28/2019,2019,4,12,28,6,1,52,Dec,Sat
12/29/2019,2019,4,12,29,7,1,53,Dec,Sun
12/30/2019,2019,4,12,30,1,0,53,Dec,Mon
12/31/2019,2019,4,12,31,2,0,53,Dec,Tue
1/1/2020,2020,1,1,1,3,0,1,Jan,Wed
1/2/2020,2020,1,1,2,4,0,1,Jan,Thu
1/3/2020,2020,1,1,3,5,0,1,Jan,Fri
1/4/2020,2020,1,1,4,6,1,1,Jan,Sat
1/5/2020,2020,1,1,5,7,1,2,Jan,Sun
1/6/2020,2020,1,1,6,1,0,2,Jan,Mon
1/7/2020,2020,1,1,7,2,0,2,Jan,Tue
1/8/2020,2020,1,1,8,3,0,2,Jan,Wed
1/9/2020,2020,1,1,9,4,0,2,Jan,Thu
1/10/2020,2020,1,1,10,5,0,2,Jan,Fri
1/11/2020,2020,1,1,11,6,1,2,Jan,Sat
1/12/2020,2020,1,1,12,7,1,3,Jan,Sun
1/13/2020,2020,1,1,13,1,0,3,Jan,Mon
1/14/2020,2020,1,1,14,2,0,3,Jan,Tue
1/15/2020,2020,1,1,15,3,0,3,Jan,Wed
1/16/2020,2020,1,1,16,4,0,3,Jan,Thu
1/17/2020,2020,1,1,17,5,0,3,Jan,Fri
1/18/2020,2020,1,1,18,6,1,3,Jan,Sat
1/19/2020,2020,1,1,19,7,1,4,Jan,Sun
1/20/2020,2020,1,1,20,1,0,4,Jan,Mon
1/21/2020,2020,1,1,21,2,0,4,Jan,Tue
1/22/2020,2020,1,1,22,3,0,4,Jan,Wed
1/23/2020,2020,1,1,23,4,0,4,Jan,Thu
1/24/2020,2020,1,1,24,5,0,4,Jan,Fri
1/25/2020,2020,1,1,25,6,1,4,Jan,Sat
1/26/2020,2020,1,1,26,7,1,5,Jan,Sun
1/27/2020,2020,1,1,27,1,0,5,Jan,Mon
1/28/2020,2020,1,1,28,2,0,5,Jan,Tue
1/29/2020,2020,1,1,29,3,0,5,Jan,Wed
1/30/2020,2020,1,1,30,4,0,5,Jan,Thu
1/31/2020,2020,1,1,31,5,0,5,Jan,Fri
2/1/2020,2020,1,2,1,6,1,5,Feb,Sat
2/2/2020,2020,1,2,2,7,1,6,Feb,Sun
2/3/2020,2020,1,2,3,1,0,6,Feb,Mon
2/4/2020,2020,1,2,4,2,0,6,Feb,Tue
2/5/2020,2020,1,2,5,3,0,6,Feb,Wed
2/6/2020,2020,1,2,6,4,0,6,Feb,Thu
2/7/2020,2020,1,2,7,5,0,6,Feb,Fri
2/8/2020,2020,1,2,8,6,1,6,Feb,Sat
2/9/2020,2020,1,2,9,7,1,7,Feb,Sun
2/10/2020,2020,1,2,10,1,0,7,Feb,Mon
2/11/2020,2020,1,2,11,2,0,7,Feb,Tue
2/12/2020,2020,1,2,12,3,0,7,Feb,Wed
2/13/2020,2020,1,2,13,4,0,7,Feb,Thu
2/14/2020,2020,1,2,14,5,0,7,Feb,Fri
2/15/2020,2020,1,2,15,6,1,7,Feb,Sat
2/16/2020,2020,1,2,16,7,1,8,Feb,Sun
2/17/2020,2020,1,2,17,1,0,8,Feb,Mon
2/18/2020,2020,1,2,18,2,0,8,Feb,Tue
2/19/2020,2020,1,2,19,3,0,8,Feb,Wed
2/20/2020,2020,1,2,20,4,0,8,Feb,Thu
2/21/2020,2020,1,2,21,5,0,8,Feb,Fri
2/22/2020,2020,1,2,22,6,1,8,Feb,Sat
2/23/2020,2020,1,2,23,7,1,9,Feb,Sun
2/24/2020,2020,1,2,24,1,0,9,Feb,Mon
2/25/2020,2020,1,2,25,2,0,9,Feb,Tue
2/26/2020,2020,1,2,26,3,0,9,Feb,Wed
2/27/2020,2020,1,2,27,4,0,9,Feb,Thu
2/28/2020,2020,1,2,28,5,0,9,Feb,Fri
2/29/2020,2020,1,2,29,6,1,9,Feb,Sat
3/1/2020,2020,1,3,1,7,1,10,Mar,Sun
3/2/2020,2020,1,3,2,1,0,10,Mar,Mon
3/3/2020,2020,1,3,3,2,0,10,Mar,Tue
3/4/2020,2020,1,3,4,3,0,10,Mar,Wed
3/5/2020,2020,1,3,5,4,0,10,Mar,Thu
3/6/2020,2020,1,3,6,5,0,10,Mar,Fri
3/7/2020,2020,1,3,7,6,1,10,Mar,Sat
3/8/2020,2020,1,3,8,7,1,11,Mar,Sun
3/9/2020,2020,1,3,9,1,0,11,Mar,Mon
3/10/2020,2020,1,3,10,2,0,11,Mar,Tue
3/11/2020,2020,1,3,11,3,0,11,Mar,Wed
3/12/2020,2020,1,3,12,4,0,11,Mar,Thu
3/13/2020,2020,1,3,13,5,0,11,Mar,Fri
3/14/2020,2020,1,3,14,6,1,11,Mar,Sat
3/15/2020,2020,1,3,15,7,1,12,Mar,Sun
3/16/2020,2020,1,3,16,1,0,12,Mar,Mon
3/17/2020,2020,1,3,17,2,0,12,Mar,Tue
3/18/2020,2020,1,3,18,3,0,12,Mar,Wed
3/19/2020,2020,1,3,19,4,0,12,Mar,Thu
3/20/2020,2020,1,3,20,5,0,12,Mar,Fri
3/21/2020,2020,1,3,21,6,1,12,Mar,Sat
3/22/2020,2020,1,3,22,7,1,13,Mar,Sun
3/23/2020,2020,1,3,23,1,0,13,Mar,Mon
3/24/2020,2020,1,3,24,2,0,13,Mar,Tue
3/25/2020,2020,1,3,25,3,0,13,Mar,Wed
3/26/2020,2020,1,3,26,4,0,13,Mar,Thu
3/27/2020,2020,1,3,27,5,0,13,Mar,Fri
3/28/2020,2020,1,3,28,6,1,13,Mar,Sat
3/29/2020,2020,1,3,29,7,1,14,Mar,Sun
3/30/2020,2020,1,3,30,1,0,14,Mar,Mon
3/31/2020,2020,1,3,31,2,0,14,Mar,Tue
4/1/2020,2020,2,4,1,3,0,14,Apr,Wed
4/2/2020,2020,2,4,2,4,0,14,Apr,Thu
4/3/2020,2020,2,4,3,5,0,14,Apr,Fri
4/4/2020,2020,2,4,4,6,1,14,Apr,Sat
4/5/2020,2020,2,4,5,7,1,15,Apr,Sun
4/6/2020,2020,2,4,6,1,0,15,Apr,Mon
4/7/2020,2020,2,4,7,2,0,15,Apr,Tue
4/8/2020,2020,2,4,8,3,0,15,Apr,Wed
4/9/2020,2020,2,4,9,4,0,15,Apr,Thu
4/10/2020,2020,2,4,10,5,0,15,Apr,Fri
4/11/2020,2020,2,4,11,6,1,15,Apr,Sat
4/12/2020,2020,2,4,12,7,1,16,Apr,Sun
4/13/2020,2020,2,4,13,1,0,16,Apr,Mon
4/14/2020,2020,2,4,14,2,0,16,Apr,Tue
4/15/2020,2020,2,4,15,3,0,16,Apr,Wed
4/16/2020,2020,2,4,16,4,0,16,Apr,Thu
4/17/2020,2020,2,4,17,5,0,16,Apr,Fri
4/18/2020,2020,2,4,18,6,1,16,Apr,Sat
4/19/2020,2020,2,4,19,7,1,17,Apr,Sun
4/20/2020,2020,2,4,20,1,0,17,Apr,Mon
4/21/2020,2020,2,4,21,2,0,17,Apr,Tue
4/22/2020,2020,2,4,22,3,0,17,Apr,Wed
4/23/2020,2020,2,4,23,4,0,17,Apr,Thu
4/24/2020,2020,2,4,24,5,0,17,Apr,Fri
4/25/2020,2020,2,4,25,6,1,17,Apr,Sat
4/26/2020,2020,2,4,26,7,1,18,Apr,Sun
4/27/2020,2020,2,4,27,1,0,18,Apr,Mon
4/28/2020,2020,2,4,28,2,0,18,Apr,Tue
4/29/2020,2020,2,4,29,3,0,18,Apr,Wed
4/30/2020,2020,2,4,30,4,0,18,Apr,Thu
5/1/2020,2020,2,5,1,5,0,18,May,Fri
5/2/2020,2020,2,5,2,6,1,18,May,Sat
5/3/2020,2020,2,5,3,7,1,19,May,Sun
5/4/2020,2020,2,5,4,1,0,19,May,Mon
5/5/2020,2020,2,5,5,2,0,19,May,Tue
5/6/2020,2020,2,5,6,3,0,19,May,Wed
5/7/2020,2020,2,5,7,4,0,19,May,Thu
5/8/2020,2020,2,5,8,5,0,19,May,Fri
5/9/2020,2020,2,5,9,6,1,19,May,Sat
5/10/2020,2020,2,5,10,7,1,20,May,Sun
5/11/2020,2020,2,5,11,1,0,20,May,Mon
5/12/2020,2020,2,5,12,2,0,20,May,Tue
5/13/2020,2020,2,5,13,3,0,20,May,Wed
5/14/2020,2020,2,5,14,4,0,20,May,Thu
5/15/2020,2020,2,5,15,5,0,20,May,Fri
5/16/2020,2020,2,5,16,6,1,20,May,Sat
5/17/2020,2020,2,5,17,7,1,21,May,Sun
5/18/2020,2020,2,5,18,1,0,21,May,Mon
5/19/2020,2020,2,5,19,2,0,21,May,Tue
5/20/2020,2020,2,5,20,3,0,21,May,Wed
5/21/2020,2020,2,5,21,4,0,21,May,Thu
5/22/2020,2020,2,5,22,5,0,21,May,Fri
5/23/2020,2020,2,5,23,6,1,21,May,Sat
5/24/2020,2020,2,5,24,7,1,22,May,Sun
5/25/2020,2020,2,5,25,1,0,22,May,Mon
5/26/2020,2020,2,5,26,2,0,22,May,Tue
5/27/2020,2020,2,5,27,3,0,22,May,Wed
5/28/2020,2020,2,5,28,4,0,22,May,Thu
5/29/2020,2020,2,5,29,5,0,22,May,Fri
5/30/2020,2020,2,5,30,6,1,22,May,Sat
5/31/2020,2020,2,5,31,7,1,23,May,Sun
6/1/2020,2020,2,6,1,1,0,23,Jun,Mon
6/2/2020,2020,2,6,2,2,0,23,Jun,Tue
6/3/2020,2020,2,6,3,3,0,23,Jun,Wed
6/4/2020,2020,2,6,4,4,0,23,Jun,Thu
6/5/2020,2020,2,6,5,5,0,23,Jun,Fri
6/6/2020,2020,2,6,6,6,1,23,Jun,Sat
6/7/2020,2020,2,6,7,7,1,24,Jun,Sun
6/8/2020,2020,2,6,8,1,0,24,Jun,Mon
6/9/2020,2020,2,6,9,2,0,24,Jun,Tue
6/10/2020,2020,2,6,10,3,0,24,Jun,Wed
6/11/2020,2020,2,6,11,4,0,24,Jun,Thu
6/12/2020,2020,2,6,12,5,0,24,Jun,Fri
6/13/2020,2020,2,6,13,6,1,24,Jun,Sat
6/14/2020,2020,2,6,14,7,1,25,Jun,Sun
6/15/2020,2020,2,6,15,1,0,25,Jun,Mon
6/16/2020,2020,2,6,16,2,0,25,Jun,Tue
6/17/2020,2020,2,6,17,3,0,25,Jun,Wed
6/18/2020,2020,2,6,18,4,0,25,Jun,Thu
6/19/2020,2020,2,6,19,5,0,25,Jun,Fri
6/20/2020,2020,2,6,20,6,1,25,Jun,Sat
6/21/2020,2020,2,6,21,7,1,26,Jun,Sun
6/22/2020,2020,2,6,22,1,0,26,Jun,Mon
6/23/2020,2020,2,6,23,2,0,26,Jun,Tue
6/24/2020,2020,2,6,24,3,0,26,Jun,Wed
6/25/2020,2020,2,6,25,4,0,26,Jun,Thu
6/26/2020,2020,2,6,26,5,0,26,Jun,Fri
6/27/2020,2020,2,6,27,6,1,26,Jun,Sat
6/28/2020,2020,2,6,28,7,1,27,Jun,Sun
6/29/2020,2020,2,6,29,1,0,27,Jun,Mon
6/30/2020,2020,2,6,30,2,0,27,Jun,Tue
7/1/2020,2020,3,7,1,3,0,27,Jul,Wed
7/2/2020,2020,3,7,2,4,0,27,Jul,Thu
7/3/2020,2020,3,7,3,5,0,27,Jul,Fri
7/4/2020,2020,3,7,4,6,1,27,Jul,Sat
7/5/2020,2020,3,7,5,7,1,28,Jul,Sun
7/6/2020,2020,3,7,6,1,0,28,Jul,Mon
7/7/2020,2020,3,7,7,2,0,28,Jul,Tue
7/8/2020,2020,3,7,8,3,0,28,Jul,Wed
7/9/2020,2020,3,7,9,4,0,28,Jul,Thu
7/10/2020,2020,3,7,10,5,0,28,Jul,Fri
7/11/2020,2020,3,7,11,6,1,28,Jul,Sat
7/12/2020,2020,3,7,12,7,1,29,Jul,Sun
7/13/2020,2020,3,7,13,1,0,29,Jul,Mon
7/14/2020,2020,3,7,14,2,0,29,Jul,Tue
7/15/2020,2020,3,7,15,3,0,29,Jul,Wed
7/16/2020,2020,3,7,16,4,0,29,Jul,Thu
7/17/2020,2020,3,7,17,5,0,29,Jul,Fri
7/18/2020,2020,3,7,18,6,1,29,Jul,Sat
7/19/2020,2020,3,7,19,7,1,30,Jul,Sun
7/20/2020,2020,3,7,20,1,0,30,Jul,Mon
7/21/2020,2020,3,7,21,2,0,30,Jul,Tue
7/22/2020,2020,3,7,22,3,0,30,Jul,Wed
7/23/2020,2020,3,7,23,4,0,30,Jul,Thu
7/24/2020,2020,3,7,24,5,0,30,Jul,Fri
7/25/2020,2020,3,7,25,6,1,30,Jul,Sat
7/26/2020,2020,3,7,26,7,1,31,Jul,Sun
7/27/2020,2020,3,7,27,1,0,31,Jul,Mon
7/28/2020,2020,3,7,28,2,0,31,Jul,Tue
7/29/2020,2020,3,7,29,3,0,31,Jul,Wed
7/30/2020,2020,3,7,30,4,0,31,Jul,Thu
7/31/2020,2020,3,7,31,5,0,31,Jul,Fri
8/1/2020,2020,3,8,1,6,1,31,Aug,Sat
8/2/2020,2020,3,8,2,7,1,32,Aug,Sun
8/3/2020,2020,3,8,3,1,0,32,Aug,Mon
8/4/2020,2020,3,8,4,2,0,32,Aug,Tue
8/5/2020,2020,3,8,5,3,0,32,Aug,Wed
8/6/2020,2020,3,8,6,4,0,32,Aug,Thu
8/7/2020,2020,3,8,7,5,0,32,Aug,Fri
8/8/2020,2020,3,8,8,6,1,32,Aug,Sat
8/9/2020,2020,3,8,9,7,1,33,Aug,Sun
8/10/2020,2020,3,8,10,1,0,33,Aug,Mon
8/11/2020,2020,3,8,11,2,0,33,Aug,Tue
8/12/2020,2020,3,8,12,3,0,33,Aug,Wed
8/13/2020,2020,3,8,13,4,0,33,Aug,Thu
8/14/2020,2020,3,8,14,5,0,33,Aug,Fri
8/15/2020,2020,3,8,15,6,1,33,Aug,Sat
8/16/2020,2020,3,8,16,7,1,34,Aug,Sun
8/17/2020,2020,3,8,17,1,0,34,Aug,Mon
8/18/2020,2020,3,8,18,2,0,34,Aug,Tue
8/19/2020,2020,3,8,19,3,0,34,Aug,Wed
8/20/2020,2020,3,8,20,4,0,34,Aug,Thu
8/21/2020,2020,3,8,21,5,0,34,Aug,Fri
8/22/2020,2020,3,8,22,6,1,34,Aug,Sat
8/23/2020,2020,3,8,23,7,1,35,Aug,Sun
8/24/2020,2020,3,8,24,1,0,35,Aug,Mon
8/25/2020,2020,3,8,25,2,0,35,Aug,Tue
8/26/2020,2020,3,8,26,3,0,35,Aug,Wed
8/27/2020,2020,3,8,27,4,0,35,Aug,Thu
8/28/2020,2020,3,8,28,5,0,35,Aug,Fri
8/29/2020,2020,3,8,29,6,1,35,Aug,Sat
8/30/2020,2020,3,8,30,7,1,36,Aug,Sun
8/31/2020,2020,3,8,31,1,0,36,Aug,Mon
9/1/2020,2020,3,9,1,2,0,36,Sep,Tue
9/2/2020,2020,3,9,2,3,0,36,Sep,Wed
9/3/2020,2020,3,9,3,4,0,36,Sep,Thu
9/4/2020,2020,3,9,4,5,0,36,Sep,Fri
9/5/2020,2020,3,9,5,6,1,36,Sep,Sat
9/6/2020,2020,3,9,6,7,1,37,Sep,Sun
9/7/2020,2020,3,9,7,1,0,37,Sep,Mon
9/8/2020,2020,3,9,8,2,0,37,Sep,Tue
9/9/2020,2020,3,9,9,3,0,37,Sep,Wed
9/10/2020,2020,3,9,10,4,0,37,Sep,Thu
9/11/2020,2020,3,9,11,5,0,37,Sep,Fri
9/12/2020,2020,3,9,12,6,1,37,Sep,Sat
9/13/2020,2020,3,9,13,7,1,38,Sep,Sun
9/14/2020,2020,3,9,14,1,0,38,Sep,Mon
9/15/2020,2020,3,9,15,2,0,38,Sep,Tue
9/16/2020,2020,3,9,16,3,0,38,Sep,Wed
9/17/2020,2020,3,9,17,4,0,38,Sep,Thu
9/18/2020,2020,3,9,18,5,0,38,Sep,Fri
9/19/2020,2020,3,9,19,6,1,38,Sep,Sat
9/20/2020,2020,3,9,20,7,1,39,Sep,Sun
9/21/2020,2020,3,9,21,1,0,39,Sep,Mon
9/22/2020,2020,3,9,22,2,0,39,Sep,Tue
9/23/2020,2020,3,9,23,3,0,39,Sep,Wed
9/24/2020,2020,3,9,24,4,0,39,Sep,Thu
9/25/2020,2020,3,9,25,5,0,39,Sep,Fri
9/26/2020,2020,3,9,26,6,1,39,Sep,Sat
9/27/2020,2020,3,9,27,7,1,40,Sep,Sun
9/28/2020,2020,3,9,28,1,0,40,Sep,Mon
9/29/2020,2020,3,9,29,2,0,40,Sep,Tue
9/30/2020,2020,3,9,30,3,0,40,Sep,Wed
10/1/2020,2020,4,10,1,4,0,40,Oct,Thu
10/2/2020,2020,4,10,2,5,0,40,Oct,Fri
10/3/2020,2020,4,10,3,6,1,40,Oct,Sat
10/4/2020,2020,4,10,4,7,1,41,Oct,Sun
10/5/2020,2020,4,10,5,1,0,41,Oct,Mon
10/6/2020,2020,4,10,6,2,0,41,Oct,Tue
10/7/2020,2020,4,10,7,3,0,41,Oct,Wed
10/8/2020,2020,4,10,8,4,0,41,Oct,Thu
10/9/2020,2020,4,10,9,5,0,41,Oct,Fri
10/10/2020,2020,4,10,10,6,1,41,Oct,Sat
10/11/2020,2020,4,10,11,7,1,42,Oct,Sun
10/12/2020,2020,4,10,12,1,0,42,Oct,Mon
10/13/2020,2020,4,10,13,2,0,42,Oct,Tue
10/14/2020,2020,4,10,14,3,0,42,Oct,Wed
10/15/2020,2020,4,10,15,4,0,42,Oct,Thu
10/16/2020,2020,4,10,16,5,0,42,Oct,Fri
10/17/2020,2020,4,10,17,6,1,42,Oct,Sat
10/18/2020,2020,4,10,18,7,1,43,Oct,Sun
10/19/2020,2020,4,10,19,1,0,43,Oct,Mon
10/20/2020,2020,4,10,20,2,0,43,Oct,Tue
10/21/2020,2020,4,10,21,3,0,43,Oct,Wed
10/22/2020,2020,4,10,22,4,0,43,Oct,Thu
10/23/2020,2020,4,10,23,5,0,43,Oct,Fri
10/24/2020,2020,4,10,24,6,1,43,Oct,Sat
10/25/2020,2020,4,10,25,7,1,44,Oct,Sun
10/26/2020,2020,4,10,26,1,0,44,Oct,Mon
10/27/2020,2020,4,10,27,2,0,44,Oct,Tue
10/28/2020,2020,4,10,28,3,0,44,Oct,Wed
10/29/2020,2020,4,10,29,4,0,44,Oct,Thu
10/30/2020,2020,4,10,30,5,0,44,Oct,Fri
10/31/2020,2020,4,10,31,6,1,44,Oct,Sat
11/1/2020,2020,4,11,1,7,1,45,Nov,Sun
11/2/2020,2020,4,11,2,1,0,45,Nov,Mon
11/3/2020,2020,4,11,3,2,0,45,Nov,Tue
11/4/2020,2020,4,11,4,3,0,45,Nov,Wed
11/5/2020,2020,4,11,5,4,0,45,Nov,Thu
11/6/2020,2020,4,11,6,5,0,45,Nov,Fri
11/7/2020,2020,4,11,7,6,1,45,Nov,Sat
11/8/2020,2020,4,11,8,7,1,46,Nov,Sun
11/9/2020,2020,4,11,9,1,0,46,Nov,Mon
11/10/2020,2020,4,11,10,2,0,46,Nov,Tue
11/11/2020,2020,4,11,11,3,0,46,Nov,Wed
11/12/2020,2020,4,11,12,4,0,46,Nov,Thu
11/13/2020,2020,4,11,13,5,0,46,Nov,Fri
11/14/2020,2020,4,11,14,6,1,46,Nov,Sat
11/15/2020,2020,4,11,15,7,1,47,Nov,Sun
11/16/2020,2020,4,11,16,1,0,47,Nov,Mon
11/17/2020,2020,4,11,17,2,0,47,Nov,Tue
11/18/2020,2020,4,11,18,3,0,47,Nov,Wed
11/19/2020,2020,4,11,19,4,0,47,Nov,Thu
11/20/2020,2020,4,11,20,5,0,47,Nov,Fri
11/21/2020,2020,4,11,21,6,1,47,Nov,Sat
11/22/2020,2020,4,11,22,7,1,48,Nov,Sun
11/23/2020,2020,4,11,23,1,0,48,Nov,Mon
11/24/2020,2020,4,11,24,2,0,48,Nov,Tue
11/25/2020,2020,4,11,25,3,0,48,Nov,Wed
11/26/2020,2020,4,11,26,4,0,48,Nov,Thu
11/27/2020,2020,4,11,27,5,0,48,Nov,Fri
11/28/2020,2020,4,11,28,6,1,48,Nov,Sat
11/29/2020,2020,4,11,29,7,1,49,Nov,Sun
11/30/2020,2020,4,11,30,1,0,49,Nov,Mon
12/1/2020,2020,4,12,1,2,0,49,Dec,Tue
12/2/2020,2020,4,12,2,3,0,49,Dec,Wed
12/3/2020,2020,4,12,3,4,0,49,Dec,Thu
12/4/2020,2020,4,12,4,5,0,49,Dec,Fri
12/5/2020,2020,4,12,5,6,1,49,Dec,Sat
12/6/2020,2020,4,12,6,7,1,50,Dec,Sun
12/7/2020,2020,4,12,7,1,0,50,Dec,Mon
12/8/2020,2020,4,12,8,2,0,50,Dec,Tue
12/9/2020,2020,4,12,9,3,0,50,Dec,Wed
12/10/2020,2020,4,12,10,4,0,50,Dec,Thu
12/11/2020,2020,4,12,11,5,0,50,Dec,Fri
12/12/2020,2020,4,12,12,6,1,50,Dec,Sat
12/13/2020,2020,4,12,13,7,1,51,Dec,Sun
12/14/2020,2020,4,12,14,1,0,51,Dec,Mon
12/15/2020,2020,4,12,15,2,0,51,Dec,Tue
12/16/2020,2020,4,12,16,3,0,51,Dec,Wed
12/17/2020,2020,4,12,17,4,0,51,Dec,Thu
12/18/2020,2020,4,12,18,5,0,51,Dec,Fri
12/19/2020,2020,4,12,19,6,1,51,Dec,Sat
12/20/2020,2020,4,12,20,7,1,52,Dec,Sun
12/21/2020,2020,4,12,21,1,0,52,Dec,Mon
12/22/2020,2020,4,12,22,2,0,52,Dec,Tue
12/23/2020,2020,4,12,23,3,0,52,Dec,Wed
12/24/2020,2020,4,12,24,4,0,52,Dec,Thu
12/25/2020,2020,4,12,25,5,0,52,Dec,Fri
12/26/2020,2020,4,12,26,6,1,52,Dec,Sat
12/27/2020,2020,4,12,27,7,1,53,Dec,Sun
12/28/2020,2020,4,12,28,1,0,53,Dec,Mon
12/29/2020,2020,4,12,29,2,0,53,Dec,Tue
12/30/2020,2020,4,12,30,3,0,53,Dec,Wed
12/31/2020,2020,4,12,31,4,0,53,Dec,Thu
1/1/2021,2021,1,1,1,5,0,1,Jan,Fri
1/2/2021,2021,1,1,2,6,1,1,Jan,Sat
1/3/2021,2021,1,1,3,7,1,2,Jan,Sun
1/4/2021,2021,1,1,4,1,0,2,Jan,Mon
1/5/2021,2021,1,1,5,2,0,2,Jan,Tue
1/6/2021,2021,1,1,6,3,0,2,Jan,Wed
1/7/2021,2021,1,1,7,4,0,2,Jan,Thu
1/8/2021,2021,1,1,8,5,0,2,Jan,Fri
1/9/2021,2021,1,1,9,6,1,2,Jan,Sat
1/10/2021,2021,1,1,10,7,1,3,Jan,Sun
1/11/2021,2021,1,1,11,1,0,3,Jan,Mon
1/12/2021,2021,1,1,12,2,0,3,Jan,Tue
1/13/2021,2021,1,1,13,3,0,3,Jan,Wed
1/14/2021,2021,1,1,14,4,0,3,Jan,Thu
1/15/2021,2021,1,1,15,5,0,3,Jan,Fri
1/16/2021,2021,1,1,16,6,1,3,Jan,Sat
1/17/2021,2021,1,1,17,7,1,4,Jan,Sun
1/18/2021,2021,1,1,18,1,0,4,Jan,Mon
1/19/2021,2021,1,1,19,2,0,4,Jan,Tue
1/20/2021,2021,1,1,20,3,0,4,Jan,Wed
1/21/2021,2021,1,1,21,4,0,4,Jan,Thu
1/22/2021,2021,1,1,22,5,0,4,Jan,Fri
1/23/2021,2021,1,1,23,6,1,4,Jan,Sat
1/24/2021,2021,1,1,24,7,1,5,Jan,Sun
1/25/2021,2021,1,1,25,1,0,5,Jan,Mon
1/26/2021,2021,1,1,26,2,0,5,Jan,Tue
1/27/2021,2021,1,1,27,3,0,5,Jan,Wed
1/28/2021,2021,1,1,28,4,0,5,Jan,Thu
1/29/2021,2021,1,1,29,5,0,5,Jan,Fri
1/30/2021,2021,1,1,30,6,1,5,Jan,Sat
1/31/2021,2021,1,1,31,7,1,6,Jan,Sun
2/1/2021,2021,1,2,1,1,0,6,Feb,Mon
2/2/2021,2021,1,2,2,2,0,6,Feb,Tue
2/3/2021,2021,1,2,3,3,0,6,Feb,Wed
2/4/2021,2021,1,2,4,4,0,6,Feb,Thu
2/5/2021,2021,1,2,5,5,0,6,Feb,Fri
2/6/2021,2021,1,2,6,6,1,6,Feb,Sat
2/7/2021,2021,1,2,7,7,1,7,Feb,Sun
2/8/2021,2021,1,2,8,1,0,7,Feb,Mon
2/9/2021,2021,1,2,9,2,0,7,Feb,Tue
2/10/2021,2021,1,2,10,3,0,7,Feb,Wed
2/11/2021,2021,1,2,11,4,0,7,Feb,Thu
2/12/2021,2021,1,2,12,5,0,7,Feb,Fri
2/13/2021,2021,1,2,13,6,1,7,Feb,Sat
2/14/2021,2021,1,2,14,7,1,8,Feb,Sun
2/15/2021,2021,1,2,15,1,0,8,Feb,Mon
2/16/2021,2021,1,2,16,2,0,8,Feb,Tue
2/17/2021,2021,1,2,17,3,0,8,Feb,Wed
2/18/2021,2021,1,2,18,4,0,8,Feb,Thu
2/19/2021,2021,1,2,19,5,0,8,Feb,Fri
2/20/2021,2021,1,2,20,6,1,8,Feb,Sat
2/21/2021,2021,1,2,21,7,1,9,Feb,Sun
2/22/2021,2021,1,2,22,1,0,9,Feb,Mon
2/23/2021,2021,1,2,23,2,0,9,Feb,Tue
2/24/2021,2021,1,2,24,3,0,9,Feb,Wed
2/25/2021,2021,1,2,25,4,0,9,Feb,Thu
2/26/2021,2021,1,2,26,5,0,9,Feb,Fri
2/27/2021,2021,1,2,27,6,1,9,Feb,Sat
2/28/2021,2021,1,2,28,7,1,10,Feb,Sun
3/1/2021,2021,1,3,1,1,0,10,Mar,Mon
3/2/2021,2021,1,3,2,2,0,10,Mar,Tue
3/3/2021,2021,1,3,3,3,0,10,Mar,Wed
3/4/2021,2021,1,3,4,4,0,10,Mar,Thu
3/5/2021,2021,1,3,5,5,0,10,Mar,Fri
3/6/2021,2021,1,3,6,6,1,10,Mar,Sat
3/7/2021,2021,1,3,7,7,1,11,Mar,Sun
3/8/2021,2021,1,3,8,1,0,11,Mar,Mon
3/9/2021,2021,1,3,9,2,0,11,Mar,Tue
3/10/2021,2021,1,3,10,3,0,11,Mar,Wed
3/11/2021,2021,1,3,11,4,0,11,Mar,Thu
3/12/2021,2021,1,3,12,5,0,11,Mar,Fri
3/13/2021,2021,1,3,13,6,1,11,Mar,Sat
3/14/2021,2021,1,3,14,7,1,12,Mar,Sun
3/15/2021,2021,1,3,15,1,0,12,Mar,Mon
3/16/2021,2021,1,3,16,2,0,12,Mar,Tue
3/17/2021,2021,1,3,17,3,0,12,Mar,Wed
3/18/2021,2021,1,3,18,4,0,12,Mar,Thu
3/19/2021,2021,1,3,19,5,0,12,Mar,Fri
3/20/2021,2021,1,3,20,6,1,12,Mar,Sat
3/21/2021,2021,1,3,21,7,1,13,Mar,Sun
3/22/2021,2021,1,3,22,1,0,13,Mar,Mon
3/23/2021,2021,1,3,23,2,0,13,Mar,Tue
3/24/2021,2021,1,3,24,3,0,13,Mar,Wed
3/25/2021,2021,1,3,25,4,0,13,Mar,Thu
3/26/2021,2021,1,3,26,5,0,13,Mar,Fri
3/27/2021,2021,1,3,27,6,1,13,Mar,Sat
3/28/2021,2021,1,3,28,7,1,14,Mar,Sun
3/29/2021,2021,1,3,29,1,0,14,Mar,Mon
3/30/2021,2021,1,3,30,2,0,14,Mar,Tue
3/31/2021,2021,1,3,31,3,0,14,Mar,Wed
4/1/2021,2021,2,4,1,4,0,14,Apr,Thu
4/2/2021,2021,2,4,2,5,0,14,Apr,Fri
4/3/2021,2021,2,4,3,6,1,14,Apr,Sat
4/4/2021,2021,2,4,4,7,1,15,Apr,Sun
4/5/2021,2021,2,4,5,1,0,15,Apr,Mon
4/6/2021,2021,2,4,6,2,0,15,Apr,Tue
4/7/2021,2021,2,4,7,3,0,15,Apr,Wed
4/8/2021,2021,2,4,8,4,0,15,Apr,Thu
4/9/2021,2021,2,4,9,5,0,15,Apr,Fri
4/10/2021,2021,2,4,10,6,1,15,Apr,Sat
4/11/2021,2021,2,4,11,7,1,16,Apr,Sun
4/12/2021,2021,2,4,12,1,0,16,Apr,Mon
4/13/2021,2021,2,4,13,2,0,16,Apr,Tue
4/14/2021,2021,2,4,14,3,0,16,Apr,Wed
4/15/2021,2021,2,4,15,4,0,16,Apr,Thu
4/16/2021,2021,2,4,16,5,0,16,Apr,Fri
4/17/2021,2021,2,4,17,6,1,16,Apr,Sat
4/18/2021,2021,2,4,18,7,1,17,Apr,Sun
4/19/2021,2021,2,4,19,1,0,17,Apr,Mon
4/20/2021,2021,2,4,20,2,0,17,Apr,Tue
4/21/2021,2021,2,4,21,3,0,17,Apr,Wed
4/22/2021,2021,2,4,22,4,0,17,Apr,Thu
4/23/2021,2021,2,4,23,5,0,17,Apr,Fri
4/24/2021,2021,2,4,24,6,1,17,Apr,Sat
4/25/2021,2021,2,4,25,7,1,18,Apr,Sun
4/26/2021,2021,2,4,26,1,0,18,Apr,Mon
4/27/2021,2021,2,4,27,2,0,18,Apr,Tue
4/28/2021,2021,2,4,28,3,0,18,Apr,Wed
4/29/2021,2021,2,4,29,4,0,18,Apr,Thu
4/30/2021,2021,2,4,30,5,0,18,Apr,Fri
5/1/2021,2021,2,5,1,6,1,18,May,Sat
5/2/2021,2021,2,5,2,7,1,19,May,Sun
5/3/2021,2021,2,5,3,1,0,19,May,Mon
5/4/2021,2021,2,5,4,2,0,19,May,Tue
5/5/2021,2021,2,5,5,3,0,19,May,Wed
5/6/2021,2021,2,5,6,4,0,19,May,Thu
5/7/2021,2021,2,5,7,5,0,19,May,Fri
5/8/2021,2021,2,5,8,6,1,19,May,Sat
5/9/2021,2021,2,5,9,7,1,20,May,Sun
5/10/2021,2021,2,5,10,1,0,20,May,Mon
5/11/2021,2021,2,5,11,2,0,20,May,Tue
5/12/2021,2021,2,5,12,3,0,20,May,Wed
5/13/2021,2021,2,5,13,4,0,20,May,Thu
5/14/2021,2021,2,5,14,5,0,20,May,Fri
5/15/2021,2021,2,5,15,6,1,20,May,Sat
5/16/2021,2021,2,5,16,7,1,21,May,Sun
5/17/2021,2021,2,5,17,1,0,21,May,Mon
5/18/2021,2021,2,5,18,2,0,21,May,Tue
5/19/2021,2021,2,5,19,3,0,21,May,Wed
5/20/2021,2021,2,5,20,4,0,21,May,Thu
5/21/2021,2021,2,5,21,5,0,21,May,Fri
5/22/2021,2021,2,5,22,6,1,21,May,Sat
5/23/2021,2021,2,5,23,7,1,22,May,Sun
5/24/2021,2021,2,5,24,1,0,22,May,Mon
5/25/2021,2021,2,5,25,2,0,22,May,Tue
5/26/2021,2021,2,5,26,3,0,22,May,Wed
5/27/2021,2021,2,5,27,4,0,22,May,Thu
5/28/2021,2021,2,5,28,5,0,22,May,Fri
5/29/2021,2021,2,5,29,6,1,22,May,Sat
5/30/2021,2021,2,5,30,7,1,23,May,Sun
5/31/2021,2021,2,5,31,1,0,23,May,Mon
6/1/2021,2021,2,6,1,2,0,23,Jun,Tue
6/2/2021,2021,2,6,2,3,0,23,Jun,Wed
6/3/2021,2021,2,6,3,4,0,23,Jun,Thu
6/4/2021,2021,2,6,4,5,0,23,Jun,Fri
6/5/2021,2021,2,6,5,6,1,23,Jun,Sat
6/6/2021,2021,2,6,6,7,1,24,Jun,Sun
6/7/2021,2021,2,6,7,1,0,24,Jun,Mon
6/8/2021,2021,2,6,8,2,0,24,Jun,Tue
6/9/2021,2021,2,6,9,3,0,24,Jun,Wed
6/10/2021,2021,2,6,10,4,0,24,Jun,Thu
6/11/2021,2021,2,6,11,5,0,24,Jun,Fri
6/12/2021,2021,2,6,12,6,1,24,Jun,Sat
6/13/2021,2021,2,6,13,7,1,25,Jun,Sun
6/14/2021,2021,2,6,14,1,0,25,Jun,Mon
6/15/2021,2021,2,6,15,2,0,25,Jun,Tue
6/16/2021,2021,2,6,16,3,0,25,Jun,Wed
6/17/2021,2021,2,6,17,4,0,25,Jun,Thu
6/18/2021,2021,2,6,18,5,0,25,Jun,Fri
6/19/2021,2021,2,6,19,6,1,25,Jun,Sat
6/20/2021,2021,2,6,20,7,1,26,Jun,Sun
6/21/2021,2021,2,6,21,1,0,26,Jun,Mon
6/22/2021,2021,2,6,22,2,0,26,Jun,Tue
6/23/2021,2021,2,6,23,3,0,26,Jun,Wed
6/24/2021,2021,2,6,24,4,0,26,Jun,Thu
6/25/2021,2021,2,6,25,5,0,26,Jun,Fri
6/26/2021,2021,2,6,26,6,1,26,Jun,Sat
6/27/2021,2021,2,6,27,7,1,27,Jun,Sun
6/28/2021,2021,2,6,28,1,0,27,Jun,Mon
6/29/2021,2021,2,6,29,2,0,27,Jun,Tue
6/30/2021,2021,2,6,30,3,0,27,Jun,Wed
7/1/2021,2021,3,7,1,4,0,27,Jul,Thu
7/2/2021,2021,3,7,2,5,0,27,Jul,Fri
7/3/2021,2021,3,7,3,6,1,27,Jul,Sat
7/4/2021,2021,3,7,4,7,1,28,Jul,Sun
7/5/2021,2021,3,7,5,1,0,28,Jul,Mon
7/6/2021,2021,3,7,6,2,0,28,Jul,Tue
7/7/2021,2021,3,7,7,3,0,28,Jul,Wed
7/8/2021,2021,3,7,8,4,0,28,Jul,Thu
7/9/2021,2021,3,7,9,5,0,28,Jul,Fri
7/10/2021,2021,3,7,10,6,1,28,Jul,Sat
7/11/2021,2021,3,7,11,7,1,29,Jul,Sun
7/12/2021,2021,3,7,12,1,0,29,Jul,Mon
7/13/2021,2021,3,7,13,2,0,29,Jul,Tue
7/14/2021,2021,3,7,14,3,0,29,Jul,Wed
7/15/2021,2021,3,7,15,4,0,29,Jul,Thu
7/16/2021,2021,3,7,16,5,0,29,Jul,Fri
7/17/2021,2021,3,7,17,6,1,29,Jul,Sat
7/18/2021,2021,3,7,18,7,1,30,Jul,Sun
7/19/2021,2021,3,7,19,1,0,30,Jul,Mon
7/20/2021,2021,3,7,20,2,0,30,Jul,Tue
7/21/2021,2021,3,7,21,3,0,30,Jul,Wed
7/22/2021,2021,3,7,22,4,0,30,Jul,Thu
7/23/2021,2021,3,7,23,5,0,30,Jul,Fri
7/24/2021,2021,3,7,24,6,1,30,Jul,Sat
7/25/2021,2021,3,7,25,7,1,31,Jul,Sun
7/26/2021,2021,3,7,26,1,0,31,Jul,Mon
7/27/2021,2021,3,7,27,2,0,31,Jul,Tue
7/28/2021,2021,3,7,28,3,0,31,Jul,Wed
7/29/2021,2021,3,7,29,4,0,31,Jul,Thu
7/30/2021,2021,3,7,30,5,0,31,Jul,Fri
7/31/2021,2021,3,7,31,6,1,31,Jul,Sat
8/1/2021,2021,3,8,1,7,1,32,Aug,Sun
8/2/2021,2021,3,8,2,1,0,32,Aug,Mon
8/3/2021,2021,3,8,3,2,0,32,Aug,Tue
8/4/2021,2021,3,8,4,3,0,32,Aug,Wed
8/5/2021,2021,3,8,5,4,0,32,Aug,Thu
8/6/2021,2021,3,8,6,5,0,32,Aug,Fri
8/7/2021,2021,3,8,7,6,1,32,Aug,Sat
8/8/2021,2021,3,8,8,7,1,33,Aug,Sun
8/9/2021,2021,3,8,9,1,0,33,Aug,Mon
8/10/2021,2021,3,8,10,2,0,33,Aug,Tue
8/11/2021,2021,3,8,11,3,0,33,Aug,Wed
8/12/2021,2021,3,8,12,4,0,33,Aug,Thu
8/13/2021,2021,3,8,13,5,0,33,Aug,Fri
8/14/2021,2021,3,8,14,6,1,33,Aug,Sat
8/15/2021,2021,3,8,15,7,1,34,Aug,Sun
8/16/2021,2021,3,8,16,1,0,34,Aug,Mon
8/17/2021,2021,3,8,17,2,0,34,Aug,Tue
8/18/2021,2021,3,8,18,3,0,34,Aug,Wed
8/19/2021,2021,3,8,19,4,0,34,Aug,Thu
8/20/2021,2021,3,8,20,5,0,34,Aug,Fri
8/21/2021,2021,3,8,21,6,1,34,Aug,Sat
8/22/2021,2021,3,8,22,7,1,35,Aug,Sun
8/23/2021,2021,3,8,23,1,0,35,Aug,Mon
8/24/2021,2021,3,8,24,2,0,35,Aug,Tue
8/25/2021,2021,3,8,25,3,0,35,Aug,Wed
8/26/2021,2021,3,8,26,4,0,35,Aug,Thu
8/27/2021,2021,3,8,27,5,0,35,Aug,Fri
8/28/2021,2021,3,8,28,6,1,35,Aug,Sat
8/29/2021,2021,3,8,29,7,1,36,Aug,Sun
8/30/2021,2021,3,8,30,1,0,36,Aug,Mon
8/31/2021,2021,3,8,31,2,0,36,Aug,Tue
9/1/2021,2021,3,9,1,3,0,36,Sep,Wed
9/2/2021,2021,3,9,2,4,0,36,Sep,Thu
9/3/2021,2021,3,9,3,5,0,36,Sep,Fri
9/4/2021,2021,3,9,4,6,1,36,Sep,Sat
9/5/2021,2021,3,9,5,7,1,37,Sep,Sun
9/6/2021,2021,3,9,6,1,0,37,Sep,Mon
9/7/2021,2021,3,9,7,2,0,37,Sep,Tue
9/8/2021,2021,3,9,8,3,0,37,Sep,Wed
9/9/2021,2021,3,9,9,4,0,37,Sep,Thu
9/10/2021,2021,3,9,10,5,0,37,Sep,Fri
9/11/2021,2021,3,9,11,6,1,37,Sep,Sat
9/12/2021,2021,3,9,12,7,1,38,Sep,Sun
9/13/2021,2021,3,9,13,1,0,38,Sep,Mon
9/14/2021,2021,3,9,14,2,0,38,Sep,Tue
9/15/2021,2021,3,9,15,3,0,38,Sep,Wed
9/16/2021,2021,3,9,16,4,0,38,Sep,Thu
9/17/2021,2021,3,9,17,5,0,38,Sep,Fri
9/18/2021,2021,3,9,18,6,1,38,Sep,Sat
9/19/2021,2021,3,9,19,7,1,39,Sep,Sun
9/20/2021,2021,3,9,20,1,0,39,Sep,Mon
9/21/2021,2021,3,9,21,2,0,39,Sep,Tue
9/22/2021,2021,3,9,22,3,0,39,Sep,Wed
9/23/2021,2021,3,9,23,4,0,39,Sep,Thu
9/24/2021,2021,3,9,24,5,0,39,Sep,Fri
9/25/2021,2021,3,9,25,6,1,39,Sep,Sat
9/26/2021,2021,3,9,26,7,1,40,Sep,Sun
9/27/2021,2021,3,9,27,1,0,40,Sep,Mon
9/28/2021,2021,3,9,28,2,0,40,Sep,Tue
9/29/2021,2021,3,9,29,3,0,40,Sep,Wed
9/30/2021,2021,3,9,30,4,0,40,Sep,Thu
10/1/2021,2021,4,10,1,5,0,40,Oct,Fri
10/2/2021,2021,4,10,2,6,1,40,Oct,Sat
10/3/2021,2021,4,10,3,7,1,41,Oct,Sun
10/4/2021,2021,4,10,4,1,0,41,Oct,Mon
10/5/2021,2021,4,10,5,2,0,41,Oct,Tue
10/6/2021,2021,4,10,6,3,0,41,Oct,Wed
10/7/2021,2021,4,10,7,4,0,41,Oct,Thu
10/8/2021,2021,4,10,8,5,0,41,Oct,Fri
10/9/2021,2021,4,10,9,6,1,41,Oct,Sat
10/10/2021,2021,4,10,10,7,1,42,Oct,Sun
10/11/2021,2021,4,10,11,1,0,42,Oct,Mon
10/12/2021,2021,4,10,12,2,0,42,Oct,Tue
10/13/2021,2021,4,10,13,3,0,42,Oct,Wed
10/14/2021,2021,4,10,14,4,0,42,Oct,Thu
10/15/2021,2021,4,10,15,5,0,42,Oct,Fri
10/16/2021,2021,4,10,16,6,1,42,Oct,Sat
10/17/2021,2021,4,10,17,7,1,43,Oct,Sun
10/18/2021,2021,4,10,18,1,0,43,Oct,Mon
10/19/2021,2021,4,10,19,2,0,43,Oct,Tue
10/20/2021,2021,4,10,20,3,0,43,Oct,Wed
10/21/2021,2021,4,10,21,4,0,43,Oct,Thu
10/22/2021,2021,4,10,22,5,0,43,Oct,Fri
10/23/2021,2021,4,10,23,6,1,43,Oct,Sat
10/24/2021,2021,4,10,24,7,1,44,Oct,Sun
10/25/2021,2021,4,10,25,1,0,44,Oct,Mon
10/26/2021,2021,4,10,26,2,0,44,Oct,Tue
10/27/2021,2021,4,10,27,3,0,44,Oct,Wed
10/28/2021,2021,4,10,28,4,0,44,Oct,Thu
10/29/2021,2021,4,10,29,5,0,44,Oct,Fri
10/30/2021,2021,4,10,30,6,1,44,Oct,Sat
10/31/2021,2021,4,10,31,7,1,45,Oct,Sun
11/1/2021,2021,4,11,1,1,0,45,Nov,Mon
11/2/2021,2021,4,11,2,2,0,45,Nov,Tue
11/3/2021,2021,4,11,3,3,0,45,Nov,Wed
11/4/2021,2021,4,11,4,4,0,45,Nov,Thu
11/5/2021,2021,4,11,5,5,0,45,Nov,Fri
11/6/2021,2021,4,11,6,6,1,45,Nov,Sat
11/7/2021,2021,4,11,7,7,1,46,Nov,Sun
11/8/2021,2021,4,11,8,1,0,46,Nov,Mon
11/9/2021,2021,4,11,9,2,0,46,Nov,Tue
11/10/2021,2021,4,11,10,3,0,46,Nov,Wed
11/11/2021,2021,4,11,11,4,0,46,Nov,Thu
11/12/2021,2021,4,11,12,5,0,46,Nov,Fri
11/13/2021,2021,4,11,13,6,1,46,Nov,Sat
11/14/2021,2021,4,11,14,7,1,47,Nov,Sun
11/15/2021,2021,4,11,15,1,0,47,Nov,Mon
11/16/2021,2021,4,11,16,2,0,47,Nov,Tue
11/17/2021,2021,4,11,17,3,0,47,Nov,Wed
11/18/2021,2021,4,11,18,4,0,47,Nov,Thu
11/19/2021,2021,4,11,19,5,0,47,Nov,Fri
11/20/2021,2021,4,11,20,6,1,47,Nov,Sat
11/21/2021,2021,4,11,21,7,1,48,Nov,Sun
11/22/2021,2021,4,11,22,1,0,48,Nov,Mon
11/23/2021,2021,4,11,23,2,0,48,Nov,Tue
11/24/2021,2021,4,11,24,3,0,48,Nov,Wed
11/25/2021,2021,4,11,25,4,0,48,Nov,Thu
11/26/2021,2021,4,11,26,5,0,48,Nov,Fri
11/27/2021,2021,4,11,27,6,1,48,Nov,Sat
11/28/2021,2021,4,11,28,7,1,49,Nov,Sun
11/29/2021,2021,4,11,29,1,0,49,Nov,Mon
11/30/2021,2021,4,11,30,2,0,49,Nov,Tue
12/1/2021,2021,4,12,1,3,0,49,Dec,Wed
12/2/2021,2021,4,12,2,4,0,49,Dec,Thu
12/3/2021,2021,4,12,3,5,0,49,Dec,Fri
12/4/2021,2021,4,12,4,6,1,49,Dec,Sat
12/5/2021,2021,4,12,5,7,1,50,Dec,Sun
12/6/2021,2021,4,12,6,1,0,50,Dec,Mon
12/7/2021,2021,4,12,7,2,0,50,Dec,Tue
12/8/2021,2021,4,12,8,3,0,50,Dec,Wed
12/9/2021,2021,4,12,9,4,0,50,Dec,Thu
12/10/2021,2021,4,12,10,5,0,50,Dec,Fri
12/11/2021,2021,4,12,11,6,1,50,Dec,Sat
12/12/2021,2021,4,12,12,7,1,51,Dec,Sun
12/13/2021,2021,4,12,13,1,0,51,Dec,Mon
12/14/2021,2021,4,12,14,2,0,51,Dec,Tue
12/15/2021,2021,4,12,15,3,0,51,Dec,Wed
12/16/2021,2021,4,12,16,4,0,51,Dec,Thu
12/17/2021,2021,4,12,17,5,0,51,Dec,Fri
12/18/2021,2021,4,12,18,6,1,51,Dec,Sat
12/19/2021,2021,4,12,19,7,1,52,Dec,Sun
12/20/2021,2021,4,12,20,1,0,52,Dec,Mon
12/21/2021,2021,4,12,21,2,0,52,Dec,Tue
12/22/2021,2021,4,12,22,3,0,52,Dec,Wed
12/23/2021,2021,4,12,23,4,0,52,Dec,Thu
12/24/2021,2021,4,12,24,5,0,52,Dec,Fri
12/25/2021,2021,4,12,25,6,1,52,Dec,Sat
12/26/2021,2021,4,12,26,7,1,53,Dec,Sun
12/27/2021,2021,4,12,27,1,0,53,Dec,Mon
12/28/2021,2021,4,12,28,2,0,53,Dec,Tue
12/29/2021,2021,4,12,29,3,0,53,Dec,Wed
12/30/2021,2021,4,12,30,4,0,53,Dec,Thu
12/31/2021,2021,4,12,31,5,0,53,Dec,Fri
1/1/2022,2022,1,1,1,6,1,1,Jan,Sat
1/2/2022,2022,1,1,2,7,1,2,Jan,Sun
1/3/2022,2022,1,1,3,1,0,2,Jan,Mon
1/4/2022,2022,1,1,4,2,0,2,Jan,Tue
1/5/2022,2022,1,1,5,3,0,2,Jan,Wed
1/6/2022,2022,1,1,6,4,0,2,Jan,Thu
1/7/2022,2022,1,1,7,5,0,2,Jan,Fri
1/8/2022,2022,1,1,8,6,1,2,Jan,Sat
1/9/2022,2022,1,1,9,7,1,3,Jan,Sun
1/10/2022,2022,1,1,10,1,0,3,Jan,Mon
1/11/2022,2022,1,1,11,2,0,3,Jan,Tue
1/12/2022,2022,1,1,12,3,0,3,Jan,Wed
1/13/2022,2022,1,1,13,4,0,3,Jan,Thu
1/14/2022,2022,1,1,14,5,0,3,Jan,Fri
1/15/2022,2022,1,1,15,6,1,3,Jan,Sat
1/16/2022,2022,1,1,16,7,1,4,Jan,Sun
1/17/2022,2022,1,1,17,1,0,4,Jan,Mon
1/18/2022,2022,1,1,18,2,0,4,Jan,Tue
1/19/2022,2022,1,1,19,3,0,4,Jan,Wed
1/20/2022,2022,1,1,20,4,0,4,Jan,Thu
1/21/2022,2022,1,1,21,5,0,4,Jan,Fri
1/22/2022,2022,1,1,22,6,1,4,Jan,Sat
1/23/2022,2022,1,1,23,7,1,5,Jan,Sun
1/24/2022,2022,1,1,24,1,0,5,Jan,Mon
1/25/2022,2022,1,1,25,2,0,5,Jan,Tue
1/26/2022,2022,1,1,26,3,0,5,Jan,Wed
1/27/2022,2022,1,1,27,4,0,5,Jan,Thu
1/28/2022,2022,1,1,28,5,0,5,Jan,Fri
1/29/2022,2022,1,1,29,6,1,5,Jan,Sat
1/30/2022,2022,1,1,30,7,1,6,Jan,Sun
1/31/2022,2022,1,1,31,1,0,6,Jan,Mon
2/1/2022,2022,1,2,1,2,0,6,Feb,Tue
2/2/2022,2022,1,2,2,3,0,6,Feb,Wed
2/3/2022,2022,1,2,3,4,0,6,Feb,Thu
2/4/2022,2022,1,2,4,5,0,6,Feb,Fri
2/5/2022,2022,1,2,5,6,1,6,Feb,Sat
2/6/2022,2022,1,2,6,7,1,7,Feb,Sun
2/7/2022,2022,1,2,7,1,0,7,Feb,Mon
2/8/2022,2022,1,2,8,2,0,7,Feb,Tue
2/9/2022,2022,1,2,9,3,0,7,Feb,Wed
2/10/2022,2022,1,2,10,4,0,7,Feb,Thu
2/11/2022,2022,1,2,11,5,0,7,Feb,Fri
2/12/2022,2022,1,2,12,6,1,7,Feb,Sat
2/13/2022,2022,1,2,13,7,1,8,Feb,Sun
2/14/2022,2022,1,2,14,1,0,8,Feb,Mon
2/15/2022,2022,1,2,15,2,0,8,Feb,Tue
2/16/2022,2022,1,2,16,3,0,8,Feb,Wed
2/17/2022,2022,1,2,17,4,0,8,Feb,Thu
2/18/2022,2022,1,2,18,5,0,8,Feb,Fri
2/19/2022,2022,1,2,19,6,1,8,Feb,Sat
2/20/2022,2022,1,2,20,7,1,9,Feb,Sun
2/21/2022,2022,1,2,21,1,0,9,Feb,Mon
2/22/2022,2022,1,2,22,2,0,9,Feb,Tue
2/23/2022,2022,1,2,23,3,0,9,Feb,Wed
2/24/2022,2022,1,2,24,4,0,9,Feb,Thu
2/25/2022,2022,1,2,25,5,0,9,Feb,Fri
2/26/2022,2022,1,2,26,6,1,9,Feb,Sat
2/27/2022,2022,1,2,27,7,1,10,Feb,Sun
2/28/2022,2022,1,2,28,1,0,10,Feb,Mon
3/1/2022,2022,1,3,1,2,0,10,Mar,Tue
3/2/2022,2022,1,3,2,3,0,10,Mar,Wed
3/3/2022,2022,1,3,3,4,0,10,Mar,Thu
3/4/2022,2022,1,3,4,5,0,10,Mar,Fri
3/5/2022,2022,1,3,5,6,1,10,Mar,Sat
3/6/2022,2022,1,3,6,7,1,11,Mar,Sun
3/7/2022,2022,1,3,7,1,0,11,Mar,Mon
3/8/2022,2022,1,3,8,2,0,11,Mar,Tue
3/9/2022,2022,1,3,9,3,0,11,Mar,Wed
3/10/2022,2022,1,3,10,4,0,11,Mar,Thu
3/11/2022,2022,1,3,11,5,0,11,Mar,Fri
3/12/2022,2022,1,3,12,6,1,11,Mar,Sat
3/13/2022,2022,1,3,13,7,1,12,Mar,Sun
3/14/2022,2022,1,3,14,1,0,12,Mar,Mon
3/15/2022,2022,1,3,15,2,0,12,Mar,Tue
3/16/2022,2022,1,3,16,3,0,12,Mar,Wed
3/17/2022,2022,1,3,17,4,0,12,Mar,Thu
3/18/2022,2022,1,3,18,5,0,12,Mar,Fri
3/19/2022,2022,1,3,19,6,1,12,Mar,Sat
3/20/2022,2022,1,3,20,7,1,13,Mar,Sun
3/21/2022,2022,1,3,21,1,0,13,Mar,Mon
3/22/2022,2022,1,3,22,2,0,13,Mar,Tue
3/23/2022,2022,1,3,23,3,0,13,Mar,Wed
3/24/2022,2022,1,3,24,4,0,13,Mar,Thu
3/25/2022,2022,1,3,25,5,0,13,Mar,Fri
3/26/2022,2022,1,3,26,6,1,13,Mar,Sat
3/27/2022,2022,1,3,27,7,1,14,Mar,Sun
3/28/2022,2022,1,3,28,1,0,14,Mar,Mon
3/29/2022,2022,1,3,29,2,0,14,Mar,Tue
3/30/2022,2022,1,3,30,3,0,14,Mar,Wed
3/31/2022,2022,1,3,31,4,0,14,Mar,Thu
4/1/2022,2022,2,4,1,5,0,14,Apr,Fri
4/2/2022,2022,2,4,2,6,1,14,Apr,Sat
4/3/2022,2022,2,4,3,7,1,15,Apr,Sun
4/4/2022,2022,2,4,4,1,0,15,Apr,Mon
4/5/2022,2022,2,4,5,2,0,15,Apr,Tue
4/6/2022,2022,2,4,6,3,0,15,Apr,Wed
4/7/2022,2022,2,4,7,4,0,15,Apr,Thu
4/8/2022,2022,2,4,8,5,0,15,Apr,Fri
4/9/2022,2022,2,4,9,6,1,15,Apr,Sat
4/10/2022,2022,2,4,10,7,1,16,Apr,Sun
4/11/2022,2022,2,4,11,1,0,16,Apr,Mon
4/12/2022,2022,2,4,12,2,0,16,Apr,Tue
4/13/2022,2022,2,4,13,3,0,16,Apr,Wed
4/14/2022,2022,2,4,14,4,0,16,Apr,Thu
4/15/2022,2022,2,4,15,5,0,16,Apr,Fri
4/16/2022,2022,2,4,16,6,1,16,Apr,Sat
4/17/2022,2022,2,4,17,7,1,17,Apr,Sun
4/18/2022,2022,2,4,18,1,0,17,Apr,Mon
4/19/2022,2022,2,4,19,2,0,17,Apr,Tue
4/20/2022,2022,2,4,20,3,0,17,Apr,Wed
4/21/2022,2022,2,4,21,4,0,17,Apr,Thu
4/22/2022,2022,2,4,22,5,0,17,Apr,Fri
4/23/2022,2022,2,4,23,6,1,17,Apr,Sat
4/24/2022,2022,2,4,24,7,1,18,Apr,Sun
4/25/2022,2022,2,4,25,1,0,18,Apr,Mon
4/26/2022,2022,2,4,26,2,0,18,Apr,Tue
4/27/2022,2022,2,4,27,3,0,18,Apr,Wed
4/28/2022,2022,2,4,28,4,0,18,Apr,Thu
4/29/2022,2022,2,4,29,5,0,18,Apr,Fri
4/30/2022,2022,2,4,30,6,1,18,Apr,Sat
5/1/2022,2022,2,5,1,7,1,19,May,Sun
5/2/2022,2022,2,5,2,1,0,19,May,Mon
5/3/2022,2022,2,5,3,2,0,19,May,Tue
5/4/2022,2022,2,5,4,3,0,19,May,Wed
5/5/2022,2022,2,5,5,4,0,19,May,Thu
5/6/2022,2022,2,5,6,5,0,19,May,Fri
5/7/2022,2022,2,5,7,6,1,19,May,Sat
5/8/2022,2022,2,5,8,7,1,20,May,Sun
5/9/2022,2022,2,5,9,1,0,20,May,Mon
5/10/2022,2022,2,5,10,2,0,20,May,Tue
5/11/2022,2022,2,5,11,3,0,20,May,Wed
5/12/2022,2022,2,5,12,4,0,20,May,Thu
5/13/2022,2022,2,5,13,5,0,20,May,Fri
5/14/2022,2022,2,5,14,6,1,20,May,Sat
5/15/2022,2022,2,5,15,7,1,21,May,Sun
5/16/2022,2022,2,5,16,1,0,21,May,Mon
5/17/2022,2022,2,5,17,2,0,21,May,Tue
5/18/2022,2022,2,5,18,3,0,21,May,Wed
5/19/2022,2022,2,5,19,4,0,21,May,Thu
5/20/2022,2022,2,5,20,5,0,21,May,Fri
5/21/2022,2022,2,5,21,6,1,21,May,Sat
5/22/2022,2022,2,5,22,7,1,22,May,Sun
5/23/2022,2022,2,5,23,1,0,22,May,Mon
5/24/2022,2022,2,5,24,2,0,22,May,Tue
5/25/2022,2022,2,5,25,3,0,22,May,Wed
5/26/2022,2022,2,5,26,4,0,22,May,Thu
5/27/2022,2022,2,5,27,5,0,22,May,Fri
5/28/2022,2022,2,5,28,6,1,22,May,Sat
5/29/2022,2022,2,5,29,7,1,23,May,Sun
5/30/2022,2022,2,5,30,1,0,23,May,Mon
5/31/2022,2022,2,5,31,2,0,23,May,Tue
6/1/2022,2022,2,6,1,3,0,23,Jun,Wed
6/2/2022,2022,2,6,2,4,0,23,Jun,Thu
6/3/2022,2022,2,6,3,5,0,23,Jun,Fri
6/4/2022,2022,2,6,4,6,1,23,Jun,Sat
6/5/2022,2022,2,6,5,7,1,24,Jun,Sun
6/6/2022,2022,2,6,6,1,0,24,Jun,Mon
6/7/2022,2022,2,6,7,2,0,24,Jun,Tue
6/8/2022,2022,2,6,8,3,0,24,Jun,Wed
6/9/2022,2022,2,6,9,4,0,24,Jun,Thu
6/10/2022,2022,2,6,10,5,0,24,Jun,Fri
6/11/2022,2022,2,6,11,6,1,24,Jun,Sat
6/12/2022,2022,2,6,12,7,1,25,Jun,Sun
6/13/2022,2022,2,6,13,1,0,25,Jun,Mon
6/14/2022,2022,2,6,14,2,0,25,Jun,Tue
6/15/2022,2022,2,6,15,3,0,25,Jun,Wed
6/16/2022,2022,2,6,16,4,0,25,Jun,Thu
6/17/2022,2022,2,6,17,5,0,25,Jun,Fri
6/18/2022,2022,2,6,18,6,1,25,Jun,Sat
6/19/2022,2022,2,6,19,7,1,26,Jun,Sun
6/20/2022,2022,2,6,20,1,0,26,Jun,Mon
6/21/2022,2022,2,6,21,2,0,26,Jun,Tue
6/22/2022,2022,2,6,22,3,0,26,Jun,Wed
6/23/2022,2022,2,6,23,4,0,26,Jun,Thu
6/24/2022,2022,2,6,24,5,0,26,Jun,Fri
6/25/2022,2022,2,6,25,6,1,26,Jun,Sat
6/26/2022,2022,2,6,26,7,1,27,Jun,Sun
6/27/2022,2022,2,6,27,1,0,27,Jun,Mon
6/28/2022,2022,2,6,28,2,0,27,Jun,Tue
6/29/2022,2022,2,6,29,3,0,27,Jun,Wed
6/30/2022,2022,2,6,30,4,0,27,Jun,Thu
7/1/2022,2022,3,7,1,5,0,27,Jul,Fri
7/2/2022,2022,3,7,2,6,1,27,Jul,Sat
7/3/2022,2022,3,7,3,7,1,28,Jul,Sun
7/4/2022,2022,3,7,4,1,0,28,Jul,Mon
7/5/2022,2022,3,7,5,2,0,28,Jul,Tue
7/6/2022,2022,3,7,6,3,0,28,Jul,Wed
7/7/2022,2022,3,7,7,4,0,28,Jul,Thu
7/8/2022,2022,3,7,8,5,0,28,Jul,Fri
7/9/2022,2022,3,7,9,6,1,28,Jul,Sat
7/10/2022,2022,3,7,10,7,1,29,Jul,Sun
7/11/2022,2022,3,7,11,1,0,29,Jul,Mon
7/12/2022,2022,3,7,12,2,0,29,Jul,Tue
7/13/2022,2022,3,7,13,3,0,29,Jul,Wed
7/14/2022,2022,3,7,14,4,0,29,Jul,Thu
7/15/2022,2022,3,7,15,5,0,29,Jul,Fri
7/16/2022,2022,3,7,16,6,1,29,Jul,Sat
7/17/2022,2022,3,7,17,7,1,30,Jul,Sun
7/18/2022,2022,3,7,18,1,0,30,Jul,Mon
7/19/2022,2022,3,7,19,2,0,30,Jul,Tue
7/20/2022,2022,3,7,20,3,0,30,Jul,Wed
7/21/2022,2022,3,7,21,4,0,30,Jul,Thu
7/22/2022,2022,3,7,22,5,0,30,Jul,Fri
7/23/2022,2022,3,7,23,6,1,30,Jul,Sat
7/24/2022,2022,3,7,24,7,1,31,Jul,Sun
7/25/2022,2022,3,7,25,1,0,31,Jul,Mon
7/26/2022,2022,3,7,26,2,0,31,Jul,Tue
7/27/2022,2022,3,7,27,3,0,31,Jul,Wed
7/28/2022,2022,3,7,28,4,0,31,Jul,Thu
7/29/2022,2022,3,7,29,5,0,31,Jul,Fri
7/30/2022,2022,3,7,30,6,1,31,Jul,Sat
7/31/2022,2022,3,7,31,7,1,32,Jul,Sun
8/1/2022,2022,3,8,1,1,0,32,Aug,Mon
8/2/2022,2022,3,8,2,2,0,32,Aug,Tue
8/3/2022,2022,3,8,3,3,0,32,Aug,Wed
8/4/2022,2022,3,8,4,4,0,32,Aug,Thu
8/5/2022,2022,3,8,5,5,0,32,Aug,Fri
8/6/2022,2022,3,8,6,6,1,32,Aug,Sat
8/7/2022,2022,3,8,7,7,1,33,Aug,Sun
8/8/2022,2022,3,8,8,1,0,33,Aug,Mon
8/9/2022,2022,3,8,9,2,0,33,Aug,Tue
8/10/2022,2022,3,8,10,3,0,33,Aug,Wed
8/11/2022,2022,3,8,11,4,0,33,Aug,Thu
8/12/2022,2022,3,8,12,5,0,33,Aug,Fri
8/13/2022,2022,3,8,13,6,1,33,Aug,Sat
8/14/2022,2022,3,8,14,7,1,34,Aug,Sun
8/15/2022,2022,3,8,15,1,0,34,Aug,Mon
8/16/2022,2022,3,8,16,2,0,34,Aug,Tue
8/17/2022,2022,3,8,17,3,0,34,Aug,Wed
8/18/2022,2022,3,8,18,4,0,34,Aug,Thu
8/19/2022,2022,3,8,19,5,0,34,Aug,Fri
8/20/2022,2022,3,8,20,6,1,34,Aug,Sat
8/21/2022,2022,3,8,21,7,1,35,Aug,Sun
8/22/2022,2022,3,8,22,1,0,35,Aug,Mon
8/23/2022,2022,3,8,23,2,0,35,Aug,Tue
8/24/2022,2022,3,8,24,3,0,35,Aug,Wed
8/25/2022,2022,3,8,25,4,0,35,Aug,Thu
8/26/2022,2022,3,8,26,5,0,35,Aug,Fri
8/27/2022,2022,3,8,27,6,1,35,Aug,Sat
8/28/2022,2022,3,8,28,7,1,36,Aug,Sun
8/29/2022,2022,3,8,29,1,0,36,Aug,Mon
8/30/2022,2022,3,8,30,2,0,36,Aug,Tue
8/31/2022,2022,3,8,31,3,0,36,Aug,Wed
9/1/2022,2022,3,9,1,4,0,36,Sep,Thu
9/2/2022,2022,3,9,2,5,0,36,Sep,Fri
9/3/2022,2022,3,9,3,6,1,36,Sep,Sat
9/4/2022,2022,3,9,4,7,1,37,Sep,Sun
9/5/2022,2022,3,9,5,1,0,37,Sep,Mon
9/6/2022,2022,3,9,6,2,0,37,Sep,Tue
9/7/2022,2022,3,9,7,3,0,37,Sep,Wed
9/8/2022,2022,3,9,8,4,0,37,Sep,Thu
9/9/2022,2022,3,9,9,5,0,37,Sep,Fri
9/10/2022,2022,3,9,10,6,1,37,Sep,Sat
9/11/2022,2022,3,9,11,7,1,38,Sep,Sun
9/12/2022,2022,3,9,12,1,0,38,Sep,Mon
9/13/2022,2022,3,9,13,2,0,38,Sep,Tue
9/14/2022,2022,3,9,14,3,0,38,Sep,Wed
9/15/2022,2022,3,9,15,4,0,38,Sep,Thu
9/16/2022,2022,3,9,16,5,0,38,Sep,Fri
9/17/2022,2022,3,9,17,6,1,38,Sep,Sat
9/18/2022,2022,3,9,18,7,1,39,Sep,Sun
9/19/2022,2022,3,9,19,1,0,39,Sep,Mon
9/20/2022,2022,3,9,20,2,0,39,Sep,Tue
9/21/2022,2022,3,9,21,3,0,39,Sep,Wed
9/22/2022,2022,3,9,22,4,0,39,Sep,Thu
9/23/2022,2022,3,9,23,5,0,39,Sep,Fri
9/24/2022,2022,3,9,24,6,1,39,Sep,Sat
9/25/2022,2022,3,9,25,7,1,40,Sep,Sun
9/26/2022,2022,3,9,26,1,0,40,Sep,Mon
9/27/2022,2022,3,9,27,2,0,40,Sep,Tue
9/28/2022,2022,3,9,28,3,0,40,Sep,Wed
9/29/2022,2022,3,9,29,4,0,40,Sep,Thu
9/30/2022,2022,3,9,30,5,0,40,Sep,Fri
10/1/2022,2022,4,10,1,6,1,40,Oct,Sat
10/2/2022,2022,4,10,2,7,1,41,Oct,Sun
10/3/2022,2022,4,10,3,1,0,41,Oct,Mon
10/4/2022,2022,4,10,4,2,0,41,Oct,Tue
10/5/2022,2022,4,10,5,3,0,41,Oct,Wed
10/6/2022,2022,4,10,6,4,0,41,Oct,Thu
10/7/2022,2022,4,10,7,5,0,41,Oct,Fri
10/8/2022,2022,4,10,8,6,1,41,Oct,Sat
10/9/2022,2022,4,10,9,7,1,42,Oct,Sun
10/10/2022,2022,4,10,10,1,0,42,Oct,Mon
10/11/2022,2022,4,10,11,2,0,42,Oct,Tue
10/12/2022,2022,4,10,12,3,0,42,Oct,Wed
10/13/2022,2022,4,10,13,4,0,42,Oct,Thu
10/14/2022,2022,4,10,14,5,0,42,Oct,Fri
10/15/2022,2022,4,10,15,6,1,42,Oct,Sat
10/16/2022,2022,4,10,16,7,1,43,Oct,Sun
10/17/2022,2022,4,10,17,1,0,43,Oct,Mon
10/18/2022,2022,4,10,18,2,0,43,Oct,Tue
10/19/2022,2022,4,10,19,3,0,43,Oct,Wed
10/20/2022,2022,4,10,20,4,0,43,Oct,Thu
10/21/2022,2022,4,10,21,5,0,43,Oct,Fri
10/22/2022,2022,4,10,22,6,1,43,Oct,Sat
10/23/2022,2022,4,10,23,7,1,44,Oct,Sun
10/24/2022,2022,4,10,24,1,0,44,Oct,Mon
10/25/2022,2022,4,10,25,2,0,44,Oct,Tue
10/26/2022,2022,4,10,26,3,0,44,Oct,Wed
10/27/2022,2022,4,10,27,4,0,44,Oct,Thu
10/28/2022,2022,4,10,28,5,0,44,Oct,Fri
10/29/2022,2022,4,10,29,6,1,44,Oct,Sat
10/30/2022,2022,4,10,30,7,1,45,Oct,Sun
10/31/2022,2022,4,10,31,1,0,45,Oct,Mon
11/1/2022,2022,4,11,1,2,0,45,Nov,Tue
11/2/2022,2022,4,11,2,3,0,45,Nov,Wed
11/3/2022,2022,4,11,3,4,0,45,Nov,Thu
11/4/2022,2022,4,11,4,5,0,45,Nov,Fri
11/5/2022,2022,4,11,5,6,1,45,Nov,Sat
11/6/2022,2022,4,11,6,7,1,46,Nov,Sun
11/7/2022,2022,4,11,7,1,0,46,Nov,Mon
11/8/2022,2022,4,11,8,2,0,46,Nov,Tue
11/9/2022,2022,4,11,9,3,0,46,Nov,Wed
11/10/2022,2022,4,11,10,4,0,46,Nov,Thu
11/11/2022,2022,4,11,11,5,0,46,Nov,Fri
11/12/2022,2022,4,11,12,6,1,46,Nov,Sat
11/13/2022,2022,4,11,13,7,1,47,Nov,Sun
11/14/2022,2022,4,11,14,1,0,47,Nov,Mon
11/15/2022,2022,4,11,15,2,0,47,Nov,Tue
11/16/2022,2022,4,11,16,3,0,47,Nov,Wed
11/17/2022,2022,4,11,17,4,0,47,Nov,Thu
11/18/2022,2022,4,11,18,5,0,47,Nov,Fri
11/19/2022,2022,4,11,19,6,1,47,Nov,Sat
11/20/2022,2022,4,11,20,7,1,48,Nov,Sun
11/21/2022,2022,4,11,21,1,0,48,Nov,Mon
11/22/2022,2022,4,11,22,2,0,48,Nov,Tue
11/23/2022,2022,4,11,23,3,0,48,Nov,Wed
11/24/2022,2022,4,11,24,4,0,48,Nov,Thu
11/25/2022,2022,4,11,25,5,0,48,Nov,Fri
11/26/2022,2022,4,11,26,6,1,48,Nov,Sat
11/27/2022,2022,4,11,27,7,1,49,Nov,Sun
11/28/2022,2022,4,11,28,1,0,49,Nov,Mon
11/29/2022,2022,4,11,29,2,0,49,Nov,Tue
11/30/2022,2022,4,11,30,3,0,49,Nov,Wed
12/1/2022,2022,4,12,1,4,0,49,Dec,Thu
12/2/2022,2022,4,12,2,5,0,49,Dec,Fri
12/3/2022,2022,4,12,3,6,1,49,Dec,Sat
12/4/2022,2022,4,12,4,7,1,50,Dec,Sun
12/5/2022,2022,4,12,5,1,0,50,Dec,Mon
12/6/2022,2022,4,12,6,2,0,50,Dec,Tue
12/7/2022,2022,4,12,7,3,0,50,Dec,Wed
12/8/2022,2022,4,12,8,4,0,50,Dec,Thu
12/9/2022,2022,4,12,9,5,0,50,Dec,Fri
12/10/2022,2022,4,12,10,6,1,50,Dec,Sat
12/11/2022,2022,4,12,11,7,1,51,Dec,Sun
12/12/2022,2022,4,12,12,1,0,51,Dec,Mon
12/13/2022,2022,4,12,13,2,0,51,Dec,Tue
12/14/2022,2022,4,12,14,3,0,51,Dec,Wed
12/15/2022,2022,4,12,15,4,0,51,Dec,Thu
12/16/2022,2022,4,12,16,5,0,51,Dec,Fri
12/17/2022,2022,4,12,17,6,1,51,Dec,Sat
12/18/2022,2022,4,12,18,7,1,52,Dec,Sun
12/19/2022,2022,4,12,19,1,0,52,Dec,Mon
12/20/2022,2022,4,12,20,2,0,52,Dec,Tue
12/21/2022,2022,4,12,21,3,0,52,Dec,Wed
12/22/2022,2022,4,12,22,4,0,52,Dec,Thu
12/23/2022,2022,4,12,23,5,0,52,Dec,Fri
12/24/2022,2022,4,12,24,6,1,52,Dec,Sat
12/25/2022,2022,4,12,25,7,1,53,Dec,Sun
12/26/2022,2022,4,12,26,1,0,53,Dec,Mon
12/27/2022,2022,4,12,27,2,0,53,Dec,Tue
12/28/2022,2022,4,12,28,3,0,53,Dec,Wed
12/29/2022,2022,4,12,29,4,0,53,Dec,Thu
12/30/2022,2022,4,12,30,5,0,53,Dec,Fri
12/31/2022,2022,4,12,31,6,1,53,Dec,Sat
1/1/2023,2023,1,1,1,7,1,2,Jan,Sun
1/2/2023,2023,1,1,2,1,0,2,Jan,Mon
1/3/2023,2023,1,1,3,2,0,2,Jan,Tue
1/4/2023,2023,1,1,4,3,0,2,Jan,Wed
1/5/2023,2023,1,1,5,4,0,2,Jan,Thu
1/6/2023,2023,1,1,6,5,0,2,Jan,Fri
1/7/2023,2023,1,1,7,6,1,2,Jan,Sat
1/8/2023,2023,1,1,8,7,1,3,Jan,Sun
1/9/2023,2023,1,1,9,1,0,3,Jan,Mon
1/10/2023,2023,1,1,10,2,0,3,Jan,Tue
1/11/2023,2023,1,1,11,3,0,3,Jan,Wed
1/12/2023,2023,1,1,12,4,0,3,Jan,Thu
1/13/2023,2023,1,1,13,5,0,3,Jan,Fri
1/14/2023,2023,1,1,14,6,1,3,Jan,Sat
1/15/2023,2023,1,1,15,7,1,4,Jan,Sun
1/16/2023,2023,1,1,16,1,0,4,Jan,Mon
1/17/2023,2023,1,1,17,2,0,4,Jan,Tue
1/18/2023,2023,1,1,18,3,0,4,Jan,Wed
1/19/2023,2023,1,1,19,4,0,4,Jan,Thu
1/20/2023,2023,1,1,20,5,0,4,Jan,Fri
1/21/2023,2023,1,1,21,6,1,4,Jan,Sat
1/22/2023,2023,1,1,22,7,1,5,Jan,Sun
1/23/2023,2023,1,1,23,1,0,5,Jan,Mon
1/24/2023,2023,1,1,24,2,0,5,Jan,Tue
1/25/2023,2023,1,1,25,3,0,5,Jan,Wed
1/26/2023,2023,1,1,26,4,0,5,Jan,Thu
1/27/2023,2023,1,1,27,5,0,5,Jan,Fri
1/28/2023,2023,1,1,28,6,1,5,Jan,Sat
1/29/2023,2023,1,1,29,7,1,6,Jan,Sun
1/30/2023,2023,1,1,30,1,0,6,Jan,Mon
1/31/2023,2023,1,1,31,2,0,6,Jan,Tue
2/1/2023,2023,1,2,1,3,0,6,Feb,Wed
2/2/2023,2023,1,2,2,4,0,6,Feb,Thu
2/3/2023,2023,1,2,3,5,0,6,Feb,Fri
2/4/2023,2023,1,2,4,6,1,6,Feb,Sat
2/5/2023,2023,1,2,5,7,1,7,Feb,Sun
2/6/2023,2023,1,2,6,1,0,7,Feb,Mon
2/7/2023,2023,1,2,7,2,0,7,Feb,Tue
2/8/2023,2023,1,2,8,3,0,7,Feb,Wed
2/9/2023,2023,1,2,9,4,0,7,Feb,Thu
2/10/2023,2023,1,2,10,5,0,7,Feb,Fri
2/11/2023,2023,1,2,11,6,1,7,Feb,Sat
2/12/2023,2023,1,2,12,7,1,8,Feb,Sun
2/13/2023,2023,1,2,13,1,0,8,Feb,Mon
2/14/2023,2023,1,2,14,2,0,8,Feb,Tue
2/15/2023,2023,1,2,15,3,0,8,Feb,Wed
2/16/2023,2023,1,2,16,4,0,8,Feb,Thu
2/17/2023,2023,1,2,17,5,0,8,Feb,Fri
2/18/2023,2023,1,2,18,6,1,8,Feb,Sat
2/19/2023,2023,1,2,19,7,1,9,Feb,Sun
2/20/2023,2023,1,2,20,1,0,9,Feb,Mon
2/21/2023,2023,1,2,21,2,0,9,Feb,Tue
2/22/2023,2023,1,2,22,3,0,9,Feb,Wed
2/23/2023,2023,1,2,23,4,0,9,Feb,Thu
2/24/2023,2023,1,2,24,5,0,9,Feb,Fri
2/25/2023,2023,1,2,25,6,1,9,Feb,Sat
2/26/2023,2023,1,2,26,7,1,10,Feb,Sun
2/27/2023,2023,1,2,27,1,0,10,Feb,Mon
2/28/2023,2023,1,2,28,2,0,10,Feb,Tue
3/1/2023,2023,1,3,1,3,0,10,Mar,Wed
3/2/2023,2023,1,3,2,4,0,10,Mar,Thu
3/3/2023,2023,1,3,3,5,0,10,Mar,Fri
3/4/2023,2023,1,3,4,6,1,10,Mar,Sat
3/5/2023,2023,1,3,5,7,1,11,Mar,Sun
3/6/2023,2023,1,3,6,1,0,11,Mar,Mon
3/7/2023,2023,1,3,7,2,0,11,Mar,Tue
3/8/2023,2023,1,3,8,3,0,11,Mar,Wed
3/9/2023,2023,1,3,9,4,0,11,Mar,Thu
3/10/2023,2023,1,3,10,5,0,11,Mar,Fri
3/11/2023,2023,1,3,11,6,1,11,Mar,Sat
3/12/2023,2023,1,3,12,7,1,12,Mar,Sun
3/13/2023,2023,1,3,13,1,0,12,Mar,Mon
3/14/2023,2023,1,3,14,2,0,12,Mar,Tue
3/15/2023,2023,1,3,15,3,0,12,Mar,Wed
3/16/2023,2023,1,3,16,4,0,12,Mar,Thu
3/17/2023,2023,1,3,17,5,0,12,Mar,Fri
3/18/2023,2023,1,3,18,6,1,12,Mar,Sat
3/19/2023,2023,1,3,19,7,1,13,Mar,Sun
3/20/2023,2023,1,3,20,1,0,13,Mar,Mon
3/21/2023,2023,1,3,21,2,0,13,Mar,Tue
3/22/2023,2023,1,3,22,3,0,13,Mar,Wed
3/23/2023,2023,1,3,23,4,0,13,Mar,Thu
3/24/2023,2023,1,3,24,5,0,13,Mar,Fri
3/25/2023,2023,1,3,25,6,1,13,Mar,Sat
3/26/2023,2023,1,3,26,7,1,14,Mar,Sun
3/27/2023,2023,1,3,27,1,0,14,Mar,Mon
3/28/2023,2023,1,3,28,2,0,14,Mar,Tue
3/29/2023,2023,1,3,29,3,0,14,Mar,Wed
3/30/2023,2023,1,3,30,4,0,14,Mar,Thu
3/31/2023,2023,1,3,31,5,0,14,Mar,Fri
4/1/2023,2023,2,4,1,6,1,14,Apr,Sat
4/2/2023,2023,2,4,2,7,1,15,Apr,Sun
4/3/2023,2023,2,4,3,1,0,15,Apr,Mon
4/4/2023,2023,2,4,4,2,0,15,Apr,Tue
4/5/2023,2023,2,4,5,3,0,15,Apr,Wed
4/6/2023,2023,2,4,6,4,0,15,Apr,Thu
4/7/2023,2023,2,4,7,5,0,15,Apr,Fri
4/8/2023,2023,2,4,8,6,1,15,Apr,Sat
4/9/2023,2023,2,4,9,7,1,16,Apr,Sun
4/10/2023,2023,2,4,10,1,0,16,Apr,Mon
4/11/2023,2023,2,4,11,2,0,16,Apr,Tue
4/12/2023,2023,2,4,12,3,0,16,Apr,Wed
4/13/2023,2023,2,4,13,4,0,16,Apr,Thu
4/14/2023,2023,2,4,14,5,0,16,Apr,Fri
4/15/2023,2023,2,4,15,6,1,16,Apr,Sat
4/16/2023,2023,2,4,16,7,1,17,Apr,Sun
4/17/2023,2023,2,4,17,1,0,17,Apr,Mon
4/18/2023,2023,2,4,18,2,0,17,Apr,Tue
4/19/2023,2023,2,4,19,3,0,17,Apr,Wed
4/20/2023,2023,2,4,20,4,0,17,Apr,Thu
4/21/2023,2023,2,4,21,5,0,17,Apr,Fri
4/22/2023,2023,2,4,22,6,1,17,Apr,Sat
4/23/2023,2023,2,4,23,7,1,18,Apr,Sun
4/24/2023,2023,2,4,24,1,0,18,Apr,Mon
4/25/2023,2023,2,4,25,2,0,18,Apr,Tue
4/26/2023,2023,2,4,26,3,0,18,Apr,Wed
4/27/2023,2023,2,4,27,4,0,18,Apr,Thu
4/28/2023,2023,2,4,28,5,0,18,Apr,Fri
4/29/2023,2023,2,4,29,6,1,18,Apr,Sat
4/30/2023,2023,2,4,30,7,1,19,Apr,Sun
5/1/2023,2023,2,5,1,1,0,19,May,Mon
5/2/2023,2023,2,5,2,2,0,19,May,Tue
5/3/2023,2023,2,5,3,3,0,19,May,Wed
5/4/2023,2023,2,5,4,4,0,19,May,Thu
5/5/2023,2023,2,5,5,5,0,19,May,Fri
5/6/2023,2023,2,5,6,6,1,19,May,Sat
5/7/2023,2023,2,5,7,7,1,20,May,Sun
5/8/2023,2023,2,5,8,1,0,20,May,Mon
5/9/2023,2023,2,5,9,2,0,20,May,Tue
5/10/2023,2023,2,5,10,3,0,20,May,Wed
5/11/2023,2023,2,5,11,4,0,20,May,Thu
5/12/2023,2023,2,5,12,5,0,20,May,Fri
5/13/2023,2023,2,5,13,6,1,20,May,Sat
5/14/2023,2023,2,5,14,7,1,21,May,Sun
5/15/2023,2023,2,5,15,1,0,21,May,Mon
5/16/2023,2023,2,5,16,2,0,21,May,Tue
5/17/2023,2023,2,5,17,3,0,21,May,Wed
5/18/2023,2023,2,5,18,4,0,21,May,Thu
5/19/2023,2023,2,5,19,5,0,21,May,Fri
5/20/2023,2023,2,5,20,6,1,21,May,Sat
5/21/2023,2023,2,5,21,7,1,22,May,Sun
5/22/2023,2023,2,5,22,1,0,22,May,Mon
5/23/2023,2023,2,5,23,2,0,22,May,Tue
5/24/2023,2023,2,5,24,3,0,22,May,Wed
5/25/2023,2023,2,5,25,4,0,22,May,Thu
5/26/2023,2023,2,5,26,5,0,22,May,Fri
5/27/2023,2023,2,5,27,6,1,22,May,Sat
5/28/2023,2023,2,5,28,7,1,23,May,Sun
5/29/2023,2023,2,5,29,1,0,23,May,Mon
5/30/2023,2023,2,5,30,2,0,23,May,Tue
5/31/2023,2023,2,5,31,3,0,23,May,Wed
6/1/2023,2023,2,6,1,4,0,23,Jun,Thu
6/2/2023,2023,2,6,2,5,0,23,Jun,Fri
6/3/2023,2023,2,6,3,6,1,23,Jun,Sat
6/4/2023,2023,2,6,4,7,1,24,Jun,Sun
6/5/2023,2023,2,6,5,1,0,24,Jun,Mon
6/6/2023,2023,2,6,6,2,0,24,Jun,Tue
6/7/2023,2023,2,6,7,3,0,24,Jun,Wed
6/8/2023,2023,2,6,8,4,0,24,Jun,Thu
6/9/2023,2023,2,6,9,5,0,24,Jun,Fri
6/10/2023,2023,2,6,10,6,1,24,Jun,Sat
6/11/2023,2023,2,6,11,7,1,25,Jun,Sun
6/12/2023,2023,2,6,12,1,0,25,Jun,Mon
6/13/2023,2023,2,6,13,2,0,25,Jun,Tue
6/14/2023,2023,2,6,14,3,0,25,Jun,Wed
6/15/2023,2023,2,6,15,4,0,25,Jun,Thu
6/16/2023,2023,2,6,16,5,0,25,Jun,Fri
6/17/2023,2023,2,6,17,6,1,25,Jun,Sat
6/18/2023,2023,2,6,18,7,1,26,Jun,Sun
6/19/2023,2023,2,6,19,1,0,26,Jun,Mon
6/20/2023,2023,2,6,20,2,0,26,Jun,Tue
6/21/2023,2023,2,6,21,3,0,26,Jun,Wed
6/22/2023,2023,2,6,22,4,0,26,Jun,Thu
6/23/2023,2023,2,6,23,5,0,26,Jun,Fri
6/24/2023,2023,2,6,24,6,1,26,Jun,Sat
6/25/2023,2023,2,6,25,7,1,27,Jun,Sun
6/26/2023,2023,2,6,26,1,0,27,Jun,Mon
6/27/2023,2023,2,6,27,2,0,27,Jun,Tue
6/28/2023,2023,2,6,28,3,0,27,Jun,Wed
6/29/2023,2023,2,6,29,4,0,27,Jun,Thu
6/30/2023,2023,2,6,30,5,0,27,Jun,Fri
7/1/2023,2023,3,7,1,6,1,27,Jul,Sat
7/2/2023,2023,3,7,2,7,1,28,Jul,Sun
7/3/2023,2023,3,7,3,1,0,28,Jul,Mon
7/4/2023,2023,3,7,4,2,0,28,Jul,Tue
7/5/2023,2023,3,7,5,3,0,28,Jul,Wed
7/6/2023,2023,3,7,6,4,0,28,Jul,Thu
7/7/2023,2023,3,7,7,5,0,28,Jul,Fri
7/8/2023,2023,3,7,8,6,1,28,Jul,Sat
7/9/2023,2023,3,7,9,7,1,29,Jul,Sun
7/10/2023,2023,3,7,10,1,0,29,Jul,Mon
7/11/2023,2023,3,7,11,2,0,29,Jul,Tue
7/12/2023,2023,3,7,12,3,0,29,Jul,Wed
7/13/2023,2023,3,7,13,4,0,29,Jul,Thu
7/14/2023,2023,3,7,14,5,0,29,Jul,Fri
7/15/2023,2023,3,7,15,6,1,29,Jul,Sat
7/16/2023,2023,3,7,16,7,1,30,Jul,Sun
7/17/2023,2023,3,7,17,1,0,30,Jul,Mon
7/18/2023,2023,3,7,18,2,0,30,Jul,Tue
7/19/2023,2023,3,7,19,3,0,30,Jul,Wed
7/20/2023,2023,3,7,20,4,0,30,Jul,Thu
7/21/2023,2023,3,7,21,5,0,30,Jul,Fri
7/22/2023,2023,3,7,22,6,1,30,Jul,Sat
7/23/2023,2023,3,7,23,7,1,31,Jul,Sun
7/24/2023,2023,3,7,24,1,0,31,Jul,Mon
7/25/2023,2023,3,7,25,2,0,31,Jul,Tue
7/26/2023,2023,3,7,26,3,0,31,Jul,Wed
7/27/2023,2023,3,7,27,4,0,31,Jul,Thu
7/28/2023,2023,3,7,28,5,0,31,Jul,Fri
7/29/2023,2023,3,7,29,6,1,31,Jul,Sat
7/30/2023,2023,3,7,30,7,1,32,Jul,Sun
7/31/2023,2023,3,7,31,1,0,32,Jul,Mon
8/1/2023,2023,3,8,1,2,0,32,Aug,Tue
8/2/2023,2023,3,8,2,3,0,32,Aug,Wed
8/3/2023,2023,3,8,3,4,0,32,Aug,Thu
8/4/2023,2023,3,8,4,5,0,32,Aug,Fri
8/5/2023,2023,3,8,5,6,1,32,Aug,Sat
8/6/2023,2023,3,8,6,7,1,33,Aug,Sun
8/7/2023,2023,3,8,7,1,0,33,Aug,Mon
8/8/2023,2023,3,8,8,2,0,33,Aug,Tue
8/9/2023,2023,3,8,9,3,0,33,Aug,Wed
8/10/2023,2023,3,8,10,4,0,33,Aug,Thu
8/11/2023,2023,3,8,11,5,0,33,Aug,Fri
8/12/2023,2023,3,8,12,6,1,33,Aug,Sat
8/13/2023,2023,3,8,13,7,1,34,Aug,Sun
8/14/2023,2023,3,8,14,1,0,34,Aug,Mon
8/15/2023,2023,3,8,15,2,0,34,Aug,Tue
8/16/2023,2023,3,8,16,3,0,34,Aug,Wed
8/17/2023,2023,3,8,17,4,0,34,Aug,Thu
8/18/2023,2023,3,8,18,5,0,34,Aug,Fri
8/19/2023,2023,3,8,19,6,1,34,Aug,Sat
8/20/2023,2023,3,8,20,7,1,35,Aug,Sun
8/21/2023,2023,3,8,21,1,0,35,Aug,Mon
8/22/2023,2023,3,8,22,2,0,35,Aug,Tue
8/23/2023,2023,3,8,23,3,0,35,Aug,Wed
8/24/2023,2023,3,8,24,4,0,35,Aug,Thu
8/25/2023,2023,3,8,25,5,0,35,Aug,Fri
8/26/2023,2023,3,8,26,6,1,35,Aug,Sat
8/27/2023,2023,3,8,27,7,1,36,Aug,Sun
8/28/2023,2023,3,8,28,1,0,36,Aug,Mon
8/29/2023,2023,3,8,29,2,0,36,Aug,Tue
8/30/2023,2023,3,8,30,3,0,36,Aug,Wed
8/31/2023,2023,3,8,31,4,0,36,Aug,Thu
9/1/2023,2023,3,9,1,5,0,36,Sep,Fri
9/2/2023,2023,3,9,2,6,1,36,Sep,Sat
9/3/2023,2023,3,9,3,7,1,37,Sep,Sun
9/4/2023,2023,3,9,4,1,0,37,Sep,Mon
9/5/2023,2023,3,9,5,2,0,37,Sep,Tue
9/6/2023,2023,3,9,6,3,0,37,Sep,Wed
9/7/2023,2023,3,9,7,4,0,37,Sep,Thu
9/8/2023,2023,3,9,8,5,0,37,Sep,Fri
9/9/2023,2023,3,9,9,6,1,37,Sep,Sat
9/10/2023,2023,3,9,10,7,1,38,Sep,Sun
9/11/2023,2023,3,9,11,1,0,38,Sep,Mon
9/12/2023,2023,3,9,12,2,0,38,Sep,Tue
9/13/2023,2023,3,9,13,3,0,38,Sep,Wed
9/14/2023,2023,3,9,14,4,0,38,Sep,Thu
9/15/2023,2023,3,9,15,5,0,38,Sep,Fri
9/16/2023,2023,3,9,16,6,1,38,Sep,Sat
9/17/2023,2023,3,9,17,7,1,39,Sep,Sun
9/18/2023,2023,3,9,18,1,0,39,Sep,Mon
9/19/2023,2023,3,9,19,2,0,39,Sep,Tue
9/20/2023,2023,3,9,20,3,0,39,Sep,Wed
9/21/2023,2023,3,9,21,4,0,39,Sep,Thu
9/22/2023,2023,3,9,22,5,0,39,Sep,Fri
9/23/2023,2023,3,9,23,6,1,39,Sep,Sat
9/24/2023,2023,3,9,24,7,1,40,Sep,Sun
9/25/2023,2023,3,9,25,1,0,40,Sep,Mon
9/26/2023,2023,3,9,26,2,0,40,Sep,Tue
9/27/2023,2023,3,9,27,3,0,40,Sep,Wed
9/28/2023,2023,3,9,28,4,0,40,Sep,Thu
9/29/2023,2023,3,9,29,5,0,40,Sep,Fri
9/30/2023,2023,3,9,30,6,1,40,Sep,Sat
10/1/2023,2023,4,10,1,7,1,41,Oct,Sun
10/2/2023,2023,4,10,2,1,0,41,Oct,Mon
10/3/2023,2023,4,10,3,2,0,41,Oct,Tue
10/4/2023,2023,4,10,4,3,0,41,Oct,Wed
10/5/2023,2023,4,10,5,4,0,41,Oct,Thu
10/6/2023,2023,4,10,6,5,0,41,Oct,Fri
10/7/2023,2023,4,10,7,6,1,41,Oct,Sat
10/8/2023,2023,4,10,8,7,1,42,Oct,Sun
10/9/2023,2023,4,10,9,1,0,42,Oct,Mon
10/10/2023,2023,4,10,10,2,0,42,Oct,Tue
10/11/2023,2023,4,10,11,3,0,42,Oct,Wed
10/12/2023,2023,4,10,12,4,0,42,Oct,Thu
10/13/2023,2023,4,10,13,5,0,42,Oct,Fri
10/14/2023,2023,4,10,14,6,1,42,Oct,Sat
10/15/2023,2023,4,10,15,7,1,43,Oct,Sun
10/16/2023,2023,4,10,16,1,0,43,Oct,Mon
10/17/2023,2023,4,10,17,2,0,43,Oct,Tue
10/18/2023,2023,4,10,18,3,0,43,Oct,Wed
10/19/2023,2023,4,10,19,4,0,43,Oct,Thu
10/20/2023,2023,4,10,20,5,0,43,Oct,Fri
10/21/2023,2023,4,10,21,6,1,43,Oct,Sat
10/22/2023,2023,4,10,22,7,1,44,Oct,Sun
10/23/2023,2023,4,10,23,1,0,44,Oct,Mon
10/24/2023,2023,4,10,24,2,0,44,Oct,Tue
10/25/2023,2023,4,10,25,3,0,44,Oct,Wed
10/26/2023,2023,4,10,26,4,0,44,Oct,Thu
10/27/2023,2023,4,10,27,5,0,44,Oct,Fri
10/28/2023,2023,4,10,28,6,1,44,Oct,Sat
10/29/2023,2023,4,10,29,7,1,45,Oct,Sun
10/30/2023,2023,4,10,30,1,0,45,Oct,Mon
10/31/2023,2023,4,10,31,2,0,45,Oct,Tue
11/1/2023,2023,4,11,1,3,0,45,Nov,Wed
11/2/2023,2023,4,11,2,4,0,45,Nov,Thu
11/3/2023,2023,4,11,3,5,0,45,Nov,Fri
11/4/2023,2023,4,11,4,6,1,45,Nov,Sat
11/5/2023,2023,4,11,5,7,1,46,Nov,Sun
11/6/2023,2023,4,11,6,1,0,46,Nov,Mon
11/7/2023,2023,4,11,7,2,0,46,Nov,Tue
11/8/2023,2023,4,11,8,3,0,46,Nov,Wed
11/9/2023,2023,4,11,9,4,0,46,Nov,Thu
11/10/2023,2023,4,11,10,5,0,46,Nov,Fri
11/11/2023,2023,4,11,11,6,1,46,Nov,Sat
11/12/2023,2023,4,11,12,7,1,47,Nov,Sun
11/13/2023,2023,4,11,13,1,0,47,Nov,Mon
11/14/2023,2023,4,11,14,2,0,47,Nov,Tue
11/15/2023,2023,4,11,15,3,0,47,Nov,Wed
11/16/2023,2023,4,11,16,4,0,47,Nov,Thu
11/17/2023,2023,4,11,17,5,0,47,Nov,Fri
11/18/2023,2023,4,11,18,6,1,47,Nov,Sat
11/19/2023,2023,4,11,19,7,1,48,Nov,Sun
11/20/2023,2023,4,11,20,1,0,48,Nov,Mon
11/21/2023,2023,4,11,21,2,0,48,Nov,Tue
11/22/2023,2023,4,11,22,3,0,48,Nov,Wed
11/23/2023,2023,4,11,23,4,0,48,Nov,Thu
11/24/2023,2023,4,11,24,5,0,48,Nov,Fri
11/25/2023,2023,4,11,25,6,1,48,Nov,Sat
11/26/2023,2023,4,11,26,7,1,49,Nov,Sun
11/27/2023,2023,4,11,27,1,0,49,Nov,Mon
11/28/2023,2023,4,11,28,2,0,49,Nov,Tue
11/29/2023,2023,4,11,29,3,0,49,Nov,Wed
11/30/2023,2023,4,11,30,4,0,49,Nov,Thu
12/1/2023,2023,4,12,1,5,0,49,Dec,Fri
12/2/2023,2023,4,12,2,6,1,49,Dec,Sat
12/3/2023,2023,4,12,3,7,1,50,Dec,Sun
12/4/2023,2023,4,12,4,1,0,50,Dec,Mon
12/5/2023,2023,4,12,5,2,0,50,Dec,Tue
12/6/2023,2023,4,12,6,3,0,50,Dec,Wed
12/7/2023,2023,4,12,7,4,0,50,Dec,Thu
12/8/2023,2023,4,12,8,5,0,50,Dec,Fri
12/9/2023,2023,4,12,9,6,1,50,Dec,Sat
12/10/2023,2023,4,12,10,7,1,51,Dec,Sun
12/11/2023,2023,4,12,11,1,0,51,Dec,Mon
12/12/2023,2023,4,12,12,2,0,51,Dec,Tue
12/13/2023,2023,4,12,13,3,0,51,Dec,Wed
12/14/2023,2023,4,12,14,4,0,51,Dec,Thu
12/15/2023,2023,4,12,15,5,0,51,Dec,Fri
12/16/2023,2023,4,12,16,6,1,51,Dec,Sat
12/17/2023,2023,4,12,17,7,1,52,Dec,Sun
12/18/2023,2023,4,12,18,1,0,52,Dec,Mon
12/19/2023,2023,4,12,19,2,0,52,Dec,Tue
12/20/2023,2023,4,12,20,3,0,52,Dec,Wed
12/21/2023,2023,4,12,21,4,0,52,Dec,Thu
12/22/2023,2023,4,12,22,5,0,52,Dec,Fri
12/23/2023,2023,4,12,23,6,1,52,Dec,Sat
12/24/2023,2023,4,12,24,7,1,53,Dec,Sun
12/25/2023,2023,4,12,25,1,0,53,Dec,Mon
12/26/2023,2023,4,12,26,2,0,53,Dec,Tue
12/27/2023,2023,4,12,27,3,0,53,Dec,Wed
12/28/2023,2023,4,12,28,4,0,53,Dec,Thu
12/29/2023,2023,4,12,29,5,0,53,Dec,Fri
12/30/2023,2023,4,12,30,6,1,53,Dec,Sat
12/31/2023,2023,4,12,31,7,1,54,Dec,Sun
1/1/2024,2024,1,1,1,1,0,1,Jan,Mon
1/2/2024,2024,1,1,2,2,0,1,Jan,Tue
1/3/2024,2024,1,1,3,3,0,1,Jan,Wed
1/4/2024,2024,1,1,4,4,0,1,Jan,Thu
1/5/2024,2024,1,1,5,5,0,1,Jan,Fri
1/6/2024,2024,1,1,6,6,1,1,Jan,Sat
1/7/2024,2024,1,1,7,7,1,2,Jan,Sun
1/8/2024,2024,1,1,8,1,0,2,Jan,Mon
1/9/2024,2024,1,1,9,2,0,2,Jan,Tue
1/10/2024,2024,1,1,10,3,0,2,Jan,Wed
1/11/2024,2024,1,1,11,4,0,2,Jan,Thu
1/12/2024,2024,1,1,12,5,0,2,Jan,Fri
1/13/2024,2024,1,1,13,6,1,2,Jan,Sat
1/14/2024,2024,1,1,14,7,1,3,Jan,Sun
1/15/2024,2024,1,1,15,1,0,3,Jan,Mon
1/16/2024,2024,1,1,16,2,0,3,Jan,Tue
1/17/2024,2024,1,1,17,3,0,3,Jan,Wed
1/18/2024,2024,1,1,18,4,0,3,Jan,Thu
1/19/2024,2024,1,1,19,5,0,3,Jan,Fri
1/20/2024,2024,1,1,20,6,1,3,Jan,Sat
1/21/2024,2024,1,1,21,7,1,4,Jan,Sun
1/22/2024,2024,1,1,22,1,0,4,Jan,Mon
1/23/2024,2024,1,1,23,2,0,4,Jan,Tue
1/24/2024,2024,1,1,24,3,0,4,Jan,Wed
1/25/2024,2024,1,1,25,4,0,4,Jan,Thu
1/26/2024,2024,1,1,26,5,0,4,Jan,Fri
1/27/2024,2024,1,1,27,6,1,4,Jan,Sat
1/28/2024,2024,1,1,28,7,1,5,Jan,Sun
1/29/2024,2024,1,1,29,1,0,5,Jan,Mon
1/30/2024,2024,1,1,30,2,0,5,Jan,Tue
1/31/2024,2024,1,1,31,3,0,5,Jan,Wed
2/1/2024,2024,1,2,1,4,0,5,Feb,Thu
2/2/2024,2024,1,2,2,5,0,5,Feb,Fri
2/3/2024,2024,1,2,3,6,1,5,Feb,Sat
2/4/2024,2024,1,2,4,7,1,6,Feb,Sun
2/5/2024,2024,1,2,5,1,0,6,Feb,Mon
2/6/2024,2024,1,2,6,2,0,6,Feb,Tue
2/7/2024,2024,1,2,7,3,0,6,Feb,Wed
2/8/2024,2024,1,2,8,4,0,6,Feb,Thu
2/9/2024,2024,1,2,9,5,0,6,Feb,Fri
2/10/2024,2024,1,2,10,6,1,6,Feb,Sat
2/11/2024,2024,1,2,11,7,1,7,Feb,Sun
2/12/2024,2024,1,2,12,1,0,7,Feb,Mon
2/13/2024,2024,1,2,13,2,0,7,Feb,Tue
2/14/2024,2024,1,2,14,3,0,7,Feb,Wed
2/15/2024,2024,1,2,15,4,0,7,Feb,Thu
2/16/2024,2024,1,2,16,5,0,7,Feb,Fri
2/17/2024,2024,1,2,17,6,1,7,Feb,Sat
2/18/2024,2024,1,2,18,7,1,8,Feb,Sun
2/19/2024,2024,1,2,19,1,0,8,Feb,Mon
2/20/2024,2024,1,2,20,2,0,8,Feb,Tue
2/21/2024,2024,1,2,21,3,0,8,Feb,Wed
2/22/2024,2024,1,2,22,4,0,8,Feb,Thu
2/23/2024,2024,1,2,23,5,0,8,Feb,Fri
2/24/2024,2024,1,2,24,6,1,8,Feb,Sat
2/25/2024,2024,1,2,25,7,1,9,Feb,Sun
2/26/2024,2024,1,2,26,1,0,9,Feb,Mon
2/27/2024,2024,1,2,27,2,0,9,Feb,Tue
2/28/2024,2024,1,2,28,3,0,9,Feb,Wed
2/29/2024,2024,1,2,29,4,0,9,Feb,Thu
3/1/2024,2024,1,3,1,5,0,9,Mar,Fri
3/2/2024,2024,1,3,2,6,1,9,Mar,Sat
3/3/2024,2024,1,3,3,7,1,10,Mar,Sun
3/4/2024,2024,1,3,4,1,0,10,Mar,Mon
3/5/2024,2024,1,3,5,2,0,10,Mar,Tue
3/6/2024,2024,1,3,6,3,0,10,Mar,Wed
3/7/2024,2024,1,3,7,4,0,10,Mar,Thu
3/8/2024,2024,1,3,8,5,0,10,Mar,Fri
3/9/2024,2024,1,3,9,6,1,10,Mar,Sat
3/10/2024,2024,1,3,10,7,1,11,Mar,Sun
3/11/2024,2024,1,3,11,1,0,11,Mar,Mon
3/12/2024,2024,1,3,12,2,0,11,Mar,Tue
3/13/2024,2024,1,3,13,3,0,11,Mar,Wed
3/14/2024,2024,1,3,14,4,0,11,Mar,Thu
3/15/2024,2024,1,3,15,5,0,11,Mar,Fri
3/16/2024,2024,1,3,16,6,1,11,Mar,Sat
3/17/2024,2024,1,3,17,7,1,12,Mar,Sun
3/18/2024,2024,1,3,18,1,0,12,Mar,Mon
3/19/2024,2024,1,3,19,2,0,12,Mar,Tue
3/20/2024,2024,1,3,20,3,0,12,Mar,Wed
3/21/2024,2024,1,3,21,4,0,12,Mar,Thu
3/22/2024,2024,1,3,22,5,0,12,Mar,Fri
3/23/2024,2024,1,3,23,6,1,12,Mar,Sat
3/24/2024,2024,1,3,24,7,1,13,Mar,Sun
3/25/2024,2024,1,3,25,1,0,13,Mar,Mon
3/26/2024,2024,1,3,26,2,0,13,Mar,Tue
3/27/2024,2024,1,3,27,3,0,13,Mar,Wed
3/28/2024,2024,1,3,28,4,0,13,Mar,Thu
3/29/2024,2024,1,3,29,5,0,13,Mar,Fri
3/30/2024,2024,1,3,30,6,1,13,Mar,Sat
3/31/2024,2024,1,3,31,7,1,14,Mar,Sun
4/1/2024,2024,2,4,1,1,0,14,Apr,Mon
4/2/2024,2024,2,4,2,2,0,14,Apr,Tue
4/3/2024,2024,2,4,3,3,0,14,Apr,Wed
4/4/2024,2024,2,4,4,4,0,14,Apr,Thu
4/5/2024,2024,2,4,5,5,0,14,Apr,Fri
4/6/2024,2024,2,4,6,6,1,14,Apr,Sat
4/7/2024,2024,2,4,7,7,1,15,Apr,Sun
4/8/2024,2024,2,4,8,1,0,15,Apr,Mon
4/9/2024,2024,2,4,9,2,0,15,Apr,Tue
4/10/2024,2024,2,4,10,3,0,15,Apr,Wed
4/11/2024,2024,2,4,11,4,0,15,Apr,Thu
4/12/2024,2024,2,4,12,5,0,15,Apr,Fri
4/13/2024,2024,2,4,13,6,1,15,Apr,Sat
4/14/2024,2024,2,4,14,7,1,16,Apr,Sun
4/15/2024,2024,2,4,15,1,0,16,Apr,Mon
4/16/2024,2024,2,4,16,2,0,16,Apr,Tue
4/17/2024,2024,2,4,17,3,0,16,Apr,Wed
4/18/2024,2024,2,4,18,4,0,16,Apr,Thu
4/19/2024,2024,2,4,19,5,0,16,Apr,Fri
4/20/2024,2024,2,4,20,6,1,16,Apr,Sat
4/21/2024,2024,2,4,21,7,1,17,Apr,Sun
4/22/2024,2024,2,4,22,1,0,17,Apr,Mon
4/23/2024,2024,2,4,23,2,0,17,Apr,Tue
4/24/2024,2024,2,4,24,3,0,17,Apr,Wed
4/25/2024,2024,2,4,25,4,0,17,Apr,Thu
4/26/2024,2024,2,4,26,5,0,17,Apr,Fri
4/27/2024,2024,2,4,27,6,1,17,Apr,Sat
4/28/2024,2024,2,4,28,7,1,18,Apr,Sun
4/29/2024,2024,2,4,29,1,0,18,Apr,Mon
4/30/2024,2024,2,4,30,2,0,18,Apr,Tue
5/1/2024,2024,2,5,1,3,0,18,May,Wed
5/2/2024,2024,2,5,2,4,0,18,May,Thu
5/3/2024,2024,2,5,3,5,0,18,May,Fri
5/4/2024,2024,2,5,4,6,1,18,May,Sat
5/5/2024,2024,2,5,5,7,1,19,May,Sun
5/6/2024,2024,2,5,6,1,0,19,May,Mon
5/7/2024,2024,2,5,7,2,0,19,May,Tue
5/8/2024,2024,2,5,8,3,0,19,May,Wed
5/9/2024,2024,2,5,9,4,0,19,May,Thu
5/10/2024,2024,2,5,10,5,0,19,May,Fri
5/11/2024,2024,2,5,11,6,1,19,May,Sat
5/12/2024,2024,2,5,12,7,1,20,May,Sun
5/13/2024,2024,2,5,13,1,0,20,May,Mon
5/14/2024,2024,2,5,14,2,0,20,May,Tue
5/15/2024,2024,2,5,15,3,0,20,May,Wed
5/16/2024,2024,2,5,16,4,0,20,May,Thu
5/17/2024,2024,2,5,17,5,0,20,May,Fri
5/18/2024,2024,2,5,18,6,1,20,May,Sat
5/19/2024,2024,2,5,19,7,1,21,May,Sun
5/20/2024,2024,2,5,20,1,0,21,May,Mon
5/21/2024,2024,2,5,21,2,0,21,May,Tue
5/22/2024,2024,2,5,22,3,0,21,May,Wed
5/23/2024,2024,2,5,23,4,0,21,May,Thu
5/24/2024,2024,2,5,24,5,0,21,May,Fri
5/25/2024,2024,2,5,25,6,1,21,May,Sat
5/26/2024,2024,2,5,26,7,1,22,May,Sun
5/27/2024,2024,2,5,27,1,0,22,May,Mon
5/28/2024,2024,2,5,28,2,0,22,May,Tue
5/29/2024,2024,2,5,29,3,0,22,May,Wed
5/30/2024,2024,2,5,30,4,0,22,May,Thu
5/31/2024,2024,2,5,31,5,0,22,May,Fri
6/1/2024,2024,2,6,1,6,1,22,Jun,Sat
6/2/2024,2024,2,6,2,7,1,23,Jun,Sun
6/3/2024,2024,2,6,3,1,0,23,Jun,Mon
6/4/2024,2024,2,6,4,2,0,23,Jun,Tue
6/5/2024,2024,2,6,5,3,0,23,Jun,Wed
6/6/2024,2024,2,6,6,4,0,23,Jun,Thu
6/7/2024,2024,2,6,7,5,0,23,Jun,Fri
6/8/2024,2024,2,6,8,6,1,23,Jun,Sat
6/9/2024,2024,2,6,9,7,1,24,Jun,Sun
6/10/2024,2024,2,6,10,1,0,24,Jun,Mon
6/11/2024,2024,2,6,11,2,0,24,Jun,Tue
6/12/2024,2024,2,6,12,3,0,24,Jun,Wed
6/13/2024,2024,2,6,13,4,0,24,Jun,Thu
6/14/2024,2024,2,6,14,5,0,24,Jun,Fri
6/15/2024,2024,2,6,15,6,1,24,Jun,Sat
6/16/2024,2024,2,6,16,7,1,25,Jun,Sun
6/17/2024,2024,2,6,17,1,0,25,Jun,Mon
6/18/2024,2024,2,6,18,2,0,25,Jun,Tue
6/19/2024,2024,2,6,19,3,0,25,Jun,Wed
6/20/2024,2024,2,6,20,4,0,25,Jun,Thu
6/21/2024,2024,2,6,21,5,0,25,Jun,Fri
6/22/2024,2024,2,6,22,6,1,25,Jun,Sat
6/23/2024,2024,2,6,23,7,1,26,Jun,Sun
6/24/2024,2024,2,6,24,1,0,26,Jun,Mon
6/25/2024,2024,2,6,25,2,0,26,Jun,Tue
6/26/2024,2024,2,6,26,3,0,26,Jun,Wed
6/27/2024,2024,2,6,27,4,0,26,Jun,Thu
6/28/2024,2024,2,6,28,5,0,26,Jun,Fri
6/29/2024,2024,2,6,29,6,1,26,Jun,Sat
6/30/2024,2024,2,6,30,7,1,27,Jun,Sun
7/1/2024,2024,3,7,1,1,0,27,Jul,Mon
7/2/2024,2024,3,7,2,2,0,27,Jul,Tue
7/3/2024,2024,3,7,3,3,0,27,Jul,Wed
7/4/2024,2024,3,7,4,4,0,27,Jul,Thu
7/5/2024,2024,3,7,5,5,0,27,Jul,Fri
7/6/2024,2024,3,7,6,6,1,27,Jul,Sat
7/7/2024,2024,3,7,7,7,1,28,Jul,Sun
7/8/2024,2024,3,7,8,1,0,28,Jul,Mon
7/9/2024,2024,3,7,9,2,0,28,Jul,Tue
7/10/2024,2024,3,7,10,3,0,28,Jul,Wed
7/11/2024,2024,3,7,11,4,0,28,Jul,Thu
7/12/2024,2024,3,7,12,5,0,28,Jul,Fri
7/13/2024,2024,3,7,13,6,1,28,Jul,Sat
7/14/2024,2024,3,7,14,7,1,29,Jul,Sun
7/15/2024,2024,3,7,15,1,0,29,Jul,Mon
7/16/2024,2024,3,7,16,2,0,29,Jul,Tue
7/17/2024,2024,3,7,17,3,0,29,Jul,Wed
7/18/2024,2024,3,7,18,4,0,29,Jul,Thu
7/19/2024,2024,3,7,19,5,0,29,Jul,Fri
7/20/2024,2024,3,7,20,6,1,29,Jul,Sat
7/21/2024,2024,3,7,21,7,1,30,Jul,Sun
7/22/2024,2024,3,7,22,1,0,30,Jul,Mon
7/23/2024,2024,3,7,23,2,0,30,Jul,Tue
7/24/2024,2024,3,7,24,3,0,30,Jul,Wed
7/25/2024,2024,3,7,25,4,0,30,Jul,Thu
7/26/2024,2024,3,7,26,5,0,30,Jul,Fri
7/27/2024,2024,3,7,27,6,1,30,Jul,Sat
7/28/2024,2024,3,7,28,7,1,31,Jul,Sun
7/29/2024,2024,3,7,29,1,0,31,Jul,Mon
7/30/2024,2024,3,7,30,2,0,31,Jul,Tue
7/31/2024,2024,3,7,31,3,0,31,Jul,Wed
8/1/2024,2024,3,8,1,4,0,31,Aug,Thu
8/2/2024,2024,3,8,2,5,0,31,Aug,Fri
8/3/2024,2024,3,8,3,6,1,31,Aug,Sat
8/4/2024,2024,3,8,4,7,1,32,Aug,Sun
8/5/2024,2024,3,8,5,1,0,32,Aug,Mon
8/6/2024,2024,3,8,6,2,0,32,Aug,Tue
8/7/2024,2024,3,8,7,3,0,32,Aug,Wed
8/8/2024,2024,3,8,8,4,0,32,Aug,Thu
8/9/2024,2024,3,8,9,5,0,32,Aug,Fri
8/10/2024,2024,3,8,10,6,1,32,Aug,Sat
8/11/2024,2024,3,8,11,7,1,33,Aug,Sun
8/12/2024,2024,3,8,12,1,0,33,Aug,Mon
8/13/2024,2024,3,8,13,2,0,33,Aug,Tue
8/14/2024,2024,3,8,14,3,0,33,Aug,Wed
8/15/2024,2024,3,8,15,4,0,33,Aug,Thu
8/16/2024,2024,3,8,16,5,0,33,Aug,Fri
8/17/2024,2024,3,8,17,6,1,33,Aug,Sat
8/18/2024,2024,3,8,18,7,1,34,Aug,Sun
8/19/2024,2024,3,8,19,1,0,34,Aug,Mon
8/20/2024,2024,3,8,20,2,0,34,Aug,Tue
8/21/2024,2024,3,8,21,3,0,34,Aug,Wed
8/22/2024,2024,3,8,22,4,0,34,Aug,Thu
8/23/2024,2024,3,8,23,5,0,34,Aug,Fri
8/24/2024,2024,3,8,24,6,1,34,Aug,Sat
8/25/2024,2024,3,8,25,7,1,35,Aug,Sun
8/26/2024,2024,3,8,26,1,0,35,Aug,Mon
8/27/2024,2024,3,8,27,2,0,35,Aug,Tue
8/28/2024,2024,3,8,28,3,0,35,Aug,Wed
8/29/2024,2024,3,8,29,4,0,35,Aug,Thu
8/30/2024,2024,3,8,30,5,0,35,Aug,Fri
8/31/2024,2024,3,8,31,6,1,35,Aug,Sat
9/1/2024,2024,3,9,1,7,1,36,Sep,Sun
9/2/2024,2024,3,9,2,1,0,36,Sep,Mon
9/3/2024,2024,3,9,3,2,0,36,Sep,Tue
9/4/2024,2024,3,9,4,3,0,36,Sep,Wed
9/5/2024,2024,3,9,5,4,0,36,Sep,Thu
9/6/2024,2024,3,9,6,5,0,36,Sep,Fri
9/7/2024,2024,3,9,7,6,1,36,Sep,Sat
9/8/2024,2024,3,9,8,7,1,37,Sep,Sun
9/9/2024,2024,3,9,9,1,0,37,Sep,Mon
9/10/2024,2024,3,9,10,2,0,37,Sep,Tue
9/11/2024,2024,3,9,11,3,0,37,Sep,Wed
9/12/2024,2024,3,9,12,4,0,37,Sep,Thu
9/13/2024,2024,3,9,13,5,0,37,Sep,Fri
9/14/2024,2024,3,9,14,6,1,37,Sep,Sat
9/15/2024,2024,3,9,15,7,1,38,Sep,Sun
9/16/2024,2024,3,9,16,1,0,38,Sep,Mon
9/17/2024,2024,3,9,17,2,0,38,Sep,Tue
9/18/2024,2024,3,9,18,3,0,38,Sep,Wed
9/19/2024,2024,3,9,19,4,0,38,Sep,Thu
9/20/2024,2024,3,9,20,5,0,38,Sep,Fri
9/21/2024,2024,3,9,21,6,1,38,Sep,Sat
9/22/2024,2024,3,9,22,7,1,39,Sep,Sun
9/23/2024,2024,3,9,23,1,0,39,Sep,Mon
9/24/2024,2024,3,9,24,2,0,39,Sep,Tue
9/25/2024,2024,3,9,25,3,0,39,Sep,Wed
9/26/2024,2024,3,9,26,4,0,39,Sep,Thu
9/27/2024,2024,3,9,27,5,0,39,Sep,Fri
9/28/2024,2024,3,9,28,6,1,39,Sep,Sat
9/29/2024,2024,3,9,29,7,1,40,Sep,Sun
9/30/2024,2024,3,9,30,1,0,40,Sep,Mon
10/1/2024,2024,4,10,1,2,0,40,Oct,Tue
10/2/2024,2024,4,10,2,3,0,40,Oct,Wed
10/3/2024,2024,4,10,3,4,0,40,Oct,Thu
10/4/2024,2024,4,10,4,5,0,40,Oct,Fri
10/5/2024,2024,4,10,5,6,1,40,Oct,Sat
10/6/2024,2024,4,10,6,7,1,41,Oct,Sun
10/7/2024,2024,4,10,7,1,0,41,Oct,Mon
10/8/2024,2024,4,10,8,2,0,41,Oct,Tue
10/9/2024,2024,4,10,9,3,0,41,Oct,Wed
10/10/2024,2024,4,10,10,4,0,41,Oct,Thu
10/11/2024,2024,4,10,11,5,0,41,Oct,Fri
10/12/2024,2024,4,10,12,6,1,41,Oct,Sat
10/13/2024,2024,4,10,13,7,1,42,Oct,Sun
10/14/2024,2024,4,10,14,1,0,42,Oct,Mon
10/15/2024,2024,4,10,15,2,0,42,Oct,Tue
10/16/2024,2024,4,10,16,3,0,42,Oct,Wed
10/17/2024,2024,4,10,17,4,0,42,Oct,Thu
10/18/2024,2024,4,10,18,5,0,42,Oct,Fri
10/19/2024,2024,4,10,19,6,1,42,Oct,Sat
10/20/2024,2024,4,10,20,7,1,43,Oct,Sun
10/21/2024,2024,4,10,21,1,0,43,Oct,Mon
10/22/2024,2024,4,10,22,2,0,43,Oct,Tue
10/23/2024,2024,4,10,23,3,0,43,Oct,Wed
10/24/2024,2024,4,10,24,4,0,43,Oct,Thu
10/25/2024,2024,4,10,25,5,0,43,Oct,Fri
10/26/2024,2024,4,10,26,6,1,43,Oct,Sat
10/27/2024,2024,4,10,27,7,1,44,Oct,Sun
10/28/2024,2024,4,10,28,1,0,44,Oct,Mon
10/29/2024,2024,4,10,29,2,0,44,Oct,Tue
10/30/2024,2024,4,10,30,3,0,44,Oct,Wed
10/31/2024,2024,4,10,31,4,0,44,Oct,Thu
11/1/2024,2024,4,11,1,5,0,44,Nov,Fri
11/2/2024,2024,4,11,2,6,1,44,Nov,Sat
11/3/2024,2024,4,11,3,7,1,45,Nov,Sun
11/4/2024,2024,4,11,4,1,0,45,Nov,Mon
11/5/2024,2024,4,11,5,2,0,45,Nov,Tue
11/6/2024,2024,4,11,6,3,0,45,Nov,Wed
11/7/2024,2024,4,11,7,4,0,45,Nov,Thu
11/8/2024,2024,4,11,8,5,0,45,Nov,Fri
11/9/2024,2024,4,11,9,6,1,45,Nov,Sat
11/10/2024,2024,4,11,10,7,1,46,Nov,Sun
11/11/2024,2024,4,11,11,1,0,46,Nov,Mon
11/12/2024,2024,4,11,12,2,0,46,Nov,Tue
11/13/2024,2024,4,11,13,3,0,46,Nov,Wed
11/14/2024,2024,4,11,14,4,0,46,Nov,Thu
11/15/2024,2024,4,11,15,5,0,46,Nov,Fri
11/16/2024,2024,4,11,16,6,1,46,Nov,Sat
11/17/2024,2024,4,11,17,7,1,47,Nov,Sun
11/18/2024,2024,4,11,18,1,0,47,Nov,Mon
11/19/2024,2024,4,11,19,2,0,47,Nov,Tue
11/20/2024,2024,4,11,20,3,0,47,Nov,Wed
11/21/2024,2024,4,11,21,4,0,47,Nov,Thu
11/22/2024,2024,4,11,22,5,0,47,Nov,Fri
11/23/2024,2024,4,11,23,6,1,47,Nov,Sat
11/24/2024,2024,4,11,24,7,1,48,Nov,Sun
11/25/2024,2024,4,11,25,1,0,48,Nov,Mon
11/26/2024,2024,4,11,26,2,0,48,Nov,Tue
11/27/2024,2024,4,11,27,3,0,48,Nov,Wed
11/28/2024,2024,4,11,28,4,0,48,Nov,Thu
11/29/2024,2024,4,11,29,5,0,48,Nov,Fri
11/30/2024,2024,4,11,30,6,1,48,Nov,Sat
12/1/2024,2024,4,12,1,7,1,49,Dec,Sun
12/2/2024,2024,4,12,2,1,0,49,Dec,Mon
12/3/2024,2024,4,12,3,2,0,49,Dec,Tue
12/4/2024,2024,4,12,4,3,0,49,Dec,Wed
12/5/2024,2024,4,12,5,4,0,49,Dec,Thu
12/6/2024,2024,4,12,6,5,0,49,Dec,Fri
12/7/2024,2024,4,12,7,6,1,49,Dec,Sat
12/8/2024,2024,4,12,8,7,1,50,Dec,Sun
12/9/2024,2024,4,12,9,1,0,50,Dec,Mon
12/10/2024,2024,4,12,10,2,0,50,Dec,Tue
12/11/2024,2024,4,12,11,3,0,50,Dec,Wed
12/12/2024,2024,4,12,12,4,0,50,Dec,Thu
12/13/2024,2024,4,12,13,5,0,50,Dec,Fri
12/14/2024,2024,4,12,14,6,1,50,Dec,Sat
12/15/2024,2024,4,12,15,7,1,51,Dec,Sun
12/16/2024,2024,4,12,16,1,0,51,Dec,Mon
12/17/2024,2024,4,12,17,2,0,51,Dec,Tue
12/18/2024,2024,4,12,18,3,0,51,Dec,Wed
12/19/2024,2024,4,12,19,4,0,51,Dec,Thu
12/20/2024,2024,4,12,20,5,0,51,Dec,Fri
12/21/2024,2024,4,12,21,6,1,51,Dec,Sat
12/22/2024,2024,4,12,22,7,1,52,Dec,Sun
12/23/2024,2024,4,12,23,1,0,52,Dec,Mon
12/24/2024,2024,4,12,24,2,0,52,Dec,Tue
12/25/2024,2024,4,12,25,3,0,52,Dec,Wed
12/26/2024,2024,4,12,26,4,0,52,Dec,Thu
12/27/2024,2024,4,12,27,5,0,52,Dec,Fri
12/28/2024,2024,4,12,28,6,1,52,Dec,Sat
12/29/2024,2024,4,12,29,7,1,53,Dec,Sun
12/30/2024,2024,4,12,30,1,0,53,Dec,Mon
12/31/2024,2024,4,12,31,2,0,53,Dec,Tue
1/1/2025,2025,1,1,1,3,0,1,Jan,Wed
1/2/2025,2025,1,1,2,4,0,1,Jan,Thu
1/3/2025,2025,1,1,3,5,0,1,Jan,Fri
1/4/2025,2025,1,1,4,6,1,1,Jan,Sat
1/5/2025,2025,1,1,5,7,1,2,Jan,Sun
1/6/2025,2025,1,1,6,1,0,2,Jan,Mon
1/7/2025,2025,1,1,7,2,0,2,Jan,Tue
1/8/2025,2025,1,1,8,3,0,2,Jan,Wed
1/9/2025,2025,1,1,9,4,0,2,Jan,Thu
1/10/2025,2025,1,1,10,5,0,2,Jan,Fri
1/11/2025,2025,1,1,11,6,1,2,Jan,Sat
1/12/2025,2025,1,1,12,7,1,3,Jan,Sun
1/13/2025,2025,1,1,13,1,0,3,Jan,Mon
1/14/2025,2025,1,1,14,2,0,3,Jan,Tue
1/15/2025,2025,1,1,15,3,0,3,Jan,Wed
1/16/2025,2025,1,1,16,4,0,3,Jan,Thu
1/17/2025,2025,1,1,17,5,0,3,Jan,Fri
1/18/2025,2025,1,1,18,6,1,3,Jan,Sat
1/19/2025,2025,1,1,19,7,1,4,Jan,Sun
1/20/2025,2025,1,1,20,1,0,4,Jan,Mon
1/21/2025,2025,1,1,21,2,0,4,Jan,Tue
1/22/2025,2025,1,1,22,3,0,4,Jan,Wed
1/23/2025,2025,1,1,23,4,0,4,Jan,Thu
1/24/2025,2025,1,1,24,5,0,4,Jan,Fri
1/25/2025,2025,1,1,25,6,1,4,Jan,Sat
1/26/2025,2025,1,1,26,7,1,5,Jan,Sun
1/27/2025,2025,1,1,27,1,0,5,Jan,Mon
1/28/2025,2025,1,1,28,2,0,5,Jan,Tue
1/29/2025,2025,1,1,29,3,0,5,Jan,Wed
1/30/2025,2025,1,1,30,4,0,5,Jan,Thu
1/31/2025,2025,1,1,31,5,0,5,Jan,Fri
2/1/2025,2025,1,2,1,6,1,5,Feb,Sat
2/2/2025,2025,1,2,2,7,1,6,Feb,Sun
2/3/2025,2025,1,2,3,1,0,6,Feb,Mon
2/4/2025,2025,1,2,4,2,0,6,Feb,Tue
2/5/2025,2025,1,2,5,3,0,6,Feb,Wed
2/6/2025,2025,1,2,6,4,0,6,Feb,Thu
2/7/2025,2025,1,2,7,5,0,6,Feb,Fri
2/8/2025,2025,1,2,8,6,1,6,Feb,Sat
2/9/2025,2025,1,2,9,7,1,7,Feb,Sun
2/10/2025,2025,1,2,10,1,0,7,Feb,Mon
2/11/2025,2025,1,2,11,2,0,7,Feb,Tue
2/12/2025,2025,1,2,12,3,0,7,Feb,Wed
2/13/2025,2025,1,2,13,4,0,7,Feb,Thu
2/14/2025,2025,1,2,14,5,0,7,Feb,Fri
2/15/2025,2025,1,2,15,6,1,7,Feb,Sat
2/16/2025,2025,1,2,16,7,1,8,Feb,Sun
2/17/2025,2025,1,2,17,1,0,8,Feb,Mon
2/18/2025,2025,1,2,18,2,0,8,Feb,Tue
2/19/2025,2025,1,2,19,3,0,8,Feb,Wed
2/20/2025,2025,1,2,20,4,0,8,Feb,Thu
2/21/2025,2025,1,2,21,5,0,8,Feb,Fri
2/22/2025,2025,1,2,22,6,1,8,Feb,Sat
2/23/2025,2025,1,2,23,7,1,9,Feb,Sun
2/24/2025,2025,1,2,24,1,0,9,Feb,Mon
2/25/2025,2025,1,2,25,2,0,9,Feb,Tue
2/26/2025,2025,1,2,26,3,0,9,Feb,Wed
2/27/2025,2025,1,2,27,4,0,9,Feb,Thu
2/28/2025,2025,1,2,28,5,0,9,Feb,Fri
3/1/2025,2025,1,3,1,6,1,9,Mar,Sat
3/2/2025,2025,1,3,2,7,1,10,Mar,Sun
3/3/2025,2025,1,3,3,1,0,10,Mar,Mon
3/4/2025,2025,1,3,4,2,0,10,Mar,Tue
3/5/2025,2025,1,3,5,3,0,10,Mar,Wed
3/6/2025,2025,1,3,6,4,0,10,Mar,Thu
3/7/2025,2025,1,3,7,5,0,10,Mar,Fri
3/8/2025,2025,1,3,8,6,1,10,Mar,Sat
3/9/2025,2025,1,3,9,7,1,11,Mar,Sun
3/10/2025,2025,1,3,10,1,0,11,Mar,Mon
3/11/2025,2025,1,3,11,2,0,11,Mar,Tue
3/12/2025,2025,1,3,12,3,0,11,Mar,Wed
3/13/2025,2025,1,3,13,4,0,11,Mar,Thu
3/14/2025,2025,1,3,14,5,0,11,Mar,Fri
3/15/2025,2025,1,3,15,6,1,11,Mar,Sat
3/16/2025,2025,1,3,16,7,1,12,Mar,Sun
3/17/2025,2025,1,3,17,1,0,12,Mar,Mon
3/18/2025,2025,1,3,18,2,0,12,Mar,Tue
3/19/2025,2025,1,3,19,3,0,12,Mar,Wed
3/20/2025,2025,1,3,20,4,0,12,Mar,Thu
3/21/2025,2025,1,3,21,5,0,12,Mar,Fri
3/22/2025,2025,1,3,22,6,1,12,Mar,Sat
3/23/2025,2025,1,3,23,7,1,13,Mar,Sun
3/24/2025,2025,1,3,24,1,0,13,Mar,Mon
3/25/2025,2025,1,3,25,2,0,13,Mar,Tue
3/26/2025,2025,1,3,26,3,0,13,Mar,Wed
3/27/2025,2025,1,3,27,4,0,13,Mar,Thu
3/28/2025,2025,1,3,28,5,0,13,Mar,Fri
3/29/2025,2025,1,3,29,6,1,13,Mar,Sat
3/30/2025,2025,1,3,30,7,1,14,Mar,Sun
3/31/2025,2025,1,3,31,1,0,14,Mar,Mon
4/1/2025,2025,2,4,1,2,0,14,Apr,Tue
4/2/2025,2025,2,4,2,3,0,14,Apr,Wed
4/3/2025,2025,2,4,3,4,0,14,Apr,Thu
4/4/2025,2025,2,4,4,5,0,14,Apr,Fri
4/5/2025,2025,2,4,5,6,1,14,Apr,Sat
4/6/2025,2025,2,4,6,7,1,15,Apr,Sun
4/7/2025,2025,2,4,7,1,0,15,Apr,Mon
4/8/2025,2025,2,4,8,2,0,15,Apr,Tue
4/9/2025,2025,2,4,9,3,0,15,Apr,Wed
4/10/2025,2025,2,4,10,4,0,15,Apr,Thu
4/11/2025,2025,2,4,11,5,0,15,Apr,Fri
4/12/2025,2025,2,4,12,6,1,15,Apr,Sat
4/13/2025,2025,2,4,13,7,1,16,Apr,Sun
4/14/2025,2025,2,4,14,1,0,16,Apr,Mon
4/15/2025,2025,2,4,15,2,0,16,Apr,Tue
4/16/2025,2025,2,4,16,3,0,16,Apr,Wed
4/17/2025,2025,2,4,17,4,0,16,Apr,Thu
4/18/2025,2025,2,4,18,5,0,16,Apr,Fri
4/19/2025,2025,2,4,19,6,1,16,Apr,Sat
4/20/2025,2025,2,4,20,7,1,17,Apr,Sun
4/21/2025,2025,2,4,21,1,0,17,Apr,Mon
4/22/2025,2025,2,4,22,2,0,17,Apr,Tue
4/23/2025,2025,2,4,23,3,0,17,Apr,Wed
4/24/2025,2025,2,4,24,4,0,17,Apr,Thu
4/25/2025,2025,2,4,25,5,0,17,Apr,Fri
4/26/2025,2025,2,4,26,6,1,17,Apr,Sat
4/27/2025,2025,2,4,27,7,1,18,Apr,Sun
4/28/2025,2025,2,4,28,1,0,18,Apr,Mon
4/29/2025,2025,2,4,29,2,0,18,Apr,Tue
4/30/2025,2025,2,4,30,3,0,18,Apr,Wed
5/1/2025,2025,2,5,1,4,0,18,May,Thu
5/2/2025,2025,2,5,2,5,0,18,May,Fri
5/3/2025,2025,2,5,3,6,1,18,May,Sat
5/4/2025,2025,2,5,4,7,1,19,May,Sun
5/5/2025,2025,2,5,5,1,0,19,May,Mon
5/6/2025,2025,2,5,6,2,0,19,May,Tue
5/7/2025,2025,2,5,7,3,0,19,May,Wed
5/8/2025,2025,2,5,8,4,0,19,May,Thu
5/9/2025,2025,2,5,9,5,0,19,May,Fri
5/10/2025,2025,2,5,10,6,1,19,May,Sat
5/11/2025,2025,2,5,11,7,1,20,May,Sun
5/12/2025,2025,2,5,12,1,0,20,May,Mon
5/13/2025,2025,2,5,13,2,0,20,May,Tue
5/14/2025,2025,2,5,14,3,0,20,May,Wed
5/15/2025,2025,2,5,15,4,0,20,May,Thu
5/16/2025,2025,2,5,16,5,0,20,May,Fri
5/17/2025,2025,2,5,17,6,1,20,May,Sat
5/18/2025,2025,2,5,18,7,1,21,May,Sun
5/19/2025,2025,2,5,19,1,0,21,May,Mon
5/20/2025,2025,2,5,20,2,0,21,May,Tue
5/21/2025,2025,2,5,21,3,0,21,May,Wed
5/22/2025,2025,2,5,22,4,0,21,May,Thu
5/23/2025,2025,2,5,23,5,0,21,May,Fri
5/24/2025,2025,2,5,24,6,1,21,May,Sat
5/25/2025,2025,2,5,25,7,1,22,May,Sun
5/26/2025,2025,2,5,26,1,0,22,May,Mon
5/27/2025,2025,2,5,27,2,0,22,May,Tue
5/28/2025,2025,2,5,28,3,0,22,May,Wed
5/29/2025,2025,2,5,29,4,0,22,May,Thu
5/30/2025,2025,2,5,30,5,0,22,May,Fri
5/31/2025,2025,2,5,31,6,1,22,May,Sat
6/1/2025,2025,2,6,1,7,1,23,Jun,Sun
6/2/2025,2025,2,6,2,1,0,23,Jun,Mon
6/3/2025,2025,2,6,3,2,0,23,Jun,Tue
6/4/2025,2025,2,6,4,3,0,23,Jun,Wed
6/5/2025,2025,2,6,5,4,0,23,Jun,Thu
6/6/2025,2025,2,6,6,5,0,23,Jun,Fri
6/7/2025,2025,2,6,7,6,1,23,Jun,Sat
6/8/2025,2025,2,6,8,7,1,24,Jun,Sun
6/9/2025,2025,2,6,9,1,0,24,Jun,Mon
6/10/2025,2025,2,6,10,2,0,24,Jun,Tue
6/11/2025,2025,2,6,11,3,0,24,Jun,Wed
6/12/2025,2025,2,6,12,4,0,24,Jun,Thu
6/13/2025,2025,2,6,13,5,0,24,Jun,Fri
6/14/2025,2025,2,6,14,6,1,24,Jun,Sat
6/15/2025,2025,2,6,15,7,1,25,Jun,Sun
6/16/2025,2025,2,6,16,1,0,25,Jun,Mon
6/17/2025,2025,2,6,17,2,0,25,Jun,Tue
6/18/2025,2025,2,6,18,3,0,25,Jun,Wed
6/19/2025,2025,2,6,19,4,0,25,Jun,Thu
6/20/2025,2025,2,6,20,5,0,25,Jun,Fri
6/21/2025,2025,2,6,21,6,1,25,Jun,Sat
6/22/2025,2025,2,6,22,7,1,26,Jun,Sun
6/23/2025,2025,2,6,23,1,0,26,Jun,Mon
6/24/2025,2025,2,6,24,2,0,26,Jun,Tue
6/25/2025,2025,2,6,25,3,0,26,Jun,Wed
6/26/2025,2025,2,6,26,4,0,26,Jun,Thu
6/27/2025,2025,2,6,27,5,0,26,Jun,Fri
6/28/2025,2025,2,6,28,6,1,26,Jun,Sat
6/29/2025,2025,2,6,29,7,1,27,Jun,Sun
6/30/2025,2025,2,6,30,1,0,27,Jun,Mon
7/1/2025,2025,3,7,1,2,0,27,Jul,Tue
7/2/2025,2025,3,7,2,3,0,27,Jul,Wed
7/3/2025,2025,3,7,3,4,0,27,Jul,Thu
7/4/2025,2025,3,7,4,5,0,27,Jul,Fri
7/5/2025,2025,3,7,5,6,1,27,Jul,Sat
7/6/2025,2025,3,7,6,7,1,28,Jul,Sun
7/7/2025,2025,3,7,7,1,0,28,Jul,Mon
7/8/2025,2025,3,7,8,2,0,28,Jul,Tue
7/9/2025,2025,3,7,9,3,0,28,Jul,Wed
7/10/2025,2025,3,7,10,4,0,28,Jul,Thu
7/11/2025,2025,3,7,11,5,0,28,Jul,Fri
7/12/2025,2025,3,7,12,6,1,28,Jul,Sat
7/13/2025,2025,3,7,13,7,1,29,Jul,Sun
7/14/2025,2025,3,7,14,1,0,29,Jul,Mon
7/15/2025,2025,3,7,15,2,0,29,Jul,Tue
7/16/2025,2025,3,7,16,3,0,29,Jul,Wed
7/17/2025,2025,3,7,17,4,0,29,Jul,Thu
7/18/2025,2025,3,7,18,5,0,29,Jul,Fri
7/19/2025,2025,3,7,19,6,1,29,Jul,Sat
7/20/2025,2025,3,7,20,7,1,30,Jul,Sun
7/21/2025,2025,3,7,21,1,0,30,Jul,Mon
7/22/2025,2025,3,7,22,2,0,30,Jul,Tue
7/23/2025,2025,3,7,23,3,0,30,Jul,Wed
7/24/2025,2025,3,7,24,4,0,30,Jul,Thu
7/25/2025,2025,3,7,25,5,0,30,Jul,Fri
7/26/2025,2025,3,7,26,6,1,30,Jul,Sat
7/27/2025,2025,3,7,27,7,1,31,Jul,Sun
7/28/2025,2025,3,7,28,1,0,31,Jul,Mon
7/29/2025,2025,3,7,29,2,0,31,Jul,Tue
7/30/2025,2025,3,7,30,3,0,31,Jul,Wed
7/31/2025,2025,3,7,31,4,0,31,Jul,Thu
8/1/2025,2025,3,8,1,5,0,31,Aug,Fri
8/2/2025,2025,3,8,2,6,1,31,Aug,Sat
8/3/2025,2025,3,8,3,7,1,32,Aug,Sun
8/4/2025,2025,3,8,4,1,0,32,Aug,Mon
8/5/2025,2025,3,8,5,2,0,32,Aug,Tue
8/6/2025,2025,3,8,6,3,0,32,Aug,Wed
8/7/2025,2025,3,8,7,4,0,32,Aug,Thu
8/8/2025,2025,3,8,8,5,0,32,Aug,Fri
8/9/2025,2025,3,8,9,6,1,32,Aug,Sat
8/10/2025,2025,3,8,10,7,1,33,Aug,Sun
8/11/2025,2025,3,8,11,1,0,33,Aug,Mon
8/12/2025,2025,3,8,12,2,0,33,Aug,Tue
8/13/2025,2025,3,8,13,3,0,33,Aug,Wed
8/14/2025,2025,3,8,14,4,0,33,Aug,Thu
8/15/2025,2025,3,8,15,5,0,33,Aug,Fri
8/16/2025,2025,3,8,16,6,1,33,Aug,Sat
8/17/2025,2025,3,8,17,7,1,34,Aug,Sun
8/18/2025,2025,3,8,18,1,0,34,Aug,Mon
8/19/2025,2025,3,8,19,2,0,34,Aug,Tue
8/20/2025,2025,3,8,20,3,0,34,Aug,Wed
8/21/2025,2025,3,8,21,4,0,34,Aug,Thu
8/22/2025,2025,3,8,22,5,0,34,Aug,Fri
8/23/2025,2025,3,8,23,6,1,34,Aug,Sat
8/24/2025,2025,3,8,24,7,1,35,Aug,Sun
8/25/2025,2025,3,8,25,1,0,35,Aug,Mon
8/26/2025,2025,3,8,26,2,0,35,Aug,Tue
8/27/2025,2025,3,8,27,3,0,35,Aug,Wed
8/28/2025,2025,3,8,28,4,0,35,Aug,Thu
8/29/2025,2025,3,8,29,5,0,35,Aug,Fri
8/30/2025,2025,3,8,30,6,1,35,Aug,Sat
8/31/2025,2025,3,8,31,7,1,36,Aug,Sun
9/1/2025,2025,3,9,1,1,0,36,Sep,Mon
9/2/2025,2025,3,9,2,2,0,36,Sep,Tue
9/3/2025,2025,3,9,3,3,0,36,Sep,Wed
9/4/2025,2025,3,9,4,4,0,36,Sep,Thu
9/5/2025,2025,3,9,5,5,0,36,Sep,Fri
9/6/2025,2025,3,9,6,6,1,36,Sep,Sat
9/7/2025,2025,3,9,7,7,1,37,Sep,Sun
9/8/2025,2025,3,9,8,1,0,37,Sep,Mon
9/9/2025,2025,3,9,9,2,0,37,Sep,Tue
9/10/2025,2025,3,9,10,3,0,37,Sep,Wed
9/11/2025,2025,3,9,11,4,0,37,Sep,Thu
9/12/2025,2025,3,9,12,5,0,37,Sep,Fri
9/13/2025,2025,3,9,13,6,1,37,Sep,Sat
9/14/2025,2025,3,9,14,7,1,38,Sep,Sun
9/15/2025,2025,3,9,15,1,0,38,Sep,Mon
9/16/2025,2025,3,9,16,2,0,38,Sep,Tue
9/17/2025,2025,3,9,17,3,0,38,Sep,Wed
9/18/2025,2025,3,9,18,4,0,38,Sep,Thu
9/19/2025,2025,3,9,19,5,0,38,Sep,Fri
9/20/2025,2025,3,9,20,6,1,38,Sep,Sat
9/21/2025,2025,3,9,21,7,1,39,Sep,Sun
9/22/2025,2025,3,9,22,1,0,39,Sep,Mon
9/23/2025,2025,3,9,23,2,0,39,Sep,Tue
9/24/2025,2025,3,9,24,3,0,39,Sep,Wed
9/25/2025,2025,3,9,25,4,0,39,Sep,Thu
9/26/2025,2025,3,9,26,5,0,39,Sep,Fri
9/27/2025,2025,3,9,27,6,1,39,Sep,Sat
9/28/2025,2025,3,9,28,7,1,40,Sep,Sun
9/29/2025,2025,3,9,29,1,0,40,Sep,Mon
9/30/2025,2025,3,9,30,2,0,40,Sep,Tue
10/1/2025,2025,4,10,1,3,0,40,Oct,Wed
10/2/2025,2025,4,10,2,4,0,40,Oct,Thu
10/3/2025,2025,4,10,3,5,0,40,Oct,Fri
10/4/2025,2025,4,10,4,6,1,40,Oct,Sat
10/5/2025,2025,4,10,5,7,1,41,Oct,Sun
10/6/2025,2025,4,10,6,1,0,41,Oct,Mon
10/7/2025,2025,4,10,7,2,0,41,Oct,Tue
10/8/2025,2025,4,10,8,3,0,41,Oct,Wed
10/9/2025,2025,4,10,9,4,0,41,Oct,Thu
10/10/2025,2025,4,10,10,5,0,41,Oct,Fri
10/11/2025,2025,4,10,11,6,1,41,Oct,Sat
10/12/2025,2025,4,10,12,7,1,42,Oct,Sun
10/13/2025,2025,4,10,13,1,0,42,Oct,Mon
10/14/2025,2025,4,10,14,2,0,42,Oct,Tue
10/15/2025,2025,4,10,15,3,0,42,Oct,Wed
10/16/2025,2025,4,10,16,4,0,42,Oct,Thu
10/17/2025,2025,4,10,17,5,0,42,Oct,Fri
10/18/2025,2025,4,10,18,6,1,42,Oct,Sat
10/19/2025,2025,4,10,19,7,1,43,Oct,Sun
10/20/2025,2025,4,10,20,1,0,43,Oct,Mon
10/21/2025,2025,4,10,21,2,0,43,Oct,Tue
10/22/2025,2025,4,10,22,3,0,43,Oct,Wed
10/23/2025,2025,4,10,23,4,0,43,Oct,Thu
10/24/2025,2025,4,10,24,5,0,43,Oct,Fri
10/25/2025,2025,4,10,25,6,1,43,Oct,Sat
10/26/2025,2025,4,10,26,7,1,44,Oct,Sun
10/27/2025,2025,4,10,27,1,0,44,Oct,Mon
10/28/2025,2025,4,10,28,2,0,44,Oct,Tue
10/29/2025,2025,4,10,29,3,0,44,Oct,Wed
10/30/2025,2025,4,10,30,4,0,44,Oct,Thu
10/31/2025,2025,4,10,31,5,0,44,Oct,Fri
11/1/2025,2025,4,11,1,6,1,44,Nov,Sat
11/2/2025,2025,4,11,2,7,1,45,Nov,Sun
11/3/2025,2025,4,11,3,1,0,45,Nov,Mon
11/4/2025,2025,4,11,4,2,0,45,Nov,Tue
11/5/2025,2025,4,11,5,3,0,45,Nov,Wed
11/6/2025,2025,4,11,6,4,0,45,Nov,Thu
11/7/2025,2025,4,11,7,5,0,45,Nov,Fri
11/8/2025,2025,4,11,8,6,1,45,Nov,Sat
11/9/2025,2025,4,11,9,7,1,46,Nov,Sun
11/10/2025,2025,4,11,10,1,0,46,Nov,Mon
11/11/2025,2025,4,11,11,2,0,46,Nov,Tue
11/12/2025,2025,4,11,12,3,0,46,Nov,Wed
11/13/2025,2025,4,11,13,4,0,46,Nov,Thu
11/14/2025,2025,4,11,14,5,0,46,Nov,Fri
11/15/2025,2025,4,11,15,6,1,46,Nov,Sat
11/16/2025,2025,4,11,16,7,1,47,Nov,Sun
11/17/2025,2025,4,11,17,1,0,47,Nov,Mon
11/18/2025,2025,4,11,18,2,0,47,Nov,Tue
11/19/2025,2025,4,11,19,3,0,47,Nov,Wed
11/20/2025,2025,4,11,20,4,0,47,Nov,Thu
11/21/2025,2025,4,11,21,5,0,47,Nov,Fri
11/22/2025,2025,4,11,22,6,1,47,Nov,Sat
11/23/2025,2025,4,11,23,7,1,48,Nov,Sun
11/24/2025,2025,4,11,24,1,0,48,Nov,Mon
11/25/2025,2025,4,11,25,2,0,48,Nov,Tue
11/26/2025,2025,4,11,26,3,0,48,Nov,Wed
11/27/2025,2025,4,11,27,4,0,48,Nov,Thu
11/28/2025,2025,4,11,28,5,0,48,Nov,Fri
11/29/2025,2025,4,11,29,6,1,48,Nov,Sat
11/30/2025,2025,4,11,30,7,1,49,Nov,Sun
12/1/2025,2025,4,12,1,1,0,49,Dec,Mon
12/2/2025,2025,4,12,2,2,0,49,Dec,Tue
12/3/2025,2025,4,12,3,3,0,49,Dec,Wed
12/4/2025,2025,4,12,4,4,0,49,Dec,Thu
12/5/2025,2025,4,12,5,5,0,49,Dec,Fri
12/6/2025,2025,4,12,6,6,1,49,Dec,Sat
12/7/2025,2025,4,12,7,7,1,50,Dec,Sun
12/8/2025,2025,4,12,8,1,0,50,Dec,Mon
12/9/2025,2025,4,12,9,2,0,50,Dec,Tue
12/10/2025,2025,4,12,10,3,0,50,Dec,Wed
12/11/2025,2025,4,12,11,4,0,50,Dec,Thu
12/12/2025,2025,4,12,12,5,0,50,Dec,Fri
12/13/2025,2025,4,12,13,6,1,50,Dec,Sat
12/14/2025,2025,4,12,14,7,1,51,Dec,Sun
12/15/2025,2025,4,12,15,1,0,51,Dec,Mon
12/16/2025,2025,4,12,16,2,0,51,Dec,Tue
12/17/2025,2025,4,12,17,3,0,51,Dec,Wed
12/18/2025,2025,4,12,18,4,0,51,Dec,Thu
12/19/2025,2025,4,12,19,5,0,51,Dec,Fri
12/20/2025,2025,4,12,20,6,1,51,Dec,Sat
12/21/2025,2025,4,12,21,7,1,52,Dec,Sun
12/22/2025,2025,4,12,22,1,0,52,Dec,Mon
12/23/2025,2025,4,12,23,2,0,52,Dec,Tue
12/24/2025,2025,4,12,24,3,0,52,Dec,Wed
12/25/2025,2025,4,12,25,4,0,52,Dec,Thu
12/26/2025,2025,4,12,26,5,0,52,Dec,Fri
12/27/2025,2025,4,12,27,6,1,52,Dec,Sat
12/28/2025,2025,4,12,28,7,1,53,Dec,Sun
12/29/2025,2025,4,12,29,1,0,53,Dec,Mon
12/30/2025,2025,4,12,30,2,0,53,Dec,Tue
12/31/2025,2025,4,12,31,3,0,53,Dec,Wed
1/1/2026,2026,1,1,1,4,0,1,Jan,Thu
1/2/2026,2026,1,1,2,5,0,1,Jan,Fri
1/3/2026,2026,1,1,3,6,1,1,Jan,Sat
1/4/2026,2026,1,1,4,7,1,2,Jan,Sun
1/5/2026,2026,1,1,5,1,0,2,Jan,Mon
1/6/2026,2026,1,1,6,2,0,2,Jan,Tue
1/7/2026,2026,1,1,7,3,0,2,Jan,Wed
1/8/2026,2026,1,1,8,4,0,2,Jan,Thu
1/9/2026,2026,1,1,9,5,0,2,Jan,Fri
1/10/2026,2026,1,1,10,6,1,2,Jan,Sat
1/11/2026,2026,1,1,11,7,1,3,Jan,Sun
1/12/2026,2026,1,1,12,1,0,3,Jan,Mon
1/13/2026,2026,1,1,13,2,0,3,Jan,Tue
1/14/2026,2026,1,1,14,3,0,3,Jan,Wed
1/15/2026,2026,1,1,15,4,0,3,Jan,Thu
1/16/2026,2026,1,1,16,5,0,3,Jan,Fri
1/17/2026,2026,1,1,17,6,1,3,Jan,Sat
1/18/2026,2026,1,1,18,7,1,4,Jan,Sun
1/19/2026,2026,1,1,19,1,0,4,Jan,Mon
1/20/2026,2026,1,1,20,2,0,4,Jan,Tue
1/21/2026,2026,1,1,21,3,0,4,Jan,Wed
1/22/2026,2026,1,1,22,4,0,4,Jan,Thu
1/23/2026,2026,1,1,23,5,0,4,Jan,Fri
1/24/2026,2026,1,1,24,6,1,4,Jan,Sat
1/25/2026,2026,1,1,25,7,1,5,Jan,Sun
1/26/2026,2026,1,1,26,1,0,5,Jan,Mon
1/27/2026,2026,1,1,27,2,0,5,Jan,Tue
1/28/2026,2026,1,1,28,3,0,5,Jan,Wed
1/29/2026,2026,1,1,29,4,0,5,Jan,Thu
1/30/2026,2026,1,1,30,5,0,5,Jan,Fri
1/31/2026,2026,1,1,31,6,1,5,Jan,Sat
2/1/2026,2026,1,2,1,7,1,6,Feb,Sun
2/2/2026,2026,1,2,2,1,0,6,Feb,Mon
2/3/2026,2026,1,2,3,2,0,6,Feb,Tue
2/4/2026,2026,1,2,4,3,0,6,Feb,Wed
2/5/2026,2026,1,2,5,4,0,6,Feb,Thu
2/6/2026,2026,1,2,6,5,0,6,Feb,Fri
2/7/2026,2026,1,2,7,6,1,6,Feb,Sat
2/8/2026,2026,1,2,8,7,1,7,Feb,Sun
2/9/2026,2026,1,2,9,1,0,7,Feb,Mon
2/10/2026,2026,1,2,10,2,0,7,Feb,Tue
2/11/2026,2026,1,2,11,3,0,7,Feb,Wed
2/12/2026,2026,1,2,12,4,0,7,Feb,Thu
2/13/2026,2026,1,2,13,5,0,7,Feb,Fri
2/14/2026,2026,1,2,14,6,1,7,Feb,Sat
2/15/2026,2026,1,2,15,7,1,8,Feb,Sun
2/16/2026,2026,1,2,16,1,0,8,Feb,Mon
2/17/2026,2026,1,2,17,2,0,8,Feb,Tue
2/18/2026,2026,1,2,18,3,0,8,Feb,Wed
2/19/2026,2026,1,2,19,4,0,8,Feb,Thu
2/20/2026,2026,1,2,20,5,0,8,Feb,Fri
2/21/2026,2026,1,2,21,6,1,8,Feb,Sat
2/22/2026,2026,1,2,22,7,1,9,Feb,Sun
2/23/2026,2026,1,2,23,1,0,9,Feb,Mon
2/24/2026,2026,1,2,24,2,0,9,Feb,Tue
2/25/2026,2026,1,2,25,3,0,9,Feb,Wed
2/26/2026,2026,1,2,26,4,0,9,Feb,Thu
2/27/2026,2026,1,2,27,5,0,9,Feb,Fri
2/28/2026,2026,1,2,28,6,1,9,Feb,Sat
3/1/2026,2026,1,3,1,7,1,10,Mar,Sun
3/2/2026,2026,1,3,2,1,0,10,Mar,Mon
3/3/2026,2026,1,3,3,2,0,10,Mar,Tue
3/4/2026,2026,1,3,4,3,0,10,Mar,Wed
3/5/2026,2026,1,3,5,4,0,10,Mar,Thu
3/6/2026,2026,1,3,6,5,0,10,Mar,Fri
3/7/2026,2026,1,3,7,6,1,10,Mar,Sat
3/8/2026,2026,1,3,8,7,1,11,Mar,Sun
3/9/2026,2026,1,3,9,1,0,11,Mar,Mon
3/10/2026,2026,1,3,10,2,0,11,Mar,Tue
3/11/2026,2026,1,3,11,3,0,11,Mar,Wed
3/12/2026,2026,1,3,12,4,0,11,Mar,Thu
3/13/2026,2026,1,3,13,5,0,11,Mar,Fri
3/14/2026,2026,1,3,14,6,1,11,Mar,Sat
3/15/2026,2026,1,3,15,7,1,12,Mar,Sun
3/16/2026,2026,1,3,16,1,0,12,Mar,Mon
3/17/2026,2026,1,3,17,2,0,12,Mar,Tue
3/18/2026,2026,1,3,18,3,0,12,Mar,Wed
3/19/2026,2026,1,3,19,4,0,12,Mar,Thu
3/20/2026,2026,1,3,20,5,0,12,Mar,Fri
3/21/2026,2026,1,3,21,6,1,12,Mar,Sat
3/22/2026,2026,1,3,22,7,1,13,Mar,Sun
3/23/2026,2026,1,3,23,1,0,13,Mar,Mon
3/24/2026,2026,1,3,24,2,0,13,Mar,Tue
3/25/2026,2026,1,3,25,3,0,13,Mar,Wed
3/26/2026,2026,1,3,26,4,0,13,Mar,Thu
3/27/2026,2026,1,3,27,5,0,13,Mar,Fri
3/28/2026,2026,1,3,28,6,1,13,Mar,Sat
3/29/2026,2026,1,3,29,7,1,14,Mar,Sun
3/30/2026,2026,1,3,30,1,0,14,Mar,Mon
3/31/2026,2026,1,3,31,2,0,14,Mar,Tue
4/1/2026,2026,2,4,1,3,0,14,Apr,Wed
4/2/2026,2026,2,4,2,4,0,14,Apr,Thu
4/3/2026,2026,2,4,3,5,0,14,Apr,Fri
4/4/2026,2026,2,4,4,6,1,14,Apr,Sat
4/5/2026,2026,2,4,5,7,1,15,Apr,Sun
4/6/2026,2026,2,4,6,1,0,15,Apr,Mon
4/7/2026,2026,2,4,7,2,0,15,Apr,Tue
4/8/2026,2026,2,4,8,3,0,15,Apr,Wed
4/9/2026,2026,2,4,9,4,0,15,Apr,Thu
4/10/2026,2026,2,4,10,5,0,15,Apr,Fri
4/11/2026,2026,2,4,11,6,1,15,Apr,Sat
4/12/2026,2026,2,4,12,7,1,16,Apr,Sun
4/13/2026,2026,2,4,13,1,0,16,Apr,Mon
4/14/2026,2026,2,4,14,2,0,16,Apr,Tue
4/15/2026,2026,2,4,15,3,0,16,Apr,Wed
4/16/2026,2026,2,4,16,4,0,16,Apr,Thu
4/17/2026,2026,2,4,17,5,0,16,Apr,Fri
4/18/2026,2026,2,4,18,6,1,16,Apr,Sat
4/19/2026,2026,2,4,19,7,1,17,Apr,Sun
4/20/2026,2026,2,4,20,1,0,17,Apr,Mon
4/21/2026,2026,2,4,21,2,0,17,Apr,Tue
4/22/2026,2026,2,4,22,3,0,17,Apr,Wed
4/23/2026,2026,2,4,23,4,0,17,Apr,Thu
4/24/2026,2026,2,4,24,5,0,17,Apr,Fri
4/25/2026,2026,2,4,25,6,1,17,Apr,Sat
4/26/2026,2026,2,4,26,7,1,18,Apr,Sun
4/27/2026,2026,2,4,27,1,0,18,Apr,Mon
4/28/2026,2026,2,4,28,2,0,18,Apr,Tue
4/29/2026,2026,2,4,29,3,0,18,Apr,Wed
4/30/2026,2026,2,4,30,4,0,18,Apr,Thu
5/1/2026,2026,2,5,1,5,0,18,May,Fri
5/2/2026,2026,2,5,2,6,1,18,May,Sat
5/3/2026,2026,2,5,3,7,1,19,May,Sun
5/4/2026,2026,2,5,4,1,0,19,May,Mon
5/5/2026,2026,2,5,5,2,0,19,May,Tue
5/6/2026,2026,2,5,6,3,0,19,May,Wed
5/7/2026,2026,2,5,7,4,0,19,May,Thu
5/8/2026,2026,2,5,8,5,0,19,May,Fri
5/9/2026,2026,2,5,9,6,1,19,May,Sat
5/10/2026,2026,2,5,10,7,1,20,May,Sun
5/11/2026,2026,2,5,11,1,0,20,May,Mon
5/12/2026,2026,2,5,12,2,0,20,May,Tue
5/13/2026,2026,2,5,13,3,0,20,May,Wed
5/14/2026,2026,2,5,14,4,0,20,May,Thu
5/15/2026,2026,2,5,15,5,0,20,May,Fri
5/16/2026,2026,2,5,16,6,1,20,May,Sat
5/17/2026,2026,2,5,17,7,1,21,May,Sun
5/18/2026,2026,2,5,18,1,0,21,May,Mon
5/19/2026,2026,2,5,19,2,0,21,May,Tue
5/20/2026,2026,2,5,20,3,0,21,May,Wed
5/21/2026,2026,2,5,21,4,0,21,May,Thu
5/22/2026,2026,2,5,22,5,0,21,May,Fri
5/23/2026,2026,2,5,23,6,1,21,May,Sat
5/24/2026,2026,2,5,24,7,1,22,May,Sun
5/25/2026,2026,2,5,25,1,0,22,May,Mon
5/26/2026,2026,2,5,26,2,0,22,May,Tue
5/27/2026,2026,2,5,27,3,0,22,May,Wed
5/28/2026,2026,2,5,28,4,0,22,May,Thu
5/29/2026,2026,2,5,29,5,0,22,May,Fri
5/30/2026,2026,2,5,30,6,1,22,May,Sat
5/31/2026,2026,2,5,31,7,1,23,May,Sun
6/1/2026,2026,2,6,1,1,0,23,Jun,Mon
6/2/2026,2026,2,6,2,2,0,23,Jun,Tue
6/3/2026,2026,2,6,3,3,0,23,Jun,Wed
6/4/2026,2026,2,6,4,4,0,23,Jun,Thu
6/5/2026,2026,2,6,5,5,0,23,Jun,Fri
6/6/2026,2026,2,6,6,6,1,23,Jun,Sat
6/7/2026,2026,2,6,7,7,1,24,Jun,Sun
6/8/2026,2026,2,6,8,1,0,24,Jun,Mon
6/9/2026,2026,2,6,9,2,0,24,Jun,Tue
6/10/2026,2026,2,6,10,3,0,24,Jun,Wed
6/11/2026,2026,2,6,11,4,0,24,Jun,Thu
6/12/2026,2026,2,6,12,5,0,24,Jun,Fri
6/13/2026,2026,2,6,13,6,1,24,Jun,Sat
6/14/2026,2026,2,6,14,7,1,25,Jun,Sun
6/15/2026,2026,2,6,15,1,0,25,Jun,Mon
6/16/2026,2026,2,6,16,2,0,25,Jun,Tue
6/17/2026,2026,2,6,17,3,0,25,Jun,Wed
6/18/2026,2026,2,6,18,4,0,25,Jun,Thu
6/19/2026,2026,2,6,19,5,0,25,Jun,Fri
6/20/2026,2026,2,6,20,6,1,25,Jun,Sat
6/21/2026,2026,2,6,21,7,1,26,Jun,Sun
6/22/2026,2026,2,6,22,1,0,26,Jun,Mon
6/23/2026,2026,2,6,23,2,0,26,Jun,Tue
6/24/2026,2026,2,6,24,3,0,26,Jun,Wed
6/25/2026,2026,2,6,25,4,0,26,Jun,Thu
6/26/2026,2026,2,6,26,5,0,26,Jun,Fri
6/27/2026,2026,2,6,27,6,1,26,Jun,Sat
6/28/2026,2026,2,6,28,7,1,27,Jun,Sun
6/29/2026,2026,2,6,29,1,0,27,Jun,Mon
6/30/2026,2026,2,6,30,2,0,27,Jun,Tue
7/1/2026,2026,3,7,1,3,0,27,Jul,Wed
7/2/2026,2026,3,7,2,4,0,27,Jul,Thu
7/3/2026,2026,3,7,3,5,0,27,Jul,Fri
7/4/2026,2026,3,7,4,6,1,27,Jul,Sat
7/5/2026,2026,3,7,5,7,1,28,Jul,Sun
7/6/2026,2026,3,7,6,1,0,28,Jul,Mon
7/7/2026,2026,3,7,7,2,0,28,Jul,Tue
7/8/2026,2026,3,7,8,3,0,28,Jul,Wed
7/9/2026,2026,3,7,9,4,0,28,Jul,Thu
7/10/2026,2026,3,7,10,5,0,28,Jul,Fri
7/11/2026,2026,3,7,11,6,1,28,Jul,Sat
7/12/2026,2026,3,7,12,7,1,29,Jul,Sun
7/13/2026,2026,3,7,13,1,0,29,Jul,Mon
7/14/2026,2026,3,7,14,2,0,29,Jul,Tue
7/15/2026,2026,3,7,15,3,0,29,Jul,Wed
7/16/2026,2026,3,7,16,4,0,29,Jul,Thu
7/17/2026,2026,3,7,17,5,0,29,Jul,Fri
7/18/2026,2026,3,7,18,6,1,29,Jul,Sat
7/19/2026,2026,3,7,19,7,1,30,Jul,Sun
7/20/2026,2026,3,7,20,1,0,30,Jul,Mon
7/21/2026,2026,3,7,21,2,0,30,Jul,Tue
7/22/2026,2026,3,7,22,3,0,30,Jul,Wed
7/23/2026,2026,3,7,23,4,0,30,Jul,Thu
7/24/2026,2026,3,7,24,5,0,30,Jul,Fri
7/25/2026,2026,3,7,25,6,1,30,Jul,Sat
7/26/2026,2026,3,7,26,7,1,31,Jul,Sun
7/27/2026,2026,3,7,27,1,0,31,Jul,Mon
7/28/2026,2026,3,7,28,2,0,31,Jul,Tue
7/29/2026,2026,3,7,29,3,0,31,Jul,Wed
7/30/2026,2026,3,7,30,4,0,31,Jul,Thu
7/31/2026,2026,3,7,31,5,0,31,Jul,Fri
8/1/2026,2026,3,8,1,6,1,31,Aug,Sat
8/2/2026,2026,3,8,2,7,1,32,Aug,Sun
8/3/2026,2026,3,8,3,1,0,32,Aug,Mon
8/4/2026,2026,3,8,4,2,0,32,Aug,Tue
8/5/2026,2026,3,8,5,3,0,32,Aug,Wed
8/6/2026,2026,3,8,6,4,0,32,Aug,Thu
8/7/2026,2026,3,8,7,5,0,32,Aug,Fri
8/8/2026,2026,3,8,8,6,1,32,Aug,Sat
8/9/2026,2026,3,8,9,7,1,33,Aug,Sun
8/10/2026,2026,3,8,10,1,0,33,Aug,Mon
8/11/2026,2026,3,8,11,2,0,33,Aug,Tue
8/12/2026,2026,3,8,12,3,0,33,Aug,Wed
8/13/2026,2026,3,8,13,4,0,33,Aug,Thu
8/14/2026,2026,3,8,14,5,0,33,Aug,Fri
8/15/2026,2026,3,8,15,6,1,33,Aug,Sat
8/16/2026,2026,3,8,16,7,1,34,Aug,Sun
8/17/2026,2026,3,8,17,1,0,34,Aug,Mon
8/18/2026,2026,3,8,18,2,0,34,Aug,Tue
8/19/2026,2026,3,8,19,3,0,34,Aug,Wed
8/20/2026,2026,3,8,20,4,0,34,Aug,Thu
8/21/2026,2026,3,8,21,5,0,34,Aug,Fri
8/22/2026,2026,3,8,22,6,1,34,Aug,Sat
8/23/2026,2026,3,8,23,7,1,35,Aug,Sun
8/24/2026,2026,3,8,24,1,0,35,Aug,Mon
8/25/2026,2026,3,8,25,2,0,35,Aug,Tue
8/26/2026,2026,3,8,26,3,0,35,Aug,Wed
8/27/2026,2026,3,8,27,4,0,35,Aug,Thu
8/28/2026,2026,3,8,28,5,0,35,Aug,Fri
8/29/2026,2026,3,8,29,6,1,35,Aug,Sat
8/30/2026,2026,3,8,30,7,1,36,Aug,Sun
8/31/2026,2026,3,8,31,1,0,36,Aug,Mon
9/1/2026,2026,3,9,1,2,0,36,Sep,Tue
9/2/2026,2026,3,9,2,3,0,36,Sep,Wed
9/3/2026,2026,3,9,3,4,0,36,Sep,Thu
9/4/2026,2026,3,9,4,5,0,36,Sep,Fri
9/5/2026,2026,3,9,5,6,1,36,Sep,Sat
9/6/2026,2026,3,9,6,7,1,37,Sep,Sun
9/7/2026,2026,3,9,7,1,0,37,Sep,Mon
9/8/2026,2026,3,9,8,2,0,37,Sep,Tue
9/9/2026,2026,3,9,9,3,0,37,Sep,Wed
9/10/2026,2026,3,9,10,4,0,37,Sep,Thu
9/11/2026,2026,3,9,11,5,0,37,Sep,Fri
9/12/2026,2026,3,9,12,6,1,37,Sep,Sat
9/13/2026,2026,3,9,13,7,1,38,Sep,Sun
9/14/2026,2026,3,9,14,1,0,38,Sep,Mon
9/15/2026,2026,3,9,15,2,0,38,Sep,Tue
9/16/2026,2026,3,9,16,3,0,38,Sep,Wed
9/17/2026,2026,3,9,17,4,0,38,Sep,Thu
9/18/2026,2026,3,9,18,5,0,38,Sep,Fri
9/19/2026,2026,3,9,19,6,1,38,Sep,Sat
9/20/2026,2026,3,9,20,7,1,39,Sep,Sun
9/21/2026,2026,3,9,21,1,0,39,Sep,Mon
9/22/2026,2026,3,9,22,2,0,39,Sep,Tue
9/23/2026,2026,3,9,23,3,0,39,Sep,Wed
9/24/2026,2026,3,9,24,4,0,39,Sep,Thu
9/25/2026,2026,3,9,25,5,0,39,Sep,Fri
9/26/2026,2026,3,9,26,6,1,39,Sep,Sat
9/27/2026,2026,3,9,27,7,1,40,Sep,Sun
9/28/2026,2026,3,9,28,1,0,40,Sep,Mon
9/29/2026,2026,3,9,29,2,0,40,Sep,Tue
9/30/2026,2026,3,9,30,3,0,40,Sep,Wed
10/1/2026,2026,4,10,1,4,0,40,Oct,Thu
10/2/2026,2026,4,10,2,5,0,40,Oct,Fri
10/3/2026,2026,4,10,3,6,1,40,Oct,Sat
10/4/2026,2026,4,10,4,7,1,41,Oct,Sun
10/5/2026,2026,4,10,5,1,0,41,Oct,Mon
10/6/2026,2026,4,10,6,2,0,41,Oct,Tue
10/7/2026,2026,4,10,7,3,0,41,Oct,Wed
10/8/2026,2026,4,10,8,4,0,41,Oct,Thu
10/9/2026,2026,4,10,9,5,0,41,Oct,Fri
10/10/2026,2026,4,10,10,6,1,41,Oct,Sat
10/11/2026,2026,4,10,11,7,1,42,Oct,Sun
10/12/2026,2026,4,10,12,1,0,42,Oct,Mon
10/13/2026,2026,4,10,13,2,0,42,Oct,Tue
10/14/2026,2026,4,10,14,3,0,42,Oct,Wed
10/15/2026,2026,4,10,15,4,0,42,Oct,Thu
10/16/2026,2026,4,10,16,5,0,42,Oct,Fri
10/17/2026,2026,4,10,17,6,1,42,Oct,Sat
10/18/2026,2026,4,10,18,7,1,43,Oct,Sun
10/19/2026,2026,4,10,19,1,0,43,Oct,Mon
10/20/2026,2026,4,10,20,2,0,43,Oct,Tue
10/21/2026,2026,4,10,21,3,0,43,Oct,Wed
10/22/2026,2026,4,10,22,4,0,43,Oct,Thu
10/23/2026,2026,4,10,23,5,0,43,Oct,Fri
10/24/2026,2026,4,10,24,6,1,43,Oct,Sat
10/25/2026,2026,4,10,25,7,1,44,Oct,Sun
10/26/2026,2026,4,10,26,1,0,44,Oct,Mon
10/27/2026,2026,4,10,27,2,0,44,Oct,Tue
10/28/2026,2026,4,10,28,3,0,44,Oct,Wed
10/29/2026,2026,4,10,29,4,0,44,Oct,Thu
10/30/2026,2026,4,10,30,5,0,44,Oct,Fri
10/31/2026,2026,4,10,31,6,1,44,Oct,Sat
11/1/2026,2026,4,11,1,7,1,45,Nov,Sun
11/2/2026,2026,4,11,2,1,0,45,Nov,Mon
11/3/2026,2026,4,11,3,2,0,45,Nov,Tue
11/4/2026,2026,4,11,4,3,0,45,Nov,Wed
11/5/2026,2026,4,11,5,4,0,45,Nov,Thu
11/6/2026,2026,4,11,6,5,0,45,Nov,Fri
11/7/2026,2026,4,11,7,6,1,45,Nov,Sat
11/8/2026,2026,4,11,8,7,1,46,Nov,Sun
11/9/2026,2026,4,11,9,1,0,46,Nov,Mon
11/10/2026,2026,4,11,10,2,0,46,Nov,Tue
11/11/2026,2026,4,11,11,3,0,46,Nov,Wed
11/12/2026,2026,4,11,12,4,0,46,Nov,Thu
11/13/2026,2026,4,11,13,5,0,46,Nov,Fri
11/14/2026,2026,4,11,14,6,1,46,Nov,Sat
11/15/2026,2026,4,11,15,7,1,47,Nov,Sun
11/16/2026,2026,4,11,16,1,0,47,Nov,Mon
11/17/2026,2026,4,11,17,2,0,47,Nov,Tue
11/18/2026,2026,4,11,18,3,0,47,Nov,Wed
11/19/2026,2026,4,11,19,4,0,47,Nov,Thu
11/20/2026,2026,4,11,20,5,0,47,Nov,Fri
11/21/2026,2026,4,11,21,6,1,47,Nov,Sat
11/22/2026,2026,4,11,22,7,1,48,Nov,Sun
11/23/2026,2026,4,11,23,1,0,48,Nov,Mon
11/24/2026,2026,4,11,24,2,0,48,Nov,Tue
11/25/2026,2026,4,11,25,3,0,48,Nov,Wed
11/26/2026,2026,4,11,26,4,0,48,Nov,Thu
11/27/2026,2026,4,11,27,5,0,48,Nov,Fri
11/28/2026,2026,4,11,28,6,1,48,Nov,Sat
11/29/2026,2026,4,11,29,7,1,49,Nov,Sun
11/30/2026,2026,4,11,30,1,0,49,Nov,Mon
12/1/2026,2026,4,12,1,2,0,49,Dec,Tue
12/2/2026,2026,4,12,2,3,0,49,Dec,Wed
12/3/2026,2026,4,12,3,4,0,49,Dec,Thu
12/4/2026,2026,4,12,4,5,0,49,Dec,Fri
12/5/2026,2026,4,12,5,6,1,49,Dec,Sat
12/6/2026,2026,4,12,6,7,1,50,Dec,Sun
12/7/2026,2026,4,12,7,1,0,50,Dec,Mon
12/8/2026,2026,4,12,8,2,0,50,Dec,Tue
12/9/2026,2026,4,12,9,3,0,50,Dec,Wed
12/10/2026,2026,4,12,10,4,0,50,Dec,Thu
12/11/2026,2026,4,12,11,5,0,50,Dec,Fri
12/12/2026,2026,4,12,12,6,1,50,Dec,Sat
12/13/2026,2026,4,12,13,7,1,51,Dec,Sun
12/14/2026,2026,4,12,14,1,0,51,Dec,Mon
12/15/2026,2026,4,12,15,2,0,51,Dec,Tue
12/16/2026,2026,4,12,16,3,0,51,Dec,Wed
12/17/2026,2026,4,12,17,4,0,51,Dec,Thu
12/18/2026,2026,4,12,18,5,0,51,Dec,Fri
12/19/2026,2026,4,12,19,6,1,51,Dec,Sat
12/20/2026,2026,4,12,20,7,1,52,Dec,Sun
12/21/2026,2026,4,12,21,1,0,52,Dec,Mon
12/22/2026,2026,4,12,22,2,0,52,Dec,Tue
12/23/2026,2026,4,12,23,3,0,52,Dec,Wed
12/24/2026,2026,4,12,24,4,0,52,Dec,Thu
12/25/2026,2026,4,12,25,5,0,52,Dec,Fri
12/26/2026,2026,4,12,26,6,1,52,Dec,Sat
12/27/2026,2026,4,12,27,7,1,53,Dec,Sun
12/28/2026,2026,4,12,28,1,0,53,Dec,Mon
12/29/2026,2026,4,12,29,2,0,53,Dec,Tue
12/30/2026,2026,4,12,30,3,0,53,Dec,Wed
12/31/2026,2026,4,12,31,4,0,53,Dec,Thu
1/1/2027,2027,1,1,1,5,0,1,Jan,Fri
1/2/2027,2027,1,1,2,6,1,1,Jan,Sat
1/3/2027,2027,1,1,3,7,1,2,Jan,Sun
1/4/2027,2027,1,1,4,1,0,2,Jan,Mon
1/5/2027,2027,1,1,5,2,0,2,Jan,Tue
1/6/2027,2027,1,1,6,3,0,2,Jan,Wed
1/7/2027,2027,1,1,7,4,0,2,Jan,Thu
1/8/2027,2027,1,1,8,5,0,2,Jan,Fri
1/9/2027,2027,1,1,9,6,1,2,Jan,Sat
1/10/2027,2027,1,1,10,7,1,3,Jan,Sun
1/11/2027,2027,1,1,11,1,0,3,Jan,Mon
1/12/2027,2027,1,1,12,2,0,3,Jan,Tue
1/13/2027,2027,1,1,13,3,0,3,Jan,Wed
1/14/2027,2027,1,1,14,4,0,3,Jan,Thu
1/15/2027,2027,1,1,15,5,0,3,Jan,Fri
1/16/2027,2027,1,1,16,6,1,3,Jan,Sat
1/17/2027,2027,1,1,17,7,1,4,Jan,Sun
1/18/2027,2027,1,1,18,1,0,4,Jan,Mon
1/19/2027,2027,1,1,19,2,0,4,Jan,Tue
1/20/2027,2027,1,1,20,3,0,4,Jan,Wed
1/21/2027,2027,1,1,21,4,0,4,Jan,Thu
1/22/2027,2027,1,1,22,5,0,4,Jan,Fri
1/23/2027,2027,1,1,23,6,1,4,Jan,Sat
1/24/2027,2027,1,1,24,7,1,5,Jan,Sun
1/25/2027,2027,1,1,25,1,0,5,Jan,Mon
1/26/2027,2027,1,1,26,2,0,5,Jan,Tue
1/27/2027,2027,1,1,27,3,0,5,Jan,Wed
1/28/2027,2027,1,1,28,4,0,5,Jan,Thu
1/29/2027,2027,1,1,29,5,0,5,Jan,Fri
1/30/2027,2027,1,1,30,6,1,5,Jan,Sat
1/31/2027,2027,1,1,31,7,1,6,Jan,Sun
2/1/2027,2027,1,2,1,1,0,6,Feb,Mon
2/2/2027,2027,1,2,2,2,0,6,Feb,Tue
2/3/2027,2027,1,2,3,3,0,6,Feb,Wed
2/4/2027,2027,1,2,4,4,0,6,Feb,Thu
2/5/2027,2027,1,2,5,5,0,6,Feb,Fri
2/6/2027,2027,1,2,6,6,1,6,Feb,Sat
2/7/2027,2027,1,2,7,7,1,7,Feb,Sun
2/8/2027,2027,1,2,8,1,0,7,Feb,Mon
2/9/2027,2027,1,2,9,2,0,7,Feb,Tue
2/10/2027,2027,1,2,10,3,0,7,Feb,Wed
2/11/2027,2027,1,2,11,4,0,7,Feb,Thu
2/12/2027,2027,1,2,12,5,0,7,Feb,Fri
2/13/2027,2027,1,2,13,6,1,7,Feb,Sat
2/14/2027,2027,1,2,14,7,1,8,Feb,Sun
2/15/2027,2027,1,2,15,1,0,8,Feb,Mon
2/16/2027,2027,1,2,16,2,0,8,Feb,Tue
2/17/2027,2027,1,2,17,3,0,8,Feb,Wed
2/18/2027,2027,1,2,18,4,0,8,Feb,Thu
2/19/2027,2027,1,2,19,5,0,8,Feb,Fri
2/20/2027,2027,1,2,20,6,1,8,Feb,Sat
2/21/2027,2027,1,2,21,7,1,9,Feb,Sun
2/22/2027,2027,1,2,22,1,0,9,Feb,Mon
2/23/2027,2027,1,2,23,2,0,9,Feb,Tue
2/24/2027,2027,1,2,24,3,0,9,Feb,Wed
2/25/2027,2027,1,2,25,4,0,9,Feb,Thu
2/26/2027,2027,1,2,26,5,0,9,Feb,Fri
2/27/2027,2027,1,2,27,6,1,9,Feb,Sat
2/28/2027,2027,1,2,28,7,1,10,Feb,Sun
3/1/2027,2027,1,3,1,1,0,10,Mar,Mon
3/2/2027,2027,1,3,2,2,0,10,Mar,Tue
3/3/2027,2027,1,3,3,3,0,10,Mar,Wed
3/4/2027,2027,1,3,4,4,0,10,Mar,Thu
3/5/2027,2027,1,3,5,5,0,10,Mar,Fri
3/6/2027,2027,1,3,6,6,1,10,Mar,Sat
3/7/2027,2027,1,3,7,7,1,11,Mar,Sun
3/8/2027,2027,1,3,8,1,0,11,Mar,Mon
3/9/2027,2027,1,3,9,2,0,11,Mar,Tue
3/10/2027,2027,1,3,10,3,0,11,Mar,Wed
3/11/2027,2027,1,3,11,4,0,11,Mar,Thu
3/12/2027,2027,1,3,12,5,0,11,Mar,Fri
3/13/2027,2027,1,3,13,6,1,11,Mar,Sat
3/14/2027,2027,1,3,14,7,1,12,Mar,Sun
3/15/2027,2027,1,3,15,1,0,12,Mar,Mon
3/16/2027,2027,1,3,16,2,0,12,Mar,Tue
3/17/2027,2027,1,3,17,3,0,12,Mar,Wed
3/18/2027,2027,1,3,18,4,0,12,Mar,Thu
3/19/2027,2027,1,3,19,5,0,12,Mar,Fri
3/20/2027,2027,1,3,20,6,1,12,Mar,Sat
3/21/2027,2027,1,3,21,7,1,13,Mar,Sun
3/22/2027,2027,1,3,22,1,0,13,Mar,Mon
3/23/2027,2027,1,3,23,2,0,13,Mar,Tue
3/24/2027,2027,1,3,24,3,0,13,Mar,Wed
3/25/2027,2027,1,3,25,4,0,13,Mar,Thu
3/26/2027,2027,1,3,26,5,0,13,Mar,Fri
3/27/2027,2027,1,3,27,6,1,13,Mar,Sat
3/28/2027,2027,1,3,28,7,1,14,Mar,Sun
3/29/2027,2027,1,3,29,1,0,14,Mar,Mon
3/30/2027,2027,1,3,30,2,0,14,Mar,Tue
3/31/2027,2027,1,3,31,3,0,14,Mar,Wed
4/1/2027,2027,2,4,1,4,0,14,Apr,Thu
4/2/2027,2027,2,4,2,5,0,14,Apr,Fri
4/3/2027,2027,2,4,3,6,1,14,Apr,Sat
4/4/2027,2027,2,4,4,7,1,15,Apr,Sun
4/5/2027,2027,2,4,5,1,0,15,Apr,Mon
4/6/2027,2027,2,4,6,2,0,15,Apr,Tue
4/7/2027,2027,2,4,7,3,0,15,Apr,Wed
4/8/2027,2027,2,4,8,4,0,15,Apr,Thu
4/9/2027,2027,2,4,9,5,0,15,Apr,Fri
4/10/2027,2027,2,4,10,6,1,15,Apr,Sat
4/11/2027,2027,2,4,11,7,1,16,Apr,Sun
4/12/2027,2027,2,4,12,1,0,16,Apr,Mon
4/13/2027,2027,2,4,13,2,0,16,Apr,Tue
4/14/2027,2027,2,4,14,3,0,16,Apr,Wed
4/15/2027,2027,2,4,15,4,0,16,Apr,Thu
4/16/2027,2027,2,4,16,5,0,16,Apr,Fri
4/17/2027,2027,2,4,17,6,1,16,Apr,Sat
4/18/2027,2027,2,4,18,7,1,17,Apr,Sun
4/19/2027,2027,2,4,19,1,0,17,Apr,Mon
4/20/2027,2027,2,4,20,2,0,17,Apr,Tue
4/21/2027,2027,2,4,21,3,0,17,Apr,Wed
4/22/2027,2027,2,4,22,4,0,17,Apr,Thu
4/23/2027,2027,2,4,23,5,0,17,Apr,Fri
4/24/2027,2027,2,4,24,6,1,17,Apr,Sat
4/25/2027,2027,2,4,25,7,1,18,Apr,Sun
4/26/2027,2027,2,4,26,1,0,18,Apr,Mon
4/27/2027,2027,2,4,27,2,0,18,Apr,Tue
4/28/2027,2027,2,4,28,3,0,18,Apr,Wed
4/29/2027,2027,2,4,29,4,0,18,Apr,Thu
4/30/2027,2027,2,4,30,5,0,18,Apr,Fri
5/1/2027,2027,2,5,1,6,1,18,May,Sat
5/2/2027,2027,2,5,2,7,1,19,May,Sun
5/3/2027,2027,2,5,3,1,0,19,May,Mon
5/4/2027,2027,2,5,4,2,0,19,May,Tue
5/5/2027,2027,2,5,5,3,0,19,May,Wed
5/6/2027,2027,2,5,6,4,0,19,May,Thu
5/7/2027,2027,2,5,7,5,0,19,May,Fri
5/8/2027,2027,2,5,8,6,1,19,May,Sat
5/9/2027,2027,2,5,9,7,1,20,May,Sun
5/10/2027,2027,2,5,10,1,0,20,May,Mon
5/11/2027,2027,2,5,11,2,0,20,May,Tue
5/12/2027,2027,2,5,12,3,0,20,May,Wed
5/13/2027,2027,2,5,13,4,0,20,May,Thu
5/14/2027,2027,2,5,14,5,0,20,May,Fri
5/15/2027,2027,2,5,15,6,1,20,May,Sat
5/16/2027,2027,2,5,16,7,1,21,May,Sun
5/17/2027,2027,2,5,17,1,0,21,May,Mon
5/18/2027,2027,2,5,18,2,0,21,May,Tue
5/19/2027,2027,2,5,19,3,0,21,May,Wed
5/20/2027,2027,2,5,20,4,0,21,May,Thu
5/21/2027,2027,2,5,21,5,0,21,May,Fri
5/22/2027,2027,2,5,22,6,1,21,May,Sat
5/23/2027,2027,2,5,23,7,1,22,May,Sun
5/24/2027,2027,2,5,24,1,0,22,May,Mon
5/25/2027,2027,2,5,25,2,0,22,May,Tue
5/26/2027,2027,2,5,26,3,0,22,May,Wed
5/27/2027,2027,2,5,27,4,0,22,May,Thu
5/28/2027,2027,2,5,28,5,0,22,May,Fri
5/29/2027,2027,2,5,29,6,1,22,May,Sat
5/30/2027,2027,2,5,30,7,1,23,May,Sun
5/31/2027,2027,2,5,31,1,0,23,May,Mon
6/1/2027,2027,2,6,1,2,0,23,Jun,Tue
6/2/2027,2027,2,6,2,3,0,23,Jun,Wed
6/3/2027,2027,2,6,3,4,0,23,Jun,Thu
6/4/2027,2027,2,6,4,5,0,23,Jun,Fri
6/5/2027,2027,2,6,5,6,1,23,Jun,Sat
6/6/2027,2027,2,6,6,7,1,24,Jun,Sun
6/7/2027,2027,2,6,7,1,0,24,Jun,Mon
6/8/2027,2027,2,6,8,2,0,24,Jun,Tue
6/9/2027,2027,2,6,9,3,0,24,Jun,Wed
6/10/2027,2027,2,6,10,4,0,24,Jun,Thu
6/11/2027,2027,2,6,11,5,0,24,Jun,Fri
6/12/2027,2027,2,6,12,6,1,24,Jun,Sat
6/13/2027,2027,2,6,13,7,1,25,Jun,Sun
6/14/2027,2027,2,6,14,1,0,25,Jun,Mon
6/15/2027,2027,2,6,15,2,0,25,Jun,Tue
6/16/2027,2027,2,6,16,3,0,25,Jun,Wed
6/17/2027,2027,2,6,17,4,0,25,Jun,Thu
6/18/2027,2027,2,6,18,5,0,25,Jun,Fri
6/19/2027,2027,2,6,19,6,1,25,Jun,Sat
6/20/2027,2027,2,6,20,7,1,26,Jun,Sun
6/21/2027,2027,2,6,21,1,0,26,Jun,Mon
6/22/2027,2027,2,6,22,2,0,26,Jun,Tue
6/23/2027,2027,2,6,23,3,0,26,Jun,Wed
6/24/2027,2027,2,6,24,4,0,26,Jun,Thu
6/25/2027,2027,2,6,25,5,0,26,Jun,Fri
6/26/2027,2027,2,6,26,6,1,26,Jun,Sat
6/27/2027,2027,2,6,27,7,1,27,Jun,Sun
6/28/2027,2027,2,6,28,1,0,27,Jun,Mon
6/29/2027,2027,2,6,29,2,0,27,Jun,Tue
6/30/2027,2027,2,6,30,3,0,27,Jun,Wed
7/1/2027,2027,3,7,1,4,0,27,Jul,Thu
7/2/2027,2027,3,7,2,5,0,27,Jul,Fri
7/3/2027,2027,3,7,3,6,1,27,Jul,Sat
7/4/2027,2027,3,7,4,7,1,28,Jul,Sun
7/5/2027,2027,3,7,5,1,0,28,Jul,Mon
7/6/2027,2027,3,7,6,2,0,28,Jul,Tue
7/7/2027,2027,3,7,7,3,0,28,Jul,Wed
7/8/2027,2027,3,7,8,4,0,28,Jul,Thu
7/9/2027,2027,3,7,9,5,0,28,Jul,Fri
7/10/2027,2027,3,7,10,6,1,28,Jul,Sat
7/11/2027,2027,3,7,11,7,1,29,Jul,Sun
7/12/2027,2027,3,7,12,1,0,29,Jul,Mon
7/13/2027,2027,3,7,13,2,0,29,Jul,Tue
7/14/2027,2027,3,7,14,3,0,29,Jul,Wed
7/15/2027,2027,3,7,15,4,0,29,Jul,Thu
7/16/2027,2027,3,7,16,5,0,29,Jul,Fri
7/17/2027,2027,3,7,17,6,1,29,Jul,Sat
7/18/2027,2027,3,7,18,7,1,30,Jul,Sun
7/19/2027,2027,3,7,19,1,0,30,Jul,Mon
7/20/2027,2027,3,7,20,2,0,30,Jul,Tue
7/21/2027,2027,3,7,21,3,0,30,Jul,Wed
7/22/2027,2027,3,7,22,4,0,30,Jul,Thu
7/23/2027,2027,3,7,23,5,0,30,Jul,Fri
7/24/2027,2027,3,7,24,6,1,30,Jul,Sat
7/25/2027,2027,3,7,25,7,1,31,Jul,Sun
7/26/2027,2027,3,7,26,1,0,31,Jul,Mon
7/27/2027,2027,3,7,27,2,0,31,Jul,Tue
7/28/2027,2027,3,7,28,3,0,31,Jul,Wed
7/29/2027,2027,3,7,29,4,0,31,Jul,Thu
7/30/2027,2027,3,7,30,5,0,31,Jul,Fri
7/31/2027,2027,3,7,31,6,1,31,Jul,Sat
8/1/2027,2027,3,8,1,7,1,32,Aug,Sun
8/2/2027,2027,3,8,2,1,0,32,Aug,Mon
8/3/2027,2027,3,8,3,2,0,32,Aug,Tue
8/4/2027,2027,3,8,4,3,0,32,Aug,Wed
8/5/2027,2027,3,8,5,4,0,32,Aug,Thu
8/6/2027,2027,3,8,6,5,0,32,Aug,Fri
8/7/2027,2027,3,8,7,6,1,32,Aug,Sat
8/8/2027,2027,3,8,8,7,1,33,Aug,Sun
8/9/2027,2027,3,8,9,1,0,33,Aug,Mon
8/10/2027,2027,3,8,10,2,0,33,Aug,Tue
8/11/2027,2027,3,8,11,3,0,33,Aug,Wed
8/12/2027,2027,3,8,12,4,0,33,Aug,Thu
8/13/2027,2027,3,8,13,5,0,33,Aug,Fri
8/14/2027,2027,3,8,14,6,1,33,Aug,Sat
8/15/2027,2027,3,8,15,7,1,34,Aug,Sun
8/16/2027,2027,3,8,16,1,0,34,Aug,Mon
8/17/2027,2027,3,8,17,2,0,34,Aug,Tue
8/18/2027,2027,3,8,18,3,0,34,Aug,Wed
8/19/2027,2027,3,8,19,4,0,34,Aug,Thu
8/20/2027,2027,3,8,20,5,0,34,Aug,Fri
8/21/2027,2027,3,8,21,6,1,34,Aug,Sat
8/22/2027,2027,3,8,22,7,1,35,Aug,Sun
8/23/2027,2027,3,8,23,1,0,35,Aug,Mon
8/24/2027,2027,3,8,24,2,0,35,Aug,Tue
8/25/2027,2027,3,8,25,3,0,35,Aug,Wed
8/26/2027,2027,3,8,26,4,0,35,Aug,Thu
8/27/2027,2027,3,8,27,5,0,35,Aug,Fri
8/28/2027,2027,3,8,28,6,1,35,Aug,Sat
8/29/2027,2027,3,8,29,7,1,36,Aug,Sun
8/30/2027,2027,3,8,30,1,0,36,Aug,Mon
8/31/2027,2027,3,8,31,2,0,36,Aug,Tue
9/1/2027,2027,3,9,1,3,0,36,Sep,Wed
9/2/2027,2027,3,9,2,4,0,36,Sep,Thu
9/3/2027,2027,3,9,3,5,0,36,Sep,Fri
9/4/2027,2027,3,9,4,6,1,36,Sep,Sat
9/5/2027,2027,3,9,5,7,1,37,Sep,Sun
9/6/2027,2027,3,9,6,1,0,37,Sep,Mon
9/7/2027,2027,3,9,7,2,0,37,Sep,Tue
9/8/2027,2027,3,9,8,3,0,37,Sep,Wed
9/9/2027,2027,3,9,9,4,0,37,Sep,Thu
9/10/2027,2027,3,9,10,5,0,37,Sep,Fri
9/11/2027,2027,3,9,11,6,1,37,Sep,Sat
9/12/2027,2027,3,9,12,7,1,38,Sep,Sun
9/13/2027,2027,3,9,13,1,0,38,Sep,Mon
9/14/2027,2027,3,9,14,2,0,38,Sep,Tue
9/15/2027,2027,3,9,15,3,0,38,Sep,Wed
9/16/2027,2027,3,9,16,4,0,38,Sep,Thu
9/17/2027,2027,3,9,17,5,0,38,Sep,Fri
9/18/2027,2027,3,9,18,6,1,38,Sep,Sat
9/19/2027,2027,3,9,19,7,1,39,Sep,Sun
9/20/2027,2027,3,9,20,1,0,39,Sep,Mon
9/21/2027,2027,3,9,21,2,0,39,Sep,Tue
9/22/2027,2027,3,9,22,3,0,39,Sep,Wed
9/23/2027,2027,3,9,23,4,0,39,Sep,Thu
9/24/2027,2027,3,9,24,5,0,39,Sep,Fri
9/25/2027,2027,3,9,25,6,1,39,Sep,Sat
9/26/2027,2027,3,9,26,7,1,40,Sep,Sun
9/27/2027,2027,3,9,27,1,0,40,Sep,Mon
9/28/2027,2027,3,9,28,2,0,40,Sep,Tue
9/29/2027,2027,3,9,29,3,0,40,Sep,Wed
9/30/2027,2027,3,9,30,4,0,40,Sep,Thu
10/1/2027,2027,4,10,1,5,0,40,Oct,Fri
10/2/2027,2027,4,10,2,6,1,40,Oct,Sat
10/3/2027,2027,4,10,3,7,1,41,Oct,Sun
10/4/2027,2027,4,10,4,1,0,41,Oct,Mon
10/5/2027,2027,4,10,5,2,0,41,Oct,Tue
10/6/2027,2027,4,10,6,3,0,41,Oct,Wed
10/7/2027,2027,4,10,7,4,0,41,Oct,Thu
10/8/2027,2027,4,10,8,5,0,41,Oct,Fri
10/9/2027,2027,4,10,9,6,1,41,Oct,Sat
10/10/2027,2027,4,10,10,7,1,42,Oct,Sun
10/11/2027,2027,4,10,11,1,0,42,Oct,Mon
10/12/2027,2027,4,10,12,2,0,42,Oct,Tue
10/13/2027,2027,4,10,13,3,0,42,Oct,Wed
10/14/2027,2027,4,10,14,4,0,42,Oct,Thu
10/15/2027,2027,4,10,15,5,0,42,Oct,Fri
10/16/2027,2027,4,10,16,6,1,42,Oct,Sat
10/17/2027,2027,4,10,17,7,1,43,Oct,Sun
10/18/2027,2027,4,10,18,1,0,43,Oct,Mon
10/19/2027,2027,4,10,19,2,0,43,Oct,Tue
10/20/2027,2027,4,10,20,3,0,43,Oct,Wed
10/21/2027,2027,4,10,21,4,0,43,Oct,Thu
10/22/2027,2027,4,10,22,5,0,43,Oct,Fri
10/23/2027,2027,4,10,23,6,1,43,Oct,Sat
10/24/2027,2027,4,10,24,7,1,44,Oct,Sun
10/25/2027,2027,4,10,25,1,0,44,Oct,Mon
10/26/2027,2027,4,10,26,2,0,44,Oct,Tue
10/27/2027,2027,4,10,27,3,0,44,Oct,Wed
10/28/2027,2027,4,10,28,4,0,44,Oct,Thu
10/29/2027,2027,4,10,29,5,0,44,Oct,Fri
10/30/2027,2027,4,10,30,6,1,44,Oct,Sat
10/31/2027,2027,4,10,31,7,1,45,Oct,Sun
11/1/2027,2027,4,11,1,1,0,45,Nov,Mon
11/2/2027,2027,4,11,2,2,0,45,Nov,Tue
11/3/2027,2027,4,11,3,3,0,45,Nov,Wed
11/4/2027,2027,4,11,4,4,0,45,Nov,Thu
11/5/2027,2027,4,11,5,5,0,45,Nov,Fri
11/6/2027,2027,4,11,6,6,1,45,Nov,Sat
11/7/2027,2027,4,11,7,7,1,46,Nov,Sun
11/8/2027,2027,4,11,8,1,0,46,Nov,Mon
11/9/2027,2027,4,11,9,2,0,46,Nov,Tue
11/10/2027,2027,4,11,10,3,0,46,Nov,Wed
11/11/2027,2027,4,11,11,4,0,46,Nov,Thu
11/12/2027,2027,4,11,12,5,0,46,Nov,Fri
11/13/2027,2027,4,11,13,6,1,46,Nov,Sat
11/14/2027,2027,4,11,14,7,1,47,Nov,Sun
11/15/2027,2027,4,11,15,1,0,47,Nov,Mon
11/16/2027,2027,4,11,16,2,0,47,Nov,Tue
11/17/2027,2027,4,11,17,3,0,47,Nov,Wed
11/18/2027,2027,4,11,18,4,0,47,Nov,Thu
11/19/2027,2027,4,11,19,5,0,47,Nov,Fri
11/20/2027,2027,4,11,20,6,1,47,Nov,Sat
11/21/2027,2027,4,11,21,7,1,48,Nov,Sun
11/22/2027,2027,4,11,22,1,0,48,Nov,Mon
11/23/2027,2027,4,11,23,2,0,48,Nov,Tue
11/24/2027,2027,4,11,24,3,0,48,Nov,Wed
11/25/2027,2027,4,11,25,4,0,48,Nov,Thu
11/26/2027,2027,4,11,26,5,0,48,Nov,Fri
11/27/2027,2027,4,11,27,6,1,48,Nov,Sat
11/28/2027,2027,4,11,28,7,1,49,Nov,Sun
11/29/2027,2027,4,11,29,1,0,49,Nov,Mon
11/30/2027,2027,4,11,30,2,0,49,Nov,Tue
12/1/2027,2027,4,12,1,3,0,49,Dec,Wed
12/2/2027,2027,4,12,2,4,0,49,Dec,Thu
12/3/2027,2027,4,12,3,5,0,49,Dec,Fri
12/4/2027,2027,4,12,4,6,1,49,Dec,Sat
12/5/2027,2027,4,12,5,7,1,50,Dec,Sun
12/6/2027,2027,4,12,6,1,0,50,Dec,Mon
12/7/2027,2027,4,12,7,2,0,50,Dec,Tue
12/8/2027,2027,4,12,8,3,0,50,Dec,Wed
12/9/2027,2027,4,12,9,4,0,50,Dec,Thu
12/10/2027,2027,4,12,10,5,0,50,Dec,Fri
12/11/2027,2027,4,12,11,6,1,50,Dec,Sat
12/12/2027,2027,4,12,12,7,1,51,Dec,Sun
12/13/2027,2027,4,12,13,1,0,51,Dec,Mon
12/14/2027,2027,4,12,14,2,0,51,Dec,Tue
12/15/2027,2027,4,12,15,3,0,51,Dec,Wed
12/16/2027,2027,4,12,16,4,0,51,Dec,Thu
12/17/2027,2027,4,12,17,5,0,51,Dec,Fri
12/18/2027,2027,4,12,18,6,1,51,Dec,Sat
12/19/2027,2027,4,12,19,7,1,52,Dec,Sun
12/20/2027,2027,4,12,20,1,0,52,Dec,Mon
12/21/2027,2027,4,12,21,2,0,52,Dec,Tue
12/22/2027,2027,4,12,22,3,0,52,Dec,Wed
12/23/2027,2027,4,12,23,4,0,52,Dec,Thu
12/24/2027,2027,4,12,24,5,0,52,Dec,Fri
12/25/2027,2027,4,12,25,6,1,52,Dec,Sat
12/26/2027,2027,4,12,26,7,1,53,Dec,Sun
12/27/2027,2027,4,12,27,1,0,53,Dec,Mon
12/28/2027,2027,4,12,28,2,0,53,Dec,Tue
12/29/2027,2027,4,12,29,3,0,53,Dec,Wed
12/30/2027,2027,4,12,30,4,0,53,Dec,Thu
12/31/2027,2027,4,12,31,5,0,53,Dec,Fri
1/1/2028,2028,1,1,1,6,1,1,Jan,Sat
1/2/2028,2028,1,1,2,7,1,2,Jan,Sun
1/3/2028,2028,1,1,3,1,0,2,Jan,Mon
1/4/2028,2028,1,1,4,2,0,2,Jan,Tue
1/5/2028,2028,1,1,5,3,0,2,Jan,Wed
1/6/2028,2028,1,1,6,4,0,2,Jan,Thu
1/7/2028,2028,1,1,7,5,0,2,Jan,Fri
1/8/2028,2028,1,1,8,6,1,2,Jan,Sat
1/9/2028,2028,1,1,9,7,1,3,Jan,Sun
1/10/2028,2028,1,1,10,1,0,3,Jan,Mon
1/11/2028,2028,1,1,11,2,0,3,Jan,Tue
1/12/2028,2028,1,1,12,3,0,3,Jan,Wed
1/13/2028,2028,1,1,13,4,0,3,Jan,Thu
1/14/2028,2028,1,1,14,5,0,3,Jan,Fri
1/15/2028,2028,1,1,15,6,1,3,Jan,Sat
1/16/2028,2028,1,1,16,7,1,4,Jan,Sun
1/17/2028,2028,1,1,17,1,0,4,Jan,Mon
1/18/2028,2028,1,1,18,2,0,4,Jan,Tue
1/19/2028,2028,1,1,19,3,0,4,Jan,Wed
1/20/2028,2028,1,1,20,4,0,4,Jan,Thu
1/21/2028,2028,1,1,21,5,0,4,Jan,Fri
1/22/2028,2028,1,1,22,6,1,4,Jan,Sat
1/23/2028,2028,1,1,23,7,1,5,Jan,Sun
1/24/2028,2028,1,1,24,1,0,5,Jan,Mon
1/25/2028,2028,1,1,25,2,0,5,Jan,Tue
1/26/2028,2028,1,1,26,3,0,5,Jan,Wed
1/27/2028,2028,1,1,27,4,0,5,Jan,Thu
1/28/2028,2028,1,1,28,5,0,5,Jan,Fri
1/29/2028,2028,1,1,29,6,1,5,Jan,Sat
1/30/2028,2028,1,1,30,7,1,6,Jan,Sun
1/31/2028,2028,1,1,31,1,0,6,Jan,Mon
2/1/2028,2028,1,2,1,2,0,6,Feb,Tue
2/2/2028,2028,1,2,2,3,0,6,Feb,Wed
2/3/2028,2028,1,2,3,4,0,6,Feb,Thu
2/4/2028,2028,1,2,4,5,0,6,Feb,Fri
2/5/2028,2028,1,2,5,6,1,6,Feb,Sat
2/6/2028,2028,1,2,6,7,1,7,Feb,Sun
2/7/2028,2028,1,2,7,1,0,7,Feb,Mon
2/8/2028,2028,1,2,8,2,0,7,Feb,Tue
2/9/2028,2028,1,2,9,3,0,7,Feb,Wed
2/10/2028,2028,1,2,10,4,0,7,Feb,Thu
2/11/2028,2028,1,2,11,5,0,7,Feb,Fri
2/12/2028,2028,1,2,12,6,1,7,Feb,Sat
2/13/2028,2028,1,2,13,7,1,8,Feb,Sun
2/14/2028,2028,1,2,14,1,0,8,Feb,Mon
2/15/2028,2028,1,2,15,2,0,8,Feb,Tue
2/16/2028,2028,1,2,16,3,0,8,Feb,Wed
2/17/2028,2028,1,2,17,4,0,8,Feb,Thu
2/18/2028,2028,1,2,18,5,0,8,Feb,Fri
2/19/2028,2028,1,2,19,6,1,8,Feb,Sat
2/20/2028,2028,1,2,20,7,1,9,Feb,Sun
2/21/2028,2028,1,2,21,1,0,9,Feb,Mon
2/22/2028,2028,1,2,22,2,0,9,Feb,Tue
2/23/2028,2028,1,2,23,3,0,9,Feb,Wed
2/24/2028,2028,1,2,24,4,0,9,Feb,Thu
2/25/2028,2028,1,2,25,5,0,9,Feb,Fri
2/26/2028,2028,1,2,26,6,1,9,Feb,Sat
2/27/2028,2028,1,2,27,7,1,10,Feb,Sun
2/28/2028,2028,1,2,28,1,0,10,Feb,Mon
2/29/2028,2028,1,2,29,2,0,10,Feb,Tue
3/1/2028,2028,1,3,1,3,0,10,Mar,Wed
3/2/2028,2028,1,3,2,4,0,10,Mar,Thu
3/3/2028,2028,1,3,3,5,0,10,Mar,Fri
3/4/2028,2028,1,3,4,6,1,10,Mar,Sat
3/5/2028,2028,1,3,5,7,1,11,Mar,Sun
3/6/2028,2028,1,3,6,1,0,11,Mar,Mon
3/7/2028,2028,1,3,7,2,0,11,Mar,Tue
3/8/2028,2028,1,3,8,3,0,11,Mar,Wed
3/9/2028,2028,1,3,9,4,0,11,Mar,Thu
3/10/2028,2028,1,3,10,5,0,11,Mar,Fri
3/11/2028,2028,1,3,11,6,1,11,Mar,Sat
3/12/2028,2028,1,3,12,7,1,12,Mar,Sun
3/13/2028,2028,1,3,13,1,0,12,Mar,Mon
3/14/2028,2028,1,3,14,2,0,12,Mar,Tue
3/15/2028,2028,1,3,15,3,0,12,Mar,Wed
3/16/2028,2028,1,3,16,4,0,12,Mar,Thu
3/17/2028,2028,1,3,17,5,0,12,Mar,Fri
3/18/2028,2028,1,3,18,6,1,12,Mar,Sat
3/19/2028,2028,1,3,19,7,1,13,Mar,Sun
3/20/2028,2028,1,3,20,1,0,13,Mar,Mon
3/21/2028,2028,1,3,21,2,0,13,Mar,Tue
3/22/2028,2028,1,3,22,3,0,13,Mar,Wed
3/23/2028,2028,1,3,23,4,0,13,Mar,Thu
3/24/2028,2028,1,3,24,5,0,13,Mar,Fri
3/25/2028,2028,1,3,25,6,1,13,Mar,Sat
3/26/2028,2028,1,3,26,7,1,14,Mar,Sun
3/27/2028,2028,1,3,27,1,0,14,Mar,Mon
3/28/2028,2028,1,3,28,2,0,14,Mar,Tue
3/29/2028,2028,1,3,29,3,0,14,Mar,Wed
3/30/2028,2028,1,3,30,4,0,14,Mar,Thu
3/31/2028,2028,1,3,31,5,0,14,Mar,Fri
4/1/2028,2028,2,4,1,6,1,14,Apr,Sat
4/2/2028,2028,2,4,2,7,1,15,Apr,Sun
4/3/2028,2028,2,4,3,1,0,15,Apr,Mon
4/4/2028,2028,2,4,4,2,0,15,Apr,Tue
4/5/2028,2028,2,4,5,3,0,15,Apr,Wed
4/6/2028,2028,2,4,6,4,0,15,Apr,Thu
4/7/2028,2028,2,4,7,5,0,15,Apr,Fri
4/8/2028,2028,2,4,8,6,1,15,Apr,Sat
4/9/2028,2028,2,4,9,7,1,16,Apr,Sun
4/10/2028,2028,2,4,10,1,0,16,Apr,Mon
4/11/2028,2028,2,4,11,2,0,16,Apr,Tue
4/12/2028,2028,2,4,12,3,0,16,Apr,Wed
4/13/2028,2028,2,4,13,4,0,16,Apr,Thu
4/14/2028,2028,2,4,14,5,0,16,Apr,Fri
4/15/2028,2028,2,4,15,6,1,16,Apr,Sat
4/16/2028,2028,2,4,16,7,1,17,Apr,Sun
4/17/2028,2028,2,4,17,1,0,17,Apr,Mon
4/18/2028,2028,2,4,18,2,0,17,Apr,Tue
4/19/2028,2028,2,4,19,3,0,17,Apr,Wed
4/20/2028,2028,2,4,20,4,0,17,Apr,Thu
4/21/2028,2028,2,4,21,5,0,17,Apr,Fri
4/22/2028,2028,2,4,22,6,1,17,Apr,Sat
4/23/2028,2028,2,4,23,7,1,18,Apr,Sun
4/24/2028,2028,2,4,24,1,0,18,Apr,Mon
4/25/2028,2028,2,4,25,2,0,18,Apr,Tue
4/26/2028,2028,2,4,26,3,0,18,Apr,Wed
4/27/2028,2028,2,4,27,4,0,18,Apr,Thu
4/28/2028,2028,2,4,28,5,0,18,Apr,Fri
4/29/2028,2028,2,4,29,6,1,18,Apr,Sat
4/30/2028,2028,2,4,30,7,1,19,Apr,Sun
5/1/2028,2028,2,5,1,1,0,19,May,Mon
5/2/2028,2028,2,5,2,2,0,19,May,Tue
5/3/2028,2028,2,5,3,3,0,19,May,Wed
5/4/2028,2028,2,5,4,4,0,19,May,Thu
5/5/2028,2028,2,5,5,5,0,19,May,Fri
5/6/2028,2028,2,5,6,6,1,19,May,Sat
5/7/2028,2028,2,5,7,7,1,20,May,Sun
5/8/2028,2028,2,5,8,1,0,20,May,Mon
5/9/2028,2028,2,5,9,2,0,20,May,Tue
5/10/2028,2028,2,5,10,3,0,20,May,Wed
5/11/2028,2028,2,5,11,4,0,20,May,Thu
5/12/2028,2028,2,5,12,5,0,20,May,Fri
5/13/2028,2028,2,5,13,6,1,20,May,Sat
5/14/2028,2028,2,5,14,7,1,21,May,Sun
5/15/2028,2028,2,5,15,1,0,21,May,Mon
5/16/2028,2028,2,5,16,2,0,21,May,Tue
5/17/2028,2028,2,5,17,3,0,21,May,Wed
5/18/2028,2028,2,5,18,4,0,21,May,Thu
5/19/2028,2028,2,5,19,5,0,21,May,Fri
5/20/2028,2028,2,5,20,6,1,21,May,Sat
5/21/2028,2028,2,5,21,7,1,22,May,Sun
5/22/2028,2028,2,5,22,1,0,22,May,Mon
5/23/2028,2028,2,5,23,2,0,22,May,Tue
5/24/2028,2028,2,5,24,3,0,22,May,Wed
5/25/2028,2028,2,5,25,4,0,22,May,Thu
5/26/2028,2028,2,5,26,5,0,22,May,Fri
5/27/2028,2028,2,5,27,6,1,22,May,Sat
5/28/2028,2028,2,5,28,7,1,23,May,Sun
5/29/2028,2028,2,5,29,1,0,23,May,Mon
5/30/2028,2028,2,5,30,2,0,23,May,Tue
5/31/2028,2028,2,5,31,3,0,23,May,Wed
6/1/2028,2028,2,6,1,4,0,23,Jun,Thu
6/2/2028,2028,2,6,2,5,0,23,Jun,Fri
6/3/2028,2028,2,6,3,6,1,23,Jun,Sat
6/4/2028,2028,2,6,4,7,1,24,Jun,Sun
6/5/2028,2028,2,6,5,1,0,24,Jun,Mon
6/6/2028,2028,2,6,6,2,0,24,Jun,Tue
6/7/2028,2028,2,6,7,3,0,24,Jun,Wed
6/8/2028,2028,2,6,8,4,0,24,Jun,Thu
6/9/2028,2028,2,6,9,5,0,24,Jun,Fri
6/10/2028,2028,2,6,10,6,1,24,Jun,Sat
6/11/2028,2028,2,6,11,7,1,25,Jun,Sun
6/12/2028,2028,2,6,12,1,0,25,Jun,Mon
6/13/2028,2028,2,6,13,2,0,25,Jun,Tue
6/14/2028,2028,2,6,14,3,0,25,Jun,Wed
6/15/2028,2028,2,6,15,4,0,25,Jun,Thu
6/16/2028,2028,2,6,16,5,0,25,Jun,Fri
6/17/2028,2028,2,6,17,6,1,25,Jun,Sat
6/18/2028,2028,2,6,18,7,1,26,Jun,Sun
6/19/2028,2028,2,6,19,1,0,26,Jun,Mon
6/20/2028,2028,2,6,20,2,0,26,Jun,Tue
6/21/2028,2028,2,6,21,3,0,26,Jun,Wed
6/22/2028,2028,2,6,22,4,0,26,Jun,Thu
6/23/2028,2028,2,6,23,5,0,26,Jun,Fri
6/24/2028,2028,2,6,24,6,1,26,Jun,Sat
6/25/2028,2028,2,6,25,7,1,27,Jun,Sun
6/26/2028,2028,2,6,26,1,0,27,Jun,Mon
6/27/2028,2028,2,6,27,2,0,27,Jun,Tue
6/28/2028,2028,2,6,28,3,0,27,Jun,Wed
6/29/2028,2028,2,6,29,4,0,27,Jun,Thu
6/30/2028,2028,2,6,30,5,0,27,Jun,Fri
7/1/2028,2028,3,7,1,6,1,27,Jul,Sat
7/2/2028,2028,3,7,2,7,1,28,Jul,Sun
7/3/2028,2028,3,7,3,1,0,28,Jul,Mon
7/4/2028,2028,3,7,4,2,0,28,Jul,Tue
7/5/2028,2028,3,7,5,3,0,28,Jul,Wed
7/6/2028,2028,3,7,6,4,0,28,Jul,Thu
7/7/2028,2028,3,7,7,5,0,28,Jul,Fri
7/8/2028,2028,3,7,8,6,1,28,Jul,Sat
7/9/2028,2028,3,7,9,7,1,29,Jul,Sun
7/10/2028,2028,3,7,10,1,0,29,Jul,Mon
7/11/2028,2028,3,7,11,2,0,29,Jul,Tue
7/12/2028,2028,3,7,12,3,0,29,Jul,Wed
7/13/2028,2028,3,7,13,4,0,29,Jul,Thu
7/14/2028,2028,3,7,14,5,0,29,Jul,Fri
7/15/2028,2028,3,7,15,6,1,29,Jul,Sat
7/16/2028,2028,3,7,16,7,1,30,Jul,Sun
7/17/2028,2028,3,7,17,1,0,30,Jul,Mon
7/18/2028,2028,3,7,18,2,0,30,Jul,Tue
7/19/2028,2028,3,7,19,3,0,30,Jul,Wed
7/20/2028,2028,3,7,20,4,0,30,Jul,Thu
7/21/2028,2028,3,7,21,5,0,30,Jul,Fri
7/22/2028,2028,3,7,22,6,1,30,Jul,Sat
7/23/2028,2028,3,7,23,7,1,31,Jul,Sun
7/24/2028,2028,3,7,24,1,0,31,Jul,Mon
7/25/2028,2028,3,7,25,2,0,31,Jul,Tue
7/26/2028,2028,3,7,26,3,0,31,Jul,Wed
7/27/2028,2028,3,7,27,4,0,31,Jul,Thu
7/28/2028,2028,3,7,28,5,0,31,Jul,Fri
7/29/2028,2028,3,7,29,6,1,31,Jul,Sat
7/30/2028,2028,3,7,30,7,1,32,Jul,Sun
7/31/2028,2028,3,7,31,1,0,32,Jul,Mon
8/1/2028,2028,3,8,1,2,0,32,Aug,Tue
8/2/2028,2028,3,8,2,3,0,32,Aug,Wed
8/3/2028,2028,3,8,3,4,0,32,Aug,Thu
8/4/2028,2028,3,8,4,5,0,32,Aug,Fri
8/5/2028,2028,3,8,5,6,1,32,Aug,Sat
8/6/2028,2028,3,8,6,7,1,33,Aug,Sun
8/7/2028,2028,3,8,7,1,0,33,Aug,Mon
8/8/2028,2028,3,8,8,2,0,33,Aug,Tue
8/9/2028,2028,3,8,9,3,0,33,Aug,Wed
8/10/2028,2028,3,8,10,4,0,33,Aug,Thu
8/11/2028,2028,3,8,11,5,0,33,Aug,Fri
8/12/2028,2028,3,8,12,6,1,33,Aug,Sat
8/13/2028,2028,3,8,13,7,1,34,Aug,Sun
8/14/2028,2028,3,8,14,1,0,34,Aug,Mon
8/15/2028,2028,3,8,15,2,0,34,Aug,Tue
8/16/2028,2028,3,8,16,3,0,34,Aug,Wed
8/17/2028,2028,3,8,17,4,0,34,Aug,Thu
8/18/2028,2028,3,8,18,5,0,34,Aug,Fri
8/19/2028,2028,3,8,19,6,1,34,Aug,Sat
8/20/2028,2028,3,8,20,7,1,35,Aug,Sun
8/21/2028,2028,3,8,21,1,0,35,Aug,Mon
8/22/2028,2028,3,8,22,2,0,35,Aug,Tue
8/23/2028,2028,3,8,23,3,0,35,Aug,Wed
8/24/2028,2028,3,8,24,4,0,35,Aug,Thu
8/25/2028,2028,3,8,25,5,0,35,Aug,Fri
8/26/2028,2028,3,8,26,6,1,35,Aug,Sat
8/27/2028,2028,3,8,27,7,1,36,Aug,Sun
8/28/2028,2028,3,8,28,1,0,36,Aug,Mon
8/29/2028,2028,3,8,29,2,0,36,Aug,Tue
8/30/2028,2028,3,8,30,3,0,36,Aug,Wed
8/31/2028,2028,3,8,31,4,0,36,Aug,Thu
9/1/2028,2028,3,9,1,5,0,36,Sep,Fri
9/2/2028,2028,3,9,2,6,1,36,Sep,Sat
9/3/2028,2028,3,9,3,7,1,37,Sep,Sun
9/4/2028,2028,3,9,4,1,0,37,Sep,Mon
9/5/2028,2028,3,9,5,2,0,37,Sep,Tue
9/6/2028,2028,3,9,6,3,0,37,Sep,Wed
9/7/2028,2028,3,9,7,4,0,37,Sep,Thu
9/8/2028,2028,3,9,8,5,0,37,Sep,Fri
9/9/2028,2028,3,9,9,6,1,37,Sep,Sat
9/10/2028,2028,3,9,10,7,1,38,Sep,Sun
9/11/2028,2028,3,9,11,1,0,38,Sep,Mon
9/12/2028,2028,3,9,12,2,0,38,Sep,Tue
9/13/2028,2028,3,9,13,3,0,38,Sep,Wed
9/14/2028,2028,3,9,14,4,0,38,Sep,Thu
9/15/2028,2028,3,9,15,5,0,38,Sep,Fri
9/16/2028,2028,3,9,16,6,1,38,Sep,Sat
9/17/2028,2028,3,9,17,7,1,39,Sep,Sun
9/18/2028,2028,3,9,18,1,0,39,Sep,Mon
9/19/2028,2028,3,9,19,2,0,39,Sep,Tue
9/20/2028,2028,3,9,20,3,0,39,Sep,Wed
9/21/2028,2028,3,9,21,4,0,39,Sep,Thu
9/22/2028,2028,3,9,22,5,0,39,Sep,Fri
9/23/2028,2028,3,9,23,6,1,39,Sep,Sat
9/24/2028,2028,3,9,24,7,1,40,Sep,Sun
9/25/2028,2028,3,9,25,1,0,40,Sep,Mon
9/26/2028,2028,3,9,26,2,0,40,Sep,Tue
9/27/2028,2028,3,9,27,3,0,40,Sep,Wed
9/28/2028,2028,3,9,28,4,0,40,Sep,Thu
9/29/2028,2028,3,9,29,5,0,40,Sep,Fri
9/30/2028,2028,3,9,30,6,1,40,Sep,Sat
10/1/2028,2028,4,10,1,7,1,41,Oct,Sun
10/2/2028,2028,4,10,2,1,0,41,Oct,Mon
10/3/2028,2028,4,10,3,2,0,41,Oct,Tue
10/4/2028,2028,4,10,4,3,0,41,Oct,Wed
10/5/2028,2028,4,10,5,4,0,41,Oct,Thu
10/6/2028,2028,4,10,6,5,0,41,Oct,Fri
10/7/2028,2028,4,10,7,6,1,41,Oct,Sat
10/8/2028,2028,4,10,8,7,1,42,Oct,Sun
10/9/2028,2028,4,10,9,1,0,42,Oct,Mon
10/10/2028,2028,4,10,10,2,0,42,Oct,Tue
10/11/2028,2028,4,10,11,3,0,42,Oct,Wed
10/12/2028,2028,4,10,12,4,0,42,Oct,Thu
10/13/2028,2028,4,10,13,5,0,42,Oct,Fri
10/14/2028,2028,4,10,14,6,1,42,Oct,Sat
10/15/2028,2028,4,10,15,7,1,43,Oct,Sun
10/16/2028,2028,4,10,16,1,0,43,Oct,Mon
10/17/2028,2028,4,10,17,2,0,43,Oct,Tue
10/18/2028,2028,4,10,18,3,0,43,Oct,Wed
10/19/2028,2028,4,10,19,4,0,43,Oct,Thu
10/20/2028,2028,4,10,20,5,0,43,Oct,Fri
10/21/2028,2028,4,10,21,6,1,43,Oct,Sat
10/22/2028,2028,4,10,22,7,1,44,Oct,Sun
10/23/2028,2028,4,10,23,1,0,44,Oct,Mon
10/24/2028,2028,4,10,24,2,0,44,Oct,Tue
10/25/2028,2028,4,10,25,3,0,44,Oct,Wed
10/26/2028,2028,4,10,26,4,0,44,Oct,Thu
10/27/2028,2028,4,10,27,5,0,44,Oct,Fri
10/28/2028,2028,4,10,28,6,1,44,Oct,Sat
10/29/2028,2028,4,10,29,7,1,45,Oct,Sun
10/30/2028,2028,4,10,30,1,0,45,Oct,Mon
10/31/2028,2028,4,10,31,2,0,45,Oct,Tue
11/1/2028,2028,4,11,1,3,0,45,Nov,Wed
11/2/2028,2028,4,11,2,4,0,45,Nov,Thu
11/3/2028,2028,4,11,3,5,0,45,Nov,Fri
11/4/2028,2028,4,11,4,6,1,45,Nov,Sat
11/5/2028,2028,4,11,5,7,1,46,Nov,Sun
11/6/2028,2028,4,11,6,1,0,46,Nov,Mon
11/7/2028,2028,4,11,7,2,0,46,Nov,Tue
11/8/2028,2028,4,11,8,3,0,46,Nov,Wed
11/9/2028,2028,4,11,9,4,0,46,Nov,Thu
11/10/2028,2028,4,11,10,5,0,46,Nov,Fri
11/11/2028,2028,4,11,11,6,1,46,Nov,Sat
11/12/2028,2028,4,11,12,7,1,47,Nov,Sun
11/13/2028,2028,4,11,13,1,0,47,Nov,Mon
11/14/2028,2028,4,11,14,2,0,47,Nov,Tue
11/15/2028,2028,4,11,15,3,0,47,Nov,Wed
11/16/2028,2028,4,11,16,4,0,47,Nov,Thu
11/17/2028,2028,4,11,17,5,0,47,Nov,Fri
11/18/2028,2028,4,11,18,6,1,47,Nov,Sat
11/19/2028,2028,4,11,19,7,1,48,Nov,Sun
11/20/2028,2028,4,11,20,1,0,48,Nov,Mon
11/21/2028,2028,4,11,21,2,0,48,Nov,Tue
11/22/2028,2028,4,11,22,3,0,48,Nov,Wed
11/23/2028,2028,4,11,23,4,0,48,Nov,Thu
11/24/2028,2028,4,11,24,5,0,48,Nov,Fri
11/25/2028,2028,4,11,25,6,1,48,Nov,Sat
11/26/2028,2028,4,11,26,7,1,49,Nov,Sun
11/27/2028,2028,4,11,27,1,0,49,Nov,Mon
11/28/2028,2028,4,11,28,2,0,49,Nov,Tue
11/29/2028,2028,4,11,29,3,0,49,Nov,Wed
11/30/2028,2028,4,11,30,4,0,49,Nov,Thu
12/1/2028,2028,4,12,1,5,0,49,Dec,Fri
12/2/2028,2028,4,12,2,6,1,49,Dec,Sat
12/3/2028,2028,4,12,3,7,1,50,Dec,Sun
12/4/2028,2028,4,12,4,1,0,50,Dec,Mon
12/5/2028,2028,4,12,5,2,0,50,Dec,Tue
12/6/2028,2028,4,12,6,3,0,50,Dec,Wed
12/7/2028,2028,4,12,7,4,0,50,Dec,Thu
12/8/2028,2028,4,12,8,5,0,50,Dec,Fri
12/9/2028,2028,4,12,9,6,1,50,Dec,Sat
12/10/2028,2028,4,12,10,7,1,51,Dec,Sun
12/11/2028,2028,4,12,11,1,0,51,Dec,Mon
12/12/2028,2028,4,12,12,2,0,51,Dec,Tue
12/13/2028,2028,4,12,13,3,0,51,Dec,Wed
12/14/2028,2028,4,12,14,4,0,51,Dec,Thu
12/15/2028,2028,4,12,15,5,0,51,Dec,Fri
12/16/2028,2028,4,12,16,6,1,51,Dec,Sat
12/17/2028,2028,4,12,17,7,1,52,Dec,Sun
12/18/2028,2028,4,12,18,1,0,52,Dec,Mon
12/19/2028,2028,4,12,19,2,0,52,Dec,Tue
12/20/2028,2028,4,12,20,3,0,52,Dec,Wed
12/21/2028,2028,4,12,21,4,0,52,Dec,Thu
12/22/2028,2028,4,12,22,5,0,52,Dec,Fri
12/23/2028,2028,4,12,23,6,1,52,Dec,Sat
12/24/2028,2028,4,12,24,7,1,53,Dec,Sun
12/25/2028,2028,4,12,25,1,0,53,Dec,Mon
12/26/2028,2028,4,12,26,2,0,53,Dec,Tue
12/27/2028,2028,4,12,27,3,0,53,Dec,Wed
12/28/2028,2028,4,12,28,4,0,53,Dec,Thu
12/29/2028,2028,4,12,29,5,0,53,Dec,Fri
12/30/2028,2028,4,12,30,6,1,53,Dec,Sat
12/31/2028,2028,4,12,31,7,1,54,Dec,Sun
1/1/2029,2029,1,1,1,1,0,1,Jan,Mon
1/2/2029,2029,1,1,2,2,0,1,Jan,Tue
1/3/2029,2029,1,1,3,3,0,1,Jan,Wed
1/4/2029,2029,1,1,4,4,0,1,Jan,Thu
1/5/2029,2029,1,1,5,5,0,1,Jan,Fri
1/6/2029,2029,1,1,6,6,1,1,Jan,Sat
1/7/2029,2029,1,1,7,7,1,2,Jan,Sun
1/8/2029,2029,1,1,8,1,0,2,Jan,Mon
1/9/2029,2029,1,1,9,2,0,2,Jan,Tue
1/10/2029,2029,1,1,10,3,0,2,Jan,Wed
1/11/2029,2029,1,1,11,4,0,2,Jan,Thu
1/12/2029,2029,1,1,12,5,0,2,Jan,Fri
1/13/2029,2029,1,1,13,6,1,2,Jan,Sat
1/14/2029,2029,1,1,14,7,1,3,Jan,Sun
1/15/2029,2029,1,1,15,1,0,3,Jan,Mon
1/16/2029,2029,1,1,16,2,0,3,Jan,Tue
1/17/2029,2029,1,1,17,3,0,3,Jan,Wed
1/18/2029,2029,1,1,18,4,0,3,Jan,Thu
1/19/2029,2029,1,1,19,5,0,3,Jan,Fri
1/20/2029,2029,1,1,20,6,1,3,Jan,Sat
1/21/2029,2029,1,1,21,7,1,4,Jan,Sun
1/22/2029,2029,1,1,22,1,0,4,Jan,Mon
1/23/2029,2029,1,1,23,2,0,4,Jan,Tue
1/24/2029,2029,1,1,24,3,0,4,Jan,Wed
1/25/2029,2029,1,1,25,4,0,4,Jan,Thu
1/26/2029,2029,1,1,26,5,0,4,Jan,Fri
1/27/2029,2029,1,1,27,6,1,4,Jan,Sat
1/28/2029,2029,1,1,28,7,1,5,Jan,Sun
1/29/2029,2029,1,1,29,1,0,5,Jan,Mon
1/30/2029,2029,1,1,30,2,0,5,Jan,Tue
1/31/2029,2029,1,1,31,3,0,5,Jan,Wed
2/1/2029,2029,1,2,1,4,0,5,Feb,Thu
2/2/2029,2029,1,2,2,5,0,5,Feb,Fri
2/3/2029,2029,1,2,3,6,1,5,Feb,Sat
2/4/2029,2029,1,2,4,7,1,6,Feb,Sun
2/5/2029,2029,1,2,5,1,0,6,Feb,Mon
2/6/2029,2029,1,2,6,2,0,6,Feb,Tue
2/7/2029,2029,1,2,7,3,0,6,Feb,Wed
2/8/2029,2029,1,2,8,4,0,6,Feb,Thu
2/9/2029,2029,1,2,9,5,0,6,Feb,Fri
2/10/2029,2029,1,2,10,6,1,6,Feb,Sat
2/11/2029,2029,1,2,11,7,1,7,Feb,Sun
2/12/2029,2029,1,2,12,1,0,7,Feb,Mon
2/13/2029,2029,1,2,13,2,0,7,Feb,Tue
2/14/2029,2029,1,2,14,3,0,7,Feb,Wed
2/15/2029,2029,1,2,15,4,0,7,Feb,Thu
2/16/2029,2029,1,2,16,5,0,7,Feb,Fri
2/17/2029,2029,1,2,17,6,1,7,Feb,Sat
2/18/2029,2029,1,2,18,7,1,8,Feb,Sun
2/19/2029,2029,1,2,19,1,0,8,Feb,Mon
2/20/2029,2029,1,2,20,2,0,8,Feb,Tue
2/21/2029,2029,1,2,21,3,0,8,Feb,Wed
2/22/2029,2029,1,2,22,4,0,8,Feb,Thu
2/23/2029,2029,1,2,23,5,0,8,Feb,Fri
2/24/2029,2029,1,2,24,6,1,8,Feb,Sat
2/25/2029,2029,1,2,25,7,1,9,Feb,Sun
2/26/2029,2029,1,2,26,1,0,9,Feb,Mon
2/27/2029,2029,1,2,27,2,0,9,Feb,Tue
2/28/2029,2029,1,2,28,3,0,9,Feb,Wed
3/1/2029,2029,1,3,1,4,0,9,Mar,Thu
3/2/2029,2029,1,3,2,5,0,9,Mar,Fri
3/3/2029,2029,1,3,3,6,1,9,Mar,Sat
3/4/2029,2029,1,3,4,7,1,10,Mar,Sun
3/5/2029,2029,1,3,5,1,0,10,Mar,Mon
3/6/2029,2029,1,3,6,2,0,10,Mar,Tue
3/7/2029,2029,1,3,7,3,0,10,Mar,Wed
3/8/2029,2029,1,3,8,4,0,10,Mar,Thu
3/9/2029,2029,1,3,9,5,0,10,Mar,Fri
3/10/2029,2029,1,3,10,6,1,10,Mar,Sat
3/11/2029,2029,1,3,11,7,1,11,Mar,Sun
3/12/2029,2029,1,3,12,1,0,11,Mar,Mon
3/13/2029,2029,1,3,13,2,0,11,Mar,Tue
3/14/2029,2029,1,3,14,3,0,11,Mar,Wed
3/15/2029,2029,1,3,15,4,0,11,Mar,Thu
3/16/2029,2029,1,3,16,5,0,11,Mar,Fri
3/17/2029,2029,1,3,17,6,1,11,Mar,Sat
3/18/2029,2029,1,3,18,7,1,12,Mar,Sun
3/19/2029,2029,1,3,19,1,0,12,Mar,Mon
3/20/2029,2029,1,3,20,2,0,12,Mar,Tue
3/21/2029,2029,1,3,21,3,0,12,Mar,Wed
3/22/2029,2029,1,3,22,4,0,12,Mar,Thu
3/23/2029,2029,1,3,23,5,0,12,Mar,Fri
3/24/2029,2029,1,3,24,6,1,12,Mar,Sat
3/25/2029,2029,1,3,25,7,1,13,Mar,Sun
3/26/2029,2029,1,3,26,1,0,13,Mar,Mon
3/27/2029,2029,1,3,27,2,0,13,Mar,Tue
3/28/2029,2029,1,3,28,3,0,13,Mar,Wed
3/29/2029,2029,1,3,29,4,0,13,Mar,Thu
3/30/2029,2029,1,3,30,5,0,13,Mar,Fri
3/31/2029,2029,1,3,31,6,1,13,Mar,Sat
4/1/2029,2029,2,4,1,7,1,14,Apr,Sun
4/2/2029,2029,2,4,2,1,0,14,Apr,Mon
4/3/2029,2029,2,4,3,2,0,14,Apr,Tue
4/4/2029,2029,2,4,4,3,0,14,Apr,Wed
4/5/2029,2029,2,4,5,4,0,14,Apr,Thu
4/6/2029,2029,2,4,6,5,0,14,Apr,Fri
4/7/2029,2029,2,4,7,6,1,14,Apr,Sat
4/8/2029,2029,2,4,8,7,1,15,Apr,Sun
4/9/2029,2029,2,4,9,1,0,15,Apr,Mon
4/10/2029,2029,2,4,10,2,0,15,Apr,Tue
4/11/2029,2029,2,4,11,3,0,15,Apr,Wed
4/12/2029,2029,2,4,12,4,0,15,Apr,Thu
4/13/2029,2029,2,4,13,5,0,15,Apr,Fri
4/14/2029,2029,2,4,14,6,1,15,Apr,Sat
4/15/2029,2029,2,4,15,7,1,16,Apr,Sun
4/16/2029,2029,2,4,16,1,0,16,Apr,Mon
4/17/2029,2029,2,4,17,2,0,16,Apr,Tue
4/18/2029,2029,2,4,18,3,0,16,Apr,Wed
4/19/2029,2029,2,4,19,4,0,16,Apr,Thu
4/20/2029,2029,2,4,20,5,0,16,Apr,Fri
4/21/2029,2029,2,4,21,6,1,16,Apr,Sat
4/22/2029,2029,2,4,22,7,1,17,Apr,Sun
4/23/2029,2029,2,4,23,1,0,17,Apr,Mon
4/24/2029,2029,2,4,24,2,0,17,Apr,Tue
4/25/2029,2029,2,4,25,3,0,17,Apr,Wed
4/26/2029,2029,2,4,26,4,0,17,Apr,Thu
4/27/2029,2029,2,4,27,5,0,17,Apr,Fri
4/28/2029,2029,2,4,28,6,1,17,Apr,Sat
4/29/2029,2029,2,4,29,7,1,18,Apr,Sun
4/30/2029,2029,2,4,30,1,0,18,Apr,Mon
5/1/2029,2029,2,5,1,2,0,18,May,Tue
5/2/2029,2029,2,5,2,3,0,18,May,Wed
5/3/2029,2029,2,5,3,4,0,18,May,Thu
5/4/2029,2029,2,5,4,5,0,18,May,Fri
5/5/2029,2029,2,5,5,6,1,18,May,Sat
5/6/2029,2029,2,5,6,7,1,19,May,Sun
5/7/2029,2029,2,5,7,1,0,19,May,Mon
5/8/2029,2029,2,5,8,2,0,19,May,Tue
5/9/2029,2029,2,5,9,3,0,19,May,Wed
5/10/2029,2029,2,5,10,4,0,19,May,Thu
5/11/2029,2029,2,5,11,5,0,19,May,Fri
5/12/2029,2029,2,5,12,6,1,19,May,Sat
5/13/2029,2029,2,5,13,7,1,20,May,Sun
5/14/2029,2029,2,5,14,1,0,20,May,Mon
5/15/2029,2029,2,5,15,2,0,20,May,Tue
5/16/2029,2029,2,5,16,3,0,20,May,Wed
5/17/2029,2029,2,5,17,4,0,20,May,Thu
5/18/2029,2029,2,5,18,5,0,20,May,Fri
5/19/2029,2029,2,5,19,6,1,20,May,Sat
5/20/2029,2029,2,5,20,7,1,21,May,Sun
5/21/2029,2029,2,5,21,1,0,21,May,Mon
5/22/2029,2029,2,5,22,2,0,21,May,Tue
5/23/2029,2029,2,5,23,3,0,21,May,Wed
5/24/2029,2029,2,5,24,4,0,21,May,Thu
5/25/2029,2029,2,5,25,5,0,21,May,Fri
5/26/2029,2029,2,5,26,6,1,21,May,Sat
5/27/2029,2029,2,5,27,7,1,22,May,Sun
5/28/2029,2029,2,5,28,1,0,22,May,Mon
5/29/2029,2029,2,5,29,2,0,22,May,Tue
5/30/2029,2029,2,5,30,3,0,22,May,Wed
5/31/2029,2029,2,5,31,4,0,22,May,Thu
6/1/2029,2029,2,6,1,5,0,22,Jun,Fri
6/2/2029,2029,2,6,2,6,1,22,Jun,Sat
6/3/2029,2029,2,6,3,7,1,23,Jun,Sun
6/4/2029,2029,2,6,4,1,0,23,Jun,Mon
6/5/2029,2029,2,6,5,2,0,23,Jun,Tue
6/6/2029,2029,2,6,6,3,0,23,Jun,Wed
6/7/2029,2029,2,6,7,4,0,23,Jun,Thu
6/8/2029,2029,2,6,8,5,0,23,Jun,Fri
6/9/2029,2029,2,6,9,6,1,23,Jun,Sat
6/10/2029,2029,2,6,10,7,1,24,Jun,Sun
6/11/2029,2029,2,6,11,1,0,24,Jun,Mon
6/12/2029,2029,2,6,12,2,0,24,Jun,Tue
6/13/2029,2029,2,6,13,3,0,24,Jun,Wed
6/14/2029,2029,2,6,14,4,0,24,Jun,Thu
6/15/2029,2029,2,6,15,5,0,24,Jun,Fri
6/16/2029,2029,2,6,16,6,1,24,Jun,Sat
6/17/2029,2029,2,6,17,7,1,25,Jun,Sun
6/18/2029,2029,2,6,18,1,0,25,Jun,Mon
6/19/2029,2029,2,6,19,2,0,25,Jun,Tue
6/20/2029,2029,2,6,20,3,0,25,Jun,Wed
6/21/2029,2029,2,6,21,4,0,25,Jun,Thu
6/22/2029,2029,2,6,22,5,0,25,Jun,Fri
6/23/2029,2029,2,6,23,6,1,25,Jun,Sat
6/24/2029,2029,2,6,24,7,1,26,Jun,Sun
6/25/2029,2029,2,6,25,1,0,26,Jun,Mon
6/26/2029,2029,2,6,26,2,0,26,Jun,Tue
6/27/2029,2029,2,6,27,3,0,26,Jun,Wed
6/28/2029,2029,2,6,28,4,0,26,Jun,Thu
6/29/2029,2029,2,6,29,5,0,26,Jun,Fri
6/30/2029,2029,2,6,30,6,1,26,Jun,Sat
7/1/2029,2029,3,7,1,7,1,27,Jul,Sun
7/2/2029,2029,3,7,2,1,0,27,Jul,Mon
7/3/2029,2029,3,7,3,2,0,27,Jul,Tue
7/4/2029,2029,3,7,4,3,0,27,Jul,Wed
7/5/2029,2029,3,7,5,4,0,27,Jul,Thu
7/6/2029,2029,3,7,6,5,0,27,Jul,Fri
7/7/2029,2029,3,7,7,6,1,27,Jul,Sat
7/8/2029,2029,3,7,8,7,1,28,Jul,Sun
7/9/2029,2029,3,7,9,1,0,28,Jul,Mon
7/10/2029,2029,3,7,10,2,0,28,Jul,Tue
7/11/2029,2029,3,7,11,3,0,28,Jul,Wed
7/12/2029,2029,3,7,12,4,0,28,Jul,Thu
7/13/2029,2029,3,7,13,5,0,28,Jul,Fri
7/14/2029,2029,3,7,14,6,1,28,Jul,Sat
7/15/2029,2029,3,7,15,7,1,29,Jul,Sun
7/16/2029,2029,3,7,16,1,0,29,Jul,Mon
7/17/2029,2029,3,7,17,2,0,29,Jul,Tue
7/18/2029,2029,3,7,18,3,0,29,Jul,Wed
7/19/2029,2029,3,7,19,4,0,29,Jul,Thu
7/20/2029,2029,3,7,20,5,0,29,Jul,Fri
7/21/2029,2029,3,7,21,6,1,29,Jul,Sat
7/22/2029,2029,3,7,22,7,1,30,Jul,Sun
7/23/2029,2029,3,7,23,1,0,30,Jul,Mon
7/24/2029,2029,3,7,24,2,0,30,Jul,Tue
7/25/2029,2029,3,7,25,3,0,30,Jul,Wed
7/26/2029,2029,3,7,26,4,0,30,Jul,Thu
7/27/2029,2029,3,7,27,5,0,30,Jul,Fri
7/28/2029,2029,3,7,28,6,1,30,Jul,Sat
7/29/2029,2029,3,7,29,7,1,31,Jul,Sun
7/30/2029,2029,3,7,30,1,0,31,Jul,Mon
7/31/2029,2029,3,7,31,2,0,31,Jul,Tue
8/1/2029,2029,3,8,1,3,0,31,Aug,Wed
8/2/2029,2029,3,8,2,4,0,31,Aug,Thu
8/3/2029,2029,3,8,3,5,0,31,Aug,Fri
8/4/2029,2029,3,8,4,6,1,31,Aug,Sat
8/5/2029,2029,3,8,5,7,1,32,Aug,Sun
8/6/2029,2029,3,8,6,1,0,32,Aug,Mon
8/7/2029,2029,3,8,7,2,0,32,Aug,Tue
8/8/2029,2029,3,8,8,3,0,32,Aug,Wed
8/9/2029,2029,3,8,9,4,0,32,Aug,Thu
8/10/2029,2029,3,8,10,5,0,32,Aug,Fri
8/11/2029,2029,3,8,11,6,1,32,Aug,Sat
8/12/2029,2029,3,8,12,7,1,33,Aug,Sun
8/13/2029,2029,3,8,13,1,0,33,Aug,Mon
8/14/2029,2029,3,8,14,2,0,33,Aug,Tue
8/15/2029,2029,3,8,15,3,0,33,Aug,Wed
8/16/2029,2029,3,8,16,4,0,33,Aug,Thu
8/17/2029,2029,3,8,17,5,0,33,Aug,Fri
8/18/2029,2029,3,8,18,6,1,33,Aug,Sat
8/19/2029,2029,3,8,19,7,1,34,Aug,Sun
8/20/2029,2029,3,8,20,1,0,34,Aug,Mon
8/21/2029,2029,3,8,21,2,0,34,Aug,Tue
8/22/2029,2029,3,8,22,3,0,34,Aug,Wed
8/23/2029,2029,3,8,23,4,0,34,Aug,Thu
8/24/2029,2029,3,8,24,5,0,34,Aug,Fri
8/25/2029,2029,3,8,25,6,1,34,Aug,Sat
8/26/2029,2029,3,8,26,7,1,35,Aug,Sun
8/27/2029,2029,3,8,27,1,0,35,Aug,Mon
8/28/2029,2029,3,8,28,2,0,35,Aug,Tue
8/29/2029,2029,3,8,29,3,0,35,Aug,Wed
8/30/2029,2029,3,8,30,4,0,35,Aug,Thu
8/31/2029,2029,3,8,31,5,0,35,Aug,Fri
9/1/2029,2029,3,9,1,6,1,35,Sep,Sat
9/2/2029,2029,3,9,2,7,1,36,Sep,Sun
9/3/2029,2029,3,9,3,1,0,36,Sep,Mon
9/4/2029,2029,3,9,4,2,0,36,Sep,Tue
9/5/2029,2029,3,9,5,3,0,36,Sep,Wed
9/6/2029,2029,3,9,6,4,0,36,Sep,Thu
9/7/2029,2029,3,9,7,5,0,36,Sep,Fri
9/8/2029,2029,3,9,8,6,1,36,Sep,Sat
9/9/2029,2029,3,9,9,7,1,37,Sep,Sun
9/10/2029,2029,3,9,10,1,0,37,Sep,Mon
9/11/2029,2029,3,9,11,2,0,37,Sep,Tue
9/12/2029,2029,3,9,12,3,0,37,Sep,Wed
9/13/2029,2029,3,9,13,4,0,37,Sep,Thu
9/14/2029,2029,3,9,14,5,0,37,Sep,Fri
9/15/2029,2029,3,9,15,6,1,37,Sep,Sat
9/16/2029,2029,3,9,16,7,1,38,Sep,Sun
9/17/2029,2029,3,9,17,1,0,38,Sep,Mon
9/18/2029,2029,3,9,18,2,0,38,Sep,Tue
9/19/2029,2029,3,9,19,3,0,38,Sep,Wed
9/20/2029,2029,3,9,20,4,0,38,Sep,Thu
9/21/2029,2029,3,9,21,5,0,38,Sep,Fri
9/22/2029,2029,3,9,22,6,1,38,Sep,Sat
9/23/2029,2029,3,9,23,7,1,39,Sep,Sun
9/24/2029,2029,3,9,24,1,0,39,Sep,Mon
9/25/2029,2029,3,9,25,2,0,39,Sep,Tue
9/26/2029,2029,3,9,26,3,0,39,Sep,Wed
9/27/2029,2029,3,9,27,4,0,39,Sep,Thu
9/28/2029,2029,3,9,28,5,0,39,Sep,Fri
9/29/2029,2029,3,9,29,6,1,39,Sep,Sat
9/30/2029,2029,3,9,30,7,1,40,Sep,Sun
10/1/2029,2029,4,10,1,1,0,40,Oct,Mon
10/2/2029,2029,4,10,2,2,0,40,Oct,Tue
10/3/2029,2029,4,10,3,3,0,40,Oct,Wed
10/4/2029,2029,4,10,4,4,0,40,Oct,Thu
10/5/2029,2029,4,10,5,5,0,40,Oct,Fri
10/6/2029,2029,4,10,6,6,1,40,Oct,Sat
10/7/2029,2029,4,10,7,7,1,41,Oct,Sun
10/8/2029,2029,4,10,8,1,0,41,Oct,Mon
10/9/2029,2029,4,10,9,2,0,41,Oct,Tue
10/10/2029,2029,4,10,10,3,0,41,Oct,Wed
10/11/2029,2029,4,10,11,4,0,41,Oct,Thu
10/12/2029,2029,4,10,12,5,0,41,Oct,Fri
10/13/2029,2029,4,10,13,6,1,41,Oct,Sat
10/14/2029,2029,4,10,14,7,1,42,Oct,Sun
10/15/2029,2029,4,10,15,1,0,42,Oct,Mon
10/16/2029,2029,4,10,16,2,0,42,Oct,Tue
10/17/2029,2029,4,10,17,3,0,42,Oct,Wed
10/18/2029,2029,4,10,18,4,0,42,Oct,Thu
10/19/2029,2029,4,10,19,5,0,42,Oct,Fri
10/20/2029,2029,4,10,20,6,1,42,Oct,Sat
10/21/2029,2029,4,10,21,7,1,43,Oct,Sun
10/22/2029,2029,4,10,22,1,0,43,Oct,Mon
10/23/2029,2029,4,10,23,2,0,43,Oct,Tue
10/24/2029,2029,4,10,24,3,0,43,Oct,Wed
10/25/2029,2029,4,10,25,4,0,43,Oct,Thu
10/26/2029,2029,4,10,26,5,0,43,Oct,Fri
10/27/2029,2029,4,10,27,6,1,43,Oct,Sat
10/28/2029,2029,4,10,28,7,1,44,Oct,Sun
10/29/2029,2029,4,10,29,1,0,44,Oct,Mon
10/30/2029,2029,4,10,30,2,0,44,Oct,Tue
10/31/2029,2029,4,10,31,3,0,44,Oct,Wed
11/1/2029,2029,4,11,1,4,0,44,Nov,Thu
11/2/2029,2029,4,11,2,5,0,44,Nov,Fri
11/3/2029,2029,4,11,3,6,1,44,Nov,Sat
11/4/2029,2029,4,11,4,7,1,45,Nov,Sun
11/5/2029,2029,4,11,5,1,0,45,Nov,Mon
11/6/2029,2029,4,11,6,2,0,45,Nov,Tue
11/7/2029,2029,4,11,7,3,0,45,Nov,Wed
11/8/2029,2029,4,11,8,4,0,45,Nov,Thu
11/9/2029,2029,4,11,9,5,0,45,Nov,Fri
11/10/2029,2029,4,11,10,6,1,45,Nov,Sat
11/11/2029,2029,4,11,11,7,1,46,Nov,Sun
11/12/2029,2029,4,11,12,1,0,46,Nov,Mon
11/13/2029,2029,4,11,13,2,0,46,Nov,Tue
11/14/2029,2029,4,11,14,3,0,46,Nov,Wed
11/15/2029,2029,4,11,15,4,0,46,Nov,Thu
11/16/2029,2029,4,11,16,5,0,46,Nov,Fri
11/17/2029,2029,4,11,17,6,1,46,Nov,Sat
11/18/2029,2029,4,11,18,7,1,47,Nov,Sun
11/19/2029,2029,4,11,19,1,0,47,Nov,Mon
11/20/2029,2029,4,11,20,2,0,47,Nov,Tue
11/21/2029,2029,4,11,21,3,0,47,Nov,Wed
11/22/2029,2029,4,11,22,4,0,47,Nov,Thu
11/23/2029,2029,4,11,23,5,0,47,Nov,Fri
11/24/2029,2029,4,11,24,6,1,47,Nov,Sat
11/25/2029,2029,4,11,25,7,1,48,Nov,Sun
11/26/2029,2029,4,11,26,1,0,48,Nov,Mon
11/27/2029,2029,4,11,27,2,0,48,Nov,Tue
11/28/2029,2029,4,11,28,3,0,48,Nov,Wed
11/29/2029,2029,4,11,29,4,0,48,Nov,Thu
11/30/2029,2029,4,11,30,5,0,48,Nov,Fri
12/1/2029,2029,4,12,1,6,1,48,Dec,Sat
12/2/2029,2029,4,12,2,7,1,49,Dec,Sun
12/3/2029,2029,4,12,3,1,0,49,Dec,Mon
12/4/2029,2029,4,12,4,2,0,49,Dec,Tue
12/5/2029,2029,4,12,5,3,0,49,Dec,Wed
12/6/2029,2029,4,12,6,4,0,49,Dec,Thu
12/7/2029,2029,4,12,7,5,0,49,Dec,Fri
12/8/2029,2029,4,12,8,6,1,49,Dec,Sat
12/9/2029,2029,4,12,9,7,1,50,Dec,Sun
12/10/2029,2029,4,12,10,1,0,50,Dec,Mon
12/11/2029,2029,4,12,11,2,0,50,Dec,Tue
12/12/2029,2029,4,12,12,3,0,50,Dec,Wed
12/13/2029,2029,4,12,13,4,0,50,Dec,Thu
12/14/2029,2029,4,12,14,5,0,50,Dec,Fri
12/15/2029,2029,4,12,15,6,1,50,Dec,Sat
12/16/2029,2029,4,12,16,7,1,51,Dec,Sun
12/17/2029,2029,4,12,17,1,0,51,Dec,Mon
12/18/2029,2029,4,12,18,2,0,51,Dec,Tue
12/19/2029,2029,4,12,19,3,0,51,Dec,Wed
12/20/2029,2029,4,12,20,4,0,51,Dec,Thu
12/21/2029,2029,4,12,21,5,0,51,Dec,Fri
12/22/2029,2029,4,12,22,6,1,51,Dec,Sat
12/23/2029,2029,4,12,23,7,1,52,Dec,Sun
12/24/2029,2029,4,12,24,1,0,52,Dec,Mon
12/25/2029,2029,4,12,25,2,0,52,Dec,Tue
12/26/2029,2029,4,12,26,3,0,52,Dec,Wed
12/27/2029,2029,4,12,27,4,0,52,Dec,Thu
12/28/2029,2029,4,12,28,5,0,52,Dec,Fri
12/29/2029,2029,4,12,29,6,1,52,Dec,Sat
12/30/2029,2029,4,12,30,7,1,53,Dec,Sun
12/31/2029,2029,4,12,31,1,0,53,Dec,Mon
1/1/2030,2030,1,1,1,2,0,1,Jan,Tue
1/2/2030,2030,1,1,2,3,0,1,Jan,Wed
1/3/2030,2030,1,1,3,4,0,1,Jan,Thu
1/4/2030,2030,1,1,4,5,0,1,Jan,Fri
1/5/2030,2030,1,1,5,6,1,1,Jan,Sat
1/6/2030,2030,1,1,6,7,1,2,Jan,Sun
1/7/2030,2030,1,1,7,1,0,2,Jan,Mon
1/8/2030,2030,1,1,8,2,0,2,Jan,Tue
1/9/2030,2030,1,1,9,3,0,2,Jan,Wed
1/10/2030,2030,1,1,10,4,0,2,Jan,Thu
1/11/2030,2030,1,1,11,5,0,2,Jan,Fri
1/12/2030,2030,1,1,12,6,1,2,Jan,Sat
1/13/2030,2030,1,1,13,7,1,3,Jan,Sun
1/14/2030,2030,1,1,14,1,0,3,Jan,Mon
1/15/2030,2030,1,1,15,2,0,3,Jan,Tue
1/16/2030,2030,1,1,16,3,0,3,Jan,Wed
1/17/2030,2030,1,1,17,4,0,3,Jan,Thu
1/18/2030,2030,1,1,18,5,0,3,Jan,Fri
1/19/2030,2030,1,1,19,6,1,3,Jan,Sat
1/20/2030,2030,1,1,20,7,1,4,Jan,Sun
1/21/2030,2030,1,1,21,1,0,4,Jan,Mon
1/22/2030,2030,1,1,22,2,0,4,Jan,Tue
1/23/2030,2030,1,1,23,3,0,4,Jan,Wed
1/24/2030,2030,1,1,24,4,0,4,Jan,Thu
1/25/2030,2030,1,1,25,5,0,4,Jan,Fri
1/26/2030,2030,1,1,26,6,1,4,Jan,Sat
1/27/2030,2030,1,1,27,7,1,5,Jan,Sun
1/28/2030,2030,1,1,28,1,0,5,Jan,Mon
1/29/2030,2030,1,1,29,2,0,5,Jan,Tue
1/30/2030,2030,1,1,30,3,0,5,Jan,Wed
1/31/2030,2030,1,1,31,4,0,5,Jan,Thu
2/1/2030,2030,1,2,1,5,0,5,Feb,Fri
2/2/2030,2030,1,2,2,6,1,5,Feb,Sat
2/3/2030,2030,1,2,3,7,1,6,Feb,Sun
2/4/2030,2030,1,2,4,1,0,6,Feb,Mon
2/5/2030,2030,1,2,5,2,0,6,Feb,Tue
2/6/2030,2030,1,2,6,3,0,6,Feb,Wed
2/7/2030,2030,1,2,7,4,0,6,Feb,Thu
2/8/2030,2030,1,2,8,5,0,6,Feb,Fri
2/9/2030,2030,1,2,9,6,1,6,Feb,Sat
2/10/2030,2030,1,2,10,7,1,7,Feb,Sun
2/11/2030,2030,1,2,11,1,0,7,Feb,Mon
2/12/2030,2030,1,2,12,2,0,7,Feb,Tue
2/13/2030,2030,1,2,13,3,0,7,Feb,Wed
2/14/2030,2030,1,2,14,4,0,7,Feb,Thu
2/15/2030,2030,1,2,15,5,0,7,Feb,Fri
2/16/2030,2030,1,2,16,6,1,7,Feb,Sat
2/17/2030,2030,1,2,17,7,1,8,Feb,Sun
2/18/2030,2030,1,2,18,1,0,8,Feb,Mon
2/19/2030,2030,1,2,19,2,0,8,Feb,Tue
2/20/2030,2030,1,2,20,3,0,8,Feb,Wed
2/21/2030,2030,1,2,21,4,0,8,Feb,Thu
2/22/2030,2030,1,2,22,5,0,8,Feb,Fri
2/23/2030,2030,1,2,23,6,1,8,Feb,Sat
2/24/2030,2030,1,2,24,7,1,9,Feb,Sun
2/25/2030,2030,1,2,25,1,0,9,Feb,Mon
2/26/2030,2030,1,2,26,2,0,9,Feb,Tue
2/27/2030,2030,1,2,27,3,0,9,Feb,Wed
2/28/2030,2030,1,2,28,4,0,9,Feb,Thu
3/1/2030,2030,1,3,1,5,0,9,Mar,Fri
3/2/2030,2030,1,3,2,6,1,9,Mar,Sat
3/3/2030,2030,1,3,3,7,1,10,Mar,Sun
3/4/2030,2030,1,3,4,1,0,10,Mar,Mon
3/5/2030,2030,1,3,5,2,0,10,Mar,Tue
3/6/2030,2030,1,3,6,3,0,10,Mar,Wed
3/7/2030,2030,1,3,7,4,0,10,Mar,Thu
3/8/2030,2030,1,3,8,5,0,10,Mar,Fri
3/9/2030,2030,1,3,9,6,1,10,Mar,Sat
3/10/2030,2030,1,3,10,7,1,11,Mar,Sun
3/11/2030,2030,1,3,11,1,0,11,Mar,Mon
3/12/2030,2030,1,3,12,2,0,11,Mar,Tue
3/13/2030,2030,1,3,13,3,0,11,Mar,Wed
3/14/2030,2030,1,3,14,4,0,11,Mar,Thu
3/15/2030,2030,1,3,15,5,0,11,Mar,Fri
3/16/2030,2030,1,3,16,6,1,11,Mar,Sat
3/17/2030,2030,1,3,17,7,1,12,Mar,Sun
3/18/2030,2030,1,3,18,1,0,12,Mar,Mon
3/19/2030,2030,1,3,19,2,0,12,Mar,Tue
3/20/2030,2030,1,3,20,3,0,12,Mar,Wed
3/21/2030,2030,1,3,21,4,0,12,Mar,Thu
3/22/2030,2030,1,3,22,5,0,12,Mar,Fri
3/23/2030,2030,1,3,23,6,1,12,Mar,Sat
3/24/2030,2030,1,3,24,7,1,13,Mar,Sun
3/25/2030,2030,1,3,25,1,0,13,Mar,Mon
3/26/2030,2030,1,3,26,2,0,13,Mar,Tue
3/27/2030,2030,1,3,27,3,0,13,Mar,Wed
3/28/2030,2030,1,3,28,4,0,13,Mar,Thu
3/29/2030,2030,1,3,29,5,0,13,Mar,Fri
3/30/2030,2030,1,3,30,6,1,13,Mar,Sat
3/31/2030,2030,1,3,31,7,1,14,Mar,Sun
4/1/2030,2030,2,4,1,1,0,14,Apr,Mon
4/2/2030,2030,2,4,2,2,0,14,Apr,Tue
4/3/2030,2030,2,4,3,3,0,14,Apr,Wed
4/4/2030,2030,2,4,4,4,0,14,Apr,Thu
4/5/2030,2030,2,4,5,5,0,14,Apr,Fri
4/6/2030,2030,2,4,6,6,1,14,Apr,Sat
4/7/2030,2030,2,4,7,7,1,15,Apr,Sun
4/8/2030,2030,2,4,8,1,0,15,Apr,Mon
4/9/2030,2030,2,4,9,2,0,15,Apr,Tue
4/10/2030,2030,2,4,10,3,0,15,Apr,Wed
4/11/2030,2030,2,4,11,4,0,15,Apr,Thu
4/12/2030,2030,2,4,12,5,0,15,Apr,Fri
4/13/2030,2030,2,4,13,6,1,15,Apr,Sat
4/14/2030,2030,2,4,14,7,1,16,Apr,Sun
4/15/2030,2030,2,4,15,1,0,16,Apr,Mon
4/16/2030,2030,2,4,16,2,0,16,Apr,Tue
4/17/2030,2030,2,4,17,3,0,16,Apr,Wed
4/18/2030,2030,2,4,18,4,0,16,Apr,Thu
4/19/2030,2030,2,4,19,5,0,16,Apr,Fri
4/20/2030,2030,2,4,20,6,1,16,Apr,Sat
4/21/2030,2030,2,4,21,7,1,17,Apr,Sun
4/22/2030,2030,2,4,22,1,0,17,Apr,Mon
4/23/2030,2030,2,4,23,2,0,17,Apr,Tue
4/24/2030,2030,2,4,24,3,0,17,Apr,Wed
4/25/2030,2030,2,4,25,4,0,17,Apr,Thu
4/26/2030,2030,2,4,26,5,0,17,Apr,Fri
4/27/2030,2030,2,4,27,6,1,17,Apr,Sat
4/28/2030,2030,2,4,28,7,1,18,Apr,Sun
4/29/2030,2030,2,4,29,1,0,18,Apr,Mon
4/30/2030,2030,2,4,30,2,0,18,Apr,Tue
5/1/2030,2030,2,5,1,3,0,18,May,Wed
5/2/2030,2030,2,5,2,4,0,18,May,Thu
5/3/2030,2030,2,5,3,5,0,18,May,Fri
5/4/2030,2030,2,5,4,6,1,18,May,Sat
5/5/2030,2030,2,5,5,7,1,19,May,Sun
5/6/2030,2030,2,5,6,1,0,19,May,Mon
5/7/2030,2030,2,5,7,2,0,19,May,Tue
5/8/2030,2030,2,5,8,3,0,19,May,Wed
5/9/2030,2030,2,5,9,4,0,19,May,Thu
5/10/2030,2030,2,5,10,5,0,19,May,Fri
5/11/2030,2030,2,5,11,6,1,19,May,Sat
5/12/2030,2030,2,5,12,7,1,20,May,Sun
5/13/2030,2030,2,5,13,1,0,20,May,Mon
5/14/2030,2030,2,5,14,2,0,20,May,Tue
5/15/2030,2030,2,5,15,3,0,20,May,Wed
5/16/2030,2030,2,5,16,4,0,20,May,Thu
5/17/2030,2030,2,5,17,5,0,20,May,Fri
5/18/2030,2030,2,5,18,6,1,20,May,Sat
5/19/2030,2030,2,5,19,7,1,21,May,Sun
5/20/2030,2030,2,5,20,1,0,21,May,Mon
5/21/2030,2030,2,5,21,2,0,21,May,Tue
5/22/2030,2030,2,5,22,3,0,21,May,Wed
5/23/2030,2030,2,5,23,4,0,21,May,Thu
5/24/2030,2030,2,5,24,5,0,21,May,Fri
5/25/2030,2030,2,5,25,6,1,21,May,Sat
5/26/2030,2030,2,5,26,7,1,22,May,Sun
5/27/2030,2030,2,5,27,1,0,22,May,Mon
5/28/2030,2030,2,5,28,2,0,22,May,Tue
5/29/2030,2030,2,5,29,3,0,22,May,Wed
5/30/2030,2030,2,5,30,4,0,22,May,Thu
5/31/2030,2030,2,5,31,5,0,22,May,Fri
6/1/2030,2030,2,6,1,6,1,22,Jun,Sat
6/2/2030,2030,2,6,2,7,1,23,Jun,Sun
6/3/2030,2030,2,6,3,1,0,23,Jun,Mon
6/4/2030,2030,2,6,4,2,0,23,Jun,Tue
6/5/2030,2030,2,6,5,3,0,23,Jun,Wed
6/6/2030,2030,2,6,6,4,0,23,Jun,Thu
6/7/2030,2030,2,6,7,5,0,23,Jun,Fri
6/8/2030,2030,2,6,8,6,1,23,Jun,Sat
6/9/2030,2030,2,6,9,7,1,24,Jun,Sun
6/10/2030,2030,2,6,10,1,0,24,Jun,Mon
6/11/2030,2030,2,6,11,2,0,24,Jun,Tue
6/12/2030,2030,2,6,12,3,0,24,Jun,Wed
6/13/2030,2030,2,6,13,4,0,24,Jun,Thu
6/14/2030,2030,2,6,14,5,0,24,Jun,Fri
6/15/2030,2030,2,6,15,6,1,24,Jun,Sat
6/16/2030,2030,2,6,16,7,1,25,Jun,Sun
6/17/2030,2030,2,6,17,1,0,25,Jun,Mon
6/18/2030,2030,2,6,18,2,0,25,Jun,Tue
6/19/2030,2030,2,6,19,3,0,25,Jun,Wed
6/20/2030,2030,2,6,20,4,0,25,Jun,Thu
6/21/2030,2030,2,6,21,5,0,25,Jun,Fri
6/22/2030,2030,2,6,22,6,1,25,Jun,Sat
6/23/2030,2030,2,6,23,7,1,26,Jun,Sun
6/24/2030,2030,2,6,24,1,0,26,Jun,Mon
6/25/2030,2030,2,6,25,2,0,26,Jun,Tue
6/26/2030,2030,2,6,26,3,0,26,Jun,Wed
6/27/2030,2030,2,6,27,4,0,26,Jun,Thu
6/28/2030,2030,2,6,28,5,0,26,Jun,Fri
6/29/2030,2030,2,6,29,6,1,26,Jun,Sat
6/30/2030,2030,2,6,30,7,1,27,Jun,Sun
7/1/2030,2030,3,7,1,1,0,27,Jul,Mon
7/2/2030,2030,3,7,2,2,0,27,Jul,Tue
7/3/2030,2030,3,7,3,3,0,27,Jul,Wed
7/4/2030,2030,3,7,4,4,0,27,Jul,Thu
7/5/2030,2030,3,7,5,5,0,27,Jul,Fri
7/6/2030,2030,3,7,6,6,1,27,Jul,Sat
7/7/2030,2030,3,7,7,7,1,28,Jul,Sun
7/8/2030,2030,3,7,8,1,0,28,Jul,Mon
7/9/2030,2030,3,7,9,2,0,28,Jul,Tue
7/10/2030,2030,3,7,10,3,0,28,Jul,Wed
7/11/2030,2030,3,7,11,4,0,28,Jul,Thu
7/12/2030,2030,3,7,12,5,0,28,Jul,Fri
7/13/2030,2030,3,7,13,6,1,28,Jul,Sat
7/14/2030,2030,3,7,14,7,1,29,Jul,Sun
7/15/2030,2030,3,7,15,1,0,29,Jul,Mon
7/16/2030,2030,3,7,16,2,0,29,Jul,Tue
7/17/2030,2030,3,7,17,3,0,29,Jul,Wed
7/18/2030,2030,3,7,18,4,0,29,Jul,Thu
7/19/2030,2030,3,7,19,5,0,29,Jul,Fri
7/20/2030,2030,3,7,20,6,1,29,Jul,Sat
7/21/2030,2030,3,7,21,7,1,30,Jul,Sun
7/22/2030,2030,3,7,22,1,0,30,Jul,Mon
7/23/2030,2030,3,7,23,2,0,30,Jul,Tue
7/24/2030,2030,3,7,24,3,0,30,Jul,Wed
7/25/2030,2030,3,7,25,4,0,30,Jul,Thu
7/26/2030,2030,3,7,26,5,0,30,Jul,Fri
7/27/2030,2030,3,7,27,6,1,30,Jul,Sat
7/28/2030,2030,3,7,28,7,1,31,Jul,Sun
7/29/2030,2030,3,7,29,1,0,31,Jul,Mon
7/30/2030,2030,3,7,30,2,0,31,Jul,Tue
7/31/2030,2030,3,7,31,3,0,31,Jul,Wed
8/1/2030,2030,3,8,1,4,0,31,Aug,Thu
8/2/2030,2030,3,8,2,5,0,31,Aug,Fri
8/3/2030,2030,3,8,3,6,1,31,Aug,Sat
8/4/2030,2030,3,8,4,7,1,32,Aug,Sun
8/5/2030,2030,3,8,5,1,0,32,Aug,Mon
8/6/2030,2030,3,8,6,2,0,32,Aug,Tue
8/7/2030,2030,3,8,7,3,0,32,Aug,Wed
8/8/2030,2030,3,8,8,4,0,32,Aug,Thu
8/9/2030,2030,3,8,9,5,0,32,Aug,Fri
8/10/2030,2030,3,8,10,6,1,32,Aug,Sat
8/11/2030,2030,3,8,11,7,1,33,Aug,Sun
8/12/2030,2030,3,8,12,1,0,33,Aug,Mon
8/13/2030,2030,3,8,13,2,0,33,Aug,Tue
8/14/2030,2030,3,8,14,3,0,33,Aug,Wed
8/15/2030,2030,3,8,15,4,0,33,Aug,Thu
8/16/2030,2030,3,8,16,5,0,33,Aug,Fri
8/17/2030,2030,3,8,17,6,1,33,Aug,Sat
8/18/2030,2030,3,8,18,7,1,34,Aug,Sun
8/19/2030,2030,3,8,19,1,0,34,Aug,Mon
8/20/2030,2030,3,8,20,2,0,34,Aug,Tue
8/21/2030,2030,3,8,21,3,0,34,Aug,Wed
8/22/2030,2030,3,8,22,4,0,34,Aug,Thu
8/23/2030,2030,3,8,23,5,0,34,Aug,Fri
8/24/2030,2030,3,8,24,6,1,34,Aug,Sat
8/25/2030,2030,3,8,25,7,1,35,Aug,Sun
8/26/2030,2030,3,8,26,1,0,35,Aug,Mon
8/27/2030,2030,3,8,27,2,0,35,Aug,Tue
8/28/2030,2030,3,8,28,3,0,35,Aug,Wed
8/29/2030,2030,3,8,29,4,0,35,Aug,Thu
8/30/2030,2030,3,8,30,5,0,35,Aug,Fri
8/31/2030,2030,3,8,31,6,1,35,Aug,Sat
9/1/2030,2030,3,9,1,7,1,36,Sep,Sun
9/2/2030,2030,3,9,2,1,0,36,Sep,Mon
9/3/2030,2030,3,9,3,2,0,36,Sep,Tue
9/4/2030,2030,3,9,4,3,0,36,Sep,Wed
9/5/2030,2030,3,9,5,4,0,36,Sep,Thu
9/6/2030,2030,3,9,6,5,0,36,Sep,Fri
9/7/2030,2030,3,9,7,6,1,36,Sep,Sat
9/8/2030,2030,3,9,8,7,1,37,Sep,Sun
9/9/2030,2030,3,9,9,1,0,37,Sep,Mon
9/10/2030,2030,3,9,10,2,0,37,Sep,Tue
9/11/2030,2030,3,9,11,3,0,37,Sep,Wed
9/12/2030,2030,3,9,12,4,0,37,Sep,Thu
9/13/2030,2030,3,9,13,5,0,37,Sep,Fri
9/14/2030,2030,3,9,14,6,1,37,Sep,Sat
9/15/2030,2030,3,9,15,7,1,38,Sep,Sun
9/16/2030,2030,3,9,16,1,0,38,Sep,Mon
9/17/2030,2030,3,9,17,2,0,38,Sep,Tue
9/18/2030,2030,3,9,18,3,0,38,Sep,Wed
9/19/2030,2030,3,9,19,4,0,38,Sep,Thu
9/20/2030,2030,3,9,20,5,0,38,Sep,Fri
9/21/2030,2030,3,9,21,6,1,38,Sep,Sat
9/22/2030,2030,3,9,22,7,1,39,Sep,Sun
9/23/2030,2030,3,9,23,1,0,39,Sep,Mon
9/24/2030,2030,3,9,24,2,0,39,Sep,Tue
9/25/2030,2030,3,9,25,3,0,39,Sep,Wed
9/26/2030,2030,3,9,26,4,0,39,Sep,Thu
9/27/2030,2030,3,9,27,5,0,39,Sep,Fri
9/28/2030,2030,3,9,28,6,1,39,Sep,Sat
9/29/2030,2030,3,9,29,7,1,40,Sep,Sun
9/30/2030,2030,3,9,30,1,0,40,Sep,Mon
10/1/2030,2030,4,10,1,2,0,40,Oct,Tue
10/2/2030,2030,4,10,2,3,0,40,Oct,Wed
10/3/2030,2030,4,10,3,4,0,40,Oct,Thu
10/4/2030,2030,4,10,4,5,0,40,Oct,Fri
10/5/2030,2030,4,10,5,6,1,40,Oct,Sat
10/6/2030,2030,4,10,6,7,1,41,Oct,Sun
10/7/2030,2030,4,10,7,1,0,41,Oct,Mon
10/8/2030,2030,4,10,8,2,0,41,Oct,Tue
10/9/2030,2030,4,10,9,3,0,41,Oct,Wed
10/10/2030,2030,4,10,10,4,0,41,Oct,Thu
10/11/2030,2030,4,10,11,5,0,41,Oct,Fri
10/12/2030,2030,4,10,12,6,1,41,Oct,Sat
10/13/2030,2030,4,10,13,7,1,42,Oct,Sun
10/14/2030,2030,4,10,14,1,0,42,Oct,Mon
10/15/2030,2030,4,10,15,2,0,42,Oct,Tue
10/16/2030,2030,4,10,16,3,0,42,Oct,Wed
10/17/2030,2030,4,10,17,4,0,42,Oct,Thu
10/18/2030,2030,4,10,18,5,0,42,Oct,Fri
10/19/2030,2030,4,10,19,6,1,42,Oct,Sat
10/20/2030,2030,4,10,20,7,1,43,Oct,Sun
10/21/2030,2030,4,10,21,1,0,43,Oct,Mon
10/22/2030,2030,4,10,22,2,0,43,Oct,Tue
10/23/2030,2030,4,10,23,3,0,43,Oct,Wed
10/24/2030,2030,4,10,24,4,0,43,Oct,Thu
10/25/2030,2030,4,10,25,5,0,43,Oct,Fri
10/26/2030,2030,4,10,26,6,1,43,Oct,Sat
10/27/2030,2030,4,10,27,7,1,44,Oct,Sun
10/28/2030,2030,4,10,28,1,0,44,Oct,Mon
10/29/2030,2030,4,10,29,2,0,44,Oct,Tue
10/30/2030,2030,4,10,30,3,0,44,Oct,Wed
10/31/2030,2030,4,10,31,4,0,44,Oct,Thu
11/1/2030,2030,4,11,1,5,0,44,Nov,Fri
11/2/2030,2030,4,11,2,6,1,44,Nov,Sat
11/3/2030,2030,4,11,3,7,1,45,Nov,Sun
11/4/2030,2030,4,11,4,1,0,45,Nov,Mon
11/5/2030,2030,4,11,5,2,0,45,Nov,Tue
11/6/2030,2030,4,11,6,3,0,45,Nov,Wed
11/7/2030,2030,4,11,7,4,0,45,Nov,Thu
11/8/2030,2030,4,11,8,5,0,45,Nov,Fri
11/9/2030,2030,4,11,9,6,1,45,Nov,Sat
11/10/2030,2030,4,11,10,7,1,46,Nov,Sun
11/11/2030,2030,4,11,11,1,0,46,Nov,Mon
11/12/2030,2030,4,11,12,2,0,46,Nov,Tue
11/13/2030,2030,4,11,13,3,0,46,Nov,Wed
11/14/2030,2030,4,11,14,4,0,46,Nov,Thu
11/15/2030,2030,4,11,15,5,0,46,Nov,Fri
11/16/2030,2030,4,11,16,6,1,46,Nov,Sat
11/17/2030,2030,4,11,17,7,1,47,Nov,Sun
11/18/2030,2030,4,11,18,1,0,47,Nov,Mon
11/19/2030,2030,4,11,19,2,0,47,Nov,Tue
11/20/2030,2030,4,11,20,3,0,47,Nov,Wed
11/21/2030,2030,4,11,21,4,0,47,Nov,Thu
11/22/2030,2030,4,11,22,5,0,47,Nov,Fri
11/23/2030,2030,4,11,23,6,1,47,Nov,Sat
11/24/2030,2030,4,11,24,7,1,48,Nov,Sun
11/25/2030,2030,4,11,25,1,0,48,Nov,Mon
11/26/2030,2030,4,11,26,2,0,48,Nov,Tue
11/27/2030,2030,4,11,27,3,0,48,Nov,Wed
11/28/2030,2030,4,11,28,4,0,48,Nov,Thu
11/29/2030,2030,4,11,29,5,0,48,Nov,Fri
11/30/2030,2030,4,11,30,6,1,48,Nov,Sat
12/1/2030,2030,4,12,1,7,1,49,Dec,Sun
12/2/2030,2030,4,12,2,1,0,49,Dec,Mon
12/3/2030,2030,4,12,3,2,0,49,Dec,Tue
12/4/2030,2030,4,12,4,3,0,49,Dec,Wed
12/5/2030,2030,4,12,5,4,0,49,Dec,Thu
12/6/2030,2030,4,12,6,5,0,49,Dec,Fri
12/7/2030,2030,4,12,7,6,1,49,Dec,Sat
12/8/2030,2030,4,12,8,7,1,50,Dec,Sun
12/9/2030,2030,4,12,9,1,0,50,Dec,Mon
12/10/2030,2030,4,12,10,2,0,50,Dec,Tue
12/11/2030,2030,4,12,11,3,0,50,Dec,Wed
12/12/2030,2030,4,12,12,4,0,50,Dec,Thu
12/13/2030,2030,4,12,13,5,0,50,Dec,Fri
12/14/2030,2030,4,12,14,6,1,50,Dec,Sat
12/15/2030,2030,4,12,15,7,1,51,Dec,Sun
12/16/2030,2030,4,12,16,1,0,51,Dec,Mon
12/17/2030,2030,4,12,17,2,0,51,Dec,Tue
12/18/2030,2030,4,12,18,3,0,51,Dec,Wed
12/19/2030,2030,4,12,19,4,0,51,Dec,Thu
12/20/2030,2030,4,12,20,5,0,51,Dec,Fri
12/21/2030,2030,4,12,21,6,1,51,Dec,Sat
12/22/2030,2030,4,12,22,7,1,52,Dec,Sun
12/23/2030,2030,4,12,23,1,0,52,Dec,Mon
12/24/2030,2030,4,12,24,2,0,52,Dec,Tue
12/25/2030,2030,4,12,25,3,0,52,Dec,Wed
12/26/2030,2030,4,12,26,4,0,52,Dec,Thu
12/27/2030,2030,4,12,27,5,0,52,Dec,Fri
12/28/2030,2030,4,12,28,6,1,52,Dec,Sat
12/29/2030,2030,4,12,29,7,1,53,Dec,Sun
12/30/2030,2030,4,12,30,1,0,53,Dec,Mon
12/31/2030,2030,4,12,31,2,0,53,Dec,Tue
